Participant,CollectionSite,Address,City,State,Zip,MapURL
ANTIGO POLICE DEPARTMENT,ANTIGO POLICE DEPARTMENT EVENT 8:00 AM TO 5:00 PM,840 CLERMONT ST,ANTIGO,WI,54409,"http://maps.google.com/maps?q=840 CLERMONT ST,+ANTIGO,+WI+54409&hl=en"
ASHLAND COUNTY SHERIFF'S OFFICE,ASHLAND COUNTY SHERIFF'S OFFICE DROP BOX ONLY 24/7,220 6TH STREET E,ASHLAND,WI,54806,"http://maps.google.com/maps?q=220 6TH STREET E,+ASHLAND,+WI+54806&hl=en"
ASHLAND POLICE DEPARTMENT,ASHLAND POLICE DEPARATMENT,601 W MAIN STREET,ASHLAND,WI,54806,"http://maps.google.com/maps?q=601 W MAIN STREET,+ASHLAND,+WI+54806&hl=en"
BARAGA COUNTY SHERIFF'S OFFICE,BARAGA COUNTY SHERIFF'S OFFICE,940 HIGHWAY US 41,LANSE,MI,49946,"http://maps.google.com/maps?q=940 HIGHWAY US 41,+LANSE,+MI+49946&hl=en"
BAYFIELD POLICE DEPARTMENT,BAYFIELD POLICE DEPARTMENT DROP BOX M-F 8:00AM-4:00PM,125 S FIRST STREET,BAYFIELD,WI,54814,"http://maps.google.com/maps?q=125 S FIRST STREET,+BAYFIELD,+WI+54814&hl=en"
BIRCHWOOD POLICE DEPARTMENT,BIRCHWOOD VILLAGE HALL BOX ONLY M-T 8:00AM-5:00PM,101 N MAIN ST,BIRCHWOOD,WI,54817,"http://maps.google.com/maps?q=101 N MAIN ST,+BIRCHWOOD,+WI+54817&hl=en"
BLOOMER POLICE DEPARTMENT,BLOOMER POLICE DEPARTMENT DROP BOX ONLY 24/7,1200 5TH AVE,BLOOMER,WI,54724,"http://maps.google.com/maps?q=1200 5TH AVE,+BLOOMER,+WI+54724&hl=en"
BOYCEVILLE POLICE DEPARTMENT,BOYCEVILLE COMMUNITY DISTRICT EVENT 10:00AM-2:00PM,1233 CHARLOTTE STREET,BOYCEVILLE,WI,54725,"http://maps.google.com/maps?q=1233 CHARLOTTE STREET,+BOYCEVILLE,+WI+54725&hl=en"
CADOTT POLICE DEPARTMENT,CADOTT POLICE DEPARTMENT EVENT 7:00AM-11:00PM,110 CENTRAL STREET,CADOTT,WI,54727,"http://maps.google.com/maps?q=110 CENTRAL STREET,+CADOTT,+WI+54727&hl=en"
CHOCOLAY POLICE DEPARTMENT,CHOCOLAY POLICE DEPARTMENT,5010 US 41 SOUTH,MARQUETTE,MI,49855,"http://maps.google.com/maps?q=5010 US 41 SOUTH,+MARQUETTE,+MI+49855&hl=en"
CITY OF GILLETT POLICE DEPARTMENT,GILLETT POLICE DEPARTMENT DROP BOX ONLY M-TH 7:00AM-4:00PM,150 N. MCKENZIE AVE,GILLETT,WI,54124,"http://maps.google.com/maps?q=150 N. MCKENZIE AVE,+GILLETT,+WI+54124&hl=en"
CLINTONVILLE POLICE DEPARTMENT,CLINTONVILLE POLICE DEPARTMENT DROP BOX ONLY 24/7,35 S CLINTON AVE,CLINTONVILLE,WI,54929,"http://maps.google.com/maps?q=35 S CLINTON AVE,+CLINTONVILLE,+WI+54929&hl=en"
COOK COUNTY SO,COOK COUNTY SHERIFF'S OFFICE,143 GUNFLINT TRAIL,GRAND MARAIS,MN,55604,"http://maps.google.com/maps?q=143 GUNFLINT TRAIL,+GRAND MARAIS,+MN+55604&hl=en"
COOK COUNTY SO,GRAND PORTAGE HEALTH SERVICES,62 UPPER ROAD,GRAND PORTAGE,MN,55605,"http://maps.google.com/maps?q=62 UPPER ROAD,+GRAND PORTAGE,+MN+55605&hl=en"
CORNELL POLICE DEPARTMENT,CORNELL POLICE DEPARTMENT DROP BOX ONLY M-F 8:00 AM - 12:00 PM,221 MAIN STREET,CORNELL,WI,54732,"http://maps.google.com/maps?q=221 MAIN STREET,+CORNELL,+WI+54732&hl=en"
DULUTH PD,DULUTH PD,2030 N ARLINGTON AVENUE,DULUTH,MN,55811,"http://maps.google.com/maps?q=2030 N ARLINGTON AVENUE,+DULUTH,+MN+55811&hl=en"
EAGLE RIVER POLICE DEPARTMENT,EAGLE RIVER POLICE DEPARTMENT DROP BOX ONLY M-F 8:00AM-4:30PM,525 E MAPLE ST,EAGLE RIVER,WI,54521,"http://maps.google.com/maps?q=525 E MAPLE ST,+EAGLE RIVER,+WI+54521&hl=en"
EDGAR POLICE DEPARTMENT,EDGAR POLICE DEPARTMENT EVENT 8:00AM-11:00AM,224 S. THIRD AVE,EDGAR,WI,54426,"http://maps.google.com/maps?q=224 S. THIRD AVE,+EDGAR,+WI+54426&hl=en"
ESCANABA DEPARTMENT OF PUBLIC SAFETY,ESCANABA DEPARTMENT OF PUBLIC SAFETY,1900 THIRD AVENUE N,ESCANABA,MI,49829,"http://maps.google.com/maps?q=1900 THIRD AVENUE N,+ESCANABA,+MI+49829&hl=en"
EVEREST METRO POLICE DEPARTMENT,EVEREST METRO POLICE DEPARTMENT DROP BOX M-F 8:00 AM - 5:00 PM,5303 MESKER ST,WESTON,WI,54476,"http://maps.google.com/maps?q=5303 MESKER ST,+WESTON,+WI+54476&hl=en"
FOREST COUNTY SHERIFF'S OFFICE,FOREST COUNTY SHERIFF'S OFFICE EVENT 10:00AM-2:00PM,100 S. PARK,CRANDON,WI,54520,"http://maps.google.com/maps?q=100 S. PARK,+CRANDON,+WI+54520&hl=en"
FORSYTH TOWNSHIP POLICE DEPARTMENT,FORSYTH TOWNSHIP POLICE DEPARTMENT,99 NORTH PINE STREET,GWINN,MI,49841,"http://maps.google.com/maps?q=99 NORTH PINE STREET,+GWINN,+MI+49841&hl=en"
HANNAHVILLE TRIBAL POLICE DEPARTMENT,HANNAHVILLE TRIBAL POLICE DEPARTMENT LOCATED BEHIND THE ISLAND RESORT AND CASINO,W399 U.S. 2 & 41,HARRIS,MI,49845,"http://maps.google.com/maps?q=W399 U.S. 2 & 41,+HARRIS,+MI+49845&hl=en"
HAYWARD POLICE DEPARTMENT,HAYWARD POLICE DEPARTMENT EVENT 9:00 AM TO NOON,15889 W THIRD ST,HAYWARD,WI,54843,"http://maps.google.com/maps?q=15889 W THIRD ST,+HAYWARD,+WI+54843&hl=en"
HOUGHTON COUNTY SHERIFF'S OFFICE,HOUGHTON COUNTY SHERIFF'S OFFICE,403 E HOUGHTON AVENUE,HOUGHTON,MI,49931,"http://maps.google.com/maps?q=403 E HOUGHTON AVENUE,+HOUGHTON,+MI+49931&hl=en"
IRON COUNTY SHERIFF'S OFFICE,IRON COUNTY SHERIFF'S OFFICE,2 SOUTH SIXTH STREET,CRYSTAL FALLS,MI,49920,"http://maps.google.com/maps?q=2 SOUTH SIXTH STREET,+CRYSTAL FALLS,+MI+49920&hl=en"
IRON COUNTY SHERIFF'S OFFICE,IRON COUNTY SHERIFF'S OFFICE DROP BOX ONLY 24/7,300 TACONITE STREET STE 226,HURLEY,WI,54534,"http://maps.google.com/maps?q=300 TACONITE STREET STE 226,+HURLEY,+WI+54534&hl=en"
ISHPEMING CITY POLICE DEPARTMENT,ISHPEMING CITY POLICE DEPARTMENT,100 S. LAKE ST,ISHPEMING,MI,49849,"http://maps.google.com/maps?q=100 S. LAKE ST,+ISHPEMING,+MI+49849&hl=en"
KEWAUNEE COUNTY SHERIFF'S OFFICE,KEWAUNEE COUNTY HIGHWAY DEPARTMENT EVENT 4/21/18 8:00AM-12:00PM,E2180 STATE HIGHWAY 54,CASCO,WI,54205,"http://maps.google.com/maps?q=E2180 STATE HIGHWAY 54,+CASCO,+WI+54205&hl=en"
KRONENWETTER POLICE DEPARTMENT,KRONENWETTER POLICE DEPARTMENT DROP BOX ONLY 24/7,1582 KRONENWETTER DR,KRONENWETTER,WI,54455,"http://maps.google.com/maps?q=1582 KRONENWETTER DR,+KRONENWETTER,+WI+54455&hl=en"
LAC COURTE OREILLES TRIBAL POLICE DEPARTMENT,LAC COURTE OREILLES TRIBAL POLICE DEPARTMENT EVENT 10:00AM-2:00PM,13394 W TREPANIA ROAD,HAYWARD,WI,54843,"http://maps.google.com/maps?q=13394 W TREPANIA ROAD,+HAYWARD,+WI+54843&hl=en"
LAC DU FLAMBEU TRIBAL POLICE DEPARTMENT,LAC DU FLAMBEAU TRIBAL POLICE DEPARTMENT EVENT 10:00 AM - 2:00 PM,623 PEACE PIPE RD,LAC DU FLAMBEAU,WI,54538,"http://maps.google.com/maps?q=623 PEACE PIPE RD,+LAC DU FLAMBEAU,+WI+54538&hl=en"
LAC VIEUX DESERT TRIBAL POLICE DEPARTMENT,LAC VIEUX DESERT TRIBAL POLICE DEPARTMENT,E23924 POW WOW TRAIL,WATERSMEET,MI,49969,"http://maps.google.com/maps?q=E23924 POW WOW TRAIL,+WATERSMEET,+MI+49969&hl=en"
MARATHON CITY POLICE DEPARTMENT,MARATHON CITY POLICE DEPARTMENT DROP BOX M-F 7:00AM-4:00PM,311 WALNUT STREET,MARATHON,WI,54448,"http://maps.google.com/maps?q=311 WALNUT STREET,+MARATHON,+WI+54448&hl=en"
MARINETTE COUNTY SHERIFF'S OFFICE,AMBERG COMMUNITY CENTER EVENT FROM 9:00AM-1:00PM,N15035 GRANT STREET/COUNTY HWY V,AMBERG,WI,54102,"http://maps.google.com/maps?q=N15035 GRANT STREET/COUNTY HWY V,+AMBERG,+WI+54102&hl=en"
MARINETTE COUNTY SHERIFF'S OFFICE,BAY AREA MEDICAL CENTER CRIVITZ EVENT FROM 9:00AM-1:00PM,112 N US HWY 141,CRIVITZ,WI,54114,"http://maps.google.com/maps?q=112 N US HWY 141,+CRIVITZ,+WI+54114&hl=en"
MARINETTE COUNTY SHERIFF'S OFFICE,BAY AREA MEDICAL CENTER MOBILITY CENTER EVENT FROM 9:00AM-1:00PM,3117 SHORE DRIVE,MARINETTE,WI,54143,"http://maps.google.com/maps?q=3117 SHORE DRIVE,+MARINETTE,+WI+54143&hl=en"
MARINETTE COUNTY SHERIFF'S OFFICE,MARINETTE COUNTY SHERIFF'S OFFICE EVENT FROM 9:00AM-1:00PM,2161 UNIVERSITY DR,MARINETTE,WI,54143,"http://maps.google.com/maps?q=2161 UNIVERSITY DR,+MARINETTE,+WI+54143&hl=en"
MARINETTE POLICE DEPARTMENT,MARINETTE POLICE DEPARTMENT DROP BOX 24/7,1905 HALL AVE.,MARINETTE,WI,54143,"http://maps.google.com/maps?q=1905 HALL AVE.,+MARINETTE,+WI+54143&hl=en"
MARION POLICE DEPARTMENT,"MARION POLICE DEPARTMENT DROP BOX M-F 7:00AM-12:00AM, S 10:00AM-12:00AM, S 12:00PM-10",124 W GARFIELD AVE,MARION,WI,54950,"http://maps.google.com/maps?q=124 W GARFIELD AVE,+MARION,+WI+54950&hl=en"
MARQUETTE POLICE DEPARTMENT,MARQUETTE POLICE DEPARTMENT,300 W BARAGA,MARQUETTE,MI,49855,"http://maps.google.com/maps?q=300 W BARAGA,+MARQUETTE,+MI+49855&hl=en"
MARSHFIELD POLICE DEPARTMENT,SHOPKO EVENT 10:00 AM - 2:00 PM,1306 N CENTRAL AVE,MARSHFIELD,WI,54449,"http://maps.google.com/maps?q=1306 N CENTRAL AVE,+MARSHFIELD,+WI+54449&hl=en"
MENOMINEE COUNTY SHERIFF'S OFFICE,MENOMINEE COUNTY SHERIFF'S OFFICE 10:00AM-4:00PM,W3269 COURTHOUSE LANE,KESHENA,WI,54135,"http://maps.google.com/maps?q=W3269 COURTHOUSE LANE,+KESHENA,+WI+54135&hl=en"
MENOMONIEE TRIBAL POLICE DEPARTMENT,MENOMONIEE TRIBAL POLICE DEPARTMENT EVENT 10:00AM-2:00PM,W3293 WOLF RIVER DRIVE,KESHENA,WI,54135,"http://maps.google.com/maps?q=W3293 WOLF RIVER DRIVE,+KESHENA,+WI+54135&hl=en"
MERRILL POLICE DEPARTMENT,MERRILL POLICE DEPARTMENT DROP BOX ONLY 24/7,1004 E 1ST ST,MERRILL,WI,54452,"http://maps.google.com/maps?q=1004 E 1ST ST,+MERRILL,+WI+54452&hl=en"
MICHIGAN STATE POLICE,MICHIGAN STATE POLICE CALUMET POST,55195 NORTH U.S. HIGHWAY 41,CALUMET,MI,49913,"http://maps.google.com/maps?q=55195 NORTH U.S. HIGHWAY 41,+CALUMET,+MI+49913&hl=en"
MICHIGAN STATE POLICE,MICHIGAN STATE POLICE GLADSTONE POST,922 LAKE SHORE DRIVE,GLADSTONE,MI,49837,"http://maps.google.com/maps?q=922 LAKE SHORE DRIVE,+GLADSTONE,+MI+49837&hl=en"
MICHIGAN STATE POLICE,MICHIGAN STATE POLICE IRON MOUNTAIN POST,1916 NORTH STEPHENSON,IRON MOUNTAIN,MI,49801,"http://maps.google.com/maps?q=1916 NORTH STEPHENSON,+IRON MOUNTAIN,+MI+49801&hl=en"
MICHIGAN STATE POLICE,MICHIGAN STATE POLICE NEGAUNEE POST,180 U.S. 41 EAST,NEGAUNEE,MI,49866,"http://maps.google.com/maps?q=180 U.S. 41 EAST,+NEGAUNEE,+MI+49866&hl=en"
MICHIGAN STATE POLICE,MICHIGAN STATE POLICE WAKEFIELD POST,100 SUNDAY LAKE STREET,WAKEFIELD,MI,49968,"http://maps.google.com/maps?q=100 SUNDAY LAKE STREET,+WAKEFIELD,+MI+49968&hl=en"
MICHIGAN TECH PUBLIC SAFETY & POLICE SERVICES,MICHIGAN TECH PUBLIC SAFETY,206 MACINNES DRIVE,HOUGHTON,MI,49931,"http://maps.google.com/maps?q=206 MACINNES DRIVE,+HOUGHTON,+MI+49931&hl=en"
MINOCQUA POLICE DEPARTMENT,MINOCQUA POLICE DEPARTMENT EVENT 10:00 AM TO 2:00 PM,418 E CHICAGO AVE,MINOCQUA,WI,54548,"http://maps.google.com/maps?q=418 E CHICAGO AVE,+MINOCQUA,+WI+54548&hl=en"
MOSINEE POLICE DEPARTMENT,MOSINEE POLICE DEPARTMENT EVENT 9:00AM-12:00PM,225 MAIN STREET,MOSINEE,WI,54455,"http://maps.google.com/maps?q=225 MAIN STREET,+MOSINEE,+WI+54455&hl=en"
OCONTO COUNTY SHERIFF'S OFFICE,OCONTO COUNTY SHERIFF'S OFFICE DROP BOX ONLY M-F 8:00AM-4:00PM,220 ARBUTUS AVE,OCONTO,WI,54153,"http://maps.google.com/maps?q=220 ARBUTUS AVE,+OCONTO,+WI+54153&hl=en"
ONEIDA COUNTY SHERIFF'S OFFICE,ONEIDA COUNTY LANDFILL EVENT 10:00AM-2:00PM,7450 COUNTY HIGHWAY K,RHINELANDER,WI,54501,"http://maps.google.com/maps?q=7450 COUNTY HIGHWAY K,+RHINELANDER,+WI+54501&hl=en"
ONTONAGON COUNTY SHERIFF OFFICE,ONTONAGON COUNTY SHERIFF OFFICE,620 CONGLOMERATE STREET,ONTONAGON,MI,49953,"http://maps.google.com/maps?q=620 CONGLOMERATE STREET,+ONTONAGON,+MI+49953&hl=en"
PARK FALLS POLICE DEPARTMENT,PARK FALLS POLICE DEPARTMENT EVENT 9:00AM-1:00PM,400 4TH AVE SOUTH,PARK FALLS,WI,54552,"http://maps.google.com/maps?q=400 4TH AVE SOUTH,+PARK FALLS,+WI+54552&hl=en"
PORTAGE COUNTY SHERIFF'S OFFICE,FAITH LUTHERAN CHURCH EVENT APRIL 24TH 11:30AM-12:30PM,253 S MAIN ST,ROSHOLT,WI,54473,"http://maps.google.com/maps?q=253 S MAIN ST,+ROSHOLT,+WI+54473&hl=en"
PORTAGE COUNTY SHERIFF'S OFFICE,VILLAGE PARK LODGE JUNCTION CITY APRIL 26TH 11:00 AM - 12:30PM,1001 MAIN STREET,JUNCTION CITY,WI,54443,"http://maps.google.com/maps?q=1001 MAIN STREET,+JUNCTION CITY,+WI+54443&hl=en"
PRICE COUNTY SHERIFF'S OFFICE,PRICE COUNTY SHERIFF'S OFFICE DROP BOX ONLY 24/7,164 CHERRY ST,PHILLIPS,WI,54555,"http://maps.google.com/maps?q=164 CHERRY ST,+PHILLIPS,+WI+54555&hl=en"
PROCTOR PD,PROCTOR POLICE DEPARTMENT,100 PIONK DRIVE,PROCTOR,MN,55810,"http://maps.google.com/maps?q=100 PIONK DRIVE,+PROCTOR,+MN+55810&hl=en"
PULASKI POLICE DEPARTMENT,PULASKI POLICE DEPARTMENT EVENT 8:00AM-12:00PM,585 E GLENBROOK DRIVE,PULASKI,WI,54162,"http://maps.google.com/maps?q=585 E GLENBROOK DRIVE,+PULASKI,+WI+54162&hl=en"
RHINELANDER POLICE DEPARTMENT,RHINELANDER POLICE DEPARTMENT EVENT 10:00AM-2:00PM,201 N BROWN ST,RHINELANDER,WI,54501,"http://maps.google.com/maps?q=201 N BROWN ST,+RHINELANDER,+WI+54501&hl=en"
RICE LAKE POLICE DEPARTMENT,RICE LAKE POLICE DEPARTMENT DROP BOX 24/7,34 SOUTH WILSON AVE,RICE LAKE,WI,54868,"http://maps.google.com/maps?q=34 SOUTH WILSON AVE,+RICE LAKE,+WI+54868&hl=en"
ROTHSCHILD POLICE DEPARTMENT,ROTHSCHILD POLICE DEPARTMENT DROP BOX ONLY 24/7,211 GRAND AVE,ROTHSCHILD,WI,54474,"http://maps.google.com/maps?q=211 GRAND AVE,+ROTHSCHILD,+WI+54474&hl=en"
RUSK COUNTY SHERIFF'S OFFICE,RUSK COUNTY SHERIFF'S OFFICE DROP BOX 24/7,"311 E. MINER AVE, SUITE L100",LADYSMITH,WI,54848,"http://maps.google.com/maps?q=311 E. MINER AVE, SUITE L100,+LADYSMITH,+WI+54848&hl=en"
SAWYER COUNTY SHERIFF'S OFFICE,WINTER CO-OP EVENT 10:00AM-1:00PM,5159 N SOUTH MAIN ST,WINTER,WI,54896,"http://maps.google.com/maps?q=5159 N SOUTH MAIN ST,+WINTER,+WI+54896&hl=en"
SHAWANO POLICE DEPARTMENT,SHAWANO POLICE DEPARTMENT DROP BOX 24/7,125 S. SAWYER ST,SHAWANO,WI,54166,"http://maps.google.com/maps?q=125 S. SAWYER ST,+SHAWANO,+WI+54166&hl=en"
SPENCER POLICE DEPARTMENT,SPENCER POLICE DEPARTMENT EVENT 10:00AM-2:00PM,105 S PARK STREET,SPENCER,WI,54479,"http://maps.google.com/maps?q=105 S PARK STREET,+SPENCER,+WI+54479&hl=en"
STANLEY POLICE DEPARTMENT,STANLEY POLICE DEPARTMENT EVENT 10:00AM-2:00PM,353 SOUTH BROADWAY STREET,STANLEY,WI,54768,"http://maps.google.com/maps?q=353 SOUTH BROADWAY STREET,+STANLEY,+WI+54768&hl=en"
SUPERIOR POLICE DEPARTMENT,SUPERIOR POLICE DEPARTMENT DROP BOX,1316 N 14TH STREETSUITE 150,SUPERIOR,WI,54880,"http://maps.google.com/maps?q=1316 N 14TH STREET,+SUPERIOR,+WI+54880&hl=en"
SURING POLICE DEPARTMENT,SURING POLICE DEPARTMENT EVENT 9:00AM-1:00PM,604 E MAIN STREET,SURING,WI,54174,"http://maps.google.com/maps?q=604 E MAIN STREET,+SURING,+WI+54174&hl=en"
TAYLOR COUNTY SHERIFF'S OFFICE,TAYLOR COUNTY SHERIFF'S OFFICE DROP BOX M-F 8:30AM-4:30PM,224 SOUTH 2ND STREET,MEDFORD,WI,54451,"http://maps.google.com/maps?q=224 SOUTH 2ND STREET,+MEDFORD,+WI+54451&hl=en"
THORP POLICE DEPARTMENT,THORP POLICE DEPARTMENT DROP BOX M-F 8:00AM-5:00PM,300 W PROSPECT ST,THORP,WI,54771,"http://maps.google.com/maps?q=300 W PROSPECT ST,+THORP,+WI+54771&hl=en"
THREE LAKES POLICE DEPARTMENT,THREE LAKES POLICE DEPARTMENT EVENT 10:00AM-2:00PM,1733 SUPERIOR STREET,THREE LAKES,WI,54562,"http://maps.google.com/maps?q=1733 SUPERIOR STREET,+THREE LAKES,+WI+54562&hl=en"
TOMAHAWK POLICE DEPT,TOMAHAWK POLICE DEPT 7:00AM-11:00PM,219 W SOMO AVE,TOMAHAWK,WI,54487,"http://maps.google.com/maps?q=219 W SOMO AVE,+TOMAHAWK,+WI+54487&hl=en"
VILAS COUNTY SHERIFF'S OFFICE,VILAS CONTY SHERIFF'S OFFICE EVENT 10:00AM-3:30PM,330 COURT STREET,EAGLE RIVER,WI,54521,"http://maps.google.com/maps?q=330 COURT STREET,+EAGLE RIVER,+WI+54521&hl=en"
VILLAGE OF FALL CREEK POLICE DEPARTMENT,VILLAGE OF FALL CREEK DROP BOX M-F 8:0AM-4:30PM (CLOSED 12-1),122 E LINCOLN AVENUE,FALL CREEK,WI,54742,"http://maps.google.com/maps?q=122 E LINCOLN AVENUE,+FALL CREEK,+WI+54742&hl=en"
WASHBURN COUNTY SHERIFF'S OFFICE,WASHBURN COUNTY SHERIFF'S OFFICE EVENT 10:00AM-2:00PM,421 HWY 63,SHELL LAKE,WI,54871,"http://maps.google.com/maps?q=421 HWY 63,+SHELL LAKE,+WI+54871&hl=en"
WASHINGTON ISLAND POLICE DEPARTMENT,WASHINGTON ISLAND POLICE DEPARTMENT EVENT 10:00AM-12:00PM,1045 MAIN ROAD,WASHINGTON ISLAND,WI,54246,"http://maps.google.com/maps?q=1045 MAIN ROAD,+WASHINGTON ISLAND,+WI+54246&hl=en"
WAUSAU POLICE DEPARTMENT,WAUSAU POLICE DEPARTMENT EVENT 10:00AM-2:00PM,515 GRAND AVE,WAUSAU,WI,54403,"http://maps.google.com/maps?q=515 GRAND AVE,+WAUSAU,+WI+54403&hl=en"
