Participant,CollectionSite,Address,City,State,Zip,MapURL
OLDHAM COUNTY SHERIFF'S OFFICE,LAGRANGE FIRE DEPARTMENT STATION 2,3637 W HWY 146,BUCKNER,KY,40010,"http://maps.google.com/maps?q=3637 W HWY 146,+BUCKNER,+KY+40010&hl=en"
OLDHAM COUNTY SHERIFF'S OFFICE,NORTH OLDHAM FIRE DEPARTMENT,1660 HIGHWAY 1793,GOSHEN,KY,40026,"http://maps.google.com/maps?q=1660 HIGHWAY 1793,+GOSHEN,+KY+40026&hl=en"
OLDHAM COUNTY SHERIFF'S OFFICE,OLDHAM COUNTY POLICE DEPARTMENT,1855 NORTH HIGHWAY 393,LA GRANGE,KY,40031,"http://maps.google.com/maps?q=1855 NORTH HIGHWAY 393,+LA GRANGE,+KY+40031&hl=en"
OVERTON COUNTY SHERIFF'S DEPT.,FRED'S PHARMACY,890 OVERTON PLAZA,LIVINGSTON,TN,38570,"http://maps.google.com/maps?q=890 OVERTON PLAZA,+LIVINGSTON,+TN+38570&hl=en"
OWINGSVILLE POLICE DEPARTMENT,OWINGSVILLE POLICE DEPARTMENT,19 GOODPASTER AVE,OWINGSVILLE,KY,40360,"http://maps.google.com/maps?q=19 GOODPASTER AVE,+OWINGSVILLE,+KY+40360&hl=en"
PENDLETON COUNTY SHERIFF'S OFFICE,PENDLETON COUNTY SHERIFF'S OFFICE,202 CHAPEL STREET,FALMOUTH,KY,41040,"http://maps.google.com/maps?q=202 CHAPEL STREET,+FALMOUTH,+KY+41040&hl=en"
PIERCE TOWNSHIP POLICE DEPARTMENT,PIERCE TOWNSHIP POLICE DEPARTMENT,950 LOCUST CORNER RD,CINCINNATI,OH,45245,"http://maps.google.com/maps?q=950 LOCUST CORNER RD,+CINCINNATI,+OH+45245&hl=en"
PROSPECT POLICE DEPARTMENT,KROGER,5929 TIMBER RIDGE DR.,PROSPECT,KY,40059,"http://maps.google.com/maps?q=5929 TIMBER RIDGE DR.,+PROSPECT,+KY+40059&hl=en"
PULASKI (TOWN OF) POLICE DEPARTMENT,FOOD CITY PARKING LOT NEAR ENTRANCE TO STORE,1400 BOB WHITE BLVD,PULASKI,VA,24301,"http://maps.google.com/maps?q=1400 BOB WHITE BLVD,+PULASKI,+VA+24301&hl=en"
PULASKI COUNTY SERIFF'S OFFICE,KROGER PHARMACY SOUTH LOCATION STONEGATE CENTER,50 STONEGATE CENTER,SOMERSET,KY,42501,"http://maps.google.com/maps?q=50 STONEGATE CENTER,+SOMERSET,+KY+42501&hl=en"
PULASKI SHERIFF'S OFFICE,"FAIRLAWN WALMART APRIL 28, 2018 LOCATION",7373 PEPPERS FERRY BLVD,RADFORD,VA,24141,"http://maps.google.com/maps?q=7373 PEPPERS FERRY BLVD,+RADFORD,+VA+24141&hl=en"
PUTNAM COUNTY SHERIFF'S DEPARTMENT,PUTNAM COUNTY SHERIFF'S DEPARTMENT,SHERIFF'S DEPARTMENT3389 WINFIELD ROAD,WINFIELD,WV,25213,"http://maps.google.com/maps?q=SHERIFF'S DEPARTMENT,+WINFIELD,+WV+25213&hl=en"
RADFORD CITY POLICE DEPARTMENT,RADFORD FIRE DEPARTMENT PARKING LOT,1500 WADSWORTH STREET,RADFORD,VA,24141,"http://maps.google.com/maps?q=1500 WADSWORTH STREET,+RADFORD,+VA+24141&hl=en"
RALEIGH COUNTY SD,CRAB ORCHARD PHARMACY,1299 ROBERT C. BYRD DRIVE,CRAB ORCHARD,WV,25827,"http://maps.google.com/maps?q=1299 ROBERT C. BYRD DRIVE,+CRAB ORCHARD,+WV+25827&hl=en"
RICHLANDS POLICE DEPARTMENT,RICHLANDS POLICE DEPARTMENT FRONT LOBBY,1851 CRANWELL DRIVE,RICHLANDS,VA,24641,"http://maps.google.com/maps?q=1851 CRANWELL DRIVE,+RICHLANDS,+VA+24641&hl=en"
RICHMOND POLICE DEPARTMENT,RICHMOND POLICE DEPARTMENT,1721 LEXINGTON RD,RICHMOND,KY,40475,"http://maps.google.com/maps?q=1721 LEXINGTON RD,+RICHMOND,+KY+40475&hl=en"
ROCKY TOP POLICE DEPARTMENT,ROCKY TOP POLICE AND FIRE DEPT.,104 LAWSON ST.,ROCKY TOP,TN,37769,"http://maps.google.com/maps?q=104 LAWSON ST.,+ROCKY TOP,+TN+37769&hl=en"
ROSS COUNTY SHERIFF'S OFFICE,ROSS COUNTY LAW COMPLEX,28 N PAINT ST.,CHILLICOTHE,OH,45601,"http://maps.google.com/maps?q=28 N PAINT ST.,+CHILLICOTHE,+OH+45601&hl=en"
ROWAN COUNTY SHERIFF'S OFFICE,KSP POST 8 MOREHEAD,1595 FLEMINGSBURG ROAD,MOREHEAD,KY,40351,"http://maps.google.com/maps?q=1595 FLEMINGSBURG ROAD,+MOREHEAD,+KY+40351&hl=en"
RUSSELL COUNTY SHERIFF'S OFFICE,BLUE DEVIL DRUG,19408 HWY 58,CASTLEWOOD,VA,24224,"http://maps.google.com/maps?q=19408 HWY 58,+CASTLEWOOD,+VA+24224&hl=en"
RUSSELL COUNTY SHERIFF'S OFFICE,FOOD CITY,159 PITTSTON RD,LEBANON,VA,24266,"http://maps.google.com/maps?q=159 PITTSTON RD,+LEBANON,+VA+24266&hl=en"
RUSSELL COUNTY SHERIFF'S OFFICE,NEW GARDEN PHARMACY,5300 REDBUD HWY,HONAKER,VA,24260,"http://maps.google.com/maps?q=5300 REDBUD HWY,+HONAKER,+VA+24260&hl=en"
RUSSELL COUNTY SHERIFF'S OFFICE,RUSSELL COUNTY SHERIFF'S OFFICE,410 MONUMENT SQUARE #109,JAMESTOWN,KY,42629,"http://maps.google.com/maps?q=410 MONUMENT SQUARE #109,+JAMESTOWN,+KY+42629&hl=en"
RUTLEDGE POLICE DEPT.,RUTLEDGE CITY HALL,8028 RUTLEDGE PIKE,RUTLEDGE,TN,37861,"http://maps.google.com/maps?q=8028 RUTLEDGE PIKE,+RUTLEDGE,+TN+37861&hl=en"
SALTVILLE POLICE DEPARTMENT,SALTVILLE POLICE DEPARTMENT,217 PALMER AVE,SALTVILLE,VA,24370,"http://maps.google.com/maps?q=217 PALMER AVE,+SALTVILLE,+VA+24370&hl=en"
SCOTT COUNTY SHERIFF'S OFFICE,FOOD COUNTRY OUTSIDE NEAR MAIN ENTRANCE,42158 US 58,DUFFIELD,VA,24244,"http://maps.google.com/maps?q=42158 US 58,+DUFFIELD,+VA+24244&hl=en"
SCOTT COUNTY SHERIFF'S OFFICE,SCOTT COUNTY SHERIFF'S OFFICE,575 SCOTT HIGH DRIVE,HUNTSVILLE,TN,37756,"http://maps.google.com/maps?q=575 SCOTT HIGH DRIVE,+HUNTSVILLE,+TN+37756&hl=en"
SCOTT COUNTY SHERIFF'S OFFICE,SCOTT COUNTY SHERIFF'S OFFICE NEAR MAIN ENTRANCE,336 WATER STREET,GATE CITY,VA,24251,"http://maps.google.com/maps?q=336 WATER  STREET,+GATE CITY,+VA+24251&hl=en"
SHELBY COUNTY CORONER OFFICE,SHELBY COUNTY CORONER'S OFFICE,419 WASHINGTON STREET,SHELBYVILLE,KY,40065,"http://maps.google.com/maps?q=419 WASHINGTON STREET,+SHELBYVILLE,+KY+40065&hl=en"
SMYTH COUNTY SHERIFF'S OFFICE,FOOD CITY,910 N. MAIN ST.,MARION,VA,24354,"http://maps.google.com/maps?q=910 N. MAIN ST.,+MARION,+VA+24354&hl=en"
SPENCER POLICE DEPARTMENT,SPENCER POLICE DEPARTMENT,116 COURT ST,SPENCER,WV,25276,"http://maps.google.com/maps?q=116 COURT ST,+SPENCER,+WV+25276&hl=en"
ST. ALBANS POLICE DEPARTMENT,ST. ALBANS POLICE DEPARTMENT,51 6TH AVENUE,SAINT ALBANS,WV,25177,"http://maps.google.com/maps?q=51 6TH AVENUE,+SAINT ALBANS,+WV+25177&hl=en"
ST. PAUL POLICE DEPARTMENT,FOOD CITY,16410 WISE ST.,SAINT PAUL,VA,24283,"http://maps.google.com/maps?q=16410 WISE ST.,+SAINT PAUL,+VA+24283&hl=en"
TAZEWELL (TOWN OF) POLICE DEPARTMENT,TAZEWELL POLICE DEPARTMENT,211 CENTRAL AVE,TAZEWELL,VA,24651,"http://maps.google.com/maps?q=211 CENTRAL AVE,+TAZEWELL,+VA+24651&hl=en"
TUSCULUM POLICE DEPARTMENT,DOAK ELEMENTARY SCHOOL,70 WEST STREET,GREENEVILLE,TN,37745,"http://maps.google.com/maps?q=70 WEST STREET,+GREENEVILLE,+TN+37745&hl=en"
UNION COUNTY SHERIFF'S OFFICE,UNION COUNTY SHERIFFS OFFICE,130 VETERANS STREET,MAYNARDVILLE,TN,37807,"http://maps.google.com/maps?q=130 VETERANS STREET,+MAYNARDVILLE,+TN+37807&hl=en"
UNIVERSITY OF CINCINNATI PUBLIC SAFETY DEPARTMENT,UNIVERSITY OF CINCINNATI PUBLIC SAFETY DEPARTMENT,51 W. CORRY BLVD.EDWARDS THREE,CINCINNATI,OH,45221,"http://maps.google.com/maps?q=51 W. CORRY BLVD.,+CINCINNATI,+OH+45221&hl=en"
VIRGINIA STATE POLICE,VIRGINIA STATE POLICE DIVISION IV HQS POC: LT PATRICK KIRTNER,1186 EAST LEE HIGHWAY,WYTHEVILLE,VA,24382,"http://maps.google.com/maps?q=1186 EAST LEE HIGHWAY,+WYTHEVILLE,+VA+24382&hl=en"
WASHINGTON COUNTY SHERIFF'S OFFICE,GLADE PHARMACY,33472 LEE HWY,GLADE SPRING,VA,24340,"http://maps.google.com/maps?q=33472 LEE HWY,+GLADE SPRING,+VA+24340&hl=en"
WASHINGTON COUNTY SHERIFF'S OFFICE,MICHAELS PHARMACY (276)676-2900,101 CHARWOOD DRIVE,ABINGDON,VA,24210,"http://maps.google.com/maps?q=101 CHARWOOD DRIVE,+ABINGDON,+VA+24210&hl=en"
WASHINGTON COUNTY SHERIFF'S OFFICE,WALMART SUPER CENTER (276)619-4843,16032 FIFTEEN MILE BOULEVARD,ABINGDON,VA,24211,"http://maps.google.com/maps?q=16032 FIFTEEN MILE BOULEVARD,+ABINGDON,+VA+24211&hl=en"
WASHINGTON COUNTY TENNESSEE SHERIFFS OFFICE,GRAY COMMUNITY CHEST,113 GRAY RURITAN DRIVE,GRAY,TN,37615,"http://maps.google.com/maps?q=113 GRAY RURITAN DRIVE,+GRAY,+TN+37615&hl=en"
WEBER CITY POLICE DEPARTMENT,FOOD CITY - WEBER CITY NEAR FRONT ENTRANCE,FRANK B. SMITH LN,WEBER CITY,VA,24290,"http://maps.google.com/maps?q=FRANK B. SMITH LN,+WEBER CITY,+VA+24290&hl=en"
WEST VIRGINIA STATE POLICE,WEST VIRGINIA STATE POLICE SGT B K WELLMAN/3045285555,3339 US ROUTE 60 EAST,HUNTINGTON,WV,25705,"http://maps.google.com/maps?q=3339 US ROUTE 60 EAST,+HUNTINGTON,+WV+25705&hl=en"
WEST VIRGINIA STATE POLICE,WEST VIRGINIA STATE POLICE SGT R.J. DRAKE/3048243101,8021 COURT AVENUE,HAMLIN,WV,25523,"http://maps.google.com/maps?q=8021 COURT AVENUE,+HAMLIN,+WV+25523&hl=en"
WEST VIRGINIA STATE POLICE,WEST VIRGINIA STATE POLICE SGT R.L. FRYE/3047927200,735 RIVERVIEW AVENUE,LOGAN,WV,25601,"http://maps.google.com/maps?q=735 RIVERVIEW AVENUE,+LOGAN,+WV+25601&hl=en"
WEST VIRGINIA STATE POLICE,WEST VIRGINIA STATE POLICE SGT. B.K. HAMMONTREE/3045587777,711 JEFFERSON ROAD,SOUTH CHARLESTON,WV,25309,"http://maps.google.com/maps?q=711 JEFFERSON ROAD,+SOUTH CHARLESTON,+WV+25309&hl=en"
WEST VIRGINIA STATE POLICE,WEST VIRGINIA STATE POLICE SGT. C.H.FLOWERS/304-586-2000,3389 WINFIELD ROAD,WINFIELD,WV,25213,"http://maps.google.com/maps?q=3389 WINFIELD ROAD,+WINFIELD,+WV+25213&hl=en"
WEST VIRGINIA STATE POLICE,WVSP-BECKLEY SGT G.D. WILLIAMS/3042566700,105 PINECREST DR,BECKLEY,WV,25801,"http://maps.google.com/maps?q=105 PINECREST DR,+BECKLEY,+WV+25801&hl=en"
WEST VIRGINIA STATE POLICE,WVSP-LEWISBURG SGT D.A EVANS/3046477600,381 GREENBRIAR RD,LEWISBURG,WV,24901,"http://maps.google.com/maps?q=381 GREENBRIAR RD,+LEWISBURG,+WV+24901&hl=en"
WEST VIRGINIA STATE POLICE,WVSP-OAK HILL SGT. J.L. MILAM/3044692915,3057 MAIN ST,OAK HILL,WV,25901,"http://maps.google.com/maps?q=3057 MAIN ST,+OAK HILL,+WV+25901&hl=en"
WEST VIRGINIA STATE POLICE,WVSP-PRINCETON SGT. D.W. MILLER/3044252101,910 OAKVALE RD,PRINCETON,WV,24740,"http://maps.google.com/maps?q=910 OAKVALE RD,+PRINCETON,+WV+24740&hl=en"
WHITE PINE POLICE DEPT.,WHITE PINE PD,1548 MAIN ST.,WHITE PINE,TN,37890,"http://maps.google.com/maps?q=1548 MAIN ST.,+WHITE PINE,+TN+37890&hl=en"
"WILLIAMSON, WV POLICE DEPARTMENT","WILLIAMSON, WV PD",108 EAST 4TH AVE,WILLIAMSON,WV,25661,"http://maps.google.com/maps?q=108 EAST 4TH AVE,+WILLIAMSON,+WV+25661&hl=en"
WILMINGTON POLICE DEPARTMENT,BLANCHESTER POLICE DEPARTMENT,318 E MAIN,BLANCHESTER,OH,45107,"http://maps.google.com/maps?q=318 E MAIN,+BLANCHESTER,+OH+45107&hl=en"
WILMINGTON POLICE DEPARTMENT,CVS OF WILMINGTON,120 E MAIN STREET,WILMINGTON,OH,45177,"http://maps.google.com/maps?q=120 E MAIN STREET,+WILMINGTON,+OH+45177&hl=en"
WINCHESTER POLICE DEPARTMENT,WINCHESTER POLICE DEPARTMENT WINCHESTER POLICE DEPARTMENT,16 SOUTH MAPLE STREET,WINCHESTER,KY,40391,"http://maps.google.com/maps?q=16 SOUTH MAPLE STREET,+WINCHESTER,+KY+40391&hl=en"
WINFIELD WV POLICE DEPT,WINFIELD WV POLICE DEPARTMENT,3232 WINFIELD ROAD,WINFIELD,WV,25213,"http://maps.google.com/maps?q=3232 WINFIELD ROAD,+WINFIELD,+WV+25213&hl=en"
WISE COUNTY SHERIFF'S OFFICE,FOOD CITY,16410 WISE ST,SAINT PAUL,VA,24283,"http://maps.google.com/maps?q=16410 WISE ST,+SAINT PAUL,+VA+24283&hl=en"
WISE POLICE DEPARTMENT,FOOD CITY NEAR FRONT ENTRANCE,207 WOODLAND DRIVE,WISE,VA,24293,"http://maps.google.com/maps?q=207 WOODLAND DRIVE,+WISE,+VA+24293&hl=en"
WOODFORD COUNTY SHERIFF'S OFFICE,KROGER,KROGER WAY,VERSAILLES,KY,40383,"http://maps.google.com/maps?q=KROGER WAY,+VERSAILLES,+KY+40383&hl=en"
WOODFORD COUNTY SHERIFF'S OFFICE,KROGERS,212 KROGER WAY,VERSAILLES,KY,40383,"http://maps.google.com/maps?q=212 KROGER WAY,+VERSAILLES,+KY+40383&hl=en"
WOODFORD COUNTY SHERIFF'S OFFICE,MIDWAY CITY HALL,101 E MAIN ST,MIDWAY,KY,40347,"http://maps.google.com/maps?q=101 E MAIN ST,+MIDWAY,+KY+40347&hl=en"
WOODFORD COUNTY SHERIFF'S OFFICE,WOODFORD COUNTY SHERIFFS OFFICE SIDE OF COURT HOUSE ON COURT ST.,103 SOUTH MAIN ST,VERSAILLES,KY,40383,"http://maps.google.com/maps?q=103 SOUTH MAIN ST,+VERSAILLES,+KY+40383&hl=en"
WV DIVISION OF PROTECTIVE SERVICES,WV STATE CAPITOL BUILDING OUTSIDE-CALIFORNIA AVE,1900 KANAWHA BOULEVARD EAST,CHARLESTON,WV,25305,"http://maps.google.com/maps?q=1900 KANAWHA BOULEVARD EAST,+CHARLESTON,+WV+25305&hl=en"
WYTHE COUNTY SHERIFF'S OFFICE,WYTHE COUNTY SHERIFF'S OFFICE SALLY PORT AREA FOR COLLECTION,245 S 4TH STREET,WYTHEVILLE,VA,24382,"http://maps.google.com/maps?q=245 S 4TH STREET,+WYTHEVILLE,+VA+24382&hl=en"
