Participant,CollectionSite,Address,City,State,Zip,MapURL
ALBEMARLE COUNTY POLICE DEPARTMENT,WEGMANS,100 WEGMANS WAY,CHARLOTTESVILLE,VA,22902,"http://maps.google.com/maps?q=100 WEGMANS WAY,+CHARLOTTESVILLE,+VA+22902&hl=en"
AMELIA COUNTY SHERFF'S OFFICE,AMELIA PHARMACY INC. FRONT SIDEWALK BY STORE ENTRANCE,15412 PATRICK HENRY HWY.,AMELIA,VA,23002,"http://maps.google.com/maps?q=15412 PATRICK HENRY HWY.,+AMELIA,+VA+23002&hl=en"
AMELIA COUNTY SHERFF'S OFFICE,RITE AID PHARMACY FRONT SIDEWALK BY STORE ENTRANCE,15105 PATRICK HENRY HWY,AMELIA,VA,23002,"http://maps.google.com/maps?q=15105 PATRICK HENRY HWY,+AMELIA,+VA+23002&hl=en"
AMHERST COUNTY SHERIFF'S OFFICE,AMHERST COUNTY SHERIFF'S OFFICE PHONE NUMBER 434-946-9381,115 TAYLOR ST,AMHERST,VA,24521,"http://maps.google.com/maps?q=115 TAYLOR ST,+AMHERST,+VA+24521&hl=en"
APPOMATTOX COUNTY SHERIFF'S OFFICE,HOMETOWN PHARMACY,199 OLD COURTHOUSE ROAD,APPOMATTOX,VA,24522,"http://maps.google.com/maps?q=199 OLD COURTHOUSE ROAD,+APPOMATTOX,+VA+24522&hl=en"
ASHLAND POLICE DEPARTMENT,ASHLAND POLICE DEPARTMENT VISITOR PARKING LOT,601 ENGLAND STREET,ASHLAND,VA,23005,"http://maps.google.com/maps?q=601 ENGLAND STREET,+ASHLAND,+VA+23005&hl=en"
BLACKSTONE (TOWN OF) POLICE DEPARTMENT,BLACKSTONE POLICE DEPT CONFERENCE ROOM,101 WEST ELM STREET,BLACKSTONE,VA,23824,"http://maps.google.com/maps?q=101 WEST ELM STREET,+BLACKSTONE,+VA+23824&hl=en"
BRUNSWICK COUNTY SHERIFF'S OFFICE,DOSHER MEMORIAL HOSPITAL,924 N. HOWE STREET,SOUTHPORT,NC,28461,"http://maps.google.com/maps?q=924 N. HOWE STREET,+SOUTHPORT,+NC+28461&hl=en"
BRUNSWICK COUNTY SHERIFF'S OFFICE,NOVANT HEALTH BRUNSWICK MEDICAL CENTER,240 HOSPITAL DRIVE NE,BOLIVIA,NC,28422,"http://maps.google.com/maps?q=240 HOSPITAL DRIVE NE,+BOLIVIA,+NC+28422&hl=en"
BUENA VISTA POLICE DEPARTMENT,CVS PHARMACY EXTERIOR BREEZEWAY,2148 E. MIDLAND TRAIL,BUENA VISTA,VA,24416,"http://maps.google.com/maps?q=2148 E. MIDLAND TRAIL,+BUENA VISTA,+VA+24416&hl=en"
CAROLINE COUNTY SHERIFF'S OFFICE,CVS PHARMACY PARKING LOT,18048 JEFFERSON DAVIS HIGHWAY,RUTHER GLEN,VA,22546,"http://maps.google.com/maps?q=18048 JEFFERSON DAVIS HIGHWAY,+RUTHER GLEN,+VA+22546&hl=en"
CARY POLICE DEPARTMENT,CARY POLICE DEPARTMENT DET. WHITNEY MATTHEWS,120 WILKINSON AVE,CARY,NC,27513,"http://maps.google.com/maps?q=120 WILKINSON AVE,+CARY,+NC+27513&hl=en"
CARY POLICE DEPARTMENT,CHRIST THE KING LUTHERAN CHURCH DET. WHITNEY MATTHEWS,600 WALNUT ST,CARY,NC,27511,"http://maps.google.com/maps?q=600 WALNUT ST,+CARY,+NC+27511&hl=en"
CARY POLICE DEPARTMENT,CVS DET. WHITNEY MATTHEWS,2994 KILDAIRE FARM RD,CARY,NC,27511,"http://maps.google.com/maps?q=2994 KILDAIRE FARM RD,+CARY,+NC+27511&hl=en"
CARY POLICE DEPARTMENT,WALGREENS DET. WHITNEY MATTHEWS,10210 GREEN LEVEL CHURCH RD,CARY,NC,27519,"http://maps.google.com/maps?q=10210 GREEN LEVEL CHURCH RD,+CARY,+NC+27519&hl=en"
CARY POLICE DEPARTMENT,WALGREENS DET. WHITNEY MATTHEWS,1210 KILDAIRE FARM RD,CARY,NC,27511,"http://maps.google.com/maps?q=1210 KILDAIRE FARM RD,+CARY,+NC+27511&hl=en"
CHESAPEAKE POLICE DEPARTMENT,CHESAPEAKE POLICE 2ND PRECINCT,1209 20TH STREET,CHESAPEAKE,VA,23324,"http://maps.google.com/maps?q=1209 20TH STREET,+CHESAPEAKE,+VA+23324&hl=en"
CHESAPEAKE POLICE DEPARTMENT,CHESAPEAKE POLICE 3RD PRECINCT,949 NORTH GEORGE WASHINGTON HIGHWAY,CHESAPEAKE,VA,23323,"http://maps.google.com/maps?q=949 NORTH GEORGE WASHINGTON HIGHWAY,+CHESAPEAKE,+VA+23323&hl=en"
CHESAPEAKE POLICE DEPARTMENT,CHESAPEAKE POLICE 4TH PRECINCT,4764 STATION HOUSE ROAD,CHESAPEAKE,VA,23321,"http://maps.google.com/maps?q=4764 STATION HOUSE ROAD,+CHESAPEAKE,+VA+23321&hl=en"
CHESAPEAKE POLICE DEPARTMENT,CHESAPEAKE POLICE 5TH PRECINCT,400 VOLVO PARKWAY,CHESAPEAKE,VA,23320,"http://maps.google.com/maps?q=400 VOLVO PARKWAY,+CHESAPEAKE,+VA+23320&hl=en"
CHESAPEAKE SHERIFF'S OFFICE,CHESAPEAKE SHERIFF'S OFFICE ADMIN BUILDING ACROSS FROM CORRECTIONAL CENTER,401 ALBEMARLE DRIVE,CHESAPEAKE,VA,23322,"http://maps.google.com/maps?q=401 ALBEMARLE DRIVE,+CHESAPEAKE,+VA+23322&hl=en"
CHESTERFIELD COUNTY POLICE DEPARTMENT,WEGMANS,12501 STONE VILLAGE WAY,MIDLOTHIAN,VA,23113,"http://maps.google.com/maps?q=12501 STONE VILLAGE WAY,+MIDLOTHIAN,+VA+23113&hl=en"
COLONIAL HEIGHTS POLICE DEPARTMENT,ASHLEY FURNITURE HOMESTORE PARKING LOT,1899 SOUTHPARK BLVD,COLONIAL HEIGHTS,VA,23834,"http://maps.google.com/maps?q=1899 SOUTHPARK BLVD,+COLONIAL HEIGHTS,+VA+23834&hl=en"
CURRITUCK COUNTY SHERIFF'S OFFICE,CURRITUCK FAMILY YMCA,130 COMMUNITY WAY,BARCO,NC,27917,"http://maps.google.com/maps?q=130 COMMUNITY WAY,+BARCO,+NC+27917&hl=en"
DANVILLE POLICE DEPARTMENT,CENTRA MEDICAL GROUP DANVILLE PARKING LOT - WEST END OF THE BUILDING,414 PARK AVE,DANVILLE,VA,24541,"http://maps.google.com/maps?q=414 PARK AVE,+DANVILLE,+VA+24541&hl=en"
DINWIDDIE COUNTY SHERIFF'S OFFICE,EASTSIDE ENHANCEMENT CENTER,7301 BOYDTON PLANK ROAD,PETERSBURG,VA,23803,"http://maps.google.com/maps?q=7301 BOYDTON PLANK ROAD,+PETERSBURG,+VA+23803&hl=en"
DURHAM POLICE DEPARTMENT,CVS,3573 HILLSBOROUGH RD,DURHAM,NC,27705,"http://maps.google.com/maps?q=3573 HILLSBOROUGH RD,+DURHAM,+NC+27705&hl=en"
DURHAM POLICE DEPARTMENT,TRIANGLE PHARMACY,1700 E NC HIGHWAY 54,DURHAM,NC,27713,"http://maps.google.com/maps?q=1700 E NC HIGHWAY 54,+DURHAM,+NC+27713&hl=en"
DURHAM POLICE DEPARTMENT,WALGREENS,1812 HOLLOWAY STREET,DURHAM,NC,27701,"http://maps.google.com/maps?q=1812 HOLLOWAY STREET,+DURHAM,+NC+27701&hl=en"
DURHAM POLICE DEPARTMENT,WALGREENS,6405 FAYETTEVILLE RD,DURHAM,NC,27713,"http://maps.google.com/maps?q=6405 FAYETTEVILLE RD,+DURHAM,+NC+27713&hl=en"
FARMVILLE POLICE DEPARTMENT/LONGWOOD UNIVERSITY PD,MIDTOWN SQUARE IN FRONT OF CHICK-FIL-A,156 S. SOUTH STREET,FARMVILLE,VA,23901,"http://maps.google.com/maps?q=156 S. SOUTH STREET,+FARMVILLE,+VA+23901&hl=en"
FLORENCE POLICE DEPARTMENT,WEST FLORENCE HIGH SCHOOL,221 N. BELTLINE DR.,FLORENCE,SC,29505,"http://maps.google.com/maps?q=221 N. BELTLINE DR.,+FLORENCE,+SC+29505&hl=en"
FLUVANNA COUNTY SHERIFF'S OFFICE,JEFFERSON PHARMACY,194 B TURKEY SAG TRAIL,PALMYRA,VA,22963,"http://maps.google.com/maps?q=194 B TURKEY SAG TRAIL,+PALMYRA,+VA+22963&hl=en"
FRANKLIN COUNTY SHERIFF'S OFFICE,FRANKLIN COUNTY SHERIFF'S WESTLAKE SUBSTATION,13205 BOOKER T. WASHINGTON HWY,HARDY,VA,24101,"http://maps.google.com/maps?q=13205 BOOKER T. WASHINGTON HWY,+HARDY,+VA+24101&hl=en"
GLOUCESTER COUNTY SHERIFF'S OFFICE,GLOUCESTER PHARMACY,7453 HARGETT BLVD,GLOUCESTER,VA,23061,"http://maps.google.com/maps?q=7453 HARGETT BLVD,+GLOUCESTER,+VA+23061&hl=en"
GLOUCESTER COUNTY SHERIFF'S OFFICE,WALGREEN'S PHARMACY FRONT ENTRANCE,2418 GEORGE WASHINGTON MEMORIAL HIGHWAY,HAYES,VA,23072,"http://maps.google.com/maps?q=2418 GEORGE WASHINGTON MEMORIAL HIGHWAY,+HAYES,+VA+23072&hl=en"
GOOCHLAND COUNTY SHERIFF'S OFFICE,GOOCHLAND FIRE/RESCUE COMPANY 5,2710 FAIRGROUNDS ROAD,GOOCHLAND,VA,23063,"http://maps.google.com/maps?q=2710 FAIRGROUNDS ROAD,+GOOCHLAND,+VA+23063&hl=en"
GOOCHLAND COUNTY SHERIFF'S OFFICE,WEST CREEK EMERGENCY CENTER,12720 TUCKAHOE CREEK PKWY,HENRICO,VA,23238,"http://maps.google.com/maps?q=12720 TUCKAHOE CREEK PKWY,+HENRICO,+VA+23238&hl=en"
HAMPTON POLICE DIVISION,SENTARA CAREPLEX HOSPITAL NEAR EMERGENCY ROOM ENTRANCE,3000 COLISEUM DRIVE,HAMPTON,VA,23666,"http://maps.google.com/maps?q=3000 COLISEUM DRIVE,+HAMPTON,+VA+23666&hl=en"
HANOVER COUNTY SHERIFF'S OFFICE,MECHANICSVILLE CONVENIENCE CENTER,7427 VERDI LANE,MECHANICSVILLE,VA,23116,"http://maps.google.com/maps?q=7427 VERDI LANE,+MECHANICSVILLE,+VA+23116&hl=en"
HAVELOCK POLICE DEPARTMENT,HAVELOCK POLICE DEPARTMENT 252-463-7104,2 GOVERNMENTAL AVE,HAVELOCK,NC,28532,"http://maps.google.com/maps?q=2 GOVERNMENTAL AVE,+HAVELOCK,+NC+28532&hl=en"
HENRICO POLICE DEPARTMENT,EASTERN HENRICO RECREATION CENTER,1440 N. LABURNUM AVENUE,RICHMOND,VA,23223,"http://maps.google.com/maps?q=1440 N. LABURNUM AVENUE,+RICHMOND,+VA+23223&hl=en"
HENRICO POLICE DEPARTMENT,HENRICO TRAINING CENTER ENTRANCE IS ON SHRADER ROAD,7721 E. PARHAM ROAD,HENRICO,VA,23294,"http://maps.google.com/maps?q=7721 E. PARHAM ROAD,+HENRICO,+VA+23294&hl=en"
HENRICO POLICE DEPARTMENT,VARINA PUBLIC LIBRARY,1875 NEW MARKET ROAD,HENRICO,VA,23231,"http://maps.google.com/maps?q=1875 NEW MARKET ROAD,+HENRICO,+VA+23231&hl=en"
HENRICO POLICE DEPARTMENT,WEGMANS,12200 WEGMANS BOULEVARD,HENRICO,VA,23233,"http://maps.google.com/maps?q=12200 WEGMANS BOULEVARD,+HENRICO,+VA+23233&hl=en"
HOLLY RIDGE POLICE DEPARTMENT,HOLLY RIDGE POLICE DEPARTMENT LT. EWAN S RICHARDS,313SOUND ROAD,HOLLY RIDGE,NC,28445,"http://maps.google.com/maps?q=313,+HOLLY RIDGE,+NC+28445&hl=en"
HOPEWELL POLICE DEPARTMENT,HOPEWELL POLICE DEPARTMENT PARKING LOT BY MAIN ENTRANCE,300 N. MAIN STREET,HOPEWELL,VA,23860,"http://maps.google.com/maps?q=300 N. MAIN STREET,+HOPEWELL,+VA+23860&hl=en"
JACKSONVILLE POLICE DEPARTMENT,ONSLOW MEMORIAL HOSPITAL,317 WESTERN BLVD,JACKSONVILLE,NC,28546,"http://maps.google.com/maps?q=317 WESTERN BLVD,+JACKSONVILLE,+NC+28546&hl=en"
JACKSONVILLE POLICE DEPARTMENT,WALGREENS,1600 GUM BRANCH RD.,JACKSONVILLE,NC,28540,"http://maps.google.com/maps?q=1600 GUM BRANCH RD.,+JACKSONVILLE,+NC+28540&hl=en"
JACKSONVILLE POLICE DEPARTMENT,WALGREENS,359 WESTERN BLVD.,JACKSONVILLE,NC,28546,"http://maps.google.com/maps?q=359 WESTERN BLVD.,+JACKSONVILLE,+NC+28546&hl=en"
JAMES CITY COUNTY POLICE DEPARTMENT,JAMES CITY COUNTY POLICE DEPARTMENT LAW ENFORCEMENT CENTER,4600 OPPORTUNITY WAY,WILLIAMSBURG,VA,23188,"http://maps.google.com/maps?q=4600 OPPORTUNITY WAY,+WILLIAMSBURG,+VA+23188&hl=en"
KING AND QUEEN SHERIFF'S OFFICE,NICK'S RESTAURANT SIDE PARKING LOT,3483 LEWIS B. PULLER HWY,SHACKLEFORDS,VA,23156,"http://maps.google.com/maps?q=3483 LEWIS B. PULLER HWY,+SHACKLEFORDS,+VA+23156&hl=en"
KING AND QUEEN SHERIFF'S OFFICE,PAMUNKEY REGIONAL LIBRARY FRONT PARKING LOT,396 NEWTOWN ROAD,SAINT STEPHENS CHURCH,VA,23148,"http://maps.google.com/maps?q=396 NEWTOWN ROAD,+SAINT STEPHENS CHURCH,+VA+23148&hl=en"
KING WILLIAM COUNTY SHERIFF'S OFFICE,CENTRAL CROSSING FOOD LION PARKING LOT AREA NEAR FRONT OF STORE,4915 RICHMOND TAPPAHANNOCK HIGHWAY,AYLETT,VA,23009,"http://maps.google.com/maps?q=4915 RICHMOND TAPPAHANNOCK HIGHWAY,+AYLETT,+VA+23009&hl=en"
LANCASTER COUNTY SHERIFF'S DEPARTMENT,LANCASTER SHERIFF'S OFFICE,8293 MARY BALL ROAD,LANCASTER,VA,22503,"http://maps.google.com/maps?q=8293 MARY BALL ROAD,+LANCASTER,+VA+22503&hl=en"
LAWRENCEVILLE POLICE DEPARTMENT,LAWRENCEVILLE MUNICIPAL BUILDING AT THE ENTRANCE TO THE POLICE DEPARTMENT,400 N. MAIN STREET,LAWRENCEVILLE,VA,23868,"http://maps.google.com/maps?q=400 N. MAIN STREET,+LAWRENCEVILLE,+VA+23868&hl=en"
LEXINGTON POLICE DEPARTMENT,CVS PHARMACY,506 E NELSON STREET,LEXINGTON,VA,24450,"http://maps.google.com/maps?q=506 E NELSON STREET,+LEXINGTON,+VA+24450&hl=en"
LYNCHBURG POLICE DEPARTMENT,LYNCHBURG POLICE DEPARTMENT LOBBY,905 COURT STREET,LYNCHBURG,VA,24504,"http://maps.google.com/maps?q=905 COURT STREET,+LYNCHBURG,+VA+24504&hl=en"
MARTINSVILLE POLICE DEPARTMENT,MARTINSVILLE FIRE DEPARTMENT FRONT ENTRANCE,65 WEST CHURCH ST.,MARTINSVILLE,VA,24112,"http://maps.google.com/maps?q=65 WEST CHURCH ST.,+MARTINSVILLE,+VA+24112&hl=en"
NC STATE UNIVERSITY POLICE DEPT.,NC STATE UNIVERSITY POLICE DEPARTMENT FRONT LOBBY,2610 WOLF VILLAGE WAYCAMPUS BOX 7220,RALEIGH,NC,27695,"http://maps.google.com/maps?q=2610 WOLF VILLAGE WAY,+RALEIGH,+NC+27695&hl=en"
NEW HANOVER COUNTY SENIOR RESOURCE CENTER,SENIOR RESOURCE CENTER NEW HANOVER COUNTY,2222 S. COLLEGE RD.,WILMINGTON,NC,28403,"http://maps.google.com/maps?q=2222 S. COLLEGE RD.,+WILMINGTON,+NC+28403&hl=en"
NEW HANOVER REGIONAL MEDICAL CENTER,NEW HANOVER MEDICAL GROUP - MYRTLE GROVE,5145 SOUTH COLLEGE ROAD,WILMINGTON,NC,28412,"http://maps.google.com/maps?q=5145 SOUTH COLLEGE ROAD,+WILMINGTON,+NC+28412&hl=en"
NEW HANOVER REGIONAL MEDICAL CENTER,NHRMC ATLANTIC SURGICENTER,9104 MARKET STREET,WILMINGTON,NC,28411,"http://maps.google.com/maps?q=9104 MARKET STREET,+WILMINGTON,+NC+28411&hl=en"
NEW HANOVER REGIONAL MEDICAL CENTER,NHRMC BRUNSWICK FOREST,1333 SOUTH DICKINSON DRIVE,LELAND,NC,28451,"http://maps.google.com/maps?q=1333 SOUTH DICKINSON DRIVE,+LELAND,+NC+28451&hl=en"
NEW HANOVER REGIONAL MEDICAL CENTER,NHRMC EXPRESS CARE - AUTUM HALL,510 CAROLINA BAY DRIVE,WILMINGTON,NC,28403,"http://maps.google.com/maps?q=510 CAROLINA BAY DRIVE,+WILMINGTON,+NC+28403&hl=en"
NEW HANOVER REGIONAL MEDICAL CENTER,NHRMC MEDICAL MALL,2243 SOUTH 17TH STREET,WILMINGTON,NC,28401,"http://maps.google.com/maps?q=2243 SOUTH 17TH STREET,+WILMINGTON,+NC+28401&hl=en"
NEW HANOVER REGIONAL MEDICAL CENTER,PENDER MEMORIAL HOSPITAL,507 EAST FREMONT STREET,BURGAW,NC,28425,"http://maps.google.com/maps?q=507 EAST FREMONT STREET,+BURGAW,+NC+28425&hl=en"
NEW KENT COUNTY SHERIFF'S OFFICE,NEW KENT SHERIFF'S OFFICE,11995 COURTHOUSE CIRCLE,NEW KENT,VA,23124,"http://maps.google.com/maps?q=11995 COURTHOUSE CIRCLE,+NEW KENT,+VA+23124&hl=en"
NEWPORT NEWS POLICE DEPARTMENT,NEWPORT NEWS PD NORTH PRECINCT LOT BETWEEN POLICE AND FIRE DEPARTMENTS,368 DESHAZOR DRIVE,NEWPORT NEWS,VA,23608,"http://maps.google.com/maps?q=368 DESHAZOR DRIVE,+NEWPORT NEWS,+VA+23608&hl=en"
NEWPORT NEWS POLICE DEPARTMENT,NEWPORT NEWS PD SOUTH PRECINCT,3303 JEFFERSON AVENUE,NEWPORT NEWS,VA,23607,"http://maps.google.com/maps?q=3303 JEFFERSON AVENUE,+NEWPORT NEWS,+VA+23607&hl=en"
NEWPORT NEWS POLICE DEPARTMENT,SENTARA PORT WARWICK AT THE EMERGENCY ROOM ENTRANCE,1031 LOFTIS BLVD.,NEWPORT NEWS,VA,23606,"http://maps.google.com/maps?q=1031 LOFTIS BLVD.,+NEWPORT NEWS,+VA+23606&hl=en"
NORFOLK POLICE DEPARTMENT,NORFOLK POLICE 3RD DIVISION FRONT ENTRANCE,901 ASBURY AVENUE,NORFOLK,VA,23513,"http://maps.google.com/maps?q=901 ASBURY AVENUE,+NORFOLK,+VA+23513&hl=en"
NORFOLK POLICE DEPARTMENT,NORFOLK POLICE OPERATIONS CENTER FRONT ENTRANCE,3661 E. VIRGINIA BEACH BLVD,NORFOLK,VA,23502,"http://maps.google.com/maps?q=3661 E. VIRGINIA BEACH BLVD,+NORFOLK,+VA+23502&hl=en"
NORFOLK POLICE DEPARTMENT,NORFOLK POLICE TRAINING CENTER FRONT ENTRANCE,2500 N. MILITARY HWY,NORFOLK,VA,23502,"http://maps.google.com/maps?q=2500 N. MILITARY HWY,+NORFOLK,+VA+23502&hl=en"
NORFOLK STATE UNIVERSITY POLICE DEPARTMENT,NORFOLK STATE UNIVERSITY PD LOBBY AREA,2501 CORPREW AVE,NORFOLK,VA,23504,"http://maps.google.com/maps?q=2501 CORPREW AVE,+NORFOLK,+VA+23504&hl=en"
NORTHAMPTON COUNTY SHERIFF'S OFFICE,NORTHAMPTON COUNTY SHERIFF'S OFFICE FRONT LOBBY,5211 THE HORNES,EASTVILLE,VA,23347,"http://maps.google.com/maps?q=5211 THE HORNES,+EASTVILLE,+VA+23347&hl=en"
NORTHUMBERLAND COUNTY SHERIFF'S OFFICE,NORTHUMBERLAND COUNTY SHERIFF'S OFFICE,195 JUDICIAL PLACE,HEATHSVILLE,VA,22473,"http://maps.google.com/maps?q=195 JUDICIAL PLACE,+HEATHSVILLE,+VA+22473&hl=en"
OLD DOMINION UNIVERSITY POLICE DEPARTMENT,CVS,3717 HAMPTON BLVD,NORFOLK,VA,23508,"http://maps.google.com/maps?q=3717 HAMPTON BLVD,+NORFOLK,+VA+23508&hl=en"
ONSLOW COUNTY SHERIFF OFFICE,CVS PHARMACY,1309 NC HWY 210,SNEADS FERRY,NC,28460,"http://maps.google.com/maps?q=1309 NC HWY 210,+SNEADS FERRY,+NC+28460&hl=en"
ONSLOW COUNTY SHERIFF OFFICE,WAL GREENS PHARMACY 910-219-0490,3069 RICHLANDS HWY,JACKSONVILLE,NC,28540,"http://maps.google.com/maps?q=3069 RICHLANDS HWY,+JACKSONVILLE,+NC+28540&hl=en"
ORANGE COUNTY SHERIFFS OFFICE,CHAPEL HILL NORTH HARRIS TEETER ON OCTOBER 27TH,1800 MARTIN LUTHER KING JR BLVD,CHAPEL HILL,NC,27514,"http://maps.google.com/maps?q=1800 MARTIN LUTHER KING JR BLVD,+CHAPEL HILL,+NC+27514&hl=en"
ORANGE COUNTY SHERIFFS OFFICE,ORANGE COUNTY SHERIFFS OFFICE,106 E MARGARET LANE,HILLSBOROUGH,NC,27278,"http://maps.google.com/maps?q=106 E MARGARET LANE,+HILLSBOROUGH,+NC+27278&hl=en"
PETERSBURG POLICE DEPARTMENT,CVS PHARMACY,2100 SOUTH CRATER RD,PETERSBURG,VA,23805,"http://maps.google.com/maps?q=2100 SOUTH CRATER RD,+PETERSBURG,+VA+23805&hl=en"
PETERSBURG SHERIFF'S OFFICE,WALMART #2160 PARKING LOT-PETERSBURG,3500 SOUTH CRATER ROAD,PETERSBURG,VA,23805,"http://maps.google.com/maps?q=3500 SOUTH CRATER ROAD,+PETERSBURG,+VA+23805&hl=en"
PITTSYLVANIA COUNTY SHERIFF'S OFFICE,MT. HERMON SHOPPING CENTER FOOD LION PARKING LOT,4048 FRANKLIN TURNPIKE,DANVILLE,VA,24540,"http://maps.google.com/maps?q=4048 FRANKLIN TURNPIKE,+DANVILLE,+VA+24540&hl=en"
PITTSYLVANIA COUNTY SHERIFF'S OFFICE,PITTSYLVANIA COUNTY SHERIFF'S OFFICE IN FRONT OF SHERIFF'S OFFICE,21 NORTH MAIN STREET,CHATHAM,VA,24531,"http://maps.google.com/maps?q=21 NORTH MAIN STREET,+CHATHAM,+VA+24531&hl=en"
POQUOSON POLICE DEPARTMENT,POQUOSON PHARMACY PARKING LOT,498 WYTHE CREEK ROAD,POQUOSON,VA,23662,"http://maps.google.com/maps?q=498 WYTHE CREEK ROAD,+POQUOSON,+VA+23662&hl=en"
PORTSMOUTH POLICE DEPARTMENT,PORTSMOUTH FIRE STATION #3 FRONT DOOR,4001 RIVERSHORE ROAD,PORTSMOUTH,VA,23703,"http://maps.google.com/maps?q=4001 RIVERSHORE ROAD,+PORTSMOUTH,+VA+23703&hl=en"
PORTSMOUTH POLICE DEPARTMENT,PORTSMOUTH POLICE DEPARTMENT HEADQUARTERS,801 WATER ST,PORTSMOUTH,VA,23704,"http://maps.google.com/maps?q=801 WATER ST,+PORTSMOUTH,+VA+23704&hl=en"
PORTSMOUTH POLICE DEPARTMENT,PORTSMOUTH SAFETY TOWN OUTSIDE FRONT DOOR,4404 DEEP CREEK BLVD,PORTSMOUTH,VA,23702,"http://maps.google.com/maps?q=4404 DEEP CREEK BLVD,+PORTSMOUTH,+VA+23702&hl=en"
POWHATAN COUNTY SHERIFF'S OFFICE,POWHATAN COUNTY COURTHOUSE,3880 OLD BUCKINGHAM ROAD,POWHATAN,VA,23139,"http://maps.google.com/maps?q=3880 OLD BUCKINGHAM ROAD,+POWHATAN,+VA+23139&hl=en"
PRINCE GEORGE COUNTY POLICE DEPARTMENT,PRINCE GEORGE COUNTY POLICE DEPARTMENT SIDE PARKING LOT,6600 COURTHOUSE ROAD,PRINCE GEORGE,VA,23875,"http://maps.google.com/maps?q=6600 COURTHOUSE ROAD,+PRINCE GEORGE,+VA+23875&hl=en"
RALEIGH POLICE DEPARTMENT,FALLS RIVER PHARMACY,10930 RAVEN RIDGE RD,RALEIGH,NC,27614,"http://maps.google.com/maps?q=10930 RAVEN RIDGE RD,+RALEIGH,+NC+27614&hl=en"
RALEIGH POLICE DEPARTMENT,HAYES BARTON PHARMACY,2000 FAIRVIEW RD,RALEIGH,NC,27608,"http://maps.google.com/maps?q=2000 FAIRVIEW RD,+RALEIGH,+NC+27608&hl=en"
RALEIGH POLICE DEPARTMENT,JOSEF'S PHARMACY,2100 NEW BERN AVE,RALEIGH,NC,27610,"http://maps.google.com/maps?q=2100 NEW BERN AVE,+RALEIGH,+NC+27610&hl=en"
RALEIGH POLICE DEPARTMENT,WELLNESS PHARMACY AND COMPOUNDING CENTER,2601 BLUE RIDGE RD,RALEIGH,NC,27607,"http://maps.google.com/maps?q=2601 BLUE RIDGE RD,+RALEIGH,+NC+27607&hl=en"
RICHLANDS POLICE DEPARTMENT,WALGREENS PARKING LOT,9005 RICHLANDS HWY,RICHLANDS,NC,28574,"http://maps.google.com/maps?q=9005 RICHLANDS HWY,+RICHLANDS,+NC+28574&hl=en"
ROANOKE CITY POLICE DEPARTMENT,CVS AT TARGET,4737 VALLEY VIEW BLVD,ROANOKE,VA,24012,"http://maps.google.com/maps?q=4737 VALLEY VIEW BLVD,+ROANOKE,+VA+24012&hl=en"
ROANOKE COUNTY POLICE DEPARTMENT,KROGER AT VALLEY GATEWAY NEAR FRONT ENTRANCE,3970 VALLEY GATEWAY BLVD,ROANOKE,VA,24012,"http://maps.google.com/maps?q=3970 VALLEY GATEWAY BLVD,+ROANOKE,+VA+24012&hl=en"
ROCKY MOUNT POLICE DEPARTMENT,WAL MART,550 OLD FRANKLIN TURNPIKE ROCKY MOUNT,ROCKY MOUNT,VA,24151,"http://maps.google.com/maps?q=550 OLD FRANKLIN TURNPIKE ROCKY MOUNT,+ROCKY MOUNT,+VA+24151&hl=en"
SAS INSTITUTE COMPANY POLICE,SAS INSTITUTE,100 SAS CAMPUS DRIVE,CARY,NC,27513,"http://maps.google.com/maps?q=100 SAS CAMPUS DRIVE,+CARY,+NC+27513&hl=en"
SURF CITY POLICE DEPARTMENT,ISLAND FAMILY MEDICINE,2540 NC 210,SURF CITY,NC,28445,"http://maps.google.com/maps?q=2540 NC 210,+SURF CITY,+NC+28445&hl=en"
SURRY COUNTY SHERIFF'S OFFICE,SURRY COUNTY CIRCUIT COURT HOUSE PARKING LOT,28 COLONIAL TRAIL EAST,SURRY,VA,23883,"http://maps.google.com/maps?q=28 COLONIAL TRAIL EAST,+SURRY,+VA+23883&hl=en"
TAPPAHANNOCK PD / ESSEX COUNTY SO,WAL-MART PARKING LOT OUTSIDE BETWEEN TWO ENTRANCES,1660 TAPPAHANNOCK BLVD,TAPPAHANNOCK,VA,22560,"http://maps.google.com/maps?q=1660 TAPPAHANNOCK BLVD,+TAPPAHANNOCK,+VA+22560&hl=en"
TOWN OF DUCK POLICE DEPARTMENT,TOWN OF DUCK POLICE DEPARTMENT LT. JEFFREY ACKERMAN,1259 DUCK RD,DUCK,NC,27949,"http://maps.google.com/maps?q=1259 DUCK RD,+DUCK,+NC+27949&hl=en"
UNC POLICE COMMUNITY SERVICES,"UNC WELLNESS CENTER HOSTED ON OCTOBER 20, 2018",100 SPRUNT ST.,CHAPEL HILL,NC,27517,"http://maps.google.com/maps?q=100 SPRUNT ST.,+CHAPEL HILL,+NC+27517&hl=en"
UNCW POLICE,UNCW POLICE DEPARTMENT,5126 LIONFISH DR,WILMINGTON,NC,28403,"http://maps.google.com/maps?q=5126 LIONFISH DR,+WILMINGTON,+NC+28403&hl=en"
VINTON POLICE DEPARTMENT,KROGER PARKING LOT LAKE DRIVE PLAZA,915 HARDY ROAD,VINTON,VA,24179,"http://maps.google.com/maps?q=915 HARDY ROAD,+VINTON,+VA+24179&hl=en"
VIRGINIA STATE POLICE,HALIFAX/SOUTH BOSTON REGIONAL TASK FORCE POC: SA JAY GEORGE,640 HAMILTON BOULEVARD(SOUTH BOSTON POLICE DEPARTMENT),APPOMATTOX,VA,24522,"http://maps.google.com/maps?q=640 HAMILTON BOULEVARD,+APPOMATTOX,+VA+24522&hl=en"
VIRGINIA STATE POLICE,VIRGINIA STATE POLICE - AREA 47 STATION POC: SGT ANDREA FISCHER,1557 S. MILITARY HIGHWAY,CHESAPEAKE,VA,23320,"http://maps.google.com/maps?q=1557 S. MILITARY HIGHWAY,+CHESAPEAKE,+VA+23320&hl=en"
VIRGINIA STATE POLICE,VIRGINIA STATE POLICE DIVISION I HQS POC: SGT MELANIE MCKENNEY,9300 BROOK ROAD,GLEN ALLEN,VA,23060,"http://maps.google.com/maps?q=9300 BROOK ROAD,+GLEN ALLEN,+VA+23060&hl=en"
VIRGINIA STATE POLICE,VIRGINIA STATE POLICE DIVISION III HQS POC: SGT DREW MCCORMICK,240 THIRD DIVISION LOOP,APPOMATTOX,VA,24522,"http://maps.google.com/maps?q=240 THIRD DIVISION LOOP,+APPOMATTOX,+VA+24522&hl=en"
WHITEVILLE POLICE DEPARTMENT,COLUMBUS REGIONAL HEALTHCARE 500 JEFFERSON STREET,500 JEFFERSON STREET,WHITEVILLE,NC,28472,"http://maps.google.com/maps?q=500 JEFFERSON STREET,+WHITEVILLE,+NC+28472&hl=en"
WHITEVILLE POLICE DEPARTMENT,WHITEVILLE POLICE DEPARTMENT,117 E. COLUMBUS ST,WHITEVILLE,NC,28472,"http://maps.google.com/maps?q=117 E. COLUMBUS ST,+WHITEVILLE,+NC+28472&hl=en"
WILLIAMSBURG POLICE DEPARTMENT,WILLIAMSBURG FIRE DEPARTMENT,WILLIAMSBURG FIRE DEPARTMENT440 N BOUNDARY STREET,WILLIAMSBURG,VA,23185,"http://maps.google.com/maps?q=WILLIAMSBURG FIRE DEPARTMENT,+WILLIAMSBURG,+VA+23185&hl=en"
YORK-POQUOSON SHERIFF'S OFFICE,YORK-POQUOSON SHERIFF'S OFFICE D.A.R.E. OFFICE NEXT TO SUBWAY,5338-D GEORGE WASHINGTON MEMORIAL HWY,YORKTOWN,VA,23692,"http://maps.google.com/maps?q=5338-D GEORGE WASHINGTON MEMORIAL HWY,+YORKTOWN,+VA+23692&hl=en"
