Participant,CollectionSite,Address,City,State,Zip,MapURL
SIOUX CITY POLICE DEPARTMENT,WALMART,3101 FLOYD BLVD.,SIOUX CITY,IA,51104,"http://maps.google.com/maps?q=3101 FLOYD BLVD.,+SIOUX CITY,+IA+51104&hl=en"
SIOUX COUNTY SHERIFF'S OFFICE,SIOUX COUNTY SHERIFF'S OFFICE LOBBY,4363 IRONWOOD AVE,ORANGE CITY,IA,51041,"http://maps.google.com/maps?q=4363 IRONWOOD AVE,+ORANGE CITY,+IA+51041&hl=en"
SPENCER POLICE DEPARTMENT,SPENCER POLICE DEPARTMENT 11:00AM - 1:00PM,712 GRAND AVE,SPENCER,IA,51301,"http://maps.google.com/maps?q=712 GRAND AVE,+SPENCER,+IA+51301&hl=en"
SPIRIT LAKE POLICE DEPARTMENT,HY-VEE,1500 18TH STREET,SPIRIT LAKE,IA,51360,"http://maps.google.com/maps?q=1500 18TH STREET,+SPIRIT LAKE,+IA+51360&hl=en"
ST. FRANCIS PD,GOODRICH PHARMACY LOCATED IN KINGS COUNTY MARKET,23122 ST. FRANCIS BLVD NW,SAINT FRANCIS,MN,55070,"http://maps.google.com/maps?q=23122 ST. FRANCIS BLVD NW,+SAINT FRANCIS,+MN+55070&hl=en"
ST. FRANCIS PD,ST. FRANCIS POLICE DEPARTMENT,4058 ST. FRANCIS BLVD NW,SAINT FRANCIS,MN,55070,"http://maps.google.com/maps?q=4058 ST. FRANCIS BLVD NW,+SAINT FRANCIS,+MN+55070&hl=en"
TAKOMA PARK POLICE DEPARTMENT,TAKOMA PARK POLICE DEPARTMENT LOBBY,7500 MAPLE AVENUE,TAKOMA PARK,MD,20912,"http://maps.google.com/maps?q=7500 MAPLE AVENUE,+TAKOMA PARK,+MD+20912&hl=en"
UNIVERSITY OF MD BALTIMORE COUNTY POLICE,UMBC POLICE DEPARTMENT POLICE STATION,"1000 HILLTOP CIRCLE,LOT 8",BALTIMORE,MD,21250,"http://maps.google.com/maps?q=1000 HILLTOP CIRCLE,,+BALTIMORE,+MD+21250&hl=en"
UNIVERSITY OF MD POLICE DEPT OF PUBLIC SAFETY,UNIVERSITY OF MD POLICE DEPT OF PUBLIC SAFETY,7569 BALTIMORE AVENUE,COLLEGE PARK,MD,20742,"http://maps.google.com/maps?q=7569 BALTIMORE AVENUE,+COLLEGE PARK,+MD+20742&hl=en"
VIENNA POLICE DEPARTMENT,VIENNA POLICE DEPARTMENT,215 CENTER STREET SOUTH,VIENNA,VA,22180,"http://maps.google.com/maps?q=215 CENTER STREET SOUTH,+VIENNA,+VA+22180&hl=en"
VIRGINIA STATE POLICE,VIRGINIA STATE POLICE DIVISION VII HQS POC: SGT BILL JOYNER,4977 ALLIANCE DRIVE,FAIRFAX,VA,22030,"http://maps.google.com/maps?q=4977 ALLIANCE DRIVE,+FAIRFAX,+VA+22030&hl=en"
WASHINGTON METROPOLITAN POLICE DEPT,FIFTH POLICE DISTRICT,"1805 BLADENSBURG ROAD, NE",WASHINGTON,DC,20002,"http://maps.google.com/maps?q=1805 BLADENSBURG ROAD, NE,+WASHINGTON,+DC+20002&hl=en"
WASHINGTON METROPOLITAN POLICE DEPT,FIRST POLICE DISTRICT,"101 M STREET, SW",WASHINGTON,DC,20024,"http://maps.google.com/maps?q=101 M STREET, SW,+WASHINGTON,+DC+20024&hl=en"
WASHINGTON METROPOLITAN POLICE DEPT,FOURTH POLICE DISTRICT,"6001 GEORGIA AVENUE, NW",WASHINGTON,DC,20011,"http://maps.google.com/maps?q=6001 GEORGIA AVENUE, NW,+WASHINGTON,+DC+20011&hl=en"
WASHINGTON METROPOLITAN POLICE DEPT,SECOND POLICE DISTRICT,"3320 IDAHO AVENUE, NW",WASHINGTON,DC,20016,"http://maps.google.com/maps?q=3320 IDAHO AVENUE, NW,+WASHINGTON,+DC+20016&hl=en"
WASHINGTON METROPOLITAN POLICE DEPT,SEVENTH POLICE DISTRICT,"2455 ALABAMA AVENUE, SE",WASHINGTON,DC,20020,"http://maps.google.com/maps?q=2455 ALABAMA AVENUE, SE,+WASHINGTON,+DC+20020&hl=en"
WASHINGTON METROPOLITAN POLICE DEPT,SIXTH POLICE DISTRICT,5002 HAYES STREET NE,WASHINGTON,DC,20019,"http://maps.google.com/maps?q=5002 HAYES STREET NE,+WASHINGTON,+DC+20019&hl=en"
WASHINGTON METROPOLITAN POLICE DEPT,THIRD POLICE DISTRIST,"1620 V STREET, NW",WASHINGTON,DC,20009,"http://maps.google.com/maps?q=1620 V STREET, NW,+WASHINGTON,+DC+20009&hl=en"
WASHINGTON SUBURBAN SANITARY COMMISSION,WSSC POLICE DEPARTMENT,14501 SWEITZER LANE,LAUREL,MD,20707,"http://maps.google.com/maps?q=14501 SWEITZER LANE,+LAUREL,+MD+20707&hl=en"
WATERTOWN POLICE DEPARTMENT,WATERTOWN POLICE DEPARTMENT,128 MAPLE ST. N,WATERTOWN,SD,57201,"http://maps.google.com/maps?q=128 MAPLE ST. N,+WATERTOWN,+SD+57201&hl=en"
WILKIN COUNTY SHERIFF'S OFFICE,WILKIN COUNTY SHERIFF'S OFFICE,515 DACOTAH AVENUE,BRECKENRIDGE,MN,56520,"http://maps.google.com/maps?q=515 DACOTAH AVENUE,+BRECKENRIDGE,+MN+56520&hl=en"
