Participant,CollectionSite,Address,City,State,Zip,MapURL
ALTOONA POLICE DEPARTMENT,ALTOONA POLICE DEPARTMENT EVENT 10:00AM-2:00PM,1904 SPOONER AVE,ALTOONA,WI,54720,"http://maps.google.com/maps?q=1904 SPOONER AVE,+ALTOONA,+WI+54720&hl=en"
ANOKA COUNTY SHERIFF'S OFFICE,ANOKA COUNTY SO,13301 HANSON BOULEVARD NW,ANDOVER,MN,55304,"http://maps.google.com/maps?q=13301 HANSON BOULEVARD NW,+ANDOVER,+MN+55304&hl=en"
ANTELOPE CO SHERIFF DEPT,ANTELOPE COUNTY SHERIFF DEPT,1102 L ST,NELIGH,NE,68756,"http://maps.google.com/maps?q=1102 L ST,+NELIGH,+NE+68756&hl=en"
APPLE VALLEY PD,APPLE VALLEY PD,7100 147TH STREET WEST,APPLE VALLEY,MN,55124,"http://maps.google.com/maps?q=7100 147TH STREET WEST,+APPLE VALLEY,+MN+55124&hl=en"
ARCADIA POLICE DEPARTMENT,ARCADIA POLICE DEPARTMENT EVENT 9:00AM-11:00AM,203 W MAIN STREET,ARCADIA,WI,54612,"http://maps.google.com/maps?q=203 W MAIN STREET,+ARCADIA,+WI+54612&hl=en"
ARLINGTON PD,ARLINGTON POLICE DEPARTMENT,108 4TH AVENUE NW,ARLINGTON,MN,55307,"http://maps.google.com/maps?q=108 4TH AVENUE NW,+ARLINGTON,+MN+55307&hl=en"
BECKER PD,BECKER POLICE DEPARTMENT DROPBOX,12060 SHERBURNE AVENUE,BECKER,MN,55308,"http://maps.google.com/maps?q=12060 SHERBURNE AVENUE,+BECKER,+MN+55308&hl=en"
BENSON PD,BENSON PD,2110 HALL AVENUE,BENSON,MN,56215,"http://maps.google.com/maps?q=2110 HALL AVENUE,+BENSON,+MN+56215&hl=en"
BENTON COUNTY SHERIFF'S OFFICE,BENTON COUNTY SHERIFF'S OFFICE,113 E 3 STREET,VINTON,IA,52349,"http://maps.google.com/maps?q=113 E 3 STREET,+VINTON,+IA+52349&hl=en"
BLAIR POLICE DEPARTMENT,BLAIR POLICE DEPARTMENT 9:00AM-1:00PM,122 S. URBERG AVE,BLAIR,WI,54616,"http://maps.google.com/maps?q=122 S. URBERG AVE,+BLAIR,+WI+54616&hl=en"
BLOOMINGTON PD,BLOOMINGTON PD,1800 W OLD SHAKOPEE ROAD,BLOOMINGTON,MN,55431,"http://maps.google.com/maps?q=1800 W OLD SHAKOPEE ROAD,+BLOOMINGTON,+MN+55431&hl=en"
BOYCEVILLE POLICE DEPARTMENT,BOYCEVILLE VILLAGE HALL EVENT 10:00AM-2:00PM,1233 CHARLOTTE STREET,BOYCEVILLE,WI,54725,"http://maps.google.com/maps?q=1233 CHARLOTTE STREET,+BOYCEVILLE,+WI+54725&hl=en"
BRANDON POLICE DEPARTMENT,BRANDON POLICE DEPT.,304 S MAIN AVE.,BRANDON,SD,57005,"http://maps.google.com/maps?q=304 S MAIN AVE.,+BRANDON,+SD+57005&hl=en"
BROOKINGS COUNTY SHERIFF'S OFFICE,BROOKINGS COUNTY SHERIFF'S OFFICE,315 7TH AVENUE,BROOKINGS,SD,57006,"http://maps.google.com/maps?q=315 7TH AVENUE,+BROOKINGS,+SD+57006&hl=en"
BROOKLYN PARK PD,BROOKLYN PARK POLICE DEPARTMENT SOUTH PRECINCT,7608 BROOKLYN BOULEVARD,BROOKLYN PARK,MN,55443,"http://maps.google.com/maps?q=7608 BROOKLYN BOULEVARD,+BROOKLYN PARK,+MN+55443&hl=en"
BUCHANAN COUNTY SHERIFF'S OFFICE,"BCSO DEA DROP SITE (FAREWAY) LOCATED AT FAREWAY, INDEPENDENCE, IA",1400 3RD AVENUE SE,INDEPENDENCE,IA,50644,"http://maps.google.com/maps?q=1400 3RD AVENUE SE,+INDEPENDENCE,+IA+50644&hl=en"
BUENA VISTA COUNTY SHERIFF'S OFFICE,NEWELL CITY HALL,207 E 2ND STREET,NEWELL,IA,50568,"http://maps.google.com/maps?q=207 E 2ND STREET,+NEWELL,+IA+50568&hl=en"
BUENA VISTA COUNTY SHERIFF'S OFFICE,SIOUX RAPIDS CITY HALL,100 FRONT STREET,SIOUX RAPIDS,IA,50585,"http://maps.google.com/maps?q=100 FRONT STREET,+SIOUX RAPIDS,+IA+50585&hl=en"
BUENA VISTA COUNTY SHERIFF'S OFFICE,WALMART,1831 LAKE AVE,STORM LAKE,IA,50588,"http://maps.google.com/maps?q=1831 LAKE AVE,+STORM LAKE,+IA+50588&hl=en"
BURNSVILLE PD,BURNSVILLE POLICE DEPARTMENT,100 CIVIC CENTER PARKWAY,BURNSVILLE,MN,55337,"http://maps.google.com/maps?q=100 CIVIC CENTER PARKWAY,+BURNSVILLE,+MN+55337&hl=en"
CAMPBELL POLICE DEPARTMENT,CAMPBELL TOWN HALL EVENT 10:00AM-2:00PM,2219 BAINBRIDGE ST,LA CROSSE,WI,54603,"http://maps.google.com/maps?q=2219 BAINBRIDGE ST,+LA CROSSE,+WI+54603&hl=en"
CARVER COUNTY SHERIFF'S OFFICE,CITY OF CARVER CARVER PLACE,113 3RD STREET EAST,CARVER,MN,55315,"http://maps.google.com/maps?q=113 3RD STREET EAST,+CARVER,+MN+55315&hl=en"
CARVER COUNTY SHERIFF'S OFFICE,CITY OF MAYER CITY HALL,413 BLUE JAY AVENUE NORTH,MAYER,MN,55360,"http://maps.google.com/maps?q=413 BLUE JAY AVENUE NORTH,+MAYER,+MN+55360&hl=en"
CARVER COUNTY SHERIFF'S OFFICE,CITY OF VICTORIA REC CENTER,8475 KOCHIA LANE,VICTORIA,MN,55386,"http://maps.google.com/maps?q=8475 KOCHIA LANE,+VICTORIA,+MN+55386&hl=en"
CEDAR FALLS POLICE DEPARTMENT,CEDAR FALLS POLICE DEPARTMENT,220 CLAY STREET,CEDAR FALLS,IA,50613,"http://maps.google.com/maps?q=220 CLAY STREET,+CEDAR FALLS,+IA+50613&hl=en"
CHAMPLIN PD,CHAMPLIN POLICE DEPARTMENT,11955 CHAMPLIN DRIVE,CHAMPLIN,MN,55316,"http://maps.google.com/maps?q=11955 CHAMPLIN DRIVE,+CHAMPLIN,+MN+55316&hl=en"
CHARLES CITY POLICE DEPARTMENT,CHARLES CITY POLICE DEPARTMENT,105 MILWAUKEE MALL,CHARLES CITY,IA,50616,"http://maps.google.com/maps?q=105 MILWAUKEE MALL,+CHARLES CITY,+IA+50616&hl=en"
CHEROKEE COUNTY SHERIFF'S OFFICE,CHEROKEE COUNTY LAW ENFORCEMENT CENTER CHEROKEE COUNTY SHERIFF'S OFFICE,111 N 5TH ST.,CHEROKEE,IA,51012,"http://maps.google.com/maps?q=111 N 5TH ST.,+CHEROKEE,+IA+51012&hl=en"
CHISAGO COUNTY SO,CHISAGO COUNTY SHERIFF'S OFFICE,15230 PER ROAD,CENTER CITY,MN,55012,"http://maps.google.com/maps?q=15230 PER ROAD,+CENTER CITY,+MN+55012&hl=en"
CLEAR LAKE POLICE DEPARTMENT,CLEAR LAKE VILLAGE HALL EVENT 10:00AM-1:00PM,350 4TH AVE,CLEAR LAKE,WI,54005,"http://maps.google.com/maps?q=350 4TH AVE,+CLEAR LAKE,+WI+54005&hl=en"
CODINGTON COUNTY SHERIFFS OFFICE,CODINGTON COUNTY SHERIFF'S OFFICE,14 1ST AVE SE,WATERTOWN,SD,57201,"http://maps.google.com/maps?q=14 1ST AVE SE,+WATERTOWN,+SD+57201&hl=en"
COLFAX POLICE DEPARTMENT,COLFAX POLICE DEPARTMENT EVENT 10:00AM-2:00PM,613 MAIN STREET,COLFAX,WI,54730,"http://maps.google.com/maps?q=613 MAIN STREET,+COLFAX,+WI+54730&hl=en"
COLUMBIA HEIGHTS PD,COLUMBIA HEIGHTS POLICE DEPARTMENT,825 41ST AVENUE NE,COLUMBIA HEIGHTS,MN,55421,"http://maps.google.com/maps?q=825 41ST AVENUE NE,+COLUMBIA HEIGHTS,+MN+55421&hl=en"
COON RAPIDS PD,COON RAPIDS PD,11155 ROBINSON DR NW,COON RAPIDS,MN,55433,"http://maps.google.com/maps?q=11155 ROBINSON DR NW,+COON RAPIDS,+MN+55433&hl=en"
COTTONWOOD COUNTY SHERIFF'S OFFICE,COTTONWOOD COUNTY SHERIFFS OFFICE,902 5TH AVENUE,WINDOM,MN,56101,"http://maps.google.com/maps?q=902 5TH AVENUE,+WINDOM,+MN+56101&hl=en"
DAKOTA COUNTY SO,DAKOTA COUNTY SHERIFFS OFFICE,1580 HIGHWAY 55,HASTINGS,MN,55033,"http://maps.google.com/maps?q=1580 HIGHWAY 55,+HASTINGS,+MN+55033&hl=en"
DAWSON BOYD PD,DAWSON BOYD POLICE DEPARTMENT,675 CHESTNUT STREET,DAWSON,MN,56232,"http://maps.google.com/maps?q=675 CHESTNUT STREET,+DAWSON,+MN+56232&hl=en"
EAU CLAIRE COUNTY SHERIFF'S OFFICE,MARSHFIELD CLINIC-EAU CLAIRE CENTER EVENT 10:00AM-2:00PM,2216 CRAIG ROAD,EAU CLAIRE,WI,54701,"http://maps.google.com/maps?q=2216 CRAIG ROAD,+EAU CLAIRE,+WI+54701&hl=en"
EDEN PRAIRIE PD,EDEN PRAIRIE SENIOR CENTER,8950 EDEN PRAIRIE ROAD,EDEN PRAIRIE,MN,55347,"http://maps.google.com/maps?q=8950 EDEN PRAIRIE ROAD,+EDEN PRAIRIE,+MN+55347&hl=en"
ESTHERVILLE POLICE DEPARTMENT,AVERA HOLY FAMILY HOSPITAL NORTH ENTRANCE,826 N 8TH STREET,ESTHERVILLE,IA,51334,"http://maps.google.com/maps?q=826 N 8TH STREET,+ESTHERVILLE,+IA+51334&hl=en"
FARIBAULT COUNTY SO,FARIBAULT COUNTY SO,320 DR. H. RUSS STREET,BLUE EARTH,MN,56013,"http://maps.google.com/maps?q=320 DR. H. RUSS STREET,+BLUE EARTH,+MN+56013&hl=en"
FILLMORE COUNTY SO,FILLMORE COUNTY SHERIFF'S OFFICE,901 HOUSTON STREET NW,PRESTON,MN,55965,"http://maps.google.com/maps?q=901 HOUSTON STREET NW,+PRESTON,+MN+55965&hl=en"
FILLMORE COUNTY SO,LANESBORO CITY HALL,202 PARKWAY AVENUE NORTH,LANESBORO,MN,55949,"http://maps.google.com/maps?q=202 PARKWAY AVENUE NORTH,+LANESBORO,+MN+55949&hl=en"
FILLMORE COUNTY SO,MABEL CITY HALL,201 SOUTH MAIN STREET,MABEL,MN,55954,"http://maps.google.com/maps?q=201 SOUTH MAIN STREET,+MABEL,+MN+55954&hl=en"
FILLMORE COUNTY SO,RUSHFORD POLICE DEPARTMENT,405 ELM STREET SOUTH,RUSHFORD,MN,55971,"http://maps.google.com/maps?q=405 ELM STREET SOUTH,+RUSHFORD,+MN+55971&hl=en"
FILLMORE COUNTY SO,SPRING VALLEY FIRE DEPARTMENT,120 WEST COURTLAND STREET,SPRING VALLEY,MN,55975,"http://maps.google.com/maps?q=120 WEST COURTLAND STREET,+SPRING VALLEY,+MN+55975&hl=en"
FREEBORN COUNTY SO/ALBERT LEA PD,FREEBORN COUNTY FAIRGROUNDS,1029 BRIDGE AVENUE,ALBERT LEA,MN,56007,"http://maps.google.com/maps?q=1029 BRIDGE AVENUE,+ALBERT LEA,+MN+56007&hl=en"
GALESVILLE POLICE DEPARTMENT,HOMETOWN PHARMACY EVENT 8:00AM-12:00PM,16812 SOUTH MAIN STREET,GALESVILLE,WI,54630,"http://maps.google.com/maps?q=16812 SOUTH MAIN STREET,+GALESVILLE,+WI+54630&hl=en"
GOLDEN VALLEY PD,GOLDEN VALLEY POLICE DEPARTMENT LOBBY,7700 GOLDEN VALLEY ROAD,MINNEAPOLIS,MN,55427,"http://maps.google.com/maps?q=7700 GOLDEN VALLEY ROAD,+MINNEAPOLIS,+MN+55427&hl=en"
HAMILTON COUNTY SHERIFF'S OFFICE,HY-VEE FOOD STORE,823 2ND STREET,WEBSTER CITY,IA,50595,"http://maps.google.com/maps?q=823 2ND STREET,+WEBSTER CITY,+IA+50595&hl=en"
HENNEPIN COUNTY SO,BROOKLYN CENTER CVS POINT OF CONTACT: GARY OR KATHY (763) 537-1237,5801 BROOKLYN BOULEVARD,MINNEAPOLIS,MN,55429,"http://maps.google.com/maps?q=5801 BROOKLYN BOULEVARD,+MINNEAPOLIS,+MN+55429&hl=en"
HENNEPIN COUNTY SO,CRYSTAL WALGREENS POINT OF CONTACT: MARK WARREN (952) 250-7501,6800 BASS LAKE ROAD,MINNEAPOLIS,MN,55428,"http://maps.google.com/maps?q=6800 BASS LAKE ROAD,+MINNEAPOLIS,+MN+55428&hl=en"
HENNEPIN COUNTY SO,ROBBINSDALE CVS POINT OF CONTACT: BARB DIN (763) 535-2459,4152 LAKELAND AVENUE NORTH,MINNEAPOLIS,MN,55422,"http://maps.google.com/maps?q=4152 LAKELAND AVENUE NORTH,+MINNEAPOLIS,+MN+55422&hl=en"
HUDSON POLICE DEPARTMENT,FAMILY FRESH EVENT 10:00 AM - 2:00 PM,2351 COULEE ROAD,HUDSON,WI,54016,"http://maps.google.com/maps?q=2351 COULEE ROAD,+HUDSON,+WI+54016&hl=en"
HURON POLICE DEPARTMENT,HURON POLICE DEPARTMENT SITE WILL BE LOCATED ON THE SOUTHSIDE OF CITY HALL,239 WISCONSIN AVE. SW,HURON,SD,57350,"http://maps.google.com/maps?q=239 WISCONSIN AVE. SW,+HURON,+SD+57350&hl=en"
JORDAN PD,JORDAN POLICE DEPARTMENT LOBBY: OPEN DAILY FROM 8AM TO 8PM,705 SYNDICATE STREET,JORDAN,MN,55352,"http://maps.google.com/maps?q=705 SYNDICATE STREET,+JORDAN,+MN+55352&hl=en"
KANABEC COUNTY SHERIFF'S OFFICE,COBORNS,710 FRANKIE LANE,MORA,MN,55051,"http://maps.google.com/maps?q=710 FRANKIE LANE,+MORA,+MN+55051&hl=en"
KANDIYOHI COUNTY SO,KANDIYOHI COUNTY SO,2201 NE 23RD STREET SUITE 101,WILLMAR,MN,56201,"http://maps.google.com/maps?q=2201 NE 23RD STREET SUITE 101,+WILLMAR,+MN+56201&hl=en"
KOSSUTH COUNTY SHERIFF'S OFFICE,HY VEE FOOD STORE NO BOXES,1500 HYW.169 N.,ALGONA,IA,50511,"http://maps.google.com/maps?q=1500 HYW.169 N.,+ALGONA,+IA+50511&hl=en"
LAC QUI PARLE SO,LAC QUI PARLE SHERIFF'S OFFICE,600 6TH STREET,MADISON,MN,56256,"http://maps.google.com/maps?q=600 6TH STREET,+MADISON,+MN+56256&hl=en"
LAKE COUNTY SHERIFF'S OFFICE,LAKE COUNTY SHERIFF'S OFFICE,219 NE 1ST STREET,MADISON,SD,57042,"http://maps.google.com/maps?q=219 NE 1ST STREET,+MADISON,+SD+57042&hl=en"
LAKE MILLS POLICE DEPARTMENT,LAKE MILLS POLICE DEPARTMENT,304 S. MILL STREET,LAKE MILLS,IA,50450,"http://maps.google.com/maps?q=304 S. MILL STREET,+LAKE MILLS,+IA+50450&hl=en"
LINCOLN COUNTY SHERIFF'S OFFICE,HARRISBURG CITY HALL,301 E. WILLOW STREET,HARRISBURG,SD,57032,"http://maps.google.com/maps?q=301 E. WILLOW STREET,+HARRISBURG,+SD+57032&hl=en"
LINN COUNTY SHERIFF'S OFFICE,CENTRAL CITY FIRE STATION,137 N 4TH ST,CENTRAL CITY,IA,52214,"http://maps.google.com/maps?q=137 N 4TH ST,+CENTRAL CITY,+IA+52214&hl=en"
LINO LAKES PUBLIC SAFETY DEPARTMENT,LINO LAKES POLICE DEPARTMENT,640 TOWN CENTER PARKWAY,LINO LAKES,MN,55014,"http://maps.google.com/maps?q=640 TOWN CENTER PARKWAY,+LINO LAKES,+MN+55014&hl=en"
LITTLE FALLS PD / MOTLEY PD / MORRISON COUNTY SO,LITTLE FALLS PD,207 1ST STREET NE,LITTLE FALLS,MN,56345,"http://maps.google.com/maps?q=207 1ST STREET NE,+LITTLE FALLS,+MN+56345&hl=en"
LONG PRAIRIE POLICE DEPARTMENT,LONG PRAIRIE POLICE DEPARTMENT,615 LAKE ST S,LONG PRAIRIE,MN,56347,"http://maps.google.com/maps?q=615 LAKE ST S,+LONG PRAIRIE,+MN+56347&hl=en"
LYON COUNTY SHERIFF'S OFFICE,LYON COUNTY SHERIFF'S OFFICE,410 SOUTH BOONE,ROCK RAPIDS,IA,51246,"http://maps.google.com/maps?q=410 SOUTH BOONE,+ROCK RAPIDS,+IA+51246&hl=en"
LYON COUNTY SO,LYON COUNTY SHERIFF'S OFFICE,611 WEST MAIN STREET,MARSHALL,MN,56258,"http://maps.google.com/maps?q=611 WEST MAIN STREET,+MARSHALL,+MN+56258&hl=en"
MANCHESTER POLICE DEPARTMENT,BLAKESLEY DRUG,220 EAST MAIN ST.,MANCHESTER,IA,52057,"http://maps.google.com/maps?q=220 EAST MAIN ST.,+MANCHESTER,+IA+52057&hl=en"
MANSON POLICE DEPARTMENT,MANSON POLICE DEPARTMENT LOBBY WILL BE OPEN FROM 7:00AM-2:30PM,1015 13TH STREET,MANSON,IA,50563,"http://maps.google.com/maps?q=1015 13TH STREET,+MANSON,+IA+50563&hl=en"
MAR-MAC POLICE DEPARTMENT,MCGREGOR PUBLIC LIBRARY,334 MAIN STREET,MC GREGOR,IA,52157,"http://maps.google.com/maps?q=334 MAIN STREET,+MC GREGOR,+IA+52157&hl=en"
MAYO CLINIC / OLMSTED COUNTY SO,MAYO CLINIC,200 FIRST STREET SW,ROCHESTER,MN,55905,"http://maps.google.com/maps?q=200 FIRST STREET SW,+ROCHESTER,+MN+55905&hl=en"
MENDOTA HEIGHTS PD,MENDOTA HEIGHTS POLICE DEPARTMENT,1101 VICTORIA CURVE,MENDOTA HEIGHTS,MN,55118,"http://maps.google.com/maps?q=1101 VICTORIA CURVE,+MENDOTA HEIGHTS,+MN+55118&hl=en"
MINNEAPOLIS PD,MINNEAPOLIS POLICE DEPARTMENT 1ST PRECINCT,19 NORTH 4TH STREET,MINNEAPOLIS,MN,55415,"http://maps.google.com/maps?q=19 NORTH 4TH STREET,+MINNEAPOLIS,+MN+55415&hl=en"
MINNEAPOLIS PD,MINNEAPOLIS POLICE DEPARTMENT 5TH PRECINCT,3101 NICOLLET AVENUE SOUTH,MINNEAPOLIS,MN,55408,"http://maps.google.com/maps?q=3101 NICOLLET AVENUE SOUTH,+MINNEAPOLIS,+MN+55408&hl=en"
"MINNESOTA STATE UNIVERSITY, MANKATO STUDENT HEALTH",MINNESOTA STATE UNIVERSITY MANKATO STUDENT HEALTH SERVICES,21 CARKOSKI COMMONS,MANKATO,MN,56001,"http://maps.google.com/maps?q=21 CARKOSKI COMMONS,+MANKATO,+MN+56001&hl=en"
MONTEVIDEO PD,MONTEVIDEO POLICE DEPARTMENT,103 CANTON AVENUE,MONTEVIDEO,MN,56265,"http://maps.google.com/maps?q=103 CANTON AVENUE,+MONTEVIDEO,+MN+56265&hl=en"
NORTH BRANCH PD,NORTH BRANCH CITY HALL OPEN FROM 10 A.M. UNTIL 2 P.M.,6408 ELM STREET,NORTH BRANCH,MN,55056,"http://maps.google.com/maps?q=6408 ELM STREET,+NORTH BRANCH,+MN+55056&hl=en"
NORTHEAST IOWA DRUG TASK FORCE,CALMAR TRAIN DEPOT,202 MARYVILLE STREET,CALMAR,IA,52132,"http://maps.google.com/maps?q=202 MARYVILLE STREET,+CALMAR,+IA+52132&hl=en"
NORTHEAST IOWA DRUG TASK FORCE,CHESTER CITY HALL,302 MAIN STREET,CHESTER,IA,52134,"http://maps.google.com/maps?q=302 MAIN STREET,+CHESTER,+IA+52134&hl=en"
NORTHEAST IOWA DRUG TASK FORCE,CHICKASAW COUNTY COMMUNITY CENTER,260 EAST PROSPECT ST.,NEW HAMPTON,IA,50659,"http://maps.google.com/maps?q=260 EAST PROSPECT ST.,+NEW HAMPTON,+IA+50659&hl=en"
NORTHEAST IOWA DRUG TASK FORCE,CLAYTON COUNTY SHERIFF'S OFFICE,22680 230TH ST,SAINT OLAF,IA,52072,"http://maps.google.com/maps?q=22680 230TH ST,+SAINT OLAF,+IA+52072&hl=en"
NORTHEAST IOWA DRUG TASK FORCE,DONLON'S PHARMACY,201 WEST WATER STREET,DECORAH,IA,52101,"http://maps.google.com/maps?q=201 WEST WATER STREET,+DECORAH,+IA+52101&hl=en"
NORTHEAST IOWA DRUG TASK FORCE,ELKADER OPERA HOUSE,207 NORTH MAIN ST.,ELKADER,IA,52043,"http://maps.google.com/maps?q=207 NORTH MAIN ST.,+ELKADER,+IA+52043&hl=en"
NORTHEAST IOWA DRUG TASK FORCE,ELMA FIRE DEPARTMENT,107 ORCHARD STREET,ELMA,IA,50628,"http://maps.google.com/maps?q=107 ORCHARD STREET,+ELMA,+IA+50628&hl=en"
NORTHEAST IOWA DRUG TASK FORCE,FAYETTE COUNTY SHERIFF'S OFFICE,220 NORTH INDISTRIAL PARKWAY,WEST UNION,IA,52175,"http://maps.google.com/maps?q=220 NORTH INDISTRIAL PARKWAY,+WEST UNION,+IA+52175&hl=en"
NORTHEAST IOWA DRUG TASK FORCE,HOWARD COUNTY SHERIFF'S OFFICE,124 S. PARK PLACE,CRESCO,IA,52136,"http://maps.google.com/maps?q=124 S. PARK PLACE,+CRESCO,+IA+52136&hl=en"
NORTHEAST IOWA DRUG TASK FORCE,LANSING FIRE DEPT.,51 NORTH FRONT ST.,LANSING,IA,52151,"http://maps.google.com/maps?q=51 NORTH FRONT ST.,+LANSING,+IA+52151&hl=en"
NORTHEAST IOWA DRUG TASK FORCE,LIME SPRINGS CITY HALL,201 CENTER STREET,LIME SPRINGS,IA,52155,"http://maps.google.com/maps?q=201 CENTER STREET,+LIME SPRINGS,+IA+52155&hl=en"
NORTHEAST IOWA DRUG TASK FORCE,MONONA POLICE DEPT.,104 EAST CENTER ST.,MONONA,IA,52159,"http://maps.google.com/maps?q=104 EAST CENTER ST.,+MONONA,+IA+52159&hl=en"
NORTHEAST IOWA DRUG TASK FORCE,POSTVILLE CITY HALL,147 N. LAWLWER ST.,POSTVILLE,IA,52162,"http://maps.google.com/maps?q=147 N. LAWLWER ST.,+POSTVILLE,+IA+52162&hl=en"
NORTHEAST IOWA DRUG TASK FORCE,PROTIVIN FIRE DEPARTMENT,132 LARSON STREET,PROTIVIN,IA,52163,"http://maps.google.com/maps?q=132 LARSON STREET,+PROTIVIN,+IA+52163&hl=en"
NORTHEAST IOWA DRUG TASK FORCE,RICEVILLE FIRE DEPARTMENT,106 WALNUT STREET,RICEVILLE,IA,50466,"http://maps.google.com/maps?q=106 WALNUT STREET,+RICEVILLE,+IA+50466&hl=en"
NORTHEAST IOWA DRUG TASK FORCE,STEEGE PHARMACY,119 NORTH VINE STREET,WEST UNION,IA,52175,"http://maps.google.com/maps?q=119 NORTH VINE STREET,+WEST UNION,+IA+52175&hl=en"
NORTHEAST IOWA DRUG TASK FORCE,THRIFTY WHITE PHARMACY,702 MONTGOMERY ST.,DECORAH,IA,52101,"http://maps.google.com/maps?q=702 MONTGOMERY ST.,+DECORAH,+IA+52101&hl=en"
NORTHEAST IOWA DRUG TASK FORCE,UNION DRUG STORE,315 HIGHWAY 150,WEST UNION,IA,52175,"http://maps.google.com/maps?q=315 HIGHWAY 150,+WEST UNION,+IA+52175&hl=en"
NORTHEAST IOWA DRUG TASK FORCE,WAL-MART SUPER CENTER,1798 OLD STAGE ROAD,DECORAH,IA,52101,"http://maps.google.com/maps?q=1798 OLD STAGE ROAD,+DECORAH,+IA+52101&hl=en"
NORTHEAST IOWA DRUG TASK FORCE,WAUKON POLICE DEPT.,565 11 1ST STREET,WAUKON,IA,52172,"http://maps.google.com/maps?q=565 11 1ST STREET,+WAUKON,+IA+52172&hl=en"
NORTHEAST IOWA DRUG TASK FORCE,WINNESHIEK CO/DECORAH POLICE LAW ENFORCEMENT CNTR,400 CLAIRBORNE DRIVE,DECORAH,IA,52101,"http://maps.google.com/maps?q=400 CLAIRBORNE DRIVE,+DECORAH,+IA+52101&hl=en"
OSCEOLA COUNTY SHERIFF OFFICE,OSCEOLA COUNTY SHERIFF OFFICE,309 6TH STREET,SIBLEY,IA,51249,"http://maps.google.com/maps?q=309 6TH STREET,+SIBLEY,+IA+51249&hl=en"
OSSEO PD,OSSEO PD,415 CENTRAL AVENUE,OSSEO,MN,55369,"http://maps.google.com/maps?q=415 CENTRAL AVENUE,+OSSEO,+MN+55369&hl=en"
OSSEO POLICE DEPARTMENT,OSSEO POLICE DEPARTMENT EVENT 10:00AM-2:00PM,13712 8TH STREET,OSSEO,WI,54758,"http://maps.google.com/maps?q=13712 8TH STREET,+OSSEO,+WI+54758&hl=en"
PALO ALTO COUNTY SHERIFF'S OFFICE,PALO ALTO COUNTY SHERIFF'S OFFICE NO BOXES,2001 11TH STREET,EMMETSBURG,IA,50536,"http://maps.google.com/maps?q=2001 11TH STREET,+EMMETSBURG,+IA+50536&hl=en"
PEPIN COUNTY SHERIFF'S OFFICE,DURAND FIRE HALL EVENT 10:00AM-1:00PM,205 E MONTGOMERY STREET,DURAND,WI,54736,"http://maps.google.com/maps?q=205 E MONTGOMERY STREET,+DURAND,+WI+54736&hl=en"
PRAIRIE ISLAND TRIBAL POLICE,PRIARIE ISLAND PUBLIC SAFETY BUILDING,1960 ISLAND BOULEVARD,WELCH,MN,55089,"http://maps.google.com/maps?q=1960 ISLAND BOULEVARD,+WELCH,+MN+55089&hl=en"
PRINCETON PD,PRINCETON PD,305 21ST AVENUE SOUTH,PRINCETON,MN,55371,"http://maps.google.com/maps?q=305 21ST AVENUE SOUTH,+PRINCETON,+MN+55371&hl=en"
RED WING PD,RED WING POLICE DEPARTMENT,430 WEST 6TH STREET,RED WING,MN,55066,"http://maps.google.com/maps?q=430 WEST 6TH STREET,+RED WING,+MN+55066&hl=en"
RENVILLE COUNTY SO,RENVILLE COUNTY SHERIFF'S OFFICE,"105 5TH STREET SOUTH, SUITE #210",OLIVIA,MN,56277,"http://maps.google.com/maps?q=105 5TH STREET SOUTH, SUITE #210,+OLIVIA,+MN+56277&hl=en"
RICHIFIELD PD,RICHFIELD POLICE DEPARTMENT,6700 PORTLAND AVENUE SOUTH,RICHFIELD,MN,55423,"http://maps.google.com/maps?q=6700 PORTLAND AVENUE SOUTH,+RICHFIELD,+MN+55423&hl=en"
RIVER FALLS POLICE DEPARTMENT,RIVER FALLS POLICE DEPARTMENT EVENT 9:00AM-5:00PM,125 E. ELM STREET,RIVER FALLS,WI,54022,"http://maps.google.com/maps?q=125 E. ELM STREET,+RIVER FALLS,+WI+54022&hl=en"
ROCK COUNTY SO,ROCK COUNTY SO,1000 NORTH BLUE MOUND AVENUE,LUVERNE,MN,56156,"http://maps.google.com/maps?q=1000 NORTH BLUE MOUND AVENUE,+LUVERNE,+MN+56156&hl=en"
SIOUX CITY POLICE DEPARTMENT,DRILLING PHARMACY,4010 MORNINGSIDE AVE,SIOUX CITY,IA,51106,"http://maps.google.com/maps?q=4010 MORNINGSIDE AVE,+SIOUX CITY,+IA+51106&hl=en"
SIOUX CITY POLICE DEPARTMENT,FAREWAY GROCERY STORE,4040 WAR EAGLE DRIVE,SIOUX CITY,IA,51109,"http://maps.google.com/maps?q=4040 WAR EAGLE DRIVE,+SIOUX CITY,+IA+51109&hl=en"
SIOUX CITY POLICE DEPARTMENT,HY VEE FOOD STORES,2827 HAMILTON BLVD.,SIOUX CITY,IA,51103,"http://maps.google.com/maps?q=2827 HAMILTON BLVD.,+SIOUX CITY,+IA+51103&hl=en"
SIOUX CITY POLICE DEPARTMENT,HY-VEE,4500 SERGEANT ROAD,SIOUX CITY,IA,51106,"http://maps.google.com/maps?q=4500 SERGEANT ROAD,+SIOUX CITY,+IA+51106&hl=en"
SIOUX CITY POLICE DEPARTMENT,TARGET,5775 SUNNYBROOK DRIVE,SIOUX CITY,IA,51101,"http://maps.google.com/maps?q=5775 SUNNYBROOK DRIVE,+SIOUX CITY,+IA+51101&hl=en"
SIOUX CITY POLICE DEPARTMENT,WALGREENS,101 PIERCE STREET,SIOUX CITY,IA,51101,"http://maps.google.com/maps?q=101 PIERCE STREET,+SIOUX CITY,+IA+51101&hl=en"
SIOUX CITY POLICE DEPARTMENT,WALMART,3101 FLOYD BLVD.,SIOUX CITY,IA,51104,"http://maps.google.com/maps?q=3101 FLOYD BLVD.,+SIOUX CITY,+IA+51104&hl=en"
SIOUX COUNTY SHERIFF'S OFFICE,SIOUX COUNTY SHERIFF'S OFFICE LOBBY,4363 IRONWOOD AVE,ORANGE CITY,IA,51041,"http://maps.google.com/maps?q=4363 IRONWOOD AVE,+ORANGE CITY,+IA+51041&hl=en"
SPENCER POLICE DEPARTMENT,SPENCER POLICE DEPARTMENT 11:00AM - 1:00PM,712 GRAND AVE,SPENCER,IA,51301,"http://maps.google.com/maps?q=712 GRAND AVE,+SPENCER,+IA+51301&hl=en"
SPIRIT LAKE POLICE DEPARTMENT,HY-VEE,1500 18TH STREET,SPIRIT LAKE,IA,51360,"http://maps.google.com/maps?q=1500 18TH STREET,+SPIRIT LAKE,+IA+51360&hl=en"
SPRING LAKE PARK PD,SPRING LAKE PARK PD,1301 81ST AVENUE NE,SPRING LAKE PARK,MN,55432,"http://maps.google.com/maps?q=1301 81ST AVENUE NE,+SPRING LAKE PARK,+MN+55432&hl=en"
ST. FRANCIS PD,GOODRICH PHARMACY LOCATED IN KINGS COUNTY MARKET,23122 ST. FRANCIS BLVD NW,SAINT FRANCIS,MN,55070,"http://maps.google.com/maps?q=23122 ST. FRANCIS BLVD NW,+SAINT FRANCIS,+MN+55070&hl=en"
ST. FRANCIS PD,ST. FRANCIS POLICE DEPARTMENT,4058 ST. FRANCIS BLVD NW,SAINT FRANCIS,MN,55070,"http://maps.google.com/maps?q=4058 ST. FRANCIS BLVD NW,+SAINT FRANCIS,+MN+55070&hl=en"
ST. LOUIS PARK PD,ST. LOUIS PARK PD,3015 RALEIGH AVE S,ST LOUIS PARK,MN,55416,"http://maps.google.com/maps?q=3015 RALEIGH AVE S,+ST LOUIS PARK,+MN+55416&hl=en"
ST. PAUL PD,ST. PAUL POLICE DEPARTMENT WESTERN DISTRICT,389 NORTH HAMLINE,SAINT PAUL,MN,55101,"http://maps.google.com/maps?q=389 NORTH HAMLINE,+SAINT PAUL,+MN+55101&hl=en"
TRAVERSE COUNTY SO,TRAVERSE COUNTY SHERIFF'S OFFICE,203 7TH STREET NORTH,WHEATON,MN,56296,"http://maps.google.com/maps?q=203 7TH STREET NORTH,+WHEATON,+MN+56296&hl=en"
WASHINGTON COUNTY SO,WILDWOOD LIBRARY 10:00AM-2:00PM,763 STILLWATER ROAD,MAHTOMEDI,MN,55115,"http://maps.google.com/maps?q=763 STILLWATER ROAD,+MAHTOMEDI,+MN+55115&hl=en"
WATERLOO POLICE DEPARTMENT,GREENWOOD PHARMACY,2104 KIMBALL AVE,WATERLOO,IA,50702,"http://maps.google.com/maps?q=2104 KIMBALL AVE,+WATERLOO,+IA+50702&hl=en"
WATERTOWN POLICE DEPARTMENT,WATERTOWN POLICE DEPARTMENT,128 MAPLE ST. N,WATERTOWN,SD,57201,"http://maps.google.com/maps?q=128 MAPLE ST. N,+WATERTOWN,+SD+57201&hl=en"
WAVERLY POLICE DEPARTMENT,WAVERLY PUBLIC LIBRARY,1500 WEST BREMER AVE,WAVERLY,IA,50677,"http://maps.google.com/maps?q=1500 WEST BREMER AVE,+WAVERLY,+IA+50677&hl=en"
WEBSTER COUNTY SHERIFF'S OFFICE,DANIEL PHARMACY 10AM-12PM,1114 CENTRAL AVE,FORT DODGE,IA,50501,"http://maps.google.com/maps?q=1114 CENTRAL AVE,+FORT DODGE,+IA+50501&hl=en"
WEBSTER COUNTY SHERIFF'S OFFICE,HY VEE PHARMACY,115 29TH ST,FORT DODGE,IA,50501,"http://maps.google.com/maps?q=115 29TH ST,+FORT DODGE,+IA+50501&hl=en"
WINNEBAGO COUNTY SHERIFF'S OFFICE,WINNEBAGO COUNTY SHERIFF'S OFFICE,935 HWY. 69 NORTH,FOREST CITY,IA,50436,"http://maps.google.com/maps?q=935 HWY. 69 NORTH,+FOREST CITY,+IA+50436&hl=en"
WINONA COUNTY ASAP,WINONA COUNTY ASAP WALGREENS PARKING LOT,750 MANKATO AVENUE,WINONA,MN,55987,"http://maps.google.com/maps?q=750 MANKATO AVENUE,+WINONA,+MN+55987&hl=en"
WRIGHT COUNTY SHERIFF'S OFFICE,IOWA SPECIALTY HOSPITAL EVENT ON 10/26/18 FROM 10AM-12PM,1316 S MAIN STREET,CLARION,IA,50525,"http://maps.google.com/maps?q=1316 S MAIN STREET,+CLARION,+IA+50525&hl=en"
