Participant,CollectionSite,Address,City,State,Zip,MapURL
ADAIR COUNTY SHERIFF'S OFFICE,ADAIR COUNTY SHERIFF'S OFFICE,215 N. FRANKLIN,KIRKSVILLE,MO,63501,"http://maps.google.com/maps?q=215 N. FRANKLIN,+KIRKSVILLE,+MO+63501&hl=en"
ALBIA POLICE DEPARTMENT,MONROE COUNTY LAW ENFORCEMENT CENTER,114 19TH AVE WEST,ALBIA,IA,52531,"http://maps.google.com/maps?q=114 19TH AVE WEST,+ALBIA,+IA+52531&hl=en"
ALEDO POLICE DEPARTMENT,ALEDO POLICE DEPARTMENT PARKING AREA ADJACENT TO NORTH SIDE OF BLDG,200 NE 2ND ST,ALEDO,IL,61231,"http://maps.google.com/maps?q=200 NE 2ND ST,+ALEDO,+IL+61231&hl=en"
ALTOONA POLICE DEPARTMENT,ALTOONA FIRE DEPT,950 VENBURY DRIVE,ALTOONA,IA,50009,"http://maps.google.com/maps?q=950 VENBURY DRIVE,+ALTOONA,+IA+50009&hl=en"
AMES IOWA POLICE DEPARMENT,CITY HALL 1ST FLR WEST SIDE OF BLDG,515 CLARK AVE,AMES,IA,50010,"http://maps.google.com/maps?q=515 CLARK AVE,+AMES,+IA+50010&hl=en"
ANKENY POLICE DEPARTMENT,ANKENY POLICE DEPARTMENT,411 SW ORDNANCE RD,ANKENY,IA,50023,"http://maps.google.com/maps?q=411 SW ORDNANCE RD,+ANKENY,+IA+50023&hl=en"
APPANOOSE COUNTY SHERIFF,APPANOOSE COUNTY SHERIFF'S OFFICE,1125 W. VAN BUREN ST.,CENTERVILLE,IA,52544,"http://maps.google.com/maps?q=1125 W. VAN BUREN ST.,+CENTERVILLE,+IA+52544&hl=en"
ATLANTIC POLICE DEPARTMENT,ATLANTIC POLICE DEPARTMENT NATHAN L KINNEY,23 E 4TH STREET,ATLANTIC,IA,50022,"http://maps.google.com/maps?q=23 E 4TH STREET,+ATLANTIC,+IA+50022&hl=en"
BENTON COUNTY SHERIFF'S OFFICE,BENTON COUNTY SHERIFF'S OFFICE,113 E 3 STREET,VINTON,IA,52349,"http://maps.google.com/maps?q=113 E 3 STREET,+VINTON,+IA+52349&hl=en"
BOONE COUNTY SHERIFF'S DEPT.,CENTRALIA POLICE DEPT. LOBBY,114 S. ROLLINS,CENTRALIA,MO,65240,"http://maps.google.com/maps?q=114 S. ROLLINS,+CENTRALIA,+MO+65240&hl=en"
BOONE COUNTY SHERIFF'S DEPT.,HALLSVILLE POLICE DEPARTMENT,202 HIGHWAY 124 EAST,HALLSVILLE,MO,65255,"http://maps.google.com/maps?q=202 HIGHWAY 124 EAST,+HALLSVILLE,+MO+65255&hl=en"
BOONE IOWA POLICE DEPARTMENT,BOONE POLICE DEPARTMENT 10:00 AM-12:00 PM.,525 STORY STREET,BOONE,IA,50036,"http://maps.google.com/maps?q=525 STORY STREET,+BOONE,+IA+50036&hl=en"
BROWN COUNTY SHERIFF'S OFFICE,MT. STERLING IGA,200 PITTSFIELD ROAD,MOUNT STERLING,IL,62353,"http://maps.google.com/maps?q=200 PITTSFIELD ROAD,+MOUNT STERLING,+IL+62353&hl=en"
BUCHANAN COUNTY SHERIFF'S OFFICE,"BCSO DEA DROP SITE (FAREWAY) LOCATED AT FAREWAY, INDEPENDENCE, IA",1400 3RD AVENUE SE,INDEPENDENCE,IA,50644,"http://maps.google.com/maps?q=1400 3RD AVENUE SE,+INDEPENDENCE,+IA+50644&hl=en"
CANTON POLICE DEPARTMENT,CANTON POLICE DEPARTMENT,2 N. MAIN STREET,CANTON,IL,61520,"http://maps.google.com/maps?q=2 N. MAIN STREET,+CANTON,+IL+61520&hl=en"
CARLINVILLE POLICE DEPT.,CARLINVILLE POLICE DEPARTMENT,570 NORTH BROAD STREET,CARLINVILLE,IL,62626,"http://maps.google.com/maps?q=570 NORTH BROAD STREET,+CARLINVILLE,+IL+62626&hl=en"
CARLISLE POLICE DEPARTMENT,CARLISLE FIRE DEPARTMENT,135 N. 2ND STREET,CARLISLE,IA,50047,"http://maps.google.com/maps?q=135 N. 2ND STREET,+CARLISLE,+IA+50047&hl=en"
CEDAR COUNTY SHERIFF'S OFFICE,CEDAR COUNTY SHERIFF'S OFFICE,711 E. SOUTH STREET,TIPTON,IA,52772,"http://maps.google.com/maps?q=711 E. SOUTH STREET,+TIPTON,+IA+52772&hl=en"
CEDAR FALLS POLICE DEPARTMENT,CEDAR FALLS POLICE DEPARTMENT,220 CLAY STREET,CEDAR FALLS,IA,50613,"http://maps.google.com/maps?q=220 CLAY STREET,+CEDAR FALLS,+IA+50613&hl=en"
CEDAR RAPIDS POLICE DEPT.,CEDAR RAPIDS POLICE DEPARTMENT,505 1ST ST SW,CEDAR RAPIDS,IA,52404,"http://maps.google.com/maps?q=505 1ST ST SW,+CEDAR RAPIDS,+IA+52404&hl=en"
CHARLES CITY POLICE DEPARTMENT,CHARLES CITY POLICE DEPARTMENT,105 MILWAUKEE MALL,CHARLES CITY,IA,50616,"http://maps.google.com/maps?q=105 MILWAUKEE MALL,+CHARLES CITY,+IA+50616&hl=en"
CHATHAM POLICE DEPARTMENT,CHATHAM POLICE DEPARTMENT,117 EAST MULBERRY,CHATHAM,IL,62629,"http://maps.google.com/maps?q=117 EAST MULBERRY,+CHATHAM,+IL+62629&hl=en"
CITY OF LODI POLICE DEPARTMENT,CITY OF LODI POLICE DEPARTMENT EVENT 8:00AM -11:00AM,142 S MAIN ST,LODI,WI,53555,"http://maps.google.com/maps?q=142 S MAIN ST,+LODI,+WI+53555&hl=en"
CLINTON COUNTY SHERIFF'S OFFICE,CLINTON COUNTY SHERIFF'S OFFICE SATELLITE OFFICE,226 11TH STREET,DE WITT,IA,52742,"http://maps.google.com/maps?q=226 11TH STREET,+DE WITT,+IA+52742&hl=en"
CLINTON POLICE DEPARTMENT,CLINTON POLICE DEPARTMENT WILLIAM GREENWALT,537 BALLPARK DRIVE,CLINTON,IA,52732,"http://maps.google.com/maps?q=537 BALLPARK DRIVE,+CLINTON,+IA+52732&hl=en"
COLONA POLICE DEPARTMENT,COLONA POLICE DEPARTMENT LOBBY,215 1ST STREET,COLONA,IL,61241,"http://maps.google.com/maps?q=215 1ST STREET,+COLONA,+IL+61241&hl=en"
CORALVILLE POLICE DEPARTMENT,CORALVILLE POLICE DEPARTMENT,1503 5TH ST.,CORALVILLE,IA,52241,"http://maps.google.com/maps?q=1503 5TH ST.,+CORALVILLE,+IA+52241&hl=en"
CORALVILLE POLICE DEPARTMENT,WALGREENS- 2ND ST.,102 2ND ST.,CORALVILLE,IA,52241,"http://maps.google.com/maps?q=102 2ND ST.,+CORALVILLE,+IA+52241&hl=en"
CORALVILLE POLICE DEPARTMENT,WALGREENS- HEARTLAND DR,2751 HEARTLAND DR.,CORALVILLE,IA,52241,"http://maps.google.com/maps?q=2751 HEARTLAND DR.,+CORALVILLE,+IA+52241&hl=en"
CROSS PLAINS POLICE DEPARTMENT,CROSS PLAINS POLICE DEPARTMENT EVENT 10:00 AM TO 2:00 PM,2417 BREWERY RD,CROSS PLAINS,WI,53528,"http://maps.google.com/maps?q=2417 BREWERY RD,+CROSS PLAINS,+WI+53528&hl=en"
DECATUR COUNTY SHERIFF'S OFFICE,DECATUR COUNTY SHERIFF'S OFFICE TRACY MOORE,203 NE IDAHO,LEON,IA,50144,"http://maps.google.com/maps?q=203 NE IDAHO,+LEON,+IA+50144&hl=en"
DEFOREST POLICE DEPARTMENT,DEFOREST POLICE DEPARTMENT EVENT 10:00 AM - 2:00 PM,110 SOUTH STEVENSON STREET,DEFOREST,WI,53532,"http://maps.google.com/maps?q=110 SOUTH STEVENSON STREET,+DEFOREST,+WI+53532&hl=en"
DICKEYVILLE POLICE DEPARTMENT,DICKEYVILLE POLICE DEPARTMENT EVENT 9:00AM-12:00PM,500 EAST AVENUE,DICKEYVILLE,WI,53808,"http://maps.google.com/maps?q=500 EAST AVENUE,+DICKEYVILLE,+WI+53808&hl=en"
DUBUQUE DRUG TASK FORCE,SAM'S CLUB,4400 ASBURY RD,DUBUQUE,IA,52002,"http://maps.google.com/maps?q=4400 ASBURY RD,+DUBUQUE,+IA+52002&hl=en"
EAST MOLINE POLICE DEPARTMENT,EAST MOLINE POLICE DEPARTMENT 1ST FLOOR COMMUNITY ROOM,915 16TH AVENUE,EAST MOLINE,IL,61244,"http://maps.google.com/maps?q=915 16TH AVENUE,+EAST MOLINE,+IL+61244&hl=en"
EAST PEORIA POLICE DEPARTMENT,EAST PEORIA FIRE DEPARTMENT CENTRAL HOUSE - FIRE BAYS,201 W. WASHINGTON STREET,EAST PEORIA,IL,61611,"http://maps.google.com/maps?q=201 W. WASHINGTON STREET,+EAST PEORIA,+IL+61611&hl=en"
EDGERTON POLICE DEPARTMENT,EDGERTON POLICE DEPARTMENT EVENT 11:00AM-2:00PM,215 W FULTON ST,EDGERTON,WI,53534,"http://maps.google.com/maps?q=215 W FULTON ST,+EDGERTON,+WI+53534&hl=en"
EVANSVILLE POLICE DEPARTMENT,EVANSVILLE POLICE DEPARTMENT EVENT 8:00 AM TO 11:00 AM,10 WEST CHURCH STREET,EVANSVILLE,WI,53536,"http://maps.google.com/maps?q=10 WEST CHURCH STREET,+EVANSVILLE,+WI+53536&hl=en"
EXCELSIOR SPRING POLICE DEPARTMENT,EXCELSIOR SPRINGS POLICE DEPARTMENT LOBBY,301 S. MAIN STREET,EXCELSIOR SPRINGS,MO,64024,"http://maps.google.com/maps?q=301 S. MAIN STREET,+EXCELSIOR SPRINGS,+MO+64024&hl=en"
FARMINGTON POLICE DEPARTMENT,FARMINGTON POLICE DEPARTMENT,322 E. FORST STREET,FARMINGTON,IL,61531,"http://maps.google.com/maps?q=322 E. FORST STREET,+FARMINGTON,+IL+61531&hl=en"
GALLATIN POLICE DEPARTMENT,GALLATIN POLICE DEPARTMENT,112 E GRAND,GALLATIN,MO,64640,"http://maps.google.com/maps?q=112 E GRAND,+GALLATIN,+MO+64640&hl=en"
GENESEO POLICE DEPARTMENT,GENESEO MUNICIPAL BUILDING CITY HALL AND POLICE DEPARTMENT,115 SOUTH OAKWOOD AVE,GENESEO,IL,61254,"http://maps.google.com/maps?q=115 SOUTH OAKWOOD AVE,+GENESEO,+IL+61254&hl=en"
GRUNDY COUNTY LAW ENFORCEMENT CENTER,GRUNDY COUNTY LAW ENFORCEMENT CENTER,610 MAIN STREET,TRENTON,MO,64683,"http://maps.google.com/maps?q=610  MAIN STREET,+TRENTON,+MO+64683&hl=en"
HAMILTON COUNTY SHERIFF'S OFFICE,HY-VEE FOOD STORE,823 2ND STREET,WEBSTER CITY,IA,50595,"http://maps.google.com/maps?q=823 2ND STREET,+WEBSTER CITY,+IA+50595&hl=en"
HANCOCK COUNTY SHERIFF'S OFFICE,DALLAS CITY HALL DALLAS CITY POLICE DEPARTMENT,120 W. 1ST STREET,DALLAS CITY,IL,62330,"http://maps.google.com/maps?q=120 W. 1ST STREET,+DALLAS CITY,+IL+62330&hl=en"
HANCOCK COUNTY SHERIFF'S OFFICE,HAMILTON POLICE DEPARTMENT,1010 BROADWAY ST,HAMILTON,IL,62341,"http://maps.google.com/maps?q=1010 BROADWAY ST,+HAMILTON,+IL+62341&hl=en"
HANCOCK COUNTY SHERIFF'S OFFICE,HANCOCK COUNTY SHERIFF'S OFFICE,98 BUCHANAN ST,CARTHAGE,IL,62321,"http://maps.google.com/maps?q=98 BUCHANAN ST,+CARTHAGE,+IL+62321&hl=en"
HANCOCK COUNTY SHERIFF'S OFFICE,JIFFI STOP,101 S. WORRELL STREET,BOWEN,IL,62316,"http://maps.google.com/maps?q=101 S. WORRELL STREET,+BOWEN,+IL+62316&hl=en"
HANCOCK COUNTY SHERIFF'S OFFICE,LAHARPE POLICE DEPARTMENT,207 E. MAIN STREET,LA HARPE,IL,61450,"http://maps.google.com/maps?q=207 E. MAIN STREET,+LA HARPE,+IL+61450&hl=en"
HANCOCK COUNTY SHERIFF'S OFFICE,NAUVOO POLICE DEPARTMENT,60 N BLUFF ST,NAUVOO,IL,62354,"http://maps.google.com/maps?q=60 N BLUFF ST,+NAUVOO,+IL+62354&hl=en"
HANCOCK COUNTY SHERIFF'S OFFICE,WARSAW CITY HALL WARSAW POLICE DEPARTMENT,210 N 4TH ST,WARSAW,IL,62379,"http://maps.google.com/maps?q=210 N 4TH ST,+WARSAW,+IL+62379&hl=en"
HENRY COUNTY SHERIFF'S OFFICE,HENRY COUNTY SHERIFF'S OFFICE NO BOXES NEEDED FOR ANY SITE,106 EAST CLAY STREET,MOUNT PLEASANT,IA,52641,"http://maps.google.com/maps?q=106 EAST CLAY STREET,+MOUNT PLEASANT,+IA+52641&hl=en"
HENRY COUNTY SHERIFF'S OFFICE,NEW LONDON POLICE DEPARTMENT,509 EAST MAIN STREET,NEW LONDON,IA,52645,"http://maps.google.com/maps?q=509 EAST MAIN STREET,+NEW LONDON,+IA+52645&hl=en"
HENRY COUNTY SHERIFF'S OFFICE,SALEM CITY HALL,201 SOUTH MAIN STREET,SALEM,IA,52649,"http://maps.google.com/maps?q=201 SOUTH MAIN STREET,+SALEM,+IA+52649&hl=en"
HENRY COUNTY SHERIFF'S OFFICE,WAYLAND FIRE DEPARTMENT,211 NORTH WASHINGTON STREET,WAYLAND,IA,52654,"http://maps.google.com/maps?q=211 NORTH WASHINGTON STREET,+WAYLAND,+IA+52654&hl=en"
HENRY COUNTY SHERIFF'S OFFICE,WINFIELD POLICE DEPARTMENT,115 NORTH LOCUST STREET,WINFIELD,IA,52659,"http://maps.google.com/maps?q=115 NORTH LOCUST STREET,+WINFIELD,+IA+52659&hl=en"
HIAWATHA POLICE DEPT,"HIAWATHA POLICE DEPT LOBBY, SOUTH WALL",101 EMMONS ST,HIAWATHA,IA,52233,"http://maps.google.com/maps?q=101 EMMONS ST,+HIAWATHA,+IA+52233&hl=en"
HIGHLAND POLICE DEPARTMENT,HIGHLAND POLICE DEPARTMENT EVENT 10:00 AM TO 2:00 PM,530 MAIN STREET,HIGHLAND,WI,53543,"http://maps.google.com/maps?q=530 MAIN STREET,+HIGHLAND,+WI+53543&hl=en"
HOLT COUNTY SHERIFF OFFICE,HOLT COUNTY SHERIFF OFFICE,107 S MAIN,OREGON,MO,64473,"http://maps.google.com/maps?q=107 S MAIN,+OREGON,+MO+64473&hl=en"
IOWA CITY POLICE DEPARTMENT,EAST SIDE RECYCLING CENTER,2401 SCOTT BLVD SE,IOWA CITY,IA,52240,"http://maps.google.com/maps?q=2401 SCOTT BLVD SE,+IOWA CITY,+IA+52240&hl=en"
IOWA COUNTY SHERIFF'S OFFICE,IOWA COUNTY SHERIFF'S OFFICE,960 FRANKLYN AVE.,MARENGO,IA,52301,"http://maps.google.com/maps?q=960 FRANKLYN AVE.,+MARENGO,+IA+52301&hl=en"
JACKSON COUNTY SHERIFF'S OFFICE,MAQUOKETA POLICE DEPARTMENT,102 S NIAGARA ST,MAQUOKETA,IA,52060,"http://maps.google.com/maps?q=102 S NIAGARA ST,+MAQUOKETA,+IA+52060&hl=en"
JACKSON COUNTY SHERIFF'S OFFICE,SABULA POLICE DEPARTMENT,411 BROAD ST,SABULA,IA,52070,"http://maps.google.com/maps?q=411 BROAD ST,+SABULA,+IA+52070&hl=en"
JACKSONVILLE POLICE DEPARTMENT,JACKSONVILLE POLICE DEPARTMENT,200 W. DOUGLAS,JACKSONVILLE,IL,62650,"http://maps.google.com/maps?q=200 W. DOUGLAS,+JACKSONVILLE,+IL+62650&hl=en"
JOHNSON COUNTY SHERIFF'S OFFICE,JOHNSON COUNTY SHERIFF'S OFFICE LOBBY- (DOUBLE BOXES),511 S CAPITOL STREET,IOWA CITY,IA,52240,"http://maps.google.com/maps?q=511 S CAPITOL STREET,+IOWA CITY,+IA+52240&hl=en"
JOHNSTON POLICE DEPARTMENT,JOHNSTON PUBLIC SAFETY BUILDING,6373 MERLE HAY ROAD,JOHNSTON,IA,50131,"http://maps.google.com/maps?q=6373 MERLE HAY ROAD,+JOHNSTON,+IA+50131&hl=en"
KANSAS CITY MISSOURI POLICE DEPT.,CHILDREN'S MERCY NORTH CAMPUS,501 NW BARRY RD,KANSAS CITY,MO,64155,"http://maps.google.com/maps?q=501 NW BARRY RD,+KANSAS CITY,+MO+64155&hl=en"
KANSAS CITY MISSOURI POLICE DEPT.,KCMO PD NORTH PATROL STATION BRAD STOTT,11000 NW PRAIRIE VIEW RD,KANSAS CITY,MO,64153,"http://maps.google.com/maps?q=11000 NW PRAIRIE VIEW RD,+KANSAS CITY,+MO+64153&hl=en"
KANSAS CITY MISSOURI POLICE DEPT.,KCMO PD SHOAL CREEK STATION,6801 PLEASANT VALLEY ROAD,KANSAS CITY,MO,64119,"http://maps.google.com/maps?q=6801 PLEASANT VALLEY ROAD,+KANSAS CITY,+MO+64119&hl=en"
KANSAS CITY MISSOURI POLICE DEPT.,LIBERTY HOSPITAL,2525 GLENN HENDREN DR.,LIBERTY,MO,64068,"http://maps.google.com/maps?q=2525 GLENN HENDREN DR.,+LIBERTY,+MO+64068&hl=en"
KEARNEY MO POLICE DEPARTMENT,KEARNEY POLICE STATION,725 WEST MO-92 HIGHWAY,KEARNEY,MO,64060,"http://maps.google.com/maps?q=725 WEST MO-92 HIGHWAY,+KEARNEY,+MO+64060&hl=en"
LAFAYETTE COUNTY MISSOURI SHERIFF OFFICE,WAVERLY MISSIOURI POLICE DEPARTMENT/CITY HALL,111 EAST KELLING STREET,WAVERLY,MO,64096,"http://maps.google.com/maps?q=111 EAST KELLING STREET,+WAVERLY,+MO+64096&hl=en"
LAKE MILLS POLICE DEPARTMENT,LAKE MILLS POLICE DEPARTMENT,304 S. MILL STREET,LAKE MILLS,IA,50450,"http://maps.google.com/maps?q=304 S. MILL STREET,+LAKE MILLS,+IA+50450&hl=en"
LAKE WAUKOMIS POLICE DEPT.,LAKE WAUKOMIS CITY HALL COMPLEX,1147 NW SOUTH SHORE DRIVE,LAKE WAUKOMIS,MO,64151,"http://maps.google.com/maps?q=1147 NW SOUTH SHORE DRIVE,+LAKE WAUKOMIS,+MO+64151&hl=en"
LANSING POLICE DEPT.,LANSING CITY HALL,800 1ST TERRACE,LANSING,KS,66043,"http://maps.google.com/maps?q=800 1ST TERRACE,+LANSING,+KS+66043&hl=en"
LEAVENWORTH COUNTY SHERIFFS OFFICE,CVS PHARMACY,390 LIMIT ST,LEAVENWORTH,KS,66048,"http://maps.google.com/maps?q=390 LIMIT ST,+LEAVENWORTH,+KS+66048&hl=en"
LEAVENWORTH POLICE DEPARTMENT,PRICE CHOPPER,2107 S. 4TH ST.,LEAVENWORTH,KS,66048,"http://maps.google.com/maps?q=2107 S. 4TH ST.,+LEAVENWORTH,+KS+66048&hl=en"
LEE COUNTY SHERIFF'S OFFICE,LEE COUNTY SHERIFF'S OFFICE,2530 255TH ST,MONTROSE,IA,52639,"http://maps.google.com/maps?q=2530 255TH ST,+MONTROSE,+IA+52639&hl=en"
LIBERTY POLICE DEPT.,LIBERTY POLICE DEPT.,101 E. KANSAS STREET,LIBERTY,MO,64068,"http://maps.google.com/maps?q=101 E. KANSAS STREET,+LIBERTY,+MO+64068&hl=en"
LINN COUNTY SHERIFF'S OFFICE,CENTRAL CITY FIRE STATION,137 N 4TH ST,CENTRAL CITY,IA,52214,"http://maps.google.com/maps?q=137 N 4TH ST,+CENTRAL CITY,+IA+52214&hl=en"
LINN COUNTY SHERIFF'S OFFICE,LINN COUNTY SHERIFF'S OFFICE,310 2ND AV SW,CEDAR RAPIDS,IA,52404,"http://maps.google.com/maps?q=310 2ND AV SW,+CEDAR RAPIDS,+IA+52404&hl=en"
LINN COUNTY SHERIFF'S OFFICE,SPRINGVILLE FIRE STATION,300 BROADWAY ST,SPRINGVILLE,IA,52336,"http://maps.google.com/maps?q=300 BROADWAY ST,+SPRINGVILLE,+IA+52336&hl=en"
LITCHFIELD POLICE DEPARTMENT,LITCHFIELD POLICE DEPARTMENT LOBBY DROP BOX,120 E. RYDER STREET,LITCHFIELD,IL,62056,"http://maps.google.com/maps?q=120 E. RYDER STREET,+LITCHFIELD,+IL+62056&hl=en"
MACON POLICE DEPARTMENT,C&R SUPERMARKET PARKING LOT,703 E BRIGGS DRIVE,MACON,MO,63552,"http://maps.google.com/maps?q=703 E BRIGGS DRIVE,+MACON,+MO+63552&hl=en"
MADRID POLICE DEPARTMENT,MADRID CITY HALL,304 S WATER STREET,MADRID,IA,50156,"http://maps.google.com/maps?q=304 S WATER STREET,+MADRID,+IA+50156&hl=en"
MANCHESTER POLICE DEPARTMENT,BLAKESLEY DRUG,220 EAST MAIN ST.,MANCHESTER,IA,52057,"http://maps.google.com/maps?q=220 EAST MAIN ST.,+MANCHESTER,+IA+52057&hl=en"
MANSON POLICE DEPARTMENT,MANSON POLICE DEPARTMENT LOBBY WILL BE OPEN FROM 7:00AM-2:30PM,1015 13TH STREET,MANSON,IA,50563,"http://maps.google.com/maps?q=1015 13TH STREET,+MANSON,+IA+50563&hl=en"
MAPLE BLUFF POLICE DEPARTMENT,VILLAGE OF MAPLE BLUFF POLICE DEPARTMENT EVENT 10:00AM-2:00PM,18 OXFORD PLACE,MADISON,WI,53704,"http://maps.google.com/maps?q=18 OXFORD PLACE,+MADISON,+WI+53704&hl=en"
MAR-MAC POLICE DEPARTMENT,MCGREGOR PUBLIC LIBRARY,334 MAIN STREET,MC GREGOR,IA,52157,"http://maps.google.com/maps?q=334 MAIN STREET,+MC GREGOR,+IA+52157&hl=en"
MARION COUNTY SHERIFFS OFFICE,MARION COUNTY SHERIFF'S OFFICE,211 N. GODFREY LN,KNOXVILLE,IA,50138,"http://maps.google.com/maps?q=211 N. GODFREY LN,+KNOXVILLE,+IA+50138&hl=en"
MARION POLICE DEPARTMENT,MARION POLICE DEPARTMENT FRONT PARKING LOT,6315 HWY 151MARION,MARION,IA,52302,"http://maps.google.com/maps?q=6315 HWY 151,+MARION,+IA+52302&hl=en"
MARSHALL MISSOURI POLICE DEPARTMENT,MARSHALL MUNICIPAL COURT BUILDING,5 EAST EASTWOOD ST,MARSHALL,MO,65340,"http://maps.google.com/maps?q=5 EAST EASTWOOD ST,+MARSHALL,+MO+65340&hl=en"
MARSHALL POLICE DEPARTMENT,"MARSHALL POLICE DEPARTMENT 7:30AM-4:30PM, 7:30AM-1:30AM",130 S PARDEE STREET,MARSHALL,WI,53559,"http://maps.google.com/maps?q=130 S PARDEE STREET,+MARSHALL,+WI+53559&hl=en"
MARYVILLE DEPARTMENT OF PUBLIC SAFETY,MARYVILLE DEPARTMENT OF PUBLIC SAFETY,222 E. 3RD ST.,MARYVILLE,MO,64468,"http://maps.google.com/maps?q=222 E. 3RD ST.,+MARYVILLE,+MO+64468&hl=en"
MASON COUNTY SHERIFF'S OFFICE,IGA STORE - MASON CITY 10:00 AM - 11:00 AM (PARKING LOT),201 WEST ELM,MASON CITY,IL,62664,"http://maps.google.com/maps?q=201 WEST ELM,+MASON CITY,+IL+62664&hl=en"
MASON COUNTY SHERIFF'S OFFICE,ONEY FOOD'S PARKING LOT PARKING LOT 1:00 PM - 2:00 PM,500 S. PROMENADE,HAVANA,IL,62644,"http://maps.google.com/maps?q=500 S. PROMENADE,+HAVANA,+IL+62644&hl=en"
MASON COUNTY SHERIFF'S OFFICE,THE LODGE AT MANITO 11:30 AM - 12:30 PM (PARKING LOT),1303 S. EAST AVENUE,MANITO,IL,61546,"http://maps.google.com/maps?q=1303 S. EAST AVENUE,+MANITO,+IL+61546&hl=en"
MELCHER-DALLAS POLICE DEPARTMENT,CITY HALL NO BOXES,305 EAST D. MAIN STREET,MELCHER DALLAS,IA,50062,"http://maps.google.com/maps?q=305 EAST D. MAIN STREET,+MELCHER DALLAS,+IA+50062&hl=en"
MENARD COUNTY SHERIFF'S DEPT.,MENARD COUNTY JAIL,315 S. SIXTH STREET,PETERSBURG,IL,62675,"http://maps.google.com/maps?q=315 S. SIXTH STREET,+PETERSBURG,+IL+62675&hl=en"
MERCER COUNTY SHERIFF'S OFFICE,MERCER COUNTY SHERIFF'S OFFICE,802 EAST MAIN STREET,PRINCETON,MO,64673,"http://maps.google.com/maps?q=802 EAST MAIN STREET,+PRINCETON,+MO+64673&hl=en"
MEXICO DEPT OF PUBLIC SAFETY,CITY HALL/FIRE DEPARTMENT,300 N. COAL,MEXICO,MO,65265,"http://maps.google.com/maps?q=300 N. COAL,+MEXICO,+MO+65265&hl=en"
MILAN POLICE DEPARTMENT,MILAN MUNICIPAL BUILDING,405 E. 1ST ST.,MILAN,IL,61264,"http://maps.google.com/maps?q=405 E. 1ST ST.,+MILAN,+IL+61264&hl=en"
MINIER POLICE DEPARTMENT,MINIER POLICE DEPARTMENT,110 W. CENTRAL AVENUE,MINIER,IL,61759,"http://maps.google.com/maps?q=110 W. CENTRAL AVENUE,+MINIER,+IL+61759&hl=en"
MOBERLY POLICE DEPARTMENT(DOUBLE BOXES),MOBERLY POLICE DEPARTMENT,300 N. CLARK,MOBERLY,MO,65270,"http://maps.google.com/maps?q=300 N. CLARK,+MOBERLY,+MO+65270&hl=en"
MOBERLY POLICE DEPARTMENT(DOUBLE BOXES),SAM'S HEALTH MART PHARMACY,530 E. HIGHWAY 24,MOBERLY,MO,65270,"http://maps.google.com/maps?q=530 E. HIGHWAY 24,+MOBERLY,+MO+65270&hl=en"
MOLINE POLICE DEPARTMENT,MOLINE POLICE DEPARTMENT,1640 6TH AVE,MOLINE,IL,61265,"http://maps.google.com/maps?q=1640 6TH AVE,+MOLINE,+IL+61265&hl=en"
MONONA POLICE DEPARTMENT,THE MEDICINE SHOPPE PHARMACY EVENT 9:00AM-1:00PM,4205 MONONA DR,MONONA,WI,53716,"http://maps.google.com/maps?q=4205 MONONA DR,+MONONA,+WI+53716&hl=en"
MONROE POLICE DEPARTMENT,MONROE CITY HALL,206 W. SHERMAN ST.,MONROE,IA,50170,"http://maps.google.com/maps?q=206 W. SHERMAN ST.,+MONROE,+IA+50170&hl=en"
MORTON POLICE DEPARTMENT,MORTON POLICE DEPARTMENT,375 W. BIRCHWOOD STREET,MORTON,IL,61550,"http://maps.google.com/maps?q=375 W. BIRCHWOOD STREET,+MORTON,+IL+61550&hl=en"
MOUNT HOREB POLICE DEPARTMENT,MOUNT HOREB POLICE DEPARTMENT EVENT 2:00PM-5:00PM,222 E FRONT ST,MOUNT HOREB,WI,53572,"http://maps.google.com/maps?q=222 E FRONT ST,+MOUNT HOREB,+WI+53572&hl=en"
MOUNT PLEASANT POLICE DEPT.,MOUNT PLEASANT POLICE DEPT.,204 E. WASHINGTON ST.,MOUNT PLEASANT,IA,52641,"http://maps.google.com/maps?q=204 E. WASHINGTON ST.,+MOUNT PLEASANT,+IA+52641&hl=en"
NORTH LIBERTY IOWA POLICE DEPARTMENT,NORTH LIBERTY POLICE DEPT.,5 E. CHERRY ST.,NORTH LIBERTY,IA,52317,"http://maps.google.com/maps?q=5 E. CHERRY ST.,+NORTH LIBERTY,+IA+52317&hl=en"
NORTHEAST IOWA DRUG TASK FORCE,CALMAR TRAIN DEPOT,202 MARYVILLE STREET,CALMAR,IA,52132,"http://maps.google.com/maps?q=202 MARYVILLE STREET,+CALMAR,+IA+52132&hl=en"
NORTHEAST IOWA DRUG TASK FORCE,CHESTER CITY HALL,302 MAIN STREET,CHESTER,IA,52134,"http://maps.google.com/maps?q=302 MAIN STREET,+CHESTER,+IA+52134&hl=en"
NORTHEAST IOWA DRUG TASK FORCE,CHICKASAW COUNTY COMMUNITY CENTER,260 EAST PROSPECT ST.,NEW HAMPTON,IA,50659,"http://maps.google.com/maps?q=260 EAST PROSPECT ST.,+NEW HAMPTON,+IA+50659&hl=en"
NORTHEAST IOWA DRUG TASK FORCE,CLAYTON COUNTY SHERIFF'S OFFICE,22680 230TH ST,SAINT OLAF,IA,52072,"http://maps.google.com/maps?q=22680 230TH ST,+SAINT OLAF,+IA+52072&hl=en"
NORTHEAST IOWA DRUG TASK FORCE,DONLON'S PHARMACY,201 WEST WATER STREET,DECORAH,IA,52101,"http://maps.google.com/maps?q=201 WEST WATER STREET,+DECORAH,+IA+52101&hl=en"
NORTHEAST IOWA DRUG TASK FORCE,ELKADER OPERA HOUSE,207 NORTH MAIN ST.,ELKADER,IA,52043,"http://maps.google.com/maps?q=207 NORTH MAIN ST.,+ELKADER,+IA+52043&hl=en"
NORTHEAST IOWA DRUG TASK FORCE,ELMA FIRE DEPARTMENT,107 ORCHARD STREET,ELMA,IA,50628,"http://maps.google.com/maps?q=107 ORCHARD STREET,+ELMA,+IA+50628&hl=en"
NORTHEAST IOWA DRUG TASK FORCE,FAYETTE COUNTY SHERIFF'S OFFICE,220 NORTH INDISTRIAL PARKWAY,WEST UNION,IA,52175,"http://maps.google.com/maps?q=220 NORTH INDISTRIAL PARKWAY,+WEST UNION,+IA+52175&hl=en"
NORTHEAST IOWA DRUG TASK FORCE,HOWARD COUNTY SHERIFF'S OFFICE,124 S. PARK PLACE,CRESCO,IA,52136,"http://maps.google.com/maps?q=124 S. PARK PLACE,+CRESCO,+IA+52136&hl=en"
NORTHEAST IOWA DRUG TASK FORCE,LANSING FIRE DEPT.,51 NORTH FRONT ST.,LANSING,IA,52151,"http://maps.google.com/maps?q=51 NORTH FRONT ST.,+LANSING,+IA+52151&hl=en"
NORTHEAST IOWA DRUG TASK FORCE,LIME SPRINGS CITY HALL,201 CENTER STREET,LIME SPRINGS,IA,52155,"http://maps.google.com/maps?q=201 CENTER STREET,+LIME SPRINGS,+IA+52155&hl=en"
NORTHEAST IOWA DRUG TASK FORCE,MONONA POLICE DEPT.,104 EAST CENTER ST.,MONONA,IA,52159,"http://maps.google.com/maps?q=104 EAST CENTER ST.,+MONONA,+IA+52159&hl=en"
NORTHEAST IOWA DRUG TASK FORCE,POSTVILLE CITY HALL,147 N. LAWLWER ST.,POSTVILLE,IA,52162,"http://maps.google.com/maps?q=147 N. LAWLWER ST.,+POSTVILLE,+IA+52162&hl=en"
NORTHEAST IOWA DRUG TASK FORCE,PROTIVIN FIRE DEPARTMENT,132 LARSON STREET,PROTIVIN,IA,52163,"http://maps.google.com/maps?q=132 LARSON STREET,+PROTIVIN,+IA+52163&hl=en"
NORTHEAST IOWA DRUG TASK FORCE,RICEVILLE FIRE DEPARTMENT,106 WALNUT STREET,RICEVILLE,IA,50466,"http://maps.google.com/maps?q=106 WALNUT STREET,+RICEVILLE,+IA+50466&hl=en"
NORTHEAST IOWA DRUG TASK FORCE,STEEGE PHARMACY,119 NORTH VINE STREET,WEST UNION,IA,52175,"http://maps.google.com/maps?q=119 NORTH VINE STREET,+WEST UNION,+IA+52175&hl=en"
NORTHEAST IOWA DRUG TASK FORCE,THRIFTY WHITE PHARMACY,702 MONTGOMERY ST.,DECORAH,IA,52101,"http://maps.google.com/maps?q=702 MONTGOMERY ST.,+DECORAH,+IA+52101&hl=en"
NORTHEAST IOWA DRUG TASK FORCE,UNION DRUG STORE,315 HIGHWAY 150,WEST UNION,IA,52175,"http://maps.google.com/maps?q=315 HIGHWAY 150,+WEST UNION,+IA+52175&hl=en"
NORTHEAST IOWA DRUG TASK FORCE,WAL-MART SUPER CENTER,1798 OLD STAGE ROAD,DECORAH,IA,52101,"http://maps.google.com/maps?q=1798 OLD STAGE ROAD,+DECORAH,+IA+52101&hl=en"
NORTHEAST IOWA DRUG TASK FORCE,WAUKON POLICE DEPT.,565 11 1ST STREET,WAUKON,IA,52172,"http://maps.google.com/maps?q=565 11 1ST STREET,+WAUKON,+IA+52172&hl=en"
NORTHEAST IOWA DRUG TASK FORCE,WINNESHIEK CO/DECORAH POLICE LAW ENFORCEMENT CNTR,400 CLAIRBORNE DRIVE,DECORAH,IA,52101,"http://maps.google.com/maps?q=400 CLAIRBORNE DRIVE,+DECORAH,+IA+52101&hl=en"
NORTHEAST MISSOURI NARCOTICS TASK FORCE,C & R SUPERMARKET,201 N CENTER ST.,SHELBINA,MO,63468,"http://maps.google.com/maps?q=201 N CENTER ST.,+SHELBINA,+MO+63468&hl=en"
NORTHEAST MISSOURI NARCOTICS TASK FORCE,COUNTY MARKET,1805 ELM ST,CANTON,MO,63435,"http://maps.google.com/maps?q=1805 ELM ST,+CANTON,+MO+63435&hl=en"
ORDORDVILLE POLICE DEPARTMENT,ORFORDVILLE POLICE DEPARTMENT EVENT 10:00AM-2:00PM,303 E BELOIT ST,ORFORDVILLE,WI,53576,"http://maps.google.com/maps?q=303 E BELOIT ST,+ORFORDVILLE,+WI+53576&hl=en"
OSCEOLA POLICE DEPARTMENT,HYVEE,510 W MCLANE STREET,OSCEOLA,IA,50213,"http://maps.google.com/maps?q=510 W MCLANE STREET,+OSCEOLA,+IA+50213&hl=en"
OSKALOOSA IA POLICE DEPARTMENT,MAHASKA DRUG PHARMACY,207 NORTH E STREET,OSKALOOSA,IA,52577,"http://maps.google.com/maps?q=207 NORTH E STREET,+OSKALOOSA,+IA+52577&hl=en"
PEKIN POLICE DEPARTMENT,PEKIN POLICE DEPARTMENT LOBBY,111 SOUTH CAPITOL STREET,PEKIN,IL,61554,"http://maps.google.com/maps?q=111 SOUTH CAPITOL STREET,+PEKIN,+IL+61554&hl=en"
PEORIA POLICE DEPARTMENT,KROGER PHARMACY,9219 N. LINDBERGH DRIVE,PEORIA,IL,61615,"http://maps.google.com/maps?q=9219 N. LINDBERGH DRIVE,+PEORIA,+IL+61615&hl=en"
PEORIA POLICE DEPARTMENT,OSF CENTER FOR HEALTH,8800 STATE ROUTE 91,PEORIA,IL,61615,"http://maps.google.com/maps?q=8800 STATE ROUTE 91,+PEORIA,+IL+61615&hl=en"
PEORIA POLICE DEPARTMENT,PEORIA POLICE DEPARTMENT,600 SW ADAMS,PEORIA,IL,61602,"http://maps.google.com/maps?q=600 SW ADAMS,+PEORIA,+IL+61602&hl=en"
PERRY POLICE DEPARTMENT,HY-VEE STORE,1215 HWY. 141,PERRY,IA,50220,"http://maps.google.com/maps?q=1215 HWY. 141,+PERRY,+IA+50220&hl=en"
PLATTE CITY POLICE DEPARTMENT,COSENTINO'S PRICE CHOPPER,2600 ENSIGN HILL DR.,PLATTE CITY,MO,64079,"http://maps.google.com/maps?q=2600 ENSIGN HILL DR.,+PLATTE CITY,+MO+64079&hl=en"
POLK COUNTY SHERIFF'S OFFICE,CVS,104 E 1ST STREET,ANKENY,IA,50023,"http://maps.google.com/maps?q=104 E 1ST STREET,+ANKENY,+IA+50023&hl=en"
POLK COUNTY SHERIFF'S OFFICE,CVS,215 EUCLID AVE,DES MOINES,IA,50310,"http://maps.google.com/maps?q=215 EUCLID AVE,+DES MOINES,+IA+50310&hl=en"
PRINCETON POLICE DEPARTMENT,PRINCETON POLICE DEPARTMENT PEG MACIEJEWSKI,605 ELM PLACE,PRINCETON,IL,61356,"http://maps.google.com/maps?q=605 ELM PLACE,+PRINCETON,+IL+61356&hl=en"
PUTNAM COUNTY SHERIFF'S OFFICE,PUTNAM SHERIFF'S OFFICE,"1601 MAIN STREET, COURTHOUSE RM:0101 (BASEMENT)",UNIONVILLE,MO,63565,"http://maps.google.com/maps?q=1601 MAIN STREET, COURTHOUSE RM:0101 (BASEMENT),+UNIONVILLE,+MO+63565&hl=en"
