Participant,CollectionSite,Address,City,State,Zip,MapURL
ALBEMARLE COUNTY POLICE DEPARTMENT,MARTHA JEFFERSON HOSPITAL BACKSIDE OF MAIN HOSPITAL,500 MARTHA JEFFERSON DRIVE,CHARLOTTESVILLE,VA,22911,"http://maps.google.com/maps?q=500 MARTHA JEFFERSON DRIVE,+CHARLOTTESVILLE,+VA+22911&hl=en"
ALBEMARLE COUNTY POLICE DEPARTMENT,WEGMANS,100 WEGMANS WAY,CHARLOTTESVILLE,VA,22902,"http://maps.google.com/maps?q=100 WEGMANS WAY,+CHARLOTTESVILLE,+VA+22902&hl=en"
ALEXANDRIA POLICE DEPARTMENT,ALEXANDRIA FIRE STATION 210,5525 EISENHOWER AVE,ALEXANDRIA,VA,22304,"http://maps.google.com/maps?q=5525 EISENHOWER AVE,+ALEXANDRIA,+VA+22304&hl=en"
ALEXANDRIA POLICE DEPARTMENT,ALEXANDRIA POLICE HEADQUARTERS FRONT ENTRANCE,3600 WHEELER AVENUE,ALEXANDRIA,VA,22304,"http://maps.google.com/maps?q=3600 WHEELER AVENUE,+ALEXANDRIA,+VA+22304&hl=en"
ALEXANDRIA POLICE DEPARTMENT,FIRST BAPTIST CHURCH FRONT ENTRANCE,2932 KING STREET,ALEXANDRIA,VA,22302,"http://maps.google.com/maps?q=2932 KING STREET,+ALEXANDRIA,+VA+22302&hl=en"
ALEXANDRIA SHERIFF'S OFFICE,NEIGHBORHOOD PHARMACY FRONT OF THE BUILDING,2204 MT. VERNON AVENUE,ALEXANDRIA,VA,22301,"http://maps.google.com/maps?q=2204 MT. VERNON AVENUE,+ALEXANDRIA,+VA+22301&hl=en"
ALLEGHANY COUNTY SHERIFF'S OFFICE,CVS/KROGER CLIFTON FORGE,1618 MAIN ST,CLIFTON FORGE,VA,24422,"http://maps.google.com/maps?q=1618 MAIN ST,+CLIFTON FORGE,+VA+24422&hl=en"
ALLEGHANY COUNTY SHERIFF'S OFFICE,WALMART SUPERCENTER,313 W. THACKER RD,COVINGTON,VA,24426,"http://maps.google.com/maps?q=313 W. THACKER RD,+COVINGTON,+VA+24426&hl=en"
AMELIA COUNTY SHERFF'S OFFICE,AMELIA PHARMACY INC. FRONT SIDEWALK BY STORE ENTRANCE,15412 PATRICK HENRY HWY.,AMELIA,VA,23002,"http://maps.google.com/maps?q=15412 PATRICK HENRY HWY.,+AMELIA,+VA+23002&hl=en"
AMELIA COUNTY SHERFF'S OFFICE,RITE AID PHARMACY FRONT SIDEWALK BY STORE ENTRANCE,15105 PATRICK HENRY HWY,AMELIA,VA,23002,"http://maps.google.com/maps?q=15105 PATRICK HENRY HWY,+AMELIA,+VA+23002&hl=en"
AMHERST COUNTY SHERIFF'S OFFICE,AMHERST COUNTY SHERIFF'S OFFICE PHONE NUMBER 434-946-9381,115 TAYLOR ST,AMHERST,VA,24521,"http://maps.google.com/maps?q=115 TAYLOR ST,+AMHERST,+VA+24521&hl=en"
ANNAPOLIS POLICE DEPARTMENT,ANNAPOLIS POLICE DEPARTMENT,199 TAYLOR AVENUE,ANNAPOLIS,MD,21401,"http://maps.google.com/maps?q=199 TAYLOR AVENUE,+ANNAPOLIS,+MD+21401&hl=en"
ANNE ARUNDEL CO,EASTERN DISTRICT,204 PASADENA ROAD,PASADENA,MD,21122,"http://maps.google.com/maps?q=204 PASADENA ROAD,+PASADENA,+MD+21122&hl=en"
ANNE ARUNDEL CO,HEADQUARTERS,8495 VETERAN'S HIGHWAY,MILLERSVILLE,MD,21108,"http://maps.google.com/maps?q=8495 VETERAN'S HIGHWAY,+MILLERSVILLE,+MD+21108&hl=en"
ANNE ARUNDEL CO,SOUTHERN DISTRICT,35 STEPNEY'S LANE,EDGEWATER,MD,21037,"http://maps.google.com/maps?q=35 STEPNEY'S LANE,+EDGEWATER,+MD+21037&hl=en"
ANNE ARUNDEL CO,WESTERN DISTRICT,8273 TELEGRAPH ROAD,ODENTON,MD,21113,"http://maps.google.com/maps?q=8273 TELEGRAPH ROAD,+ODENTON,+MD+21113&hl=en"
APPOMATTOX COUNTY SHERIFF'S OFFICE,HOMETOWN PHARMACY,199 OLD COURTHOUSE ROAD,APPOMATTOX,VA,24522,"http://maps.google.com/maps?q=199 OLD COURTHOUSE ROAD,+APPOMATTOX,+VA+24522&hl=en"
ARLINGTON COUNTY POLICE DEPARTMENT,ARLINGTON FIRE STATION #2,4805 WILSON BLVD,ARLINGTON,VA,22203,"http://maps.google.com/maps?q=4805 WILSON BLVD,+ARLINGTON,+VA+22203&hl=en"
ARLINGTON COUNTY POLICE DEPARTMENT,ARLINGTON FIRE STATION #5,1750 SOUTH HAYES STREET,ARLINGTON,VA,22202,"http://maps.google.com/maps?q=1750 SOUTH HAYES STREET,+ARLINGTON,+VA+22202&hl=en"
ARLINGTON COUNTY POLICE DEPARTMENT,ARLINGTON FIRE STATION #9 MAIN LEVEL COMMUNITY ROOM,1900 SOUTH WALTER REED DRIVE,ARLINGTON,VA,22204,"http://maps.google.com/maps?q=1900 SOUTH WALTER REED DRIVE,+ARLINGTON,+VA+22204&hl=en"
ASHLAND POLICE DEPARTMENT,ASHLAND POLICE DEPARTMENT VISITOR PARKING LOT,601 ENGLAND STREET,ASHLAND,VA,23005,"http://maps.google.com/maps?q=601 ENGLAND STREET,+ASHLAND,+VA+23005&hl=en"
BARBOUR COUNTY SHERIFF'S OFFICE,MACES PHARMACY,204 CRIM AVENUE,BELINGTON,WV,26250,"http://maps.google.com/maps?q=204 CRIM AVENUE,+BELINGTON,+WV+26250&hl=en"
BARBOUR COUNTY SHERIFF'S OFFICE,MACES PHARMACY,440 S MAIN ST,PHILIPPI,WV,26416,"http://maps.google.com/maps?q=440 S MAIN ST,+PHILIPPI,+WV+26416&hl=en"
BLACKSBURG POLICE DEPARTMENT,BLACKSBURG RECREATION CENTER PARKING LOT,725 PATRICK HENRY DRIVE,BLACKSBURG,VA,24060,"http://maps.google.com/maps?q=725 PATRICK HENRY DRIVE,+BLACKSBURG,+VA+24060&hl=en"
BLACKSTONE (TOWN OF) POLICE DEPARTMENT,BLACKSTONE POLICE DEPT CONFERENCE ROOM,101 WEST ELM STREET,BLACKSTONE,VA,23824,"http://maps.google.com/maps?q=101 WEST ELM STREET,+BLACKSTONE,+VA+23824&hl=en"
BOTETOURT COUNTY SHERIFF'S OFFICE,KROGER DALEVILLE,72 KINGSTON DRIVE,DALEVILLE,VA,24083,"http://maps.google.com/maps?q=72 KINGSTON DRIVE,+DALEVILLE,+VA+24083&hl=en"
BOWIE POLICE DEPARTMENT,BOWIE POLICE STATION,15901 EXCALIBUR ROAD,BOWIE,MD,20716,"http://maps.google.com/maps?q=15901 EXCALIBUR ROAD,+BOWIE,+MD+20716&hl=en"
BRAXTON CO. SHERRI'FS OFFICE,BRAXTON COUNTY COURT HOUSE IN FRONT OF COURTHOUSE,300 MAIN STREET,SUTTON,WV,26601,"http://maps.google.com/maps?q=300 MAIN STREET,+SUTTON,+WV+26601&hl=en"
BUENA VISTA POLICE DEPARTMENT,CVS PHARMACY EXTERIOR BREEZEWAY,2148 E. MIDLAND TRAIL,BUENA VISTA,VA,24416,"http://maps.google.com/maps?q=2148 E. MIDLAND TRAIL,+BUENA VISTA,+VA+24416&hl=en"
CALVERT COUNTY SHERIFF'S OFFICE,MT. HOPE COMMUNITY CENTER,104 PUSHAW STATION RD.,SUNDERLAND,MD,20689,"http://maps.google.com/maps?q=104 PUSHAW STATION RD.,+SUNDERLAND,+MD+20689&hl=en"
CALVERT COUNTY SHERIFF'S OFFICE,NORTHEAST COMMUNITY CENTER,4075 GORDON STINNETT AVE.,CHESAPEAKE BEACH,MD,20732,"http://maps.google.com/maps?q=4075 GORDON STINNETT AVE.,+CHESAPEAKE BEACH,+MD+20732&hl=en"
CALVERT COUNTY SHERIFF'S OFFICE,SOUTHERN COMMUNITY CENTER,20 APPEAL LANE,LUSBY,MD,20657,"http://maps.google.com/maps?q=20 APPEAL LANE,+LUSBY,+MD+20657&hl=en"
CAROLINE COUNTY SHERIFF'S OFFICE,CAROLINE SQUARE SHOPPING CENTER PARKING LOT PARKING LOT NEAR RITE AID PHARMACY ENTRANCE,104 W. BROADDUS AVENUE,BOWLING GREEN,VA,22427,"http://maps.google.com/maps?q=104 W. BROADDUS AVENUE,+BOWLING GREEN,+VA+22427&hl=en"
CAROLINE COUNTY SHERIFF'S OFFICE,CVS PHARMACY PARKING LOT,18048 JEFFERSON DAVIS HIGHWAY,RUTHER GLEN,VA,22546,"http://maps.google.com/maps?q=18048 JEFFERSON DAVIS HIGHWAY,+RUTHER GLEN,+VA+22546&hl=en"
"CAROLINE COUNTY SHERIFF'S OFFICE, DENTON",DENTON WALMART,610 LEGION ROAD,DENTON,MD,21629,"http://maps.google.com/maps?q=610 LEGION ROAD,+DENTON,+MD+21629&hl=en"
CARY POLICE DEPARTMENT,CARY POLICE DEPARTMENT DET. WHITNEY MATTHEWS,120 WILKINSON AVE,CARY,NC,27513,"http://maps.google.com/maps?q=120 WILKINSON AVE,+CARY,+NC+27513&hl=en"
CHARLES COUNTY GOVERNMENT,CHARLES COUNTY GOVERNMENT MAIN ENTRANCE PARKING LOT,200 BALTIMORE STREET,LA PLATA,MD,20646,"http://maps.google.com/maps?q=200 BALTIMORE STREET,+LA PLATA,+MD+20646&hl=en"
CHESAPEAKE POLICE DEPARTMENT,CHESAPEAKE POLICE 2ND PRECINCT,1209 20TH STREET,CHESAPEAKE,VA,23324,"http://maps.google.com/maps?q=1209 20TH STREET,+CHESAPEAKE,+VA+23324&hl=en"
CHESAPEAKE POLICE DEPARTMENT,CHESAPEAKE POLICE 3RD PRECINCT,949 NORTH GEORGE WASHINGTON HIGHWAY,CHESAPEAKE,VA,23323,"http://maps.google.com/maps?q=949 NORTH GEORGE WASHINGTON HIGHWAY,+CHESAPEAKE,+VA+23323&hl=en"
CHESAPEAKE POLICE DEPARTMENT,CHESAPEAKE POLICE 4TH PRECINCT,4764 STATION HOUSE ROAD,CHESAPEAKE,VA,23321,"http://maps.google.com/maps?q=4764 STATION HOUSE ROAD,+CHESAPEAKE,+VA+23321&hl=en"
CHESAPEAKE POLICE DEPARTMENT,CHESAPEAKE POLICE 5TH PRECINCT,400 VOLVO PARKWAY,CHESAPEAKE,VA,23320,"http://maps.google.com/maps?q=400 VOLVO PARKWAY,+CHESAPEAKE,+VA+23320&hl=en"
CHESAPEAKE SHERIFF'S OFFICE,CHESAPEAKE SHERIFF'S OFFICE ADMIN BUILDING ACROSS FROM CORRECTIONAL CENTER,401 ALBEMARLE DRIVE,CHESAPEAKE,VA,23322,"http://maps.google.com/maps?q=401 ALBEMARLE DRIVE,+CHESAPEAKE,+VA+23322&hl=en"
CHESTERFIELD COUNTY POLICE DEPARTMENT,WEGMANS,12501 STONE VILLAGE WAY,MIDLOTHIAN,VA,23113,"http://maps.google.com/maps?q=12501 STONE VILLAGE WAY,+MIDLOTHIAN,+VA+23113&hl=en"
CHEVY CHASE VILLAGE POLICE DEPARTMENT,CHEVY CHASE VILLAGE POLICE DEPARTMENT,5906 CONNECTICUT AVENUE,CHEVY CHASE,MD,20815,"http://maps.google.com/maps?q=5906 CONNECTICUT AVENUE,+CHEVY CHASE,+MD+20815&hl=en"
CHRISTIANSBURG POLICE DEPARTMENT,CVS PHARMACY PARKING LOT NEAR ENTRANCE,550 NORTH FRANKLIN ST,CHRISTIANSBURG,VA,24073,"http://maps.google.com/maps?q=550 NORTH FRANKLIN ST,+CHRISTIANSBURG,+VA+24073&hl=en"
CITY OF SEAFORD PD,CITY OF SEAFORD PD,300 VIRGINIA AVE,SEAFORD,DE,19973,"http://maps.google.com/maps?q=300 VIRGINIA AVE,+SEAFORD,+DE+19973&hl=en"
COLONIAL HEIGHTS POLICE DEPARTMENT,ASHLEY FURNITURE HOMESTORE PARKING LOT,1899 SOUTHPARK BLVD,COLONIAL HEIGHTS,VA,23834,"http://maps.google.com/maps?q=1899 SOUTHPARK BLVD,+COLONIAL HEIGHTS,+VA+23834&hl=en"
CRAIG COUNTY SHERIFF'S OFFICE,MARKET STREET PHARMACY PARKING LOT,317 MARKET ST,NEW CASTLE,VA,24127,"http://maps.google.com/maps?q=317 MARKET ST,+NEW CASTLE,+VA+24127&hl=en"
CURRITUCK COUNTY SHERIFF'S OFFICE,CURRITUCK FAMILY YMCA,130 COMMUNITY WAY,BARCO,NC,27917,"http://maps.google.com/maps?q=130 COMMUNITY WAY,+BARCO,+NC+27917&hl=en"
DAGSBORO POLICE DEPARTMENT,DAGSBORO POLICE DEPARTMENT,33134 MAIN STREET,DAGSBORO,DE,19939,"http://maps.google.com/maps?q=33134 MAIN STREET,+DAGSBORO,+DE+19939&hl=en"
DANVILLE POLICE DEPARTMENT,CENTRA MEDICAL GROUP DANVILLE PARKING LOT - WEST END OF THE BUILDING,414 PARK AVE,DANVILLE,VA,24541,"http://maps.google.com/maps?q=414 PARK AVE,+DANVILLE,+VA+24541&hl=en"
DEA - HEADQUARTERS,AURORA HILLS LIBRARY,735 18TH STREET,ARLINGTON,VA,22202,"http://maps.google.com/maps?q=735 18TH STREET,+ARLINGTON,+VA+22202&hl=en"
DEA / MONTCLAIR LIONS CLUB,MONTCLAIR LIONS,5183 WATERWAY DR,DUMFRIES,VA,22025,"http://maps.google.com/maps?q=5183 WATERWAY DR,+DUMFRIES,+VA+22025&hl=en"
DEA / MONTCLAIR LIONS CLUB,MONTCLAIR SHOPPING CENTER IN FRONT OF FRAMING OUTLET,5183 WATERWAY DRIVE,DUMFRIES,VA,22025,"http://maps.google.com/maps?q=5183 WATERWAY DRIVE,+DUMFRIES,+VA+22025&hl=en"
DELAWARE RIVER & BAY AUTHORITY,LEWES FERRY TERMINAL,43 CAPE HENLOPEN DRIVE,LEWES,DE,19958,"http://maps.google.com/maps?q=43 CAPE HENLOPEN DRIVE,+LEWES,+DE+19958&hl=en"
DELAWARE STATE POLICE,DELAWARE STATE POLICE - TROOP 7,18006 COASTAL HIGHWAY,LEWES,DE,19958,"http://maps.google.com/maps?q=18006 COASTAL HIGHWAY,+LEWES,+DE+19958&hl=en"
DELMAR POLICE DEPARTMENT,DELMAR POLICE DEPARTMENT,102 SOUTH PENNSYLVANIA AVENUE,DELMAR,MD,21875,"http://maps.google.com/maps?q=102 SOUTH PENNSYLVANIA AVENUE,+DELMAR,+MD+21875&hl=en"
DINWIDDIE COUNTY SHERIFF'S OFFICE,EASTSIDE ENHANCEMENT CENTER,7301 BOYDTON PLANK ROAD,PETERSBURG,VA,23803,"http://maps.google.com/maps?q=7301 BOYDTON PLANK ROAD,+PETERSBURG,+VA+23803&hl=en"
DUBLIN POLICE DEPARTMENT,CVS PHARMACY #7658,100 GILES AVENUE,DUBLIN,VA,24084,"http://maps.google.com/maps?q=100 GILES AVENUE,+DUBLIN,+VA+24084&hl=en"
DURHAM POLICE DEPARTMENT,CVS,3573 HILLSBOROUGH RD,DURHAM,NC,27705,"http://maps.google.com/maps?q=3573 HILLSBOROUGH RD,+DURHAM,+NC+27705&hl=en"
DURHAM POLICE DEPARTMENT,TRIANGLE PHARMACY,1700 E NC HIGHWAY 54,DURHAM,NC,27713,"http://maps.google.com/maps?q=1700 E NC HIGHWAY 54,+DURHAM,+NC+27713&hl=en"
DURHAM POLICE DEPARTMENT,WALGREENS,1812 HOLLOWAY STREET,DURHAM,NC,27701,"http://maps.google.com/maps?q=1812 HOLLOWAY STREET,+DURHAM,+NC+27701&hl=en"
DURHAM POLICE DEPARTMENT,WALGREENS,6405 FAYETTEVILLE RD,DURHAM,NC,27713,"http://maps.google.com/maps?q=6405 FAYETTEVILLE RD,+DURHAM,+NC+27713&hl=en"
FAIRFAX CITY POLICE DEPARTMENT,FAIRFAX CITY POLICE DEPARTMENT FRONT LOBBY,3730 OLD LEE HIGHWAY,FAIRFAX,VA,22030,"http://maps.google.com/maps?q=3730 OLD LEE HIGHWAY,+FAIRFAX,+VA+22030&hl=en"
FAIRFAX COUNTY POLICE DEPARTMENT,FAIR OAKS DISTRICT STATION PARKING LOT -OPERATING 10 AM TO 2 PM-,12300 LEE JACKSON MEMORIAL HIGHWAY,FAIRFAX,VA,22033,"http://maps.google.com/maps?q=12300 LEE JACKSON MEMORIAL HIGHWAY,+FAIRFAX,+VA+22033&hl=en"
FAIRFAX COUNTY POLICE DEPARTMENT,FRANCONIA DISTRICT STATION FRONT PARKING LOT -OPERATING 10 AM TO 2 PM-,6121 FRANCONIA ROAD,ALEXANDRIA,VA,22310,"http://maps.google.com/maps?q=6121 FRANCONIA ROAD,+ALEXANDRIA,+VA+22310&hl=en"
FAIRFAX COUNTY POLICE DEPARTMENT,MASON DISTRICT STATION FRONT PARKING LOT -OPERATING 10 AM TO 2 PM-,6507 COLUMBIA PIKE,ANNANDALE,VA,22003,"http://maps.google.com/maps?q=6507 COLUMBIA PIKE,+ANNANDALE,+VA+22003&hl=en"
FAIRFAX COUNTY POLICE DEPARTMENT,MCLEAN DISTRICT POLICE STATION FRONT PARKING LOT -OPERATING 10 AM TO 2 PM-,1437 BALLS HILL ROAD,MCLEAN,VA,22101,"http://maps.google.com/maps?q=1437 BALLS HILL ROAD,+MCLEAN,+VA+22101&hl=en"
FAIRFAX COUNTY POLICE DEPARTMENT,MOUNT VERNON DISTRICT POLICE STATION FRONT PARKING LOT -OPERATING 10 AM TO 2 PM-,2511 PARKERS LANE,ALEXANDRIA,VA,22306,"http://maps.google.com/maps?q=2511 PARKERS LANE,+ALEXANDRIA,+VA+22306&hl=en"
FAIRFAX COUNTY POLICE DEPARTMENT,RESTON DISTRICT STATION PARKING LOT -OPERATING 10 AM TO 2 PM-,12000 BOWMAN TOWNE DRIVE,RESTON,VA,20190,"http://maps.google.com/maps?q=12000 BOWMAN TOWNE DRIVE,+RESTON,+VA+20190&hl=en"
FAIRFAX COUNTY POLICE DEPARTMENT,SULLY DISTRICT POLICE STATION FRONT PARKING LOT -OPERATING 10 AM TO 2 PM-,4900 STONECROFT BOULEVARD,CHANTILLY,VA,20151,"http://maps.google.com/maps?q=4900 STONECROFT BOULEVARD,+CHANTILLY,+VA+20151&hl=en"
FAIRFAX COUNTY POLICE DEPARTMENT,WEST SPRINGFIELD DISTRICT STATION PARKING LOT -OPERATING 10 AM TO 2 PM-,6140 ROLLING ROAD,SPRINGFIELD,VA,22152,"http://maps.google.com/maps?q=6140 ROLLING ROAD,+SPRINGFIELD,+VA+22152&hl=en"
FALLS CHURCH POLICE DEPARTMENT,FALLS CHURCH CITY HALL EXTERIOR,300 PARK AVE,FALLS CHURCH,VA,22046,"http://maps.google.com/maps?q=300 PARK AVE,+FALLS CHURCH,+VA+22046&hl=en"
FARMVILLE POLICE DEPARTMENT/LONGWOOD UNIVERSITY PD,MIDTOWN SQUARE IN FRONT OF CHICK-FIL-A,156 S. SOUTH STREET,FARMVILLE,VA,23901,"http://maps.google.com/maps?q=156 S. SOUTH STREET,+FARMVILLE,+VA+23901&hl=en"
FLOYD COUNTY SHERIFF'S OFFICE,FLOYD COUNTY SHERIFF'S OFFICE MAIN ENTRANCE,100 MAIN STREET,FLOYD,VA,24091,"http://maps.google.com/maps?q=100 MAIN STREET,+FLOYD,+VA+24091&hl=en"
FLUVANNA COUNTY SHERIFF'S OFFICE,JEFFERSON PHARMACY,194 B TURKEY SAG TRAIL,PALMYRA,VA,22963,"http://maps.google.com/maps?q=194 B TURKEY SAG TRAIL,+PALMYRA,+VA+22963&hl=en"
FRANKLIN COUNTY SHERIFF'S OFFICE,FRANKLIN COUNTY SHERIFF'S WESTLAKE SUBSTATION,13205 BOOKER T. WASHINGTON HWY,HARDY,VA,24101,"http://maps.google.com/maps?q=13205 BOOKER T. WASHINGTON HWY,+HARDY,+VA+24101&hl=en"
FREDERICK COUNTY SHERIFF'S OFFICE,FREDERICK COUNTY PUBLIC SAFETY BUILDING,1080 COVERSTONE DRIVE,WINCHESTER,VA,22602,"http://maps.google.com/maps?q=1080 COVERSTONE DRIVE,+WINCHESTER,+VA+22602&hl=en"
FREDERICK COUNTY SHERIFF'S OFFICE,WALGREENS,131 VALLEY MILL ROAD,WINCHESTER,VA,22602,"http://maps.google.com/maps?q=131 VALLEY MILL ROAD,+WINCHESTER,+VA+22602&hl=en"
FREDERICKSBURG POLICE DEPARTMENT,MARY WASHINGTON HOSPITAL TOMPKINS-MARTIN MEDICAL PLAZA,1101 SAM PERRY BLVD,FREDERICKSBURG,VA,22401,"http://maps.google.com/maps?q=1101 SAM PERRY BLVD,+FREDERICKSBURG,+VA+22401&hl=en"
GAITHERSBURG POLICE DEPARTMENT,GAITHERSBURG POLICE DEPARTMENT,14 FULKS CORNER AVENUE,GAITHERSBURG,MD,20877,"http://maps.google.com/maps?q=14 FULKS CORNER AVENUE,+GAITHERSBURG,+MD+20877&hl=en"
GARRETT COUNTY SHERIFF'S OFFICE,GARRETT COUNTY SHERIFF'S OFFICE POC ROB CORELY,311 EAST ALDER STREET,OAKLAND,MD,21550,"http://maps.google.com/maps?q=311 EAST ALDER STREET,+OAKLAND,+MD+21550&hl=en"
GEORGE MASON UNIVERSITY POLICE DEPARTMENT,GEORGE MASON UNIVERSITY POLICE STATION,4393 UNIVERSITY DRIVE,FAIRFAX,VA,22030,"http://maps.google.com/maps?q=4393 UNIVERSITY DRIVE,+FAIRFAX,+VA+22030&hl=en"
GILES COUNTY SHERIFF'S OFFICE,GILES COUNTY SHERIFF'S OFFICE,1 TAYLOR AVENUE SUITE 3,PEARISBURG,VA,24134,"http://maps.google.com/maps?q=1 TAYLOR AVENUE SUITE 3,+PEARISBURG,+VA+24134&hl=en"
GLOUCESTER COUNTY SHERIFF'S OFFICE,GLOUCESTER PHARMACY,7453 HARGETT BLVD,GLOUCESTER,VA,23061,"http://maps.google.com/maps?q=7453 HARGETT BLVD,+GLOUCESTER,+VA+23061&hl=en"
GLOUCESTER COUNTY SHERIFF'S OFFICE,WALGREEN'S PHARMACY FRONT ENTRANCE,2418 GEORGE WASHINGTON MEMORIAL HIGHWAY,HAYES,VA,23072,"http://maps.google.com/maps?q=2418 GEORGE WASHINGTON MEMORIAL HIGHWAY,+HAYES,+VA+23072&hl=en"
GOOCHLAND COUNTY SHERIFF'S OFFICE,GOOCHLAND FIRE/RESCUE COMPANY 5,2710 FAIRGROUNDS ROAD,GOOCHLAND,VA,23063,"http://maps.google.com/maps?q=2710 FAIRGROUNDS ROAD,+GOOCHLAND,+VA+23063&hl=en"
GOOCHLAND COUNTY SHERIFF'S OFFICE,WEST CREEK EMERGENCY CENTER,12720 TUCKAHOE CREEK PKWY,HENRICO,VA,23238,"http://maps.google.com/maps?q=12720 TUCKAHOE CREEK PKWY,+HENRICO,+VA+23238&hl=en"
GREENBELT POLICE DEPARTMENT,GREENBELT POLICE DEPARTMENT,550 CRESCENT ROAD,GREENBELT,MD,20770,"http://maps.google.com/maps?q=550 CRESCENT ROAD,+GREENBELT,+MD+20770&hl=en"
HAMPSHIRE COUNTY SHERIFF'S OFFICE,HAMPSHIRE COUNTY SD,66 N HIGH STREET,ROMNEY,WV,26757,"http://maps.google.com/maps?q=66 N HIGH STREET,+ROMNEY,+WV+26757&hl=en"
HAMPTON POLICE DIVISION,SENTARA CAREPLEX HOSPITAL NEAR EMERGENCY ROOM ENTRANCE,3000 COLISEUM DRIVE,HAMPTON,VA,23666,"http://maps.google.com/maps?q=3000 COLISEUM DRIVE,+HAMPTON,+VA+23666&hl=en"
HANOVER COUNTY SHERIFF'S OFFICE,MECHANICSVILLE CONVENIENCE CENTER,7427 VERDI LANE,MECHANICSVILLE,VA,23116,"http://maps.google.com/maps?q=7427 VERDI LANE,+MECHANICSVILLE,+VA+23116&hl=en"
HENRICO POLICE DEPARTMENT,EASTERN HENRICO RECREATION CENTER,1440 N. LABURNUM AVENUE,RICHMOND,VA,23223,"http://maps.google.com/maps?q=1440 N. LABURNUM AVENUE,+RICHMOND,+VA+23223&hl=en"
HENRICO POLICE DEPARTMENT,HENRICO TRAINING CENTER ENTRANCE IS ON SHRADER ROAD,7721 E. PARHAM ROAD,HENRICO,VA,23294,"http://maps.google.com/maps?q=7721 E. PARHAM ROAD,+HENRICO,+VA+23294&hl=en"
HENRICO POLICE DEPARTMENT,VARINA PUBLIC LIBRARY,1875 NEW MARKET ROAD,HENRICO,VA,23231,"http://maps.google.com/maps?q=1875 NEW MARKET ROAD,+HENRICO,+VA+23231&hl=en"
HENRICO POLICE DEPARTMENT,WEGMANS,12200 WEGMANS BOULEVARD,HENRICO,VA,23233,"http://maps.google.com/maps?q=12200 WEGMANS BOULEVARD,+HENRICO,+VA+23233&hl=en"
HERNDON POLICE DEPARTMENT,HERNDON POLICE DEPARTMENT LOBBY AREA,397 HERNDON PARKWAY,HERNDON,VA,20170,"http://maps.google.com/maps?q=397 HERNDON PARKWAY,+HERNDON,+VA+20170&hl=en"
HIGHLAND COUNTY SHERIFF'S OFFICE,HIGHLAND COUNTY SHERIFF'S OFFICE,145 WEST MAIN STREET,MONTEREY,VA,24465,"http://maps.google.com/maps?q=145 WEST MAIN STREET,+MONTEREY,+VA+24465&hl=en"
HOPEWELL POLICE DEPARTMENT,HOPEWELL POLICE DEPARTMENT PARKING LOT BY MAIN ENTRANCE,300 N. MAIN STREET,HOPEWELL,VA,23860,"http://maps.google.com/maps?q=300 N. MAIN STREET,+HOPEWELL,+VA+23860&hl=en"
HOWARD COUNTY POLICE DEPARTMENT,HOWARD COUNTY POLICE COMMUNITY OUTREACH,10785 LITTLE PATUXENT PARKWAY,COLUMBIA,MD,21044,"http://maps.google.com/maps?q=10785 LITTLE PATUXENT PARKWAY,+COLUMBIA,+MD+21044&hl=en"
HOWARD COUNTY POLICE DEPARTMENT,HOWARD COUNTY POLICE SOUTHERN DISTRICT,11226 SCAGGSVILLE RD.,LAUREL,MD,20723,"http://maps.google.com/maps?q=11226 SCAGGSVILLE RD.,+LAUREL,+MD+20723&hl=en"
HYATTSVILLE CITY POLICE,HYATTSVILLE CITY POLICE DEPARTMENT,4310 GALLATIN STREET,HYATTSVILLE,MD,20781,"http://maps.google.com/maps?q=4310 GALLATIN STREET,+HYATTSVILLE,+MD+20781&hl=en"
JAMES CITY COUNTY POLICE DEPARTMENT,JAMES CITY COUNTY POLICE DEPARTMENT LAW ENFORCEMENT CENTER,4600 OPPORTUNITY WAY,WILLIAMSBURG,VA,23188,"http://maps.google.com/maps?q=4600 OPPORTUNITY WAY,+WILLIAMSBURG,+VA+23188&hl=en"
JEFFERSON COUNTY SHERIFF'S OFFICE,JEFFERSON COUNTY SHERIFF,102 INDUSTRIAL BOULEVARD,KEARNEYSVILLE,WV,25430,"http://maps.google.com/maps?q=102 INDUSTRIAL BOULEVARD,+KEARNEYSVILLE,+WV+25430&hl=en"
KING AND QUEEN SHERIFF'S OFFICE,NICK'S RESTAURANT SIDE PARKING LOT,3483 LEWIS B. PULLER HWY,SHACKLEFORDS,VA,23156,"http://maps.google.com/maps?q=3483 LEWIS B. PULLER HWY,+SHACKLEFORDS,+VA+23156&hl=en"
KING AND QUEEN SHERIFF'S OFFICE,PAMUNKEY REGIONAL LIBRARY FRONT PARKING LOT,396 NEWTOWN ROAD,SAINT STEPHENS CHURCH,VA,23148,"http://maps.google.com/maps?q=396 NEWTOWN ROAD,+SAINT STEPHENS CHURCH,+VA+23148&hl=en"
KING GEORGE SHERIFF'S OFFICE,KING GEORGE SHERIFF'S FRONT PARKING LOT,10445 GOVERNMENT CENTER BLVD.,KING GEORGE,VA,22485,"http://maps.google.com/maps?q=10445 GOVERNMENT CENTER BLVD.,+KING GEORGE,+VA+22485&hl=en"
KING WILLIAM COUNTY SHERIFF'S OFFICE,CENTRAL CROSSING FOOD LION PARKING LOT AREA NEAR FRONT OF STORE,4915 RICHMOND TAPPAHANNOCK HIGHWAY,AYLETT,VA,23009,"http://maps.google.com/maps?q=4915 RICHMOND TAPPAHANNOCK HIGHWAY,+AYLETT,+VA+23009&hl=en"
LANCASTER COUNTY SHERIFF'S DEPARTMENT,LANCASTER SHERIFF'S OFFICE,8293 MARY BALL ROAD,LANCASTER,VA,22503,"http://maps.google.com/maps?q=8293 MARY BALL ROAD,+LANCASTER,+VA+22503&hl=en"
LAUREL POLICE DEPARTMENT,LAUREL POLICE DEPARTMENT,205 MECHANIC STREET,LAUREL,DE,19956,"http://maps.google.com/maps?q=205 MECHANIC STREET,+LAUREL,+DE+19956&hl=en"
LAUREL POLICE DEPARTMENT,LAUREL POLICE DEPARTMENT,811 FIFTH STREET,LAUREL,MD,20707,"http://maps.google.com/maps?q=811 FIFTH STREET,+LAUREL,+MD+20707&hl=en"
LAWRENCEVILLE POLICE DEPARTMENT,LAWRENCEVILLE MUNICIPAL BUILDING AT THE ENTRANCE TO THE POLICE DEPARTMENT,400 N. MAIN STREET,LAWRENCEVILLE,VA,23868,"http://maps.google.com/maps?q=400 N. MAIN STREET,+LAWRENCEVILLE,+VA+23868&hl=en"
LEWES POLICE DEPARTMENT,CITY OF LEWES BOARD OF PUBLIC WORKS,129 SCHLEY AVENUE,LEWES,DE,19958,"http://maps.google.com/maps?q=129 SCHLEY AVENUE,+LEWES,+DE+19958&hl=en"
LEXINGTON POLICE DEPARTMENT,CVS PHARMACY,506 E NELSON STREET,LEXINGTON,VA,24450,"http://maps.google.com/maps?q=506 E NELSON STREET,+LEXINGTON,+VA+24450&hl=en"
LOUDOUN COUNTY SHERIFF'S OFFICE,ASHBURN STATION FRONT LOBBY,20272 SAVIN HILL DR,ASHBURN,VA,20147,"http://maps.google.com/maps?q=20272 SAVIN HILL DR,+ASHBURN,+VA+20147&hl=en"
LOUDOUN COUNTY SHERIFF'S OFFICE,DULLES SOUTH PUBLIC SAFETY CENTER FRONT LOBBY AREA,25216 LOUDOUN PARKWAY,CHANTILLY,VA,20152,"http://maps.google.com/maps?q=25216 LOUDOUN PARKWAY,+CHANTILLY,+VA+20152&hl=en"
LOUDOUN COUNTY SHERIFF'S OFFICE,EASTERN LOUDOUN STATION FRONT LOBBY AREA,46620 EAST FREDERICK DRIVE,STERLING,VA,20164,"http://maps.google.com/maps?q=46620 EAST FREDERICK DRIVE,+STERLING,+VA+20164&hl=en"
LOUDOUN COUNTY SHERIFF'S OFFICE,WEGMAN'S DULLES 28 CENTER,45131 COLUMBIA PL,STERLING,VA,20166,"http://maps.google.com/maps?q=45131 COLUMBIA PL,+STERLING,+VA+20166&hl=en"
LOUDOUN COUNTY SHERIFF'S OFFICE,WESTERN LOUDOUN STATION,47 W LOUDOUN ST,ROUND HILL,VA,20141,"http://maps.google.com/maps?q=47 W LOUDOUN ST,+ROUND HILL,+VA+20141&hl=en"
LOUISA COUNTY SHERIFF'S OFFICE,LOUISA COUNTY SHERIFF'S OFFICE,1 WOOLFOLK AVE,LOUISA,VA,23093,"http://maps.google.com/maps?q=1 WOOLFOLK AVE,+LOUISA,+VA+23093&hl=en"
LYNCHBURG POLICE DEPARTMENT,LYNCHBURG POLICE DEPARTMENT LOBBY,905 COURT STREET,LYNCHBURG,VA,24504,"http://maps.google.com/maps?q=905 COURT STREET,+LYNCHBURG,+VA+24504&hl=en"
MADISON COUNTY SHERIFF'S OFFICE,MADISON COUNTY SHERIFF'S OFFICE,115 CHURCH ST,MADISON,VA,22727,"http://maps.google.com/maps?q=115 CHURCH ST,+MADISON,+VA+22727&hl=en"
MANASSAS CITY POLICE DEPARTMENT,NOVANT HEALTH - PRINCE WILLIAM MEDICAL CENTER ENTRANCE TO WOMEN'S CENTER - OB/GYN,8700 SUDLEY ROAD,MANASSAS,VA,20110,"http://maps.google.com/maps?q=8700 SUDLEY ROAD,+MANASSAS,+VA+20110&hl=en"
MANASSAS PARK POLICE DEPARTMENT,MANASSAS PARK POLICE - COMMUNITY ROOM,329 MANASSAS DRIVE,MANASSAS PARK,VA,20111,"http://maps.google.com/maps?q=329 MANASSAS DRIVE,+MANASSAS PARK,+VA+20111&hl=en"
MARTINSVILLE POLICE DEPARTMENT,MARTINSVILLE FIRE DEPARTMENT FRONT ENTRANCE,65 WEST CHURCH ST.,MARTINSVILLE,VA,24112,"http://maps.google.com/maps?q=65 WEST CHURCH ST.,+MARTINSVILLE,+VA+24112&hl=en"
MARYLAND NATURAL RESOURCES POLICE,NATURAL RESOURCE POLICE BROADNECK OFFICE,1070 EAST COLLEGE PARKWAY,ANNAPOLIS,MD,21409,"http://maps.google.com/maps?q=1070 EAST COLLEGE PARKWAY,+ANNAPOLIS,+MD+21409&hl=en"
MARYLAND NATURAL RESOURCES POLICE,NATURAL RESOURCES POLICE HILLSBORO OFFICE,3001 STARR ROAD,QUEEN ANNE,MD,21657,"http://maps.google.com/maps?q=3001 STARR ROAD,+QUEEN ANNE,+MD+21657&hl=en"
MARYLAND STATE POLICE,MSP BERLIN BARRACK POC: D/SGT. RICK KLEBON,9758 OCEAN GATEWAY,BERLIN,MD,21811,"http://maps.google.com/maps?q=9758 OCEAN GATEWAY,+BERLIN,+MD+21811&hl=en"
MARYLAND STATE POLICE,MSP COLLEGE PARK BARRACK Q POC: LT. SEAN MORRIS,10100 RHODE ISLAND AVENUE,COLLEGE PARK,MD,20740,"http://maps.google.com/maps?q=10100 RHODE ISLAND AVENUE,+COLLEGE PARK,+MD+20740&hl=en"
MARYLAND STATE POLICE,MSP CUMBERLAND BARRACK POC: LT. MICHAEL FLUHARTY,1125 NATIONAL HIGHWAY,CUMBERLAND,MD,21502,"http://maps.google.com/maps?q=1125 NATIONAL HIGHWAY,+CUMBERLAND,+MD+21502&hl=en"
MARYLAND STATE POLICE,MSP EASTON BARRACK POC: D/SGT. MITCH PARKE,7053 OCEAN GATEWAY,EASTON,MD,21601,"http://maps.google.com/maps?q=7053 OCEAN GATEWAY,+EASTON,+MD+21601&hl=en"
MARYLAND STATE POLICE,MSP FORESTVILLE BARRACK POC: LT. ROLAND BUTLER,3500 FORESTVILLE ROAD,FORESTVILLE,MD,20747,"http://maps.google.com/maps?q=3500 FORESTVILLE ROAD,+FORESTVILLE,+MD+20747&hl=en"
MARYLAND STATE POLICE,MSP GLEN BURNIE BARRACK POC: SGT. EDWARD EICHER,6800 AVIATION BLVD.,GLEN BURNIE,MD,21061,"http://maps.google.com/maps?q=6800 AVIATION BLVD.,+GLEN BURNIE,+MD+21061&hl=en"
MARYLAND STATE POLICE,MSP LA PLATA BARRACK POC: D/SGT. KEVIN BEAUCHAMP,9500 MITCHELL ROAD,LA PLATA,MD,20646,"http://maps.google.com/maps?q=9500 MITCHELL ROAD,+LA PLATA,+MD+20646&hl=en"
MARYLAND STATE POLICE,MSP LEONARDTOWN BARRACK POC: D/SGT. WILLIAM ROSADO,23200 LEONARD HALL DRIVE,LEONARDTOWN,MD,20650,"http://maps.google.com/maps?q=23200 LEONARD HALL DRIVE,+LEONARDTOWN,+MD+20650&hl=en"
MARYLAND STATE POLICE,MSP MCHENRY BARRACK POC: JAMES PRITTS,67 FRIENDSVILLE ROAD,MC HENRY,MD,21541,"http://maps.google.com/maps?q=67 FRIENDSVILLE ROAD,+MC HENRY,+MD+21541&hl=en"
MARYLAND STATE POLICE,MSP PRINCESS ANNE BARRACK POC: D/SGT. KEEN,30581 PERRY ROAD,PRINCESS ANNE,MD,21853,"http://maps.google.com/maps?q=30581 PERRY ROAD,+PRINCESS ANNE,+MD+21853&hl=en"
MARYLAND STATE POLICE,MSP ROCKVILLE BARRACK POC: LT. H.B. MARTZ,7915 MONTROSE ROAD,ROCKVILLE,MD,20854,"http://maps.google.com/maps?q=7915 MONTROSE ROAD,+ROCKVILLE,+MD+20854&hl=en"
MARYLAND STATE POLICE,MSP SALISBURY BARRACK POC: D/SGT. ROBERT PHILLIPS,2765 NORTH SALISBURY BLVD.,SALISBURY,MD,21801,"http://maps.google.com/maps?q=2765 NORTH SALISBURY BLVD.,+SALISBURY,+MD+21801&hl=en"
