Participant,CollectionSite,Address,City,State,Zip,MapURL
LOUISVILLE METRO POLICE DEPARTMENT,KROGER,9440 BROWNBORO RD,LOUISVILLE,KY,40241,"http://maps.google.com/maps?q=9440 BROWNBORO RD,+LOUISVILLE,+KY+40241&hl=en"
LOUISVILLE METRO POLICE DEPARTMENT,KROGER PARKING LOT,291 N HUBBARD'S LN,LOUISVILLE,KY,40207,"http://maps.google.com/maps?q=291 N HUBBARD'S LN,+LOUISVILLE,+KY+40207&hl=en"
LOUISVILLE METRO POLICE DEPARTMENT,WALGREENS,2021 HIKES LANE,LOUISVILLE,KY,40218,"http://maps.google.com/maps?q=2021 HIKES LANE,+LOUISVILLE,+KY+40218&hl=en"
LOUISVILLE METRO POLICE DEPARTMENT,WALGREENS,3980 DIXIE HIGHWAY,LOUISVILLE,KY,40216,"http://maps.google.com/maps?q=3980 DIXIE HIGHWAY,+LOUISVILLE,+KY+40216&hl=en"
LOUISVILLE METRO POLICE DEPARTMENT,WALGREENS,7338 DIXIE HIGHWAY,LOUISVILLE,KY,40258,"http://maps.google.com/maps?q=7338 DIXIE HIGHWAY,+LOUISVILLE,+KY+40258&hl=en"
LOVELAND POLICE DEPARTMENT,LOVELAND ELEMENTARY AND PRIMARY SCHOOLS DRIVE THROUGH DROP OFF,600 LOVELAND MADEIRA ROAD,LOVELAND,OH,45140,"http://maps.google.com/maps?q=600 LOVELAND MADEIRA ROAD,+LOVELAND,+OH+45140&hl=en"
LOVELAND POLICE DEPARTMENT,LOVELAND POLICE DEPARTMENT LOBBY DROP BOX,126 SOUTH LEBANON ROAD,LOVELAND,OH,45140,"http://maps.google.com/maps?q=126 SOUTH LEBANON ROAD,+LOVELAND,+OH+45140&hl=en"
MADISON COUNTY SHERIFF'S OFFICE,MADISON COUNTY SHERIFF OPERATION CENTER,222 GARFIELD STREET,LONDON,OH,43140,"http://maps.google.com/maps?q=222 GARFIELD STREET,+LONDON,+OH+43140&hl=en"
MASON COUNTY SHERIFF'S OFFICE,MASON COUNTY SHERIFF'S OFFICE,200 SIXTH STREET,POINT PLEASANT,WV,25550,"http://maps.google.com/maps?q=200 SIXTH STREET,+POINT PLEASANT,+WV+25550&hl=en"
MASON COUNTY SHERIFF'S OFFICE,NEW HAVEN VOLUNTEER FIRE DEPT,407 5TH STREET,NEW HAVEN,WV,25265,"http://maps.google.com/maps?q=407 5TH STREET,+NEW HAVEN,+WV+25265&hl=en"
MATEWAN WV PD,MATEWAN POLICE DEPARTMENT,ROUTE 65 MCCOY ALLEY,MATEWAN,WV,25678,"http://maps.google.com/maps?q=ROUTE 65 MCCOY ALLEY,+MATEWAN,+WV+25678&hl=en"
MCDOWELL COUNTY SHERIFF DEPARTMENT,MAGIC MART,COAL HERITAGE RD,WELCH,WV,24801,"http://maps.google.com/maps?q=COAL HERITAGE RD,+WELCH,+WV+24801&hl=en"
MERCER COUNTY SHERIFF'S DEPARTMENT,MERCER COUNTY SD GARAGE,1501 WEST MAIN STREET,PRINCETON,WV,24740,"http://maps.google.com/maps?q=1501 WEST MAIN STREET,+PRINCETON,+WV+24740&hl=en"
"MERCER COUNTY, KY SHERIFFS OFFICE",MERCER COUNTY SHERIFFS OFFICE,207 WEST LEXINGTON ST,HARRODSBURG,KY,40330,"http://maps.google.com/maps?q=207 WEST LEXINGTON ST,+HARRODSBURG,+KY+40330&hl=en"
MIAMI COUNTY SHERIFF'S OFFICE,MIAMI COUNTY TRANSFER STATION,2500 N COUNTY ROAD 25A,TROY,OH,45373,"http://maps.google.com/maps?q=2500 N COUNTY ROAD 25A,+TROY,+OH+45373&hl=en"
MIAMI TOWNSHIP POLICE DEPARTMENT,MIAMI TOWNSHIP POLICE DEPARTMENT,2660 LYONS ROAD,MIAMISBURG,OH,45342,"http://maps.google.com/maps?q=2660 LYONS ROAD,+MIAMISBURG,+OH+45342&hl=en"
MIAMI TOWNSHIP POLICE DEPT. - CLERMONT CO.,MIAMI TOWNSHIP POLICE DEPT. - CLERMONT CO. 24HR DROP BOX LOCATED IN LOBBY,5900 MCPICKEN DRIVE,MILFORD,OH,45150,"http://maps.google.com/maps?q=5900 MCPICKEN DRIVE,+MILFORD,+OH+45150&hl=en"
MILTON POLICE DEPARTMENT,MILTON VOLUNTEER FIRE DEPARTMENT,341 E MAIN ST,MILTON,WV,25541,"http://maps.google.com/maps?q=341 E MAIN ST,+MILTON,+WV+25541&hl=en"
MONTGOMERY COUNTY SHERIFF'S OFFICE,MONTGOMERY COUNTY SHERIFF'S OFFICE,345 W. SECOND ST.,DAYTON,OH,45422,"http://maps.google.com/maps?q=345 W. SECOND ST.,+DAYTON,+OH+45422&hl=en"
MONTGOMERY POLICE DEPARTMENT,MONTGOMERY SAFETY CENTER,10150 MONTGOMERY RD,CINCINNATI,OH,45242,"http://maps.google.com/maps?q=10150 MONTGOMERY RD,+CINCINNATI,+OH+45242&hl=en"
MORAINE POLICE DEPARTMENT,KROGER,2917 W. ALEX BELL RD.,MORAINE,OH,45439,"http://maps.google.com/maps?q=2917 W. ALEX BELL RD.,+MORAINE,+OH+45439&hl=en"
MORGAN COUNTY SHERIFF'S OFFICE,EMA BUILDING,60 S. 4TH STREET,MCCONNELSVILLE,OH,43756,"http://maps.google.com/maps?q=60 S. 4TH STREET,+MCCONNELSVILLE,+OH+43756&hl=en"
MOUNT STERLING POLICE DEPARTMENT,KROGER,810 INDIAN MOUND DRIVE,MOUNT STERLING,KY,40353,"http://maps.google.com/maps?q=810 INDIAN MOUND DRIVE,+MOUNT STERLING,+KY+40353&hl=en"
MOUNT STERLING POLICE DEPARTMENT,MT STERLING POLICE DEPT,35 SOUTH BANK STREET,MOUNT STERLING,KY,40353,"http://maps.google.com/maps?q=35 SOUTH BANK STREET,+MOUNT STERLING,+KY+40353&hl=en"
MUSKINGUM COUNTY SHERIFF'S OFFICE,MUSKINGUM COUNTY HEALTH DEPARTMENT PARKING LOT,205 N 7TH STREET,ZANESVILLE,OH,43701,"http://maps.google.com/maps?q=205 N 7TH STREET,+ZANESVILLE,+OH+43701&hl=en"
MUSKINGUM COUNTY SHERIFF'S OFFICE,RIESBECKS PICK'N SAVE,2200 JUNE PARKWAY,ZANESVILLE,OH,43701,"http://maps.google.com/maps?q=2200 JUNE PARKWAY,+ZANESVILLE,+OH+43701&hl=en"
NEW ALBANY POLICE DEPARTMENT,PLAIN TOWNSHIP FIRE DEPARTMENT,9500 JOHNSTOWN RD.,NEW ALBANY,OH,43054,"http://maps.google.com/maps?q=9500 JOHNSTOWN RD.,+NEW ALBANY,+OH+43054&hl=en"
NICHOLAS COUNTY SHERIFF'S DEPARTMENT,NICHOLAS COUNTY COURTHOUSE,700 MAIN ST,SUMMERSVILLE,WV,26651,"http://maps.google.com/maps?q=700 MAIN ST,+SUMMERSVILLE,+WV+26651&hl=en"
NITRO POLICE DEPARTMENT,NITRO POLICE DEPARTMENT,497 1ST AVENUE SOUTH,NITRO,WV,25143,"http://maps.google.com/maps?q=497 1ST AVENUE SOUTH,+NITRO,+WV+25143&hl=en"
NORTHERN KENTUCKY DRUG STRIKE FORCE,BELLEVUE POLICE DEPARTMENT,616 POPLAR ST.,BELLEVUE,KY,41073,"http://maps.google.com/maps?q=616 POPLAR ST.,+BELLEVUE,+KY+41073&hl=en"
NORTHERN KENTUCKY DRUG STRIKE FORCE,CAMPBELL COUNTY POLICE DEPARTMENT,8774 CONSTABLE DR.,ALEXANDRIA,KY,41001,"http://maps.google.com/maps?q=8774 CONSTABLE DR.,+ALEXANDRIA,+KY+41001&hl=en"
NORTHERN KENTUCKY DRUG STRIKE FORCE,COLD SPRING POLICE DEPARTMENT,5589 EAST ALEXANDRIA PIKE,COLD SPRING,KY,41076,"http://maps.google.com/maps?q=5589 EAST ALEXANDRIA PIKE,+COLD SPRING,+KY+41076&hl=en"
NORTHERN KENTUCKY DRUG STRIKE FORCE,COVINGTON POLICE DEPARTMENT,1 POLICE MEMORIAL DR.,COVINGTON,KY,41014,"http://maps.google.com/maps?q=1 POLICE MEMORIAL DR.,+COVINGTON,+KY+41014&hl=en"
NORTHERN KENTUCKY DRUG STRIKE FORCE,DAYTON POLICE DEPARTMENT,514 6TH AVE.,DAYTON,KY,41074,"http://maps.google.com/maps?q=514 6TH AVE.,+DAYTON,+KY+41074&hl=en"
NORTHERN KENTUCKY DRUG STRIKE FORCE,EDGEWOOD POLICE DEPARTMENT,385 DUDLEY PIKE,EDGEWOOD,KY,41017,"http://maps.google.com/maps?q=385 DUDLEY PIKE,+EDGEWOOD,+KY+41017&hl=en"
NORTHERN KENTUCKY DRUG STRIKE FORCE,ERLANGER POLICE DEPARTMENT,505 COMMONWEALTH AVE.,ERLANGER,KY,41018,"http://maps.google.com/maps?q=505 COMMONWEALTH AVE.,+ERLANGER,+KY+41018&hl=en"
NORTHERN KENTUCKY DRUG STRIKE FORCE,FT. WRIGHT POLICE DEPARTMENT,409 KYLES LN.,COVINGTON,KY,41011,"http://maps.google.com/maps?q=409 KYLES LN.,+COVINGTON,+KY+41011&hl=en"
NORTHERN KENTUCKY DRUG STRIKE FORCE,KENTON COUNTY POLICE DEPARTMENT,11777 MADISON PIKE,INDEPENDENCE,KY,41051,"http://maps.google.com/maps?q=11777 MADISON PIKE,+INDEPENDENCE,+KY+41051&hl=en"
NORTHERN KENTUCKY DRUG STRIKE FORCE,NEWPORT POLICE DEPARTMENT,998 MONMOUTH ST.,NEWPORT,KY,41071,"http://maps.google.com/maps?q=998 MONMOUTH ST.,+NEWPORT,+KY+41071&hl=en"
NORTHERN KENTUCKY DRUG STRIKE FORCE,PARK HILLS POLICE DEPARTMENT,1106 AMSTERDAM RD.,PARK HILLS,KY,41011,"http://maps.google.com/maps?q=1106 AMSTERDAM RD.,+PARK HILLS,+KY+41011&hl=en"
NORTHERN KENTUCKY DRUG STRIKE FORCE,SOUTHGATE POLICE DEPARTMENT,301 W. WALNUT,SOUTHGATE,KY,41071,"http://maps.google.com/maps?q=301 W. WALNUT,+SOUTHGATE,+KY+41071&hl=en"
NORTHERN KENTUCKY DRUG STRIKE FORCE,VILLA HILLS POLICE DEPARTMENT,719 RODGERS RD.,VILLA HILLS,KY,41017,"http://maps.google.com/maps?q=719 RODGERS RD.,+VILLA HILLS,+KY+41017&hl=en"
NORTHERN KENTUCKY DRUG STRIKE FORCE,WILDER POLICE DEPARTMENT,520 LICKING PIKE,WILDER,KY,41071,"http://maps.google.com/maps?q=520 LICKING PIKE,+WILDER,+KY+41071&hl=en"
NORTHERN KENTUCKY UNIVERSITY POLICE,NKUPD,415 OLD JOHNS HILL ROAD,HIGHLAND HEIGHTS,KY,41099,"http://maps.google.com/maps?q=415 OLD JOHNS HILL ROAD,+HIGHLAND HEIGHTS,+KY+41099&hl=en"
NORTON POLICE DEPARTMENT,CVS PHARMACY PARKING LOT,1128 PARK AVENUE,NORTON,VA,24273,"http://maps.google.com/maps?q=1128 PARK AVENUE,+NORTON,+VA+24273&hl=en"
NORWOOD POLICE,NORWOOD POLICE DEPARTMENT,4701 MONTGOMERY RD.,NORWOOD,OH,45212,"http://maps.google.com/maps?q=4701 MONTGOMERY RD.,+NORWOOD,+OH+45212&hl=en"
OAK HILL WV POLICE DEPARTMENT,KROGER,411 MALL RD,OAK HILL,WV,25901,"http://maps.google.com/maps?q=411 MALL RD,+OAK HILL,+WV+25901&hl=en"
OLDHAM COUNTY SHERIFF'S OFFICE,LAGRANGE FIRE DEPARTMENT STATION 2,3637 W HWY 146,BUCKNER,KY,40010,"http://maps.google.com/maps?q=3637 W HWY 146,+BUCKNER,+KY+40010&hl=en"
OLDHAM COUNTY SHERIFF'S OFFICE,NORTH OLDHAM FIRE DEPARTMENT,1660 HIGHWAY 1793,GOSHEN,KY,40026,"http://maps.google.com/maps?q=1660 HIGHWAY 1793,+GOSHEN,+KY+40026&hl=en"
OLDHAM COUNTY SHERIFF'S OFFICE,OLDHAM COUNTY POLICE DEPARTMENT,1855 NORTH HIGHWAY 393,LA GRANGE,KY,40031,"http://maps.google.com/maps?q=1855 NORTH HIGHWAY 393,+LA GRANGE,+KY+40031&hl=en"
OWINGSVILLE POLICE DEPARTMENT,OWINGSVILLE POLICE DEPARTMENT,19 GOODPASTER AVE,OWINGSVILLE,KY,40360,"http://maps.google.com/maps?q=19 GOODPASTER AVE,+OWINGSVILLE,+KY+40360&hl=en"
"PARKERSBURG, WV POLICE DEPARTMENT",CVS PHARMACY,2323 MURDOCH AVENUE,PARKERSBURG,WV,26101,"http://maps.google.com/maps?q=2323 MURDOCH AVENUE,+PARKERSBURG,+WV+26101&hl=en"
PENDLETON COUNTY SHERIFF'S OFFICE,PENDLETON COUNTY SHERIFF'S OFFICE,202 CHAPEL STREET,FALMOUTH,KY,41040,"http://maps.google.com/maps?q=202 CHAPEL STREET,+FALMOUTH,+KY+41040&hl=en"
PERRY TOWNSHIP POLICE DEPARTMENT,PERRY TOWNSHIP POLICE DEPARTMENT,7125 SAWMILL ROAD,DUBLIN,OH,43016,"http://maps.google.com/maps?q=7125 SAWMILL ROAD,+DUBLIN,+OH+43016&hl=en"
PICKERINGTON POLICE DEPARTMENT,PICKERINGTON POLICE DEPARTMENT,1311 REFUGEE RD.,PICKERINGTON,OH,43147,"http://maps.google.com/maps?q=1311 REFUGEE RD.,+PICKERINGTON,+OH+43147&hl=en"
PIERCE TOWNSHIP POLICE DEPARTMENT,PIERCE TOWNSHIP POLICE DEPARTMENT,950 LOCUST CORNER RD,CINCINNATI,OH,45245,"http://maps.google.com/maps?q=950 LOCUST CORNER RD,+CINCINNATI,+OH+45245&hl=en"
PREBLE COUNTY SHERIFF'S OFFICE,PREBLE COUNTY SHERIFF'S OFFICE,1139 PREBLE DRIVE,EATON,OH,45320,"http://maps.google.com/maps?q=1139 PREBLE DRIVE,+EATON,+OH+45320&hl=en"
PROSPECT POLICE DEPARTMENT,KROGER,5929 TIMBER RIDGE DR.,PROSPECT,KY,40059,"http://maps.google.com/maps?q=5929 TIMBER RIDGE DR.,+PROSPECT,+KY+40059&hl=en"
PULASKI COUNTY SERIFF'S OFFICE,KROGER PHARMACY SOUTH LOCATION STONEGATE CENTER,50 STONEGATE CENTER,SOMERSET,KY,42501,"http://maps.google.com/maps?q=50 STONEGATE CENTER,+SOMERSET,+KY+42501&hl=en"
PUTNAM COUNTY SHERIFF'S DEPARTMENT,PUTNAM COUNTY SHERIFF'S DEPARTMENT,SHERIFF'S DEPARTMENT3389 WINFIELD ROAD,WINFIELD,WV,25213,"http://maps.google.com/maps?q=SHERIFF'S DEPARTMENT,+WINFIELD,+WV+25213&hl=en"
RALEIGH COUNTY SD,CRAB ORCHARD PHARMACY,1299 ROBERT C. BYRD DRIVE,CRAB ORCHARD,WV,25827,"http://maps.google.com/maps?q=1299 ROBERT C. BYRD DRIVE,+CRAB ORCHARD,+WV+25827&hl=en"
REYNOLDSBURG POLICE DEPARTMENT,REYNOLDSBURG POLICE DEPARTMENT EDWARD K KALLAY,7240 E. MAIN ST,REYNOLDSBURG,OH,43068,"http://maps.google.com/maps?q=7240 E. MAIN ST,+REYNOLDSBURG,+OH+43068&hl=en"
RICHLANDS POLICE DEPARTMENT,RICHLANDS POLICE DEPARTMENT FRONT LOBBY,1851 CRANWELL DRIVE,RICHLANDS,VA,24641,"http://maps.google.com/maps?q=1851 CRANWELL DRIVE,+RICHLANDS,+VA+24641&hl=en"
RICHMOND POLICE DEPARTMENT,RICHMOND POLICE DEPARTMENT,1721 LEXINGTON RD,RICHMOND,KY,40475,"http://maps.google.com/maps?q=1721 LEXINGTON RD,+RICHMOND,+KY+40475&hl=en"
RICHMOND POLICE DEPARTMENT,RICHMOND POLICE DEPARTMENT MSUTTON@RICHMONDINDIANA.GOV,50 NORTH 5TH STREET,RICHMOND,IN,47374,"http://maps.google.com/maps?q=50 NORTH 5TH STREET,+RICHMOND,+IN+47374&hl=en"
ROSS COUNTY SHERIFF'S OFFICE,ROSS COUNTY LAW COMPLEX,28 N PAINT ST.,CHILLICOTHE,OH,45601,"http://maps.google.com/maps?q=28 N PAINT ST.,+CHILLICOTHE,+OH+45601&hl=en"
ROSS TWP POLICE DEPARTMNET,ROSS TWP. POLICE DEPARTMENT,4055 HAMILTON CLEVES RD,FAIRFIELD,OH,45014,"http://maps.google.com/maps?q=4055 HAMILTON CLEVES RD,+FAIRFIELD,+OH+45014&hl=en"
ROWAN COUNTY SHERIFF'S OFFICE,KSP POST 8 MOREHEAD,1595 FLEMINGSBURG ROAD,MOREHEAD,KY,40351,"http://maps.google.com/maps?q=1595 FLEMINGSBURG ROAD,+MOREHEAD,+KY+40351&hl=en"
RUSH COUNTY SHERIFF DEPARTMENT,RUSH MEMORIAL HOSPITAL 13TH STREET ENTRANCE,1300 N MAIN ST,RUSHVILLE,IN,46173,"http://maps.google.com/maps?q=1300 N MAIN ST,+RUSHVILLE,+IN+46173&hl=en"
RUSSELL COUNTY SHERIFF'S OFFICE,BLUE DEVIL DRUG,19408 HWY 58,CASTLEWOOD,VA,24224,"http://maps.google.com/maps?q=19408 HWY 58,+CASTLEWOOD,+VA+24224&hl=en"
RUSSELL COUNTY SHERIFF'S OFFICE,FOOD CITY,159 PITTSTON RD,LEBANON,VA,24266,"http://maps.google.com/maps?q=159 PITTSTON RD,+LEBANON,+VA+24266&hl=en"
RUSSELL COUNTY SHERIFF'S OFFICE,NEW GARDEN PHARMACY,5300 REDBUD HWY,HONAKER,VA,24260,"http://maps.google.com/maps?q=5300 REDBUD HWY,+HONAKER,+VA+24260&hl=en"
SALTVILLE POLICE DEPARTMENT,SALTVILLE POLICE DEPARTMENT,217 PALMER AVE,SALTVILLE,VA,24370,"http://maps.google.com/maps?q=217 PALMER AVE,+SALTVILLE,+VA+24370&hl=en"
SCOTT COUNTY PARTNERSHIP PFS / CEASE OF SCOTT CO.,AUSTIN POLICE DEPARTMENT LOBBY 24/7 CONTROLLED AND NON-CONTROLLED MEDICATION DROP BOX,127 N. HIGHWAY 31,AUSTIN,IN,47102,"http://maps.google.com/maps?q=127 N. HIGHWAY 31,+AUSTIN,+IN+47102&hl=en"
SCOTT COUNTY PARTNERSHIP PFS / CEASE OF SCOTT CO.,SCOTT COUNTY SHERIFF'S DEPARTMENT LOBBY 24/7 CONTROLLED AND NON-CONTROLLED MEDICATION DROP,111 S. FIRST ST.,SCOTTSBURG,IN,47170,"http://maps.google.com/maps?q=111 S. FIRST ST.,+SCOTTSBURG,+IN+47170&hl=en"
SCOTT COUNTY PARTNERSHIP PFS / CEASE OF SCOTT CO.,"SCOTTSBURG WALMART DEA DRUG TAKE BACK: OCTOBER 27, 2018, 10AM-2PM",1618 W. MCCLAIN AVE.,SCOTTSBURG,IN,47170,"http://maps.google.com/maps?q=1618 W. MCCLAIN AVE.,+SCOTTSBURG,+IN+47170&hl=en"
SCOTT COUNTY SHERIFF'S OFFICE,FOOD COUNTRY OUTSIDE NEAR MAIN ENTRANCE,42158 US 58,DUFFIELD,VA,24244,"http://maps.google.com/maps?q=42158 US 58,+DUFFIELD,+VA+24244&hl=en"
SCOTT COUNTY SHERIFF'S OFFICE,SCOTT COUNTY SHERIFF'S OFFICE NEAR MAIN ENTRANCE,336 WATER STREET,GATE CITY,VA,24251,"http://maps.google.com/maps?q=336 WATER  STREET,+GATE CITY,+VA+24251&hl=en"
SHARON TOWNSHIP POLICE DEPARTMENT,SHARON TOWNSHIP POLICE DEPARTMENT,95 E. WILSON BRIDGE ROAD,WORTHINGTON,OH,43085,"http://maps.google.com/maps?q=95 E. WILSON BRIDGE ROAD,+WORTHINGTON,+OH+43085&hl=en"
SHARONVILLE POLICE DEPARTMENT,SHARONVILLE MUNICIPAL BUILDING,10900 READING ROAD,CINCINNATI,OH,45241,"http://maps.google.com/maps?q=10900 READING ROAD,+CINCINNATI,+OH+45241&hl=en"
SHELBY COUNTY CORONER OFFICE,SHELBY COUNTY CORONER'S OFFICE,419 WASHINGTON STREET,SHELBYVILLE,KY,40065,"http://maps.google.com/maps?q=419 WASHINGTON STREET,+SHELBYVILLE,+KY+40065&hl=en"
SMYTH COUNTY SHERIFF'S OFFICE,FOOD CITY,910 N. MAIN ST.,MARION,VA,24354,"http://maps.google.com/maps?q=910 N. MAIN ST.,+MARION,+VA+24354&hl=en"
SPENCER POLICE DEPARTMENT,SPENCER POLICE DEPARTMENT,116 COURT ST,SPENCER,WV,25276,"http://maps.google.com/maps?q=116 COURT ST,+SPENCER,+WV+25276&hl=en"
SPRINGBORO POLICE DEPARTMENT,CITY OF SPRINGBORO MUNICIPAL BUILDING,320 W CENTRAL AVE.,SPRINGBORO,OH,45066,"http://maps.google.com/maps?q=320 W CENTRAL AVE.,+SPRINGBORO,+OH+45066&hl=en"
SPRINGDALE POLICE DEPARTMENT,SPRINGDALE POLICE DEPARTMENT,12105 LAWNVIEW AVE.,CINCINNATI,OH,45246,"http://maps.google.com/maps?q=12105 LAWNVIEW AVE.,+CINCINNATI,+OH+45246&hl=en"
SPRINGFIELD TOWNSHIP POLICE DEPARTMENT,SPRINGFIELD TOWNSHIP POLICE DEPARTMENT,1130 COMPTON ROAD,CINCINNATI,OH,45231,"http://maps.google.com/maps?q=1130 COMPTON ROAD,+CINCINNATI,+OH+45231&hl=en"
ST. ALBANS POLICE DEPARTMENT,ST. ALBANS POLICE DEPARTMENT,51 6TH AVENUE,SAINT ALBANS,WV,25177,"http://maps.google.com/maps?q=51 6TH AVENUE,+SAINT ALBANS,+WV+25177&hl=en"
ST. PAUL POLICE DEPARTMENT,FOOD CITY,16410 WISE ST.,SAINT PAUL,VA,24283,"http://maps.google.com/maps?q=16410 WISE ST.,+SAINT PAUL,+VA+24283&hl=en"
TAZEWELL (TOWN OF) POLICE DEPARTMENT,TAZEWELL POLICE DEPARTMENT,211 CENTRAL AVE,TAZEWELL,VA,24651,"http://maps.google.com/maps?q=211 CENTRAL AVE,+TAZEWELL,+VA+24651&hl=en"
UNION COUNTY SHERIFF'S OFFICE,PLEASANT VALLEY FIRE DEPARTMENT,650 WEST MAIN STREET,PLAIN CITY,OH,43064,"http://maps.google.com/maps?q=650 WEST MAIN STREET,+PLAIN CITY,+OH+43064&hl=en"
UNIVERSITY OF CINCINNATI PUBLIC SAFETY DEPARTMENT,UNIVERSITY OF CINCINNATI PUBLIC SAFETY DEPARTMENT,51 W. CORRY BLVD.EDWARDS THREE,CINCINNATI,OH,45221,"http://maps.google.com/maps?q=51 W. CORRY BLVD.,+CINCINNATI,+OH+45221&hl=en"
UNIVERSITY OF DAYTON POLICE DEPARTMENT,UNIVERSITY OF DAYTON POLICE DEPARTMENT,300 COLLEGE PARK,DAYTON,OH,45469,"http://maps.google.com/maps?q=300 COLLEGE PARK,+DAYTON,+OH+45469&hl=en"
UPPER ARLINGTON DIVISION OF POLICE,UPPER ARLINGTON POLICE DIVISION MUNICIPAL SERVICES CENTER,3600 TREMONT ROAD,UPPER ARLINGTON,OH,43221,"http://maps.google.com/maps?q=3600 TREMONT ROAD,+UPPER ARLINGTON,+OH+43221&hl=en"
VANDALIA DIVISION OF POLICE,VANDALIA KROGER,780 NORTHWOODS BLVD,VANDALIA,OH,45377,"http://maps.google.com/maps?q=780 NORTHWOODS BLVD,+VANDALIA,+OH+45377&hl=en"
VANDALIA DIVISION OF POLICE,VANDALIA POLICE DEPARTMENT,245 JAMES BOHANAN DR.,VANDALIA,OH,45377,"http://maps.google.com/maps?q=245 JAMES BOHANAN DR.,+VANDALIA,+OH+45377&hl=en"
VIENNA WV POLICE DEPARTMENT,VIENNA VOLUNTEER FD,609 28TH ST,VIENNA,WV,26105,"http://maps.google.com/maps?q=609 28TH ST,+VIENNA,+WV+26105&hl=en"
"VILLAGE OF EVENDALE, OHIO",EVENDALE POLICE DEPARTMENT CHIEF NIEL KORTE,10500 READING RD,CINCINNATI,OH,45241,"http://maps.google.com/maps?q=10500 READING RD,+CINCINNATI,+OH+45241&hl=en"
VIRGINIA STATE POLICE,VIRGINIA STATE POLICE DIVISION IV HQS POC: LT PATRICK KIRTNER,1186 EAST LEE HIGHWAY,WYTHEVILLE,VA,24382,"http://maps.google.com/maps?q=1186 EAST LEE HIGHWAY,+WYTHEVILLE,+VA+24382&hl=en"
WARREN COUNTY DRUG TASK FORCE,KROGER,5100 TERRA FIRMA DR.,MASON,OH,45040,"http://maps.google.com/maps?q=5100 TERRA FIRMA DR.,+MASON,+OH+45040&hl=en"
WASHINGTON COUNTY SHERIFF'S OFFICE,BELPRE SENIOR CENTER PARKING LOT,1614 WASHINGTON BLVD,BELPRE,OH,45714,"http://maps.google.com/maps?q=1614 WASHINGTON BLVD,+BELPRE,+OH+45714&hl=en"
WASHINGTON COUNTY SHERIFF'S OFFICE,CORNER OF 2ND ST AND PUTNAM ST,CORNER OF 2ND ST AND PUTNAM ST,MARIETTA,OH,45750,"http://maps.google.com/maps?q=CORNER OF 2ND ST AND PUTNAM ST,+MARIETTA,+OH+45750&hl=en"
WASHINGTON COUNTY SHERIFF'S OFFICE,DEVOLA MEDICAL CENTER PARKING LOT,4727 STATE ROUTE 60,MARIETTA,OH,45750,"http://maps.google.com/maps?q=4727 STATE ROUTE 60,+MARIETTA,+OH+45750&hl=en"
WASHINGTON COUNTY SHERIFF'S OFFICE,FORT FRYE HIGH SCHOOL PARKING LOT,420 FIFTH STREET,BEVERLY,OH,45715,"http://maps.google.com/maps?q=420 FIFTH STREET,+BEVERLY,+OH+45715&hl=en"
WASHINGTON COUNTY SHERIFF'S OFFICE,GLADE PHARMACY,33472 LEE HWY,GLADE SPRING,VA,24340,"http://maps.google.com/maps?q=33472 LEE HWY,+GLADE SPRING,+VA+24340&hl=en"
WASHINGTON COUNTY SHERIFF'S OFFICE,MICHAELS PHARMACY (276)676-2900,101 CHARWOOD DRIVE,ABINGDON,VA,24210,"http://maps.google.com/maps?q=101 CHARWOOD DRIVE,+ABINGDON,+VA+24210&hl=en"
WASHINGTON COUNTY SHERIFF'S OFFICE,WALMART SUPER CENTER (276)619-4843,16032 FIFTEEN MILE BOULEVARD,ABINGDON,VA,24211,"http://maps.google.com/maps?q=16032 FIFTEEN MILE BOULEVARD,+ABINGDON,+VA+24211&hl=en"
WASHINGTON COUNTY SHERIFF'S OFFICE,WASHINGTON COUNTY SHERIFF'S OFFICE 24HR DROP BOX LOCATED IN LOBBY,309 4TH STREET,MARIETTA,OH,45750,"http://maps.google.com/maps?q=309 4TH STREET,+MARIETTA,+OH+45750&hl=en"
WASHINGTON COUNTY SHERIFF'S OFFICE,WHITE OAK PHARMACY PARKING LOT,8465 STATE ROUTE 339,BARLOW,OH,45712,"http://maps.google.com/maps?q=8465 STATE ROUTE 339,+BARLOW,+OH+45712&hl=en"
WASHINGTON COUNTY TENNESSEE SHERIFFS OFFICE,GRAY COMMUNITY CHEST,113 GRAY RURITAN DRIVE,GRAY,TN,37615,"http://maps.google.com/maps?q=113 GRAY RURITAN DRIVE,+GRAY,+TN+37615&hl=en"
WAYNESVILLE POLICE DEPARTMENT,WAYNESVILLE POLICE DEPARTMENT,1400 LYTLE ROAD,WAYNESVILLE,OH,45068,"http://maps.google.com/maps?q=1400 LYTLE ROAD,+WAYNESVILLE,+OH+45068&hl=en"
WEBER CITY POLICE DEPARTMENT,FOOD CITY - WEBER CITY NEAR FRONT ENTRANCE,FRANK B. SMITH LN,WEBER CITY,VA,24290,"http://maps.google.com/maps?q=FRANK B. SMITH LN,+WEBER CITY,+VA+24290&hl=en"
WEST CHESTER POLICE DEPARTMENT,WALGREENS PARKING LOT,7804 CINCINNATI-DAYTON ROAD,WEST CHESTER,OH,45069,"http://maps.google.com/maps?q=7804 CINCINNATI-DAYTON ROAD,+WEST CHESTER,+OH+45069&hl=en"
WEST JEFFERSON POLICE DEPARTMENT,JEFFERSON TOWNSHIP FIRE DEPARTMENT,745 WEST MAIN ST.,WEST JEFFERSON,OH,43162,"http://maps.google.com/maps?q=745 WEST MAIN ST.,+WEST JEFFERSON,+OH+43162&hl=en"
WEST VIRGINIA STATE POLICE,WEST VIRGINIA STATE POLICE SGT B K WELLMAN/3045285555,3339 US ROUTE 60 EAST,HUNTINGTON,WV,25705,"http://maps.google.com/maps?q=3339 US ROUTE 60 EAST,+HUNTINGTON,+WV+25705&hl=en"
WEST VIRGINIA STATE POLICE,WEST VIRGINIA STATE POLICE SGT R.E. RICHARDSON/3044204600,3828 STAUNTON TPK.,PARKERSBURG,WV,26104,"http://maps.google.com/maps?q=3828 STAUNTON TPK.,+PARKERSBURG,+WV+26104&hl=en"
WEST VIRGINIA STATE POLICE,WEST VIRGINIA STATE POLICE SGT R.J. DRAKE/3048243101,8021 COURT AVENUE,HAMLIN,WV,25523,"http://maps.google.com/maps?q=8021 COURT AVENUE,+HAMLIN,+WV+25523&hl=en"
WEST VIRGINIA STATE POLICE,WEST VIRGINIA STATE POLICE SGT R.L. FRYE/3047927200,735 RIVERVIEW AVENUE,LOGAN,WV,25601,"http://maps.google.com/maps?q=735 RIVERVIEW AVENUE,+LOGAN,+WV+25601&hl=en"
WEST VIRGINIA STATE POLICE,WEST VIRGINIA STATE POLICE SGT. B.K. HAMMONTREE/3045587777,711 JEFFERSON ROAD,SOUTH CHARLESTON,WV,25309,"http://maps.google.com/maps?q=711 JEFFERSON ROAD,+SOUTH CHARLESTON,+WV+25309&hl=en"
WEST VIRGINIA STATE POLICE,WEST VIRGINIA STATE POLICE SGT. C.H.FLOWERS/304-586-2000,3389 WINFIELD ROAD,WINFIELD,WV,25213,"http://maps.google.com/maps?q=3389 WINFIELD ROAD,+WINFIELD,+WV+25213&hl=en"
WEST VIRGINIA STATE POLICE,WVSP-BECKLEY SGT G.D. WILLIAMS/3042566700,105 PINECREST DR,BECKLEY,WV,25801,"http://maps.google.com/maps?q=105 PINECREST DR,+BECKLEY,+WV+25801&hl=en"
WEST VIRGINIA STATE POLICE,WVSP-OAK HILL SGT. J.L. MILAM/3044692915,3057 MAIN ST,OAK HILL,WV,25901,"http://maps.google.com/maps?q=3057 MAIN ST,+OAK HILL,+WV+25901&hl=en"
WEST VIRGINIA STATE POLICE,WVSP-PRINCETON SGT. D.W. MILLER/3044252101,910 OAKVALE RD,PRINCETON,WV,24740,"http://maps.google.com/maps?q=910 OAKVALE RD,+PRINCETON,+WV+24740&hl=en"
WHITEHALL DIVISION OF POLICE,WHITEHALL DIVISION OF POLICE TRACY SHARPLESS,365 S. YEARLING RD.,COLUMBUS,OH,43213,"http://maps.google.com/maps?q=365 S. YEARLING RD.,+COLUMBUS,+OH+43213&hl=en"
"WILLIAMSON, WV POLICE DEPARTMENT","WILLIAMSON, WV PD",108 EAST 4TH AVE,WILLIAMSON,WV,25661,"http://maps.google.com/maps?q=108 EAST 4TH AVE,+WILLIAMSON,+WV+25661&hl=en"
WILLIAMSTOWN POLICE DEPT,WILLIAMSTOWN PD,100 WEST 5TH ST,WILLIAMSTOWN,WV,26187,"http://maps.google.com/maps?q=100 WEST 5TH ST,+WILLIAMSTOWN,+WV+26187&hl=en"
WILMINGTON POLICE DEPARTMENT,BLANCHESTER POLICE DEPARTMENT,318 E MAIN,BLANCHESTER,OH,45107,"http://maps.google.com/maps?q=318 E MAIN,+BLANCHESTER,+OH+45107&hl=en"
WILMINGTON POLICE DEPARTMENT,CVS OF WILMINGTON,120 E MAIN STREET,WILMINGTON,OH,45177,"http://maps.google.com/maps?q=120 E MAIN STREET,+WILMINGTON,+OH+45177&hl=en"
WILMINGTON POLICE DEPARTMENT,UHL'S,444 E WASHINGTON,SABINA,OH,45169,"http://maps.google.com/maps?q=444 E WASHINGTON,+SABINA,+OH+45169&hl=en"
WINCHESTER POLICE DEPARTMENT,WINCHESTER POLICE DEPARTMENT WINCHESTER POLICE DEPARTMENT,16 SOUTH MAPLE STREET,WINCHESTER,KY,40391,"http://maps.google.com/maps?q=16 SOUTH MAPLE STREET,+WINCHESTER,+KY+40391&hl=en"
WINFIELD WV POLICE DEPT,WINFIELD WV POLICE DEPARTMENT,3232 WINFIELD ROAD,WINFIELD,WV,25213,"http://maps.google.com/maps?q=3232 WINFIELD ROAD,+WINFIELD,+WV+25213&hl=en"
WIRT COUNTY SHERIFF'S DEPARTMENT,WIRT COUNTY SHERIFF'S DEPT,100 COURT SQURE,ELIZABETH,WV,26143,"http://maps.google.com/maps?q=100 COURT SQURE,+ELIZABETH,+WV+26143&hl=en"
WISE COUNTY SHERIFF'S OFFICE,FOOD CITY,16410 WISE ST,SAINT PAUL,VA,24283,"http://maps.google.com/maps?q=16410 WISE ST,+SAINT PAUL,+VA+24283&hl=en"
WISE POLICE DEPARTMENT,FOOD CITY NEAR FRONT ENTRANCE,207 WOODLAND DRIVE,WISE,VA,24293,"http://maps.google.com/maps?q=207 WOODLAND DRIVE,+WISE,+VA+24293&hl=en"
WOOD COUNTY WV SHERIFF'S DEPARTMENT,LUBECK VFD,1340 HARRIS HWY,PARKERSBURG,WV,26101,"http://maps.google.com/maps?q=1340 HARRIS HWY,+PARKERSBURG,+WV+26101&hl=en"
WOOD COUNTY WV SHERIFF'S DEPARTMENT,MINERAL WELLS VFD,1695 ELIZABETH PIKE,MINERAL WELLS,WV,26150,"http://maps.google.com/maps?q=1695 ELIZABETH PIKE,+MINERAL WELLS,+WV+26150&hl=en"
WOOD COUNTY WV SHERIFF'S DEPARTMENT,WAVERLY VFD,15425 EMERSON AVE,WAVERLY,WV,26184,"http://maps.google.com/maps?q=15425 EMERSON AVE,+WAVERLY,+WV+26184&hl=en"
WOODFORD COUNTY SHERIFF'S OFFICE,KROGER,KROGER WAY,VERSAILLES,KY,40383,"http://maps.google.com/maps?q=KROGER WAY,+VERSAILLES,+KY+40383&hl=en"
WOODFORD COUNTY SHERIFF'S OFFICE,KROGERS,212 KROGER WAY,VERSAILLES,KY,40383,"http://maps.google.com/maps?q=212 KROGER WAY,+VERSAILLES,+KY+40383&hl=en"
WOODFORD COUNTY SHERIFF'S OFFICE,MIDWAY CITY HALL,101 E MAIN ST,MIDWAY,KY,40347,"http://maps.google.com/maps?q=101 E MAIN ST,+MIDWAY,+KY+40347&hl=en"
WOODFORD COUNTY SHERIFF'S OFFICE,WOODFORD COUNTY SHERIFFS OFFICE SIDE OF COURT HOUSE ON COURT ST.,103 SOUTH MAIN ST,VERSAILLES,KY,40383,"http://maps.google.com/maps?q=103 SOUTH MAIN ST,+VERSAILLES,+KY+40383&hl=en"
WORTHINGTON DIVISION OF POLICE,WORTHINGTON DIVISION OF POLICE,6555 WORTHINGTON GALLENA RD,COLUMBUS,OH,43085,"http://maps.google.com/maps?q=6555 WORTHINGTON GALLENA RD,+COLUMBUS,+OH+43085&hl=en"
WV DIVISION OF PROTECTIVE SERVICES,WV STATE CAPITOL BUILDING OUTSIDE-CALIFORNIA AVE,1900 KANAWHA BOULEVARD EAST,CHARLESTON,WV,25305,"http://maps.google.com/maps?q=1900 KANAWHA BOULEVARD EAST,+CHARLESTON,+WV+25305&hl=en"
WYTHE COUNTY SHERIFF'S OFFICE,WYTHE COUNTY SHERIFF'S OFFICE SALLY PORT AREA FOR COLLECTION,245 S 4TH STREET,WYTHEVILLE,VA,24382,"http://maps.google.com/maps?q=245 S 4TH STREET,+WYTHEVILLE,+VA+24382&hl=en"
