Participant,CollectionSite,Address,City,State,Zip,MapURL
ABERDEEN POLICE DEPARTMENT,ABERDEEN POLICE DEPARTMENT,114 SE 2ND AVE,ABERDEEN,SD,57401,"http://maps.google.com/maps?q=114 SE 2ND AVE,+ABERDEEN,+SD+57401&hl=en"
ANTELOPE CO SHERIFF DEPT,ANTELOPE COUNTY SHERIFF DEPT,1102 L ST,NELIGH,NE,68756,"http://maps.google.com/maps?q=1102 L ST,+NELIGH,+NE+68756&hl=en"
ATLANTIC POLICE DEPARTMENT,ATLANTIC POLICE DEPARTMENT NATHAN L KINNEY,23 E 4TH STREET,ATLANTIC,IA,50022,"http://maps.google.com/maps?q=23 E 4TH STREET,+ATLANTIC,+IA+50022&hl=en"
BENSON PD,BENSON PD,2110 HALL AVENUE,BENSON,MN,56215,"http://maps.google.com/maps?q=2110 HALL AVENUE,+BENSON,+MN+56215&hl=en"
BLAIR POLICE DEPARTMENT,BLAIR POLICE DEPARTMENT,1730 LINCOLN STREET,BLAIR,NE,68008,"http://maps.google.com/maps?q=1730 LINCOLN STREET,+BLAIR,+NE+68008&hl=en"
BRANDON POLICE DEPARTMENT,BRANDON POLICE DEPT.,304 S MAIN AVE.,BRANDON,SD,57005,"http://maps.google.com/maps?q=304 S MAIN AVE.,+BRANDON,+SD+57005&hl=en"
BROOKINGS COUNTY SHERIFF'S OFFICE,BROOKINGS COUNTY SHERIFF'S OFFICE,315 7TH AVENUE,BROOKINGS,SD,57006,"http://maps.google.com/maps?q=315 7TH AVENUE,+BROOKINGS,+SD+57006&hl=en"
BROWN COUNTY SHERIFF'S OFFICE,BROWN COUNTY SHERIFF'S OFFICE,142 WEST 4TH STREET,AINSWORTH,NE,69210,"http://maps.google.com/maps?q=142 WEST 4TH STREET,+AINSWORTH,+NE+69210&hl=en"
BUENA VISTA COUNTY SHERIFF'S OFFICE,NEWELL CITY HALL,207 E 2ND STREET,NEWELL,IA,50568,"http://maps.google.com/maps?q=207 E 2ND STREET,+NEWELL,+IA+50568&hl=en"
BUENA VISTA COUNTY SHERIFF'S OFFICE,SIOUX RAPIDS CITY HALL,100 FRONT STREET,SIOUX RAPIDS,IA,50585,"http://maps.google.com/maps?q=100 FRONT STREET,+SIOUX RAPIDS,+IA+50585&hl=en"
BUENA VISTA COUNTY SHERIFF'S OFFICE,WALMART,1831 LAKE AVE,STORM LAKE,IA,50588,"http://maps.google.com/maps?q=1831 LAKE AVE,+STORM LAKE,+IA+50588&hl=en"
CHEROKEE COUNTY SHERIFF'S OFFICE,CHEROKEE COUNTY LAW ENFORCEMENT CENTER CHEROKEE COUNTY SHERIFF'S OFFICE,111 N 5TH ST.,CHEROKEE,IA,51012,"http://maps.google.com/maps?q=111 N 5TH ST.,+CHEROKEE,+IA+51012&hl=en"
CODINGTON COUNTY SHERIFFS OFFICE,CODINGTON COUNTY SHERIFF'S OFFICE,14 1ST AVE SE,WATERTOWN,SD,57201,"http://maps.google.com/maps?q=14 1ST AVE SE,+WATERTOWN,+SD+57201&hl=en"
COTTONWOOD COUNTY SHERIFF'S OFFICE,COTTONWOOD COUNTY SHERIFFS OFFICE,902 5TH AVENUE,WINDOM,MN,56101,"http://maps.google.com/maps?q=902 5TH AVENUE,+WINDOM,+MN+56101&hl=en"
COUNCIL BLUFFS POLICE DEPARTMENT,WALGREENS,535 E BROADWAY,COUNCIL BLUFFS,IA,51503,"http://maps.google.com/maps?q=535 E BROADWAY,+COUNCIL BLUFFS,+IA+51503&hl=en"
DAWSON BOYD PD,DAWSON BOYD POLICE DEPARTMENT,675 CHESTNUT STREET,DAWSON,MN,56232,"http://maps.google.com/maps?q=675 CHESTNUT STREET,+DAWSON,+MN+56232&hl=en"
DOUGLAS COUNTY SHERIFF'S DEPARTMENT,HYVEE,1000 S 178TH STREET,OMAHA,NE,68118,"http://maps.google.com/maps?q=1000 S 178TH STREET,+OMAHA,+NE+68118&hl=en"
DOUGLAS COUNTY SHERIFF'S DEPARTMENT,HYVEE,3410 N 156TH STREET,OMAHA,NE,68116,"http://maps.google.com/maps?q=3410 N 156TH STREET,+OMAHA,+NE+68116&hl=en"
DOUGLAS COUNTY SHERIFF'S DEPARTMENT,WALGREENS,13155 W CENTER RD,OMAHA,NE,68144,"http://maps.google.com/maps?q=13155 W CENTER RD,+OMAHA,+NE+68144&hl=en"
ESTHERVILLE POLICE DEPARTMENT,AVERA HOLY FAMILY HOSPITAL NORTH ENTRANCE,826 N 8TH STREET,ESTHERVILLE,IA,51334,"http://maps.google.com/maps?q=826 N 8TH STREET,+ESTHERVILLE,+IA+51334&hl=en"
FREMONT POLICE DEPARTMENT,BAKERS STORE PAKING LOT(NO BOXES),1531 NORTH BELL ST,FREMONT,NE,68025,"http://maps.google.com/maps?q=1531 NORTH BELL ST,+FREMONT,+NE+68025&hl=en"
FREMONT POLICE DEPARTMENT,FREMONT POLICE DEPARTMENT LOBBY,725 N. PARK AVE,FREMONT,NE,68025,"http://maps.google.com/maps?q=725 N. PARK AVE,+FREMONT,+NE+68025&hl=en"
GRANT COUNTY SO,GRANT COUNTY SO,"10 2ND STREET, NE",ELBOW LAKE,MN,56531,"http://maps.google.com/maps?q=10 2ND STREET, NE,+ELBOW LAKE,+MN+56531&hl=en"
HAND COUNTY SHERIFF'S OFFICE,HAND COUNTY SHERIFF'S OFFICE NO BOXES,415 WEST 1ST AVENUESUITE 102,MILLER,SD,57362,"http://maps.google.com/maps?q=415 WEST 1ST AVENUE,+MILLER,+SD+57362&hl=en"
HARRISON COUNTY SHERIFF'S OFFICE,HARRISON COUNTY SHERIFF'S OFFICE LOBBY,111 S. FIRST AVE,LOGAN,IA,51546,"http://maps.google.com/maps?q=111 S. FIRST AVE,+LOGAN,+IA+51546&hl=en"
HURON POLICE DEPARTMENT,HURON POLICE DEPARTMENT SITE WILL BE LOCATED ON THE SOUTHSIDE OF CITY HALL,239 WISCONSIN AVE. SW,HURON,SD,57350,"http://maps.google.com/maps?q=239 WISCONSIN AVE. SW,+HURON,+SD+57350&hl=en"
KANDIYOHI COUNTY SO,KANDIYOHI COUNTY SO,2201 NE 23RD STREET SUITE 101,WILLMAR,MN,56201,"http://maps.google.com/maps?q=2201 NE 23RD STREET SUITE 101,+WILLMAR,+MN+56201&hl=en"
LA VISTA POLICE DEPARTMENT,LA VISTA POLICE DEPARTMENT,7701 S 96TH STREET,LA VISTA,NE,68128,"http://maps.google.com/maps?q=7701 S 96TH STREET,+LA VISTA,+NE+68128&hl=en"
LAC QUI PARLE SO,LAC QUI PARLE SHERIFF'S OFFICE,600 6TH STREET,MADISON,MN,56256,"http://maps.google.com/maps?q=600 6TH STREET,+MADISON,+MN+56256&hl=en"
LAKE COUNTY SHERIFF'S OFFICE,LAKE COUNTY SHERIFF'S OFFICE,219 NE 1ST STREET,MADISON,SD,57042,"http://maps.google.com/maps?q=219 NE 1ST STREET,+MADISON,+SD+57042&hl=en"
LINCOLN COUNTY SHERIFF'S OFFICE,HARRISBURG CITY HALL,301 E. WILLOW STREET,HARRISBURG,SD,57032,"http://maps.google.com/maps?q=301 E. WILLOW STREET,+HARRISBURG,+SD+57032&hl=en"
LONG PRAIRIE POLICE DEPARTMENT,LONG PRAIRIE POLICE DEPARTMENT,615 LAKE ST S,LONG PRAIRIE,MN,56347,"http://maps.google.com/maps?q=615 LAKE ST S,+LONG PRAIRIE,+MN+56347&hl=en"
LYON COUNTY SHERIFF'S OFFICE,LYON COUNTY SHERIFF'S OFFICE,410 SOUTH BOONE,ROCK RAPIDS,IA,51246,"http://maps.google.com/maps?q=410 SOUTH BOONE,+ROCK RAPIDS,+IA+51246&hl=en"
LYON COUNTY SO,LYON COUNTY SHERIFF'S OFFICE,611 WEST MAIN STREET,MARSHALL,MN,56258,"http://maps.google.com/maps?q=611 WEST MAIN STREET,+MARSHALL,+MN+56258&hl=en"
MANSON POLICE DEPARTMENT,MANSON POLICE DEPARTMENT LOBBY WILL BE OPEN FROM 7:00AM-2:30PM,1015 13TH STREET,MANSON,IA,50563,"http://maps.google.com/maps?q=1015 13TH STREET,+MANSON,+IA+50563&hl=en"
MISSOURI VALLEY POLICE DEPARTMENT,RAND COMMUNITY CENTER,100 S. 4TH ST,MISSOURI VALLEY,IA,51555,"http://maps.google.com/maps?q=100 S. 4TH ST,+MISSOURI VALLEY,+IA+51555&hl=en"
MONTEVIDEO PD,MONTEVIDEO POLICE DEPARTMENT,103 CANTON AVENUE,MONTEVIDEO,MN,56265,"http://maps.google.com/maps?q=103 CANTON AVENUE,+MONTEVIDEO,+MN+56265&hl=en"
MOORHEAD POLICE DEPARTMENT,HORNBACHERS PARKING LOT 12PM-2PM,950 40TH AVENUE SOUTH,MOORHEAD,MN,56560,"http://maps.google.com/maps?q=950 40TH AVENUE SOUTH,+MOORHEAD,+MN+56560&hl=en"
MOORHEAD POLICE DEPARTMENT,WALGREENS PARKING LOT 10AM -12PM,900 MAIN AVENUE,MOORHEAD,MN,56560,"http://maps.google.com/maps?q=900 MAIN AVENUE,+MOORHEAD,+MN+56560&hl=en"
OMAHA POLICE DEPT.-NW PRECINCT,FAMILY FARE SUPERMARKET,3026 S 24TH STREET,OMAHA,NE,68108,"http://maps.google.com/maps?q=3026 S 24TH STREET,+OMAHA,+NE+68108&hl=en"
OMAHA POLICE DEPT.-NW PRECINCT,HYVEE,747 N 132ND ST,OMAHA,NE,68154,"http://maps.google.com/maps?q=747 N 132ND ST,+OMAHA,+NE+68154&hl=en"
OMAHA POLICE DEPT.-NW PRECINCT,HYVEE,8809 W CENTER ROAD,OMAHA,NE,68124,"http://maps.google.com/maps?q=8809 W CENTER ROAD,+OMAHA,+NE+68124&hl=en"
OMAHA POLICE DEPT.-NW PRECINCT,WALGREENS,3005 LAKE ST,OMAHA,NE,68111,"http://maps.google.com/maps?q=3005 LAKE ST,+OMAHA,+NE+68111&hl=en"
OSCEOLA COUNTY SHERIFF OFFICE,OSCEOLA COUNTY SHERIFF OFFICE,309 6TH STREET,SIBLEY,IA,51249,"http://maps.google.com/maps?q=309 6TH STREET,+SIBLEY,+IA+51249&hl=en"
PALO ALTO COUNTY SHERIFF'S OFFICE,PALO ALTO COUNTY SHERIFF'S OFFICE NO BOXES,2001 11TH STREET,EMMETSBURG,IA,50536,"http://maps.google.com/maps?q=2001 11TH STREET,+EMMETSBURG,+IA+50536&hl=en"
POTTAWATTAMIE COUNTY SHERIFF'S OFFICE,OAKLAND COMMUNITY CENTER,614 DR. VAN ZEE ROAD,OAKLAND,IA,51560,"http://maps.google.com/maps?q=614 DR. VAN ZEE ROAD,+OAKLAND,+IA+51560&hl=en"
RALSTON POLICE DEPARTMENT,WALGREENS 84TH & HARRISON,8380 HARRISON STREET,RALSTON,NE,68127,"http://maps.google.com/maps?q=8380 HARRISON STREET,+RALSTON,+NE+68127&hl=en"
RENVILLE COUNTY SO,RENVILLE COUNTY SHERIFF'S OFFICE,"105 5TH STREET SOUTH, SUITE #210",OLIVIA,MN,56277,"http://maps.google.com/maps?q=105 5TH STREET SOUTH, SUITE #210,+OLIVIA,+MN+56277&hl=en"
ROCK COUNTY SO,ROCK COUNTY SO,1000 NORTH BLUE MOUND AVENUE,LUVERNE,MN,56156,"http://maps.google.com/maps?q=1000 NORTH BLUE MOUND AVENUE,+LUVERNE,+MN+56156&hl=en"
SARPY COUNTY SHERIFF'S OFFICE,HY-VEE GROCERY STORE (SHADOW LAKE) NORTH PARKING LOT,11650 S. 73RD STREET,PAPILLION,NE,68046,"http://maps.google.com/maps?q=11650 S. 73RD STREET,+PAPILLION,+NE+68046&hl=en"
SIOUX CITY POLICE DEPARTMENT,DRILLING PHARMACY,4010 MORNINGSIDE AVE,SIOUX CITY,IA,51106,"http://maps.google.com/maps?q=4010 MORNINGSIDE AVE,+SIOUX CITY,+IA+51106&hl=en"
SIOUX CITY POLICE DEPARTMENT,FAREWAY GROCERY STORE,4040 WAR EAGLE DRIVE,SIOUX CITY,IA,51109,"http://maps.google.com/maps?q=4040 WAR EAGLE DRIVE,+SIOUX CITY,+IA+51109&hl=en"
SIOUX CITY POLICE DEPARTMENT,HY VEE FOOD STORES,2827 HAMILTON BLVD.,SIOUX CITY,IA,51103,"http://maps.google.com/maps?q=2827 HAMILTON BLVD.,+SIOUX CITY,+IA+51103&hl=en"
SIOUX CITY POLICE DEPARTMENT,HY-VEE,4500 SERGEANT ROAD,SIOUX CITY,IA,51106,"http://maps.google.com/maps?q=4500 SERGEANT ROAD,+SIOUX CITY,+IA+51106&hl=en"
SIOUX CITY POLICE DEPARTMENT,TARGET,5775 SUNNYBROOK DRIVE,SIOUX CITY,IA,51101,"http://maps.google.com/maps?q=5775 SUNNYBROOK DRIVE,+SIOUX CITY,+IA+51101&hl=en"
SIOUX CITY POLICE DEPARTMENT,WALGREENS,101 PIERCE STREET,SIOUX CITY,IA,51101,"http://maps.google.com/maps?q=101 PIERCE STREET,+SIOUX CITY,+IA+51101&hl=en"
SIOUX CITY POLICE DEPARTMENT,WALMART,3101 FLOYD BLVD.,SIOUX CITY,IA,51104,"http://maps.google.com/maps?q=3101 FLOYD BLVD.,+SIOUX CITY,+IA+51104&hl=en"
SIOUX COUNTY SHERIFF'S OFFICE,SIOUX COUNTY SHERIFF'S OFFICE LOBBY,4363 IRONWOOD AVE,ORANGE CITY,IA,51041,"http://maps.google.com/maps?q=4363 IRONWOOD AVE,+ORANGE CITY,+IA+51041&hl=en"
SPENCER POLICE DEPARTMENT,SPENCER POLICE DEPARTMENT 11:00AM - 1:00PM,712 GRAND AVE,SPENCER,IA,51301,"http://maps.google.com/maps?q=712 GRAND AVE,+SPENCER,+IA+51301&hl=en"
SPIRIT LAKE POLICE DEPARTMENT,HY-VEE,1500 18TH STREET,SPIRIT LAKE,IA,51360,"http://maps.google.com/maps?q=1500 18TH STREET,+SPIRIT LAKE,+IA+51360&hl=en"
TRAVERSE COUNTY SO,TRAVERSE COUNTY SHERIFF'S OFFICE,203 7TH STREET NORTH,WHEATON,MN,56296,"http://maps.google.com/maps?q=203 7TH STREET NORTH,+WHEATON,+MN+56296&hl=en"
WATERTOWN POLICE DEPARTMENT,WATERTOWN POLICE DEPARTMENT,128 MAPLE ST. N,WATERTOWN,SD,57201,"http://maps.google.com/maps?q=128 MAPLE ST. N,+WATERTOWN,+SD+57201&hl=en"
WILKIN COUNTY SHERIFF'S OFFICE,WILKIN COUNTY SHERIFF'S OFFICE,515 DACOTAH AVENUE,BRECKENRIDGE,MN,56520,"http://maps.google.com/maps?q=515 DACOTAH AVENUE,+BRECKENRIDGE,+MN+56520&hl=en"
WINNER POLICE DEPT,"WINNER POLICE DEPARTMENT NO BOXES NEEDED, PER PAUL SCHUETH",217 EAST 3RD ST,WINNER,SD,57580,"http://maps.google.com/maps?q=217 EAST 3RD ST,+WINNER,+SD+57580&hl=en"
