Participant,CollectionSite,Address,City,State,Zip,MapURL
ALTOONA POLICE DEPARTMENT,ALTOONA FIRE DEPT,950 VENBURY DRIVE,ALTOONA,IA,50009,"http://maps.google.com/maps?q=950 VENBURY DRIVE,+ALTOONA,+IA+50009&hl=en"
AMES IOWA POLICE DEPARMENT,CITY HALL 1ST FLR WEST SIDE OF BLDG,515 CLARK AVE,AMES,IA,50010,"http://maps.google.com/maps?q=515 CLARK AVE,+AMES,+IA+50010&hl=en"
ANKENY POLICE DEPARTMENT,ANKENY POLICE DEPARTMENT,411 SW ORDNANCE RD,ANKENY,IA,50023,"http://maps.google.com/maps?q=411 SW ORDNANCE RD,+ANKENY,+IA+50023&hl=en"
ANTELOPE CO SHERIFF DEPT,ANTELOPE COUNTY SHERIFF DEPT,1102 L ST,NELIGH,NE,68756,"http://maps.google.com/maps?q=1102 L ST,+NELIGH,+NE+68756&hl=en"
APPLE VALLEY PD,APPLE VALLEY PD,7100 147TH STREET WEST,APPLE VALLEY,MN,55124,"http://maps.google.com/maps?q=7100 147TH STREET WEST,+APPLE VALLEY,+MN+55124&hl=en"
ARLINGTON PD,ARLINGTON POLICE DEPARTMENT,108 4TH AVENUE NW,ARLINGTON,MN,55307,"http://maps.google.com/maps?q=108 4TH AVENUE NW,+ARLINGTON,+MN+55307&hl=en"
ATLANTIC POLICE DEPARTMENT,ATLANTIC POLICE DEPARTMENT NATHAN L KINNEY,23 E 4TH STREET,ATLANTIC,IA,50022,"http://maps.google.com/maps?q=23 E 4TH STREET,+ATLANTIC,+IA+50022&hl=en"
BLAIR POLICE DEPARTMENT,BLAIR POLICE DEPARTMENT,1730 LINCOLN STREET,BLAIR,NE,68008,"http://maps.google.com/maps?q=1730 LINCOLN STREET,+BLAIR,+NE+68008&hl=en"
BLOOMINGTON PD,BLOOMINGTON PD,1800 W OLD SHAKOPEE ROAD,BLOOMINGTON,MN,55431,"http://maps.google.com/maps?q=1800 W OLD SHAKOPEE ROAD,+BLOOMINGTON,+MN+55431&hl=en"
BOONE IOWA POLICE DEPARTMENT,BOONE POLICE DEPARTMENT 10:00 AM-12:00 PM.,525 STORY STREET,BOONE,IA,50036,"http://maps.google.com/maps?q=525 STORY STREET,+BOONE,+IA+50036&hl=en"
BRANDON POLICE DEPARTMENT,BRANDON POLICE DEPT.,304 S MAIN AVE.,BRANDON,SD,57005,"http://maps.google.com/maps?q=304 S MAIN AVE.,+BRANDON,+SD+57005&hl=en"
BROOKINGS COUNTY SHERIFF'S OFFICE,BROOKINGS COUNTY SHERIFF'S OFFICE,315 7TH AVENUE,BROOKINGS,SD,57006,"http://maps.google.com/maps?q=315 7TH AVENUE,+BROOKINGS,+SD+57006&hl=en"
BUENA VISTA COUNTY SHERIFF'S OFFICE,NEWELL CITY HALL,207 E 2ND STREET,NEWELL,IA,50568,"http://maps.google.com/maps?q=207 E 2ND STREET,+NEWELL,+IA+50568&hl=en"
BUENA VISTA COUNTY SHERIFF'S OFFICE,SIOUX RAPIDS CITY HALL,100 FRONT STREET,SIOUX RAPIDS,IA,50585,"http://maps.google.com/maps?q=100 FRONT STREET,+SIOUX RAPIDS,+IA+50585&hl=en"
BUENA VISTA COUNTY SHERIFF'S OFFICE,WALMART,1831 LAKE AVE,STORM LAKE,IA,50588,"http://maps.google.com/maps?q=1831 LAKE AVE,+STORM LAKE,+IA+50588&hl=en"
BURNSVILLE PD,BURNSVILLE POLICE DEPARTMENT,100 CIVIC CENTER PARKWAY,BURNSVILLE,MN,55337,"http://maps.google.com/maps?q=100 CIVIC CENTER PARKWAY,+BURNSVILLE,+MN+55337&hl=en"
CARLISLE POLICE DEPARTMENT,CARLISLE FIRE DEPARTMENT,135 N. 2ND STREET,CARLISLE,IA,50047,"http://maps.google.com/maps?q=135 N. 2ND STREET,+CARLISLE,+IA+50047&hl=en"
CARVER COUNTY SHERIFF'S OFFICE,CITY OF CARVER CARVER PLACE,113 3RD STREET EAST,CARVER,MN,55315,"http://maps.google.com/maps?q=113 3RD STREET EAST,+CARVER,+MN+55315&hl=en"
CARVER COUNTY SHERIFF'S OFFICE,CITY OF VICTORIA REC CENTER,8475 KOCHIA LANE,VICTORIA,MN,55386,"http://maps.google.com/maps?q=8475 KOCHIA LANE,+VICTORIA,+MN+55386&hl=en"
CHEROKEE COUNTY SHERIFF'S OFFICE,CHEROKEE COUNTY LAW ENFORCEMENT CENTER CHEROKEE COUNTY SHERIFF'S OFFICE,111 N 5TH ST.,CHEROKEE,IA,51012,"http://maps.google.com/maps?q=111 N 5TH ST.,+CHEROKEE,+IA+51012&hl=en"
COTTONWOOD COUNTY SHERIFF'S OFFICE,COTTONWOOD COUNTY SHERIFFS OFFICE,902 5TH AVENUE,WINDOM,MN,56101,"http://maps.google.com/maps?q=902 5TH AVENUE,+WINDOM,+MN+56101&hl=en"
COUNCIL BLUFFS POLICE DEPARTMENT,WALGREENS,535 E BROADWAY,COUNCIL BLUFFS,IA,51503,"http://maps.google.com/maps?q=535 E BROADWAY,+COUNCIL BLUFFS,+IA+51503&hl=en"
DAKOTA COUNTY SO,DAKOTA COUNTY SHERIFFS OFFICE,1580 HIGHWAY 55,HASTINGS,MN,55033,"http://maps.google.com/maps?q=1580 HIGHWAY 55,+HASTINGS,+MN+55033&hl=en"
DOUGLAS COUNTY SHERIFF'S DEPARTMENT,HYVEE,1000 S 178TH STREET,OMAHA,NE,68118,"http://maps.google.com/maps?q=1000 S 178TH STREET,+OMAHA,+NE+68118&hl=en"
DOUGLAS COUNTY SHERIFF'S DEPARTMENT,HYVEE,3410 N 156TH STREET,OMAHA,NE,68116,"http://maps.google.com/maps?q=3410 N 156TH STREET,+OMAHA,+NE+68116&hl=en"
DOUGLAS COUNTY SHERIFF'S DEPARTMENT,WALGREENS,13155 W CENTER RD,OMAHA,NE,68144,"http://maps.google.com/maps?q=13155 W CENTER RD,+OMAHA,+NE+68144&hl=en"
EDEN PRAIRIE PD,EDEN PRAIRIE SENIOR CENTER,8950 EDEN PRAIRIE ROAD,EDEN PRAIRIE,MN,55347,"http://maps.google.com/maps?q=8950 EDEN PRAIRIE ROAD,+EDEN PRAIRIE,+MN+55347&hl=en"
ESTHERVILLE POLICE DEPARTMENT,AVERA HOLY FAMILY HOSPITAL NORTH ENTRANCE,826 N 8TH STREET,ESTHERVILLE,IA,51334,"http://maps.google.com/maps?q=826 N 8TH STREET,+ESTHERVILLE,+IA+51334&hl=en"
FARIBAULT COUNTY SO,FARIBAULT COUNTY SO,320 DR. H. RUSS STREET,BLUE EARTH,MN,56013,"http://maps.google.com/maps?q=320 DR. H. RUSS STREET,+BLUE EARTH,+MN+56013&hl=en"
FREEBORN COUNTY SO/ALBERT LEA PD,FREEBORN COUNTY FAIRGROUNDS,1029 BRIDGE AVENUE,ALBERT LEA,MN,56007,"http://maps.google.com/maps?q=1029 BRIDGE AVENUE,+ALBERT LEA,+MN+56007&hl=en"
FREMONT POLICE DEPARTMENT,BAKERS STORE PAKING LOT(NO BOXES),1531 NORTH BELL ST,FREMONT,NE,68025,"http://maps.google.com/maps?q=1531 NORTH BELL ST,+FREMONT,+NE+68025&hl=en"
FREMONT POLICE DEPARTMENT,FREMONT POLICE DEPARTMENT LOBBY,725 N. PARK AVE,FREMONT,NE,68025,"http://maps.google.com/maps?q=725 N. PARK AVE,+FREMONT,+NE+68025&hl=en"
GLENWOOD POLICE DEPARTMENT,MEDICAP PHARMACY,1206 S LOCUST,GLENWOOD,IA,51534,"http://maps.google.com/maps?q=1206 S LOCUST,+GLENWOOD,+IA+51534&hl=en"
HAMILTON COUNTY SHERIFF'S OFFICE,HY-VEE FOOD STORE,823 2ND STREET,WEBSTER CITY,IA,50595,"http://maps.google.com/maps?q=823 2ND STREET,+WEBSTER CITY,+IA+50595&hl=en"
HARRISON COUNTY SHERIFF'S OFFICE,HARRISON COUNTY SHERIFF'S OFFICE LOBBY,111 S. FIRST AVE,LOGAN,IA,51546,"http://maps.google.com/maps?q=111 S. FIRST AVE,+LOGAN,+IA+51546&hl=en"
HURON POLICE DEPARTMENT,HURON POLICE DEPARTMENT SITE WILL BE LOCATED ON THE SOUTHSIDE OF CITY HALL,239 WISCONSIN AVE. SW,HURON,SD,57350,"http://maps.google.com/maps?q=239 WISCONSIN AVE. SW,+HURON,+SD+57350&hl=en"
JOHNSTON POLICE DEPARTMENT,JOHNSTON PUBLIC SAFETY BUILDING,6373 MERLE HAY ROAD,JOHNSTON,IA,50131,"http://maps.google.com/maps?q=6373 MERLE HAY ROAD,+JOHNSTON,+IA+50131&hl=en"
JORDAN PD,JORDAN POLICE DEPARTMENT LOBBY: OPEN DAILY FROM 8AM TO 8PM,705 SYNDICATE STREET,JORDAN,MN,55352,"http://maps.google.com/maps?q=705 SYNDICATE STREET,+JORDAN,+MN+55352&hl=en"
KOSSUTH COUNTY SHERIFF'S OFFICE,HY VEE FOOD STORE NO BOXES,1500 HYW.169 N.,ALGONA,IA,50511,"http://maps.google.com/maps?q=1500 HYW.169 N.,+ALGONA,+IA+50511&hl=en"
LA VISTA POLICE DEPARTMENT,LA VISTA POLICE DEPARTMENT,7701 S 96TH STREET,LA VISTA,NE,68128,"http://maps.google.com/maps?q=7701 S 96TH STREET,+LA VISTA,+NE+68128&hl=en"
LAKE COUNTY SHERIFF'S OFFICE,LAKE COUNTY SHERIFF'S OFFICE,219 NE 1ST STREET,MADISON,SD,57042,"http://maps.google.com/maps?q=219 NE 1ST STREET,+MADISON,+SD+57042&hl=en"
LAKE MILLS POLICE DEPARTMENT,LAKE MILLS POLICE DEPARTMENT,304 S. MILL STREET,LAKE MILLS,IA,50450,"http://maps.google.com/maps?q=304 S. MILL STREET,+LAKE MILLS,+IA+50450&hl=en"
LINCOLN COUNTY SHERIFF'S OFFICE,HARRISBURG CITY HALL,301 E. WILLOW STREET,HARRISBURG,SD,57032,"http://maps.google.com/maps?q=301 E. WILLOW STREET,+HARRISBURG,+SD+57032&hl=en"
LYON COUNTY SHERIFF'S OFFICE,LYON COUNTY SHERIFF'S OFFICE,410 SOUTH BOONE,ROCK RAPIDS,IA,51246,"http://maps.google.com/maps?q=410 SOUTH BOONE,+ROCK RAPIDS,+IA+51246&hl=en"
LYON COUNTY SO,LYON COUNTY SHERIFF'S OFFICE,611 WEST MAIN STREET,MARSHALL,MN,56258,"http://maps.google.com/maps?q=611 WEST MAIN STREET,+MARSHALL,+MN+56258&hl=en"
MADRID POLICE DEPARTMENT,MADRID CITY HALL,304 S WATER STREET,MADRID,IA,50156,"http://maps.google.com/maps?q=304 S WATER STREET,+MADRID,+IA+50156&hl=en"
MANSON POLICE DEPARTMENT,MANSON POLICE DEPARTMENT LOBBY WILL BE OPEN FROM 7:00AM-2:30PM,1015 13TH STREET,MANSON,IA,50563,"http://maps.google.com/maps?q=1015 13TH STREET,+MANSON,+IA+50563&hl=en"
"MINNESOTA STATE UNIVERSITY, MANKATO STUDENT HEALTH",MINNESOTA STATE UNIVERSITY MANKATO STUDENT HEALTH SERVICES,21 CARKOSKI COMMONS,MANKATO,MN,56001,"http://maps.google.com/maps?q=21 CARKOSKI COMMONS,+MANKATO,+MN+56001&hl=en"
MISSOURI VALLEY POLICE DEPARTMENT,RAND COMMUNITY CENTER,100 S. 4TH ST,MISSOURI VALLEY,IA,51555,"http://maps.google.com/maps?q=100 S. 4TH ST,+MISSOURI VALLEY,+IA+51555&hl=en"
MONTGOMERY COUNTY SHERIFFS OFFICE,HY VEE PHARMACY,1605 N BROADWAY ST,RED OAK,IA,51566,"http://maps.google.com/maps?q=1605 N BROADWAY ST,+RED OAK,+IA+51566&hl=en"
OMAHA POLICE DEPT.-NW PRECINCT,FAMILY FARE SUPERMARKET,3026 S 24TH STREET,OMAHA,NE,68108,"http://maps.google.com/maps?q=3026 S 24TH STREET,+OMAHA,+NE+68108&hl=en"
OMAHA POLICE DEPT.-NW PRECINCT,HYVEE,747 N 132ND ST,OMAHA,NE,68154,"http://maps.google.com/maps?q=747 N 132ND ST,+OMAHA,+NE+68154&hl=en"
OMAHA POLICE DEPT.-NW PRECINCT,HYVEE,8809 W CENTER ROAD,OMAHA,NE,68124,"http://maps.google.com/maps?q=8809 W CENTER ROAD,+OMAHA,+NE+68124&hl=en"
OMAHA POLICE DEPT.-NW PRECINCT,WALGREENS,3005 LAKE ST,OMAHA,NE,68111,"http://maps.google.com/maps?q=3005 LAKE ST,+OMAHA,+NE+68111&hl=en"
OSCEOLA COUNTY SHERIFF OFFICE,OSCEOLA COUNTY SHERIFF OFFICE,309 6TH STREET,SIBLEY,IA,51249,"http://maps.google.com/maps?q=309 6TH STREET,+SIBLEY,+IA+51249&hl=en"
OSCEOLA POLICE DEPARTMENT,HYVEE,510 W MCLANE STREET,OSCEOLA,IA,50213,"http://maps.google.com/maps?q=510 W MCLANE STREET,+OSCEOLA,+IA+50213&hl=en"
PALO ALTO COUNTY SHERIFF'S OFFICE,PALO ALTO COUNTY SHERIFF'S OFFICE NO BOXES,2001 11TH STREET,EMMETSBURG,IA,50536,"http://maps.google.com/maps?q=2001 11TH STREET,+EMMETSBURG,+IA+50536&hl=en"
PERRY POLICE DEPARTMENT,HY-VEE STORE,1215 HWY. 141,PERRY,IA,50220,"http://maps.google.com/maps?q=1215 HWY. 141,+PERRY,+IA+50220&hl=en"
POLK COUNTY SHERIFF'S OFFICE,CVS,104 E 1ST STREET,ANKENY,IA,50023,"http://maps.google.com/maps?q=104 E 1ST STREET,+ANKENY,+IA+50023&hl=en"
POLK COUNTY SHERIFF'S OFFICE,CVS,215 EUCLID AVE,DES MOINES,IA,50310,"http://maps.google.com/maps?q=215 EUCLID AVE,+DES MOINES,+IA+50310&hl=en"
POTTAWATTAMIE COUNTY SHERIFF'S OFFICE,OAKLAND COMMUNITY CENTER,614 DR. VAN ZEE ROAD,OAKLAND,IA,51560,"http://maps.google.com/maps?q=614 DR. VAN ZEE ROAD,+OAKLAND,+IA+51560&hl=en"
RALSTON POLICE DEPARTMENT,WALGREENS 84TH & HARRISON,8380 HARRISON STREET,RALSTON,NE,68127,"http://maps.google.com/maps?q=8380 HARRISON STREET,+RALSTON,+NE+68127&hl=en"
RENVILLE COUNTY SO,RENVILLE COUNTY SHERIFF'S OFFICE,"105 5TH STREET SOUTH, SUITE #210",OLIVIA,MN,56277,"http://maps.google.com/maps?q=105 5TH STREET SOUTH, SUITE #210,+OLIVIA,+MN+56277&hl=en"
RINGGOLD COUNTY SHERIFF'S OFFICE,RINGGOLD CO SHERIFF'S OFFICE NO BOXES-SEND SHIPPING LABELS,801 W. SOUTH ST.,MOUNT AYR,IA,50854,"http://maps.google.com/maps?q=801 W. SOUTH ST.,+MOUNT AYR,+IA+50854&hl=en"
ROCK COUNTY SO,ROCK COUNTY SO,1000 NORTH BLUE MOUND AVENUE,LUVERNE,MN,56156,"http://maps.google.com/maps?q=1000 NORTH BLUE MOUND AVENUE,+LUVERNE,+MN+56156&hl=en"
SARPY COUNTY SHERIFF'S OFFICE,HY-VEE GROCERY STORE (SHADOW LAKE) NORTH PARKING LOT,11650 S. 73RD STREET,PAPILLION,NE,68046,"http://maps.google.com/maps?q=11650 S. 73RD STREET,+PAPILLION,+NE+68046&hl=en"
SIOUX CITY POLICE DEPARTMENT,DRILLING PHARMACY,4010 MORNINGSIDE AVE,SIOUX CITY,IA,51106,"http://maps.google.com/maps?q=4010 MORNINGSIDE AVE,+SIOUX CITY,+IA+51106&hl=en"
SIOUX CITY POLICE DEPARTMENT,FAREWAY GROCERY STORE,4040 WAR EAGLE DRIVE,SIOUX CITY,IA,51109,"http://maps.google.com/maps?q=4040 WAR EAGLE DRIVE,+SIOUX CITY,+IA+51109&hl=en"
SIOUX CITY POLICE DEPARTMENT,HY VEE FOOD STORES,2827 HAMILTON BLVD.,SIOUX CITY,IA,51103,"http://maps.google.com/maps?q=2827 HAMILTON BLVD.,+SIOUX CITY,+IA+51103&hl=en"
SIOUX CITY POLICE DEPARTMENT,HY-VEE,4500 SERGEANT ROAD,SIOUX CITY,IA,51106,"http://maps.google.com/maps?q=4500 SERGEANT ROAD,+SIOUX CITY,+IA+51106&hl=en"
SIOUX CITY POLICE DEPARTMENT,TARGET,5775 SUNNYBROOK DRIVE,SIOUX CITY,IA,51101,"http://maps.google.com/maps?q=5775 SUNNYBROOK DRIVE,+SIOUX CITY,+IA+51101&hl=en"
SIOUX CITY POLICE DEPARTMENT,WALGREENS,101 PIERCE STREET,SIOUX CITY,IA,51101,"http://maps.google.com/maps?q=101 PIERCE STREET,+SIOUX CITY,+IA+51101&hl=en"
SIOUX CITY POLICE DEPARTMENT,WALMART,3101 FLOYD BLVD.,SIOUX CITY,IA,51104,"http://maps.google.com/maps?q=3101 FLOYD BLVD.,+SIOUX CITY,+IA+51104&hl=en"
SIOUX COUNTY SHERIFF'S OFFICE,SIOUX COUNTY SHERIFF'S OFFICE LOBBY,4363 IRONWOOD AVE,ORANGE CITY,IA,51041,"http://maps.google.com/maps?q=4363 IRONWOOD AVE,+ORANGE CITY,+IA+51041&hl=en"
SPENCER POLICE DEPARTMENT,SPENCER POLICE DEPARTMENT 11:00AM - 1:00PM,712 GRAND AVE,SPENCER,IA,51301,"http://maps.google.com/maps?q=712 GRAND AVE,+SPENCER,+IA+51301&hl=en"
SPIRIT LAKE POLICE DEPARTMENT,HY-VEE,1500 18TH STREET,SPIRIT LAKE,IA,51360,"http://maps.google.com/maps?q=1500 18TH STREET,+SPIRIT LAKE,+IA+51360&hl=en"
URBANDALE POLICE DEPARTMENT,URBANDALE POLICE DEPARTMENT 8:00AM-2:00PM,3740 86TH ST,URBANDALE,IA,50322,"http://maps.google.com/maps?q=3740 86TH ST,+URBANDALE,+IA+50322&hl=en"
WARREN COUNTY SHERIFF'S OFFICE,WARREN COUNTY SHERIFF'S OFFICE,115 N HOWARD ST.,INDIANOLA,IA,50125,"http://maps.google.com/maps?q=115 N HOWARD ST.,+INDIANOLA,+IA+50125&hl=en"
WAUKEE POLICE DEPARTMENT,WAUKEE POLICE DEPARTMENT,1300 SE LA GRANT PKWY,WAUKEE,IA,50263,"http://maps.google.com/maps?q=1300 SE LA GRANT PKWY,+WAUKEE,+IA+50263&hl=en"
WEBSTER COUNTY SHERIFF'S OFFICE,DANIEL PHARMACY 10AM-12PM,1114 CENTRAL AVE,FORT DODGE,IA,50501,"http://maps.google.com/maps?q=1114 CENTRAL AVE,+FORT DODGE,+IA+50501&hl=en"
WEBSTER COUNTY SHERIFF'S OFFICE,HY VEE PHARMACY,115 29TH ST,FORT DODGE,IA,50501,"http://maps.google.com/maps?q=115 29TH ST,+FORT DODGE,+IA+50501&hl=en"
WEST DES MOINES POLICE DEPARTMENT,WEST DES MOINES POLICE DEPARTMENT,250 MILLS CIVIC PKWY,WEST DES MOINES,IA,50265,"http://maps.google.com/maps?q=250 MILLS CIVIC PKWY,+WEST DES MOINES,+IA+50265&hl=en"
WINDSOR HEIGHTS POLICE DEPARTMENT,WINDSOR HEIGHTS POLICE DEPARTMENT,1133 66TH STREET,WINDSOR HEIGHTS,IA,50324,"http://maps.google.com/maps?q=1133 66TH STREET,+WINDSOR HEIGHTS,+IA+50324&hl=en"
WINNEBAGO COUNTY SHERIFF'S OFFICE,WINNEBAGO COUNTY SHERIFF'S OFFICE,935 HWY. 69 NORTH,FOREST CITY,IA,50436,"http://maps.google.com/maps?q=935 HWY. 69 NORTH,+FOREST CITY,+IA+50436&hl=en"
WRIGHT COUNTY SHERIFF'S OFFICE,IOWA SPECIALTY HOSPITAL EVENT ON 10/26/18 FROM 10AM-12PM,1316 S MAIN STREET,CLARION,IA,50525,"http://maps.google.com/maps?q=1316 S MAIN STREET,+CLARION,+IA+50525&hl=en"
