Participant,CollectionSite,Address,City,State,Zip,MapURL
ALEXANDRIA POLICE DEPARTMENT,ALEXANDRIA POLICE DEPARTMENT/COMMUNITY CENTER,8236 W. MAIN ST,ALEXANDRIA,KY,41001,"http://maps.google.com/maps?q=8236 W. MAIN ST,+ALEXANDRIA,+KY+41001&hl=en"
AMBERLEY VILLAGE,AMBERLEY VILLAGE FIRE DEPARTMENT,7149 RIDGE ROAD,CINCINNATI,OH,45237,"http://maps.google.com/maps?q=7149 RIDGE ROAD,+CINCINNATI,+OH+45237&hl=en"
"ANDERSON COUNTY, KY SHERIFF",ANDERSON APOTHECARY,90 PLAZA DRIVE,LAWRENCEBURG,KY,40342,"http://maps.google.com/maps?q=90 PLAZA DRIVE,+LAWRENCEBURG,+KY+40342&hl=en"
ASHE COUNTY SHERIFF'S OFFICE,WARRENSVILLE DRUG,5121 NC HIGHWAY 88 W,WARRENSVILLE,NC,28693,"http://maps.google.com/maps?q=5121 NC HIGHWAY 88 W,+WARRENSVILLE,+NC+28693&hl=en"
ASHLAND KY POLICE,ASHLAND KY POLICE,201 17TH STREET,ASHLAND,KY,41101,"http://maps.google.com/maps?q=201 17TH STREET,+ASHLAND,+KY+41101&hl=en"
ATHENS POLICE DEPARTMENT,ATHENS ELKS LODGE PARKING LOT,600 WEST UNION STREET,ATHENS,OH,45701,"http://maps.google.com/maps?q=600 WEST UNION STREET,+ATHENS,+OH+45701&hl=en"
BECKLEY POLICE DEPARTMENT,RALEIGH COUNTY COMMISSION ON AGING,1614 SOUTH KANAWHA STREET,BECKLEY,WV,25801,"http://maps.google.com/maps?q=1614 SOUTH KANAWHA STREET,+BECKLEY,+WV+25801&hl=en"
BEXLEY POLICE DEPARTMENT,BEXLEY POLICE DEPARTMENT DAWN OVERLY,559 NORTH CASSINGHAM ROADBEXLEY,COLUMBUS,OH,43209,"http://maps.google.com/maps?q=559 NORTH CASSINGHAM ROAD,+COLUMBUS,+OH+43209&hl=en"
BIG STONE GAP POLICE DEPARTMENT,FOOD CITY,603 WOOD AVE W,BIG STONE GAP,VA,24219,"http://maps.google.com/maps?q=603 WOOD AVE W,+BIG STONE GAP,+VA+24219&hl=en"
BLUE ASH POLICE DEPARTMENT,BLUE ASH MUNICIPAL AND SAFETY CENTER FRONT PARKING LOT,4343 COOPER RD,BLUE ASH,OH,45242,"http://maps.google.com/maps?q=4343 COOPER RD,+BLUE ASH,+OH+45242&hl=en"
BOONE COUNTY SHERIFF'S OFFICE,BOONE COUNTY SHERIFF'S OFFICE COUNTY COURTHOUSE,200 STATE STREET,MADISON,WV,25130,"http://maps.google.com/maps?q=200 STATE STREET,+MADISON,+WV+25130&hl=en"
BOONE COUNTY SHERIFF'S OFFICE,JOHN SLACK PARK SHERIFF W WHITE,SR#3GENERAL DELIVERY,RACINE,WV,25165,"http://maps.google.com/maps?q=SR#3,+RACINE,+WV+25165&hl=en"
BOONE COUNTY SHERIFFS OFFICE,BOONE COUNTY SHERIFFS OFFICE SIDE PARKING LOT,3000 CONRAD LANE,BURLINGTON,KY,41005,"http://maps.google.com/maps?q=3000 CONRAD LANE,+BURLINGTON,+KY+41005&hl=en"
BOONE COUNTY SHERIFFS OFFICE,UNION CITY BUILDING PARKING LOT,1843 MOUNT ZION RD,UNION,KY,41091,"http://maps.google.com/maps?q=1843 MOUNT ZION RD,+UNION,+KY+41091&hl=en"
BOONE COUNTY SHERIFFS OFFICE,WALTON KENTUCKY CITY BUILDING PARKING LOT,40 NORTH MAIN STREET,WALTON,KY,41094,"http://maps.google.com/maps?q=40 NORTH MAIN STREET,+WALTON,+KY+41094&hl=en"
BRACKEN COUNTY SHERIFF OFFICE,BRACKEN COUNTY FISCAL COURTHOUSE,116 W MIAMI STREET,BROOKSVILLE,KY,41004,"http://maps.google.com/maps?q=116 W MIAMI STREET,+BROOKSVILLE,+KY+41004&hl=en"
BRISTOL SHERIFF'S OFFICE,FOOD CITY NEAR FRONT ENTRANCE,1320 EUCLID AVE,BRISTOL,VA,24201,"http://maps.google.com/maps?q=1320 EUCLID AVE,+BRISTOL,+VA+24201&hl=en"
BRISTOL TENNESSEE POLICE DEPARTMENT,BRISTOL POLICE DEPARTMENT MUNICIPAL PARKING LOT,801 ANDERSON STREET,BRISTOL,TN,37620,"http://maps.google.com/maps?q=801 ANDERSON STREET,+BRISTOL,+TN+37620&hl=en"
BROWN COUNTY SHERIFF OFFICE,BROWN COUNTY SHERIFFS OFFICE PARKING LOT,750 MOUNT ORAB PIKE,GEORGETOWN,OH,45121,"http://maps.google.com/maps?q=750 MOUNT ORAB PIKE,+GEORGETOWN,+OH+45121&hl=en"
BROWN COUNTY SHERIFF OFFICE,ORSCHELN FARM & HOME PARKING LOT,206 STERLING RUN BLVD,MOUNT ORAB,OH,45154,"http://maps.google.com/maps?q=206 STERLING RUN BLVD,+MOUNT ORAB,+OH+45154&hl=en"
BUCHANAN COUNTY SHERIFF'S OFFICE,FOOD CITY PHARMACY VANSANT FOOD CITY,18765 RIVERSIDE DRIVE,VANSANT,VA,24656,"http://maps.google.com/maps?q=18765 RIVERSIDE DRIVE,+VANSANT,+VA+24656&hl=en"
BUTLER COUNTY SHERIFF'S OFFICE,KROGER MARKETPLACE,7300 YANKEE RD,MIDDLETOWN,OH,45044,"http://maps.google.com/maps?q=7300 YANKEE RD,+MIDDLETOWN,+OH+45044&hl=en"
BUTLER COUNTY SHERIFF'S OFFICE,LIBERTY TWP. PRINCETON GLENDALE FIRE STATION,6682 PRINCETON-GLENDALE RD.,HAMILTON,OH,45011,"http://maps.google.com/maps?q=6682 PRINCETON-GLENDALE RD.,+HAMILTON,+OH+45011&hl=en"
BUTLER TOWNSHIP POLICE DEPARTMENT,BUTLER TOWNSHIP POLICE DEPARTMENT MAIN LOBBY,3510 SUDACHI DR,DAYTON,OH,45414,"http://maps.google.com/maps?q=3510 SUDACHI DR,+DAYTON,+OH+45414&hl=en"
CABELL COUNTY SHERIFF,DRUG EMPORIUM,3 MALL ROAD,BARBOURSVILLE,WV,25504,"http://maps.google.com/maps?q=3 MALL ROAD,+BARBOURSVILLE,+WV+25504&hl=en"
CALHOUN COUNTY SHERIFF,CALHOUN COUNTY SHERIFF,363 MAIN STSTE 204,GRANTSVILLE,WV,26147,"http://maps.google.com/maps?q=363 MAIN ST,+GRANTSVILLE,+WV+26147&hl=en"
CARTER COUNTY SO,CARTER COUNTY SHERIFF'S OFFICE- LOBBY DRUG DROP BOX IN DETENTION CENTER LOBBY,900 3RD STREET,ELIZABETHTON,TN,37643,"http://maps.google.com/maps?q=900 3RD STREET,+ELIZABETHTON,+TN+37643&hl=en"
CARTER COUNTY SO,ELIZABETHTON POLICE DEPT,525 E F STREET,ELIZABETHTON,TN,37643,"http://maps.google.com/maps?q=525 E F STREET,+ELIZABETHTON,+TN+37643&hl=en"
CENTERVILLE POLICE DEPARTMENT,KROGER PARKING LOT,1095 S. MAIN ST.,CENTERVILLE,OH,45458,"http://maps.google.com/maps?q=1095 S. MAIN ST.,+CENTERVILLE,+OH+45458&hl=en"
CEREDO WV POLICE DEPT,CEREDO PD,766 B STREET,CEREDO,WV,25507,"http://maps.google.com/maps?q=766 B STREET,+CEREDO,+WV+25507&hl=en"
CHARLESTON POLICE DEPARTMENT,DOWNTOWN CHARLESTON YMCA,1114 QUARRIER ST,CHARLESTON,WV,25301,"http://maps.google.com/maps?q=1114 QUARRIER ST,+CHARLESTON,+WV+25301&hl=en"
CHARLESTON POLICE DEPARTMENT,DRUG EMPORIUM,1603 KANAWHA BLVDWEST,CHARLESTON,WV,25302,"http://maps.google.com/maps?q=1603 KANAWHA BLVDWEST,+CHARLESTON,+WV+25302&hl=en"
CHARLESTON POLICE DEPARTMENT,PIGGLY WIGGLY PARKING LOT,5003 MACCORKLE AVENUE SE,CHARLESTON,WV,25304,"http://maps.google.com/maps?q=5003 MACCORKLE AVENUE SE,+CHARLESTON,+WV+25304&hl=en"
CHARLESTON POLICE DEPARTMENT,RITE AID BRIDGE ROAD,1015 BRIDGE ROAD,CHARLESTON,WV,25314,"http://maps.google.com/maps?q=1015 BRIDGE ROAD,+CHARLESTON,+WV+25314&hl=en"
CHARLESTON POLICE DEPARTMENT,UNIV. OF CHARLESTON ROBERT C. BYRD SCHOOL OF PHARMACY,2300 MACCORKLE AVE,CHARLESTON,WV,25304,"http://maps.google.com/maps?q=2300 MACCORKLE AVE,+CHARLESTON,+WV+25304&hl=en"
CHARLESTON POLICE DEPARTMENT,WALGREENS DRUGSTORE PARKING LOT,655 WASHINGTON STREET W,CHARLESTON,WV,25302,"http://maps.google.com/maps?q=655 WASHINGTON STREET W,+CHARLESTON,+WV+25302&hl=en"
CHILHOWIE POLICE DEPARTMENT,GREEVER'S DRUG STORE INC.,106 WEST LEE HIGHWAY,CHILHOWIE,VA,24319,"http://maps.google.com/maps?q=106 WEST LEE HIGHWAY,+CHILHOWIE,+VA+24319&hl=en"
CHILLICOTHE POLICE DEPARTMENT,KROGER PARKING LOT,887 N BRIDGE STREET,CHILLICOTHE,OH,45601,"http://maps.google.com/maps?q=887 N BRIDGE STREET,+CHILLICOTHE,+OH+45601&hl=en"
CINCINNATI PD,BRAXTON CANN,5818 MADISON ROAD,CINCINNATI,OH,45227,"http://maps.google.com/maps?q=5818 MADISON ROAD,+CINCINNATI,+OH+45227&hl=en"
CINCINNATI PD,HEALTH SOURCE OF OHIO,6131 CAMPUS LN,CINCINNATI,OH,45230,"http://maps.google.com/maps?q=6131 CAMPUS LN,+CINCINNATI,+OH+45230&hl=en"
CINCINNATI POLICE,CINCINNATI POLICE DISTRICT 3 SIDE LOT,2300 FERGUSON RD,CINCINNATI,OH,45238,"http://maps.google.com/maps?q=2300 FERGUSON RD,+CINCINNATI,+OH+45238&hl=en"
CINCINNATI POLICE,CINCINNATI POLICE DISTRICT 4 PARKING LOT,4150 READING ROAD,CINCINNATI,OH,45229,"http://maps.google.com/maps?q=4150 READING ROAD,+CINCINNATI,+OH+45229&hl=en"
CINCINNATI POLICE,KENARD KROGER PARKING LOT BY STREET,4777 KENARD AVE,CINCINNATI,OH,45232,"http://maps.google.com/maps?q=4777 KENARD AVE,+CINCINNATI,+OH+45232&hl=en"
CINCINNATI VA HOSPITAL,CINCINNATI VA HOSPITAL FRIDAY 4/27/18 @1100 - 1430/OPC CIRCLE,3100 VINE STREET,CINCINNATI,OH,45220,"http://maps.google.com/maps?q=3100 VINE STREET,+CINCINNATI,+OH+45220&hl=en"
CITY OF DEERPARK,"CITY OF DEERPARK 24HR DROP BOX ONLY, LOCATED IN POLICE LOBBY.",7777 BLUE ASH RD,CINCINNATI,OH,45236,"http://maps.google.com/maps?q=7777 BLUE ASH RD,+CINCINNATI,+OH+45236&hl=en"
CITY OF OXFORD,EAST PARK BY THE AMPHITHEATER,EAST PARK @ EAST HIGH ST.,OXFORD,OH,45056,"http://maps.google.com/maps?q=EAST  PARK @ EAST HIGH ST.,+OXFORD,+OH+45056&hl=en"
CITY OF READING POLICE DEPARTMENT,CITY OF READING POLICE DEPARTMENT POLICE DEPARTMENT LOBBY,1000 MARKET STREETREADING,CINCINNATI,OH,45215,"http://maps.google.com/maps?q=1000 MARKET STREET,+CINCINNATI,+OH+45215&hl=en"
CLARK COUNTY SHERIFF'S OFFICE,CLARK COUNTY SHERIFF'S OFFICE EAST DISTRICT OFFICE,3130 EAST MAIN STREET,SPRINGFIELD,OH,45503,"http://maps.google.com/maps?q=3130 EAST MAIN STREET,+SPRINGFIELD,+OH+45503&hl=en"
CLARKSVILLE POLICE DEPARTMENT,CLARKSVILLE PD,1970 BROADWAY,CLARKSVILLE,IN,47129,"http://maps.google.com/maps?q=1970 BROADWAY,+CLARKSVILLE,+IN+47129&hl=en"
CLAY COUNTY SHERIFF DEPT.,CLAY COUNTY COURT HOUSE FRONT DOOR/COURTYARD SQUARE,246 MAIN STREET,CLAY,WV,25043,"http://maps.google.com/maps?q=246 MAIN STREET,+CLAY,+WV+25043&hl=en"
CLEARCREEK TOWNSHIP POLICE DEPARTMENT,CLEARCREEK TOWNSHIP POLICE DEPARTMENT,7593 BUNNELL HILL RD,SPRINGBORO,OH,45066,"http://maps.google.com/maps?q=7593 BUNNELL HILL RD,+SPRINGBORO,+OH+45066&hl=en"
CLINTON TOWNSHIP POLICE,CLINTON TOWNSHIP HALL FRONT ENTRANCE,3820 CLEVELAND AVE,COLUMBUS,OH,43224,"http://maps.google.com/maps?q=3820 CLEVELAND AVE,+COLUMBUS,+OH+43224&hl=en"
COEBURN POLICE DEPARTMENT,COEBURN FOOD CITY MARTY SHOPPING CENTER,517 FRONT ST W,COEBURN,VA,24230,"http://maps.google.com/maps?q=517 FRONT ST W,+COEBURN,+VA+24230&hl=en"
COLUMBUS DIVISION OF POLICE,COLUMBUS HEALTH DEPARTMENT,240 PARSONS AVE,COLUMBUS,OH,43215,"http://maps.google.com/maps?q=240 PARSONS AVE,+COLUMBUS,+OH+43215&hl=en"
CYNTHIANA POLICE DEPARTMENT,CYNTHIANA POLICE DEPARTMENT,420 E PLEASANT STREET,CYNTHIANA,KY,41031,"http://maps.google.com/maps?q=420 E PLEASANT STREET,+CYNTHIANA,+KY+41031&hl=en"
DAMASCUS POLICE DEPARTMENT,DAMASCUS TOWN PARK,104 S BEAVER DAM AVE,DAMASCUS,VA,24236,"http://maps.google.com/maps?q=104 S BEAVER DAM AVE,+DAMASCUS,+VA+24236&hl=en"
DANVILLE POLICE DEPARTMENT,DANVILLE POLICE DEPARTMENT/CITY HALL,445 W MAIN STREET,DANVILLE,KY,40422,"http://maps.google.com/maps?q=445 W MAIN STREET,+DANVILLE,+KY+40422&hl=en"
DAYTON POLICE DEPARTMENT,DAYTON POLICE DEPARTMENT 1ST DISTRICT OFFICE,417 EAST HELENA STREET,DAYTON,OH,45420,"http://maps.google.com/maps?q=417 EAST HELENA STREET,+DAYTON,+OH+45420&hl=en"
DAYTON POLICE DEPARTMENT,DAYTON POLICE DEPARTMENT 2ND DISTRICT OFFICE,2721 WAYNE AVENUE,DAYTON,OH,45420,"http://maps.google.com/maps?q=2721 WAYNE AVENUE,+DAYTON,+OH+45420&hl=en"
DAYTON POLICE DEPARTMENT,DAYTON POLICE DEPARTMENT 3RD DISTRICT OFFICE,951 WASHINGTON STREET,DAYTON,OH,45402,"http://maps.google.com/maps?q=951 WASHINGTON STREET,+DAYTON,+OH+45402&hl=en"
DAYTON POLICE DEPARTMENT,DAYTON POLICE DEPARTMENT 5TH DISTRICT OFFICE,248 SALEM AVENUE,DAYTON,OH,45406,"http://maps.google.com/maps?q=248 SALEM AVENUE,+DAYTON,+OH+45406&hl=en"
DAYTON POLICE DEPARTMENT,DAYTON POLICE SAFETY BUILDING,335 W THIRD STREET,DAYTON,OH,45402,"http://maps.google.com/maps?q=335 W THIRD STREET,+DAYTON,+OH+45402&hl=en"
DICKENSON COUNTY SHERIFF'S OFFICE,FOOD CITY NEAR THE FRONT ENTRANCE,410 CHASE STREET,CLINTWOOD,VA,24228,"http://maps.google.com/maps?q=410 CHASE STREET,+CLINTWOOD,+VA+24228&hl=en"
DUBLIN POLICE,DUBLIN POLICE DEPARTMENT HEADQUARTERS ENTER ON DRIVE WEST OF TRAFFIC CIRCLE.EXIT AT TRAFFIC CIRCLE,6565 COMMERCE PKWY,DUBLIN,OH,43017,"http://maps.google.com/maps?q=6565 COMMERCE PKWY,+DUBLIN,+OH+43017&hl=en"
ELIZABETHTON TN POLICE DEPARTMENT,ELIZABETHTON POLICE DEPARTMENT,525 EAST F STREET,ELIZABETHTON,TN,37643,"http://maps.google.com/maps?q=525 EAST F STREET,+ELIZABETHTON,+TN+37643&hl=en"
EMINENCE POLICE DEPARTMENT,EMINENCE POLICE DEPARTMENT,45 DEPOT AVE,EMINENCE,KY,40019,"http://maps.google.com/maps?q=45 DEPOT AVE,+EMINENCE,+KY+40019&hl=en"
ENGLEWOOD POLICE DEPARTMENT,ENGLEWOOD GOVERNMENT CENTER,333 W NATIONAL ROAD,ENGLEWOOD,OH,45322,"http://maps.google.com/maps?q=333 W NATIONAL ROAD,+ENGLEWOOD,+OH+45322&hl=en"
FAIRFAX POLICE DEPARTMENT,FAIRFAX POLICE DEPARTMENT,5903 HAWTHORNE AVENUE,CINCINNATI,OH,45227,"http://maps.google.com/maps?q=5903 HAWTHORNE AVENUE,+CINCINNATI,+OH+45227&hl=en"
FAIRFIELD COUNTY SHERIFF'S OFFICE,DILEY RIDGE MEDICAL CENTER PARKING LOT,7911 DILEY ROAD,CANAL WINCHESTER,OH,43110,"http://maps.google.com/maps?q=7911 DILEY ROAD,+CANAL WINCHESTER,+OH+43110&hl=en"
FAIRFIELD COUNTY SHERIFF'S OFFICE,VIOLET TOWNSHIP MAINTENANCE GARAGE,490 N CENTER STCORNER OF N CENTER & STEMEN RD,PICKERINGTON,OH,43147,"http://maps.google.com/maps?q=490 N CENTER ST,+PICKERINGTON,+OH+43147&hl=en"
FAIRFIELD POLICE DEPARTMENT,FAIRFIELD POLICE DEPARTMENT,5230 PLEASANT AVE,FAIRFIELD,OH,45014,"http://maps.google.com/maps?q=5230 PLEASANT AVE,+FAIRFIELD,+OH+45014&hl=en"
FAIRFIELD TOWNSHIP POLICE DEPARTMENT,FAIRFIELD TOWNSHIP POLICE DEPARTMENT,6485 VONNIE VALE COURT,HAMILTON,OH,45011,"http://maps.google.com/maps?q=6485 VONNIE VALE COURT,+HAMILTON,+OH+45011&hl=en"
FAIRFIELD-HOCKING-ATHENS MAJOR CRIMES UNIT,KROGER,1735 N MEMEORIAL DR,LANCASTER,OH,43130,"http://maps.google.com/maps?q=1735 N MEMEORIAL DR,+LANCASTER,+OH+43130&hl=en"
FAYETTE COUNTY SHERIFF'S OFFICE,FAYETTE COUNTY SHERIFF'S OFFICE,100 CHURCH STREET,FAYETTEVILLE,WV,25840,"http://maps.google.com/maps?q=100 CHURCH STREET,+FAYETTEVILLE,+WV+25840&hl=en"
FAYETTE COUNTY SHERIFF'S OFFICE,KROGERS PARKING LOT,548 CLINTON AVE,WASHINGTON COURT HOUSE,OH,43160,"http://maps.google.com/maps?q=548 CLINTON AVE,+WASHINGTON COURT HOUSE,+OH+43160&hl=en"
FAYETTE COUNTY SHERIFF'S OFFICE,SHERIFF'S ANNEX BUILDING,110 WEST MARKET STREET,WASHINGTON COURT HOUSE,OH,43160,"http://maps.google.com/maps?q=110 WEST MARKET STREET,+WASHINGTON COURT HOUSE,+OH+43160&hl=en"
FLEMINGSBURG POLICE DEPARTMENT,FLEMINGSBURG POLICE DEPARTMENT,116 S MAIN CROSS STREET,FLEMINGSBURG,KY,41041,"http://maps.google.com/maps?q=116 S MAIN CROSS STREET,+FLEMINGSBURG,+KY+41041&hl=en"
FLORENCE POLICE DEPARTMENT,FLORENCE POLICE,8100 EWING BLVD,FLORENCE,KY,41042,"http://maps.google.com/maps?q=8100 EWING BLVD,+FLORENCE,+KY+41042&hl=en"
FLORENCE POLICE DEPARTMENT,KROGER PHARMACY FLORENCE,7685 MALL ROAD,FLORENCE,KY,41042,"http://maps.google.com/maps?q=7685 MALL ROAD,+FLORENCE,+KY+41042&hl=en"
FORT MITCHELL POLICE DEPARTMENT,FORT MITCHELL POLICE DEPARTMENT,2355 DIXIE HIGHWAY,FT MITCHELL,KY,41017,"http://maps.google.com/maps?q=2355 DIXIE HIGHWAY,+FT MITCHELL,+KY+41017&hl=en"
"FORT THOMAS, KENTUCKY POLICE DEPARTMENT",FT. THOMAS POLICE DEPARTMENT,130 N. FT. THOMAS AVE,FORT THOMAS,KY,41075,"http://maps.google.com/maps?q=130 N. FT. THOMAS AVE,+FORT THOMAS,+KY+41075&hl=en"
FRANKFORT POLICE DEPARTMENT,FRANKLIN COUNTY HEALTH DEPARTMENT EAST WEST CONNECTOR ROAD,851 EAST WEST CONNECTOR ROAD,FRANKFORT,KY,40601,"http://maps.google.com/maps?q=851 EAST WEST CONNECTOR ROAD,+FRANKFORT,+KY+40601&hl=en"
FRANKLIN COUNTY SHERIFF'S OFFICE,KROGER,300 S. HAMILTON RD,GAHANNA,OH,43230,"http://maps.google.com/maps?q=300 S. HAMILTON RD,+GAHANNA,+OH+43230&hl=en"
FRANKLIN COUNTY SHERIFF'S OFFICE,KROGER,3637 S. HIGH ST,COLUMBUS,OH,43207,"http://maps.google.com/maps?q=3637 S. HIGH ST,+COLUMBUS,+OH+43207&hl=en"
FRANKLIN COUNTY SHERIFF'S OFFICE,KROGER,4656 CEMETERY RD.,HILLIARD,OH,43026,"http://maps.google.com/maps?q=4656 CEMETERY RD.,+HILLIARD,+OH+43026&hl=en"
FRANKLIN COUNTY SHERIFF'S OFFICE,KROGER,55 W. SCHROCK RD.,WESTERVILLE,OH,43081,"http://maps.google.com/maps?q=55 W. SCHROCK RD.,+WESTERVILLE,+OH+43081&hl=en"
FRANKLIN COUNTY SHERIFF'S OFFICE,KROGER,6095 GENDER RD,CANAL WINCHESTER,OH,43110,"http://maps.google.com/maps?q=6095 GENDER RD,+CANAL WINCHESTER,+OH+43110&hl=en"
FRANKLIN COUNTY SHERIFF'S OFFICE,KROGER,7625 SAWMILL RD.,DUBLIN,OH,43016,"http://maps.google.com/maps?q=7625 SAWMILL RD.,+DUBLIN,+OH+43016&hl=en"
FRANKLIN POLICE DEPARTMENT (LOBBY),FRANKLIN POLICE DEPT BOOTH FALL FESTIVAL POLICE BOOTH,FALL FEST BOOTHSOUTH MAIN ST @ EAST SECOND STREET,FRANKLIN,OH,45005,"http://maps.google.com/maps?q=FALL FEST BOOTH,+FRANKLIN,+OH+45005&hl=en"
FRANKLIN TOWNSHIP POLICE DEPARTMENT,FRANKLIN TOWNSHIP POLICE DEPT. FRANKLIN TOWNSHIP FIRE DEPT.,2193 FRANK RD,COLUMBUS,OH,43223,"http://maps.google.com/maps?q=2193 FRANK RD,+COLUMBUS,+OH+43223&hl=en"
GILES COUNTY SHERIFF'S OFFICE,GILES COUNTY SHERIFF'S OFFICE,1 TAYLOR AVENUE SUITE 3,PEARISBURG,VA,24134,"http://maps.google.com/maps?q=1 TAYLOR AVENUE SUITE 3,+PEARISBURG,+VA+24134&hl=en"
GRAYSON COUNTY SHERIFF'S OFFICE,CORNER CAFE & MARKET,4013 TROUTDALE HIGHWAY,MOUTH OF WILSON,VA,24363,"http://maps.google.com/maps?q=4013 TROUTDALE HIGHWAY,+MOUTH OF WILSON,+VA+24363&hl=en"
GREEN TOWNSHIP POLICE DEPARTMENT,GREEN TOWNSHIP POLICE KIOSK IN THE LOBBY ONLY,6303 HARRISON AVE.,CINCINNATI,OH,45247,"http://maps.google.com/maps?q=6303 HARRISON AVE.,+CINCINNATI,+OH+45247&hl=en"
GREENE COUNTY SHERIFF'S OFFICE,BEAVERCREEK POLICE DEPARTMENT,1388 RESEARCH PARK DRIVE,DAYTON,OH,45432,"http://maps.google.com/maps?q=1388 RESEARCH PARK DRIVE,+DAYTON,+OH+45432&hl=en"
GREENE COUNTY SHERIFF'S OFFICE,FAIRBORN POLICE DEPARTMENT,70 W HEBBLE ROAD,FAIRBORN,OH,45324,"http://maps.google.com/maps?q=70 W HEBBLE ROAD,+FAIRBORN,+OH+45324&hl=en"
GREENE COUNTY SHERIFF'S OFFICE,GREENE COUNTY SHERIFF'S OFFICE,120 E MAIN STREET,XENIA,OH,45385,"http://maps.google.com/maps?q=120 E MAIN STREET,+XENIA,+OH+45385&hl=en"
GREENE COUNTY SHERIFF'S OFFICE,SUGARCREEK TOWNSHIP POLICE DEPARTMENT,4398 CLYO ROAD,DAYTON,OH,45459,"http://maps.google.com/maps?q=4398 CLYO ROAD,+DAYTON,+OH+45459&hl=en"
GREENHILLS POLICE,GREENHILLS MUNCIPAL BUILDING,11000 WINTON RD,CINCINNATI,OH,45218,"http://maps.google.com/maps?q=11000 WINTON RD,+CINCINNATI,+OH+45218&hl=en"
GREENVILLE POLICE DEPARTMENT,GREENVILLE POLICE DEPARTMENT,122 W. MAIN ST,GREENVILLE,OH,45331,"http://maps.google.com/maps?q=122 W. MAIN ST,+GREENVILLE,+OH+45331&hl=en"
GROVE CITY POLICE,GROVE CITY PD DRUG DROP BOX,3360 PARK ST,GROVE CITY,OH,43123,"http://maps.google.com/maps?q=3360 PARK ST,+GROVE CITY,+OH+43123&hl=en"
GROVEPORT POLICE DEPT,GROVEPORT POLICE DEPARTMENT,5690 CLYDE MOORE DR,GROVEPORT,OH,43125,"http://maps.google.com/maps?q=5690 CLYDE MOORE DR,+GROVEPORT,+OH+43125&hl=en"
HAMILTON COUNTY SHERIFF'S OFFICE,MIAMI TOWNSHIP,3780 SHADY LANE,NORTH BEND,OH,45052,"http://maps.google.com/maps?q=3780 SHADY LANE,+NORTH BEND,+OH+45052&hl=en"
HAMILTON COUNTY SHERIFF'S OFFICE,VILLAGE OF SILVERTON,6943 MONTGOMERY ROAD,CINCINNATI,OH,45236,"http://maps.google.com/maps?q=6943 MONTGOMERY ROAD,+CINCINNATI,+OH+45236&hl=en"
HAMILTON POLICE DEPARTMENT,HAMILTON POLICE DEPARTMENT,331 SOUTH FRONT STREET,HAMILTON,OH,45011,"http://maps.google.com/maps?q=331 SOUTH FRONT STREET,+HAMILTON,+OH+45011&hl=en"
HAMLIN POLICE DEPARTMENT,HAMLIN TOWN HALL,220-1 MAIN ST,HAMLIN,WV,25523,"http://maps.google.com/maps?q=220-1 MAIN ST,+HAMLIN,+WV+25523&hl=en"
HARLAN POLICE DEPARTMENT,HARLAN POLICE DEPARTMENT,218 SOUTH MAIN,HARLAN,KY,40831,"http://maps.google.com/maps?q=218 SOUTH MAIN,+HARLAN,+KY+40831&hl=en"
HARRISON COUNTY SHERIFF'S OFFICE,HARRISON COUNTY SHERIFF'S OFFICE,113 W. PIKE ST.,CYNTHIANA,KY,41031,"http://maps.google.com/maps?q=113 W. PIKE ST.,+CYNTHIANA,+KY+41031&hl=en"
HENRY COUNTY SHERIFF,HENRY COUNTY SHERIFF,123 N PROPERTY ROAD,NEW CASTLE,KY,40050,"http://maps.google.com/maps?q=123 N PROPERTY ROAD,+NEW CASTLE,+KY+40050&hl=en"
HILLIARD DIVISION OF POLICE,HILLIARD DIVISION OF POLICE,5171 NORTHWEST PARKWAY,HILLIARD,OH,43026,"http://maps.google.com/maps?q=5171 NORTHWEST PARKWAY,+HILLIARD,+OH+43026&hl=en"
HUBER HEIGHTS POLICE DEPARTMENT,HUBER HEIGHTS POLICE DEPARTMENT,6121 TAYLORSVILLE ROAD,DAYTON,OH,45424,"http://maps.google.com/maps?q=6121 TAYLORSVILLE ROAD,+DAYTON,+OH+45424&hl=en"
HUNTINGTON POLICE DEPARTMENT,CABELL HUNTINGTON HEALTH DEPARTMENT,703 7TH AVE HUNTINGTON,HUNTINGTON,WV,25701,"http://maps.google.com/maps?q=703 7TH AVE HUNTINGTON,+HUNTINGTON,+WV+25701&hl=en"
INDIANA STATE POLICE,INDIANA STATE POLICE DISTRICT 42,902 SOUTH ADAMS STREET,VERSAILLES,IN,47042,"http://maps.google.com/maps?q=902 SOUTH ADAMS STREET,+VERSAILLES,+IN+47042&hl=en"
INDIANA STATE POLICE,INDIANA STATE POLICE DISTRICT 45,8014 HIGHWAY 311,SELLERSBURG,IN,47172,"http://maps.google.com/maps?q=8014 HIGHWAY 311,+SELLERSBURG,+IN+47172&hl=en"
JACKSON COUNTY SHERIFF'S DEPARTMENT,KENNA VOLUNTEER FIRE DEPARTMENT,RT 21 AT PLEASANT VALLEY ROAD,KENNA,WV,25248,"http://maps.google.com/maps?q=RT 21 AT PLEASANT VALLEY ROAD,+KENNA,+WV+25248&hl=en"
JACKSON COUNTY SHERIFF'S DEPARTMENT,RAVENSWOOD VOLUNTEER FIRE DEPT,333 VIRGINIA STREET,RAVENSWOOD,WV,26164,"http://maps.google.com/maps?q=333 VIRGINIA STREET,+RAVENSWOOD,+WV+26164&hl=en"
JACKSON COUNTY SHERIFF'S DEPARTMENT,RIPLEY CITY HALL,203 SOUTH CHURCH ST,RIPLEY,WV,25271,"http://maps.google.com/maps?q=203 SOUTH CHURCH ST,+RIPLEY,+WV+25271&hl=en"
JEFFERSON COUNTY SHERIFF'S OFFICE,JEFFERSON COUNTY SHERIFF'S OFFICE,531 COURT PLACE SUITE 600,LOUISVILLE,KY,40202,"http://maps.google.com/maps?q=531 COURT PLACE SUITE 600,+LOUISVILLE,+KY+40202&hl=en"
JENNINGS COUNTY SHERIFFS DEPARTMENT,JAY-C FOOD STORE,2325 NORTH STATE HIGHWAY 3,NORTH VERNON,IN,47265,"http://maps.google.com/maps?q=2325 NORTH STATE HIGHWAY 3,+NORTH VERNON,+IN+47265&hl=en"
JOHNSON CITY POLICE DEPARTMENT,JOHNSON CITY POLICE DEPT. PARKING LOT,601 E. MAIN ST.,JOHNSON CITY,TN,37601,"http://maps.google.com/maps?q=601 E. MAIN ST.,+JOHNSON CITY,+TN+37601&hl=en"
JOHNSON COUNTY SHERIFF'S OFFICE,JOHNSON COUNTY SHERIFF'S DEPT,216 HONEYSUCKLE ST,MOUNTAIN CITY,TN,37683,"http://maps.google.com/maps?q=216 HONEYSUCKLE ST,+MOUNTAIN CITY,+TN+37683&hl=en"
JONESBOROUGH DEPT. OF PUBLIC SAFETY,JONESBOROUGH FIRE DEPT.,123 BOONE STREET,JONESBOROUGH,TN,37659,"http://maps.google.com/maps?q=123 BOONE STREET,+JONESBOROUGH,+TN+37659&hl=en"
KANAWHA COUNTY SHERIFF'S OFFICE,KANAWHA COUNTY SHERIFF'S DETACHMENT CROSS LANES DETACHMENT/CPT MEADOWS,903 CROSS LANES DR,CROSS LANES,WV,25313,"http://maps.google.com/maps?q=903 CROSS LANES DR,+CROSS LANES,+WV+25313&hl=en"
KANAWHA COUNTY SHERIFF'S OFFICE,KANAWHA COUNTY SHERIFF'S OFFICE QUINCY DETACHMENT/CPL B. HOWERY,2700 E DUPONT AVE,BELLE,WV,25015,"http://maps.google.com/maps?q=2700 E DUPONT AVE,+BELLE,+WV+25015&hl=en"
KANAWHA COUNTY SHERIFF'S OFFICE,KANAWHA COUNTY SHERIFF'S OFFICE SISSONVILLE DETACHMENT/LT. L.. DEITZ,6438 SISSONVILLE DRIVE,SISSONVILLE,WV,25320,"http://maps.google.com/maps?q=6438 SISSONVILLE DRIVE,+SISSONVILLE,+WV+25320&hl=en"
KANAWHA COUNTY SHERIFF'S OFFICE,KANAWHA COUNTY SHERIFF'S OFFICE ST. ALBANS DETACHMENT/SGT. FLOWERS,6809 OHIO AVENUE,SAINT ALBANS,WV,25177,"http://maps.google.com/maps?q=6809 OHIO AVENUE,+SAINT ALBANS,+WV+25177&hl=en"
KANAWHA COUNTY SHERIFF'S OFFICE,KANWHA COUNTY SHERIFF'S DEPT ELKVIEW DETACHMENT/LT. K. WHITE,902 MAIN ST,ELKVIEW,WV,25071,"http://maps.google.com/maps?q=902 MAIN ST,+ELKVIEW,+WV+25071&hl=en"
KENTUCKY STATE POLICE POST 10,KENTUCKY STATE POLICE,3319 SOUTH US 421,HARLAN,KY,40831,"http://maps.google.com/maps?q=3319 SOUTH US 421,+HARLAN,+KY+40831&hl=en"
KENTUCKY STATE POLICE POST 11,LAUREL COUNTY HEALTH DEPARTMENT,525 WHITLEY STREET,LONDON,KY,40741,"http://maps.google.com/maps?q=525 WHITLEY STREET,+LONDON,+KY+40741&hl=en"
KENTUCKY STATE POLICE POST 13,KENTUCKY STATE POLICE,100 JUSTICE DRIVE,HAZARD,KY,41701,"http://maps.google.com/maps?q=100 JUSTICE DRIVE,+HAZARD,+KY+41701&hl=en"
KENTUCKY STATE POLICE POST 14,KENTUCKY STATE POLICE,5975 STATE ROUTE US 60,ASHLAND,KY,41102,"http://maps.google.com/maps?q=5975 STATE ROUTE US 60,+ASHLAND,+KY+41102&hl=en"
KENTUCKY STATE POLICE POST 5,KENTUCKY STATE POLICE,160 CITATION LANE,CAMPBELLSBURG,KY,40011,"http://maps.google.com/maps?q=160 CITATION LANE,+CAMPBELLSBURG,+KY+40011&hl=en"
KENTUCKY STATE POLICE POST 6,KSP POST 6,4265 DIXIE HIGHWAY,DRY RIDGE,KY,41035,"http://maps.google.com/maps?q=4265 DIXIE HIGHWAY,+DRY RIDGE,+KY+41035&hl=en"
KENTUCKY STATE POLICE POST 7,KENTUCKY STATE POLICE POST 7,"699 EASTERN BYPASS, RICHMOND, KY",RICHMOND,KY,40475,"http://maps.google.com/maps?q=699 EASTERN BYPASS, RICHMOND, KY,+RICHMOND,+KY+40475&hl=en"
KENTUCKY STATE POLICE POST 8,MOREHEAD POLICE DEPARTMENT,105 E MAIN STREET,MOREHEAD,KY,40351,"http://maps.google.com/maps?q=105 E MAIN STREET,+MOREHEAD,+KY+40351&hl=en"
KENTUCKY STATE POLICE POST 9 PIKEVILLE,KENTUCKY STATE POLICE POST 9 PIKEVILLE,3499 N MAYO TRAIL,PIKEVILLE,KY,41501,"http://maps.google.com/maps?q=3499 N MAYO TRAIL,+PIKEVILLE,+KY+41501&hl=en"
KETTERING POLICE DEPARTMENT,KETTERING POLICE DEPARTMENT 10AM TO 2PM,3600 SHROYER ROAD,KETTERING,OH,45429,"http://maps.google.com/maps?q=3600 SHROYER ROAD,+KETTERING,+OH+45429&hl=en"
KINGSPORT POLICE DEPARTMENT,DOBBINS-BENNETT HIGH SCHOOL,1 TRIBE WAY,KINGSPORT,TN,37660,"http://maps.google.com/maps?q=1 TRIBE WAY,+KINGSPORT,+TN+37660&hl=en"
LAWRENCEBURG POLICE DEPT.,LAWRENCEBURG KROGER STORE DONALD B COMBS,880 W. EADS PKWY,LAWRENCEBURG,IN,47025,"http://maps.google.com/maps?q=880 W. EADS PKWY,+LAWRENCEBURG,+IN+47025&hl=en"
LEBANON DIVISION OF POLICE,COUNTRYSIDE YMCA,1699 DEERFIELD RD.,LEBANON,OH,45036,"http://maps.google.com/maps?q=1699 DEERFIELD RD.,+LEBANON,+OH+45036&hl=en"
LEBANON DIVISION OF POLICE,KROGER (PARKING LOT),1425 COLUMBUS AVE,LEBANON,OH,45036,"http://maps.google.com/maps?q=1425 COLUMBUS AVE,+LEBANON,+OH+45036&hl=en"
LEBANON POLICE DEPARTMENT,WALMART,1050 REGIONAL PARK ROAD,LEBANON,VA,24266,"http://maps.google.com/maps?q=1050 REGIONAL PARK ROAD,+LEBANON,+VA+24266&hl=en"
LEE COUNTY SHERIFF'S OFFICE,FOOD CITY,205 RIVER BEND DR.,JONESVILLE,VA,24263,"http://maps.google.com/maps?q=205 RIVER BEND DR.,+JONESVILLE,+VA+24263&hl=en"
LEXINGTON POLICE DEPARTMENT,KENTUCKY AMERICAN WATER COMPANY,2300 RICHMOND RD,LEXINGTON,KY,40502,"http://maps.google.com/maps?q=2300 RICHMOND RD,+LEXINGTON,+KY+40502&hl=en"
LICKING COUNTY SHERIFF'S OFFICE,KROGER,350 EAST BROAD STREET,PATASKALA,OH,43062,"http://maps.google.com/maps?q=350 EAST BROAD STREET,+PATASKALA,+OH+43062&hl=en"
LOCKLAND POLICE DEPARTMENT,LOCKLAND CHURCH OF NAZARENE,335 W WYOMING AV,LOCKLAND,OH,45215,"http://maps.google.com/maps?q=335 W WYOMING AV,+LOCKLAND,+OH+45215&hl=en"
LOGAN COUNTY SHERIFF'S DEPARTMENT,WAL-MART SUPER CENTER FOUNTAIN PLACE MALL,U.S. 119/WV 73,LOGAN,WV,25601,"http://maps.google.com/maps?q=U.S.  119/WV 73,+LOGAN,+WV+25601&hl=en"
