Participant,CollectionSite,Address,City,State,Zip,MapURL
ABERDEEN POLICE DEPARTMENT,ABERDEEN POLICE DEPARTMENT,114 SE 2ND AVE,ABERDEEN,SD,57401,"http://maps.google.com/maps?q=114 SE 2ND AVE,+ABERDEEN,+SD+57401&hl=en"
ADA PD,ADA PD,410 WEST MAIN STREET,ADA,MN,56510,"http://maps.google.com/maps?q=410 WEST MAIN STREET,+ADA,+MN+56510&hl=en"
AITKIN PD,AITKIN POLICE DEPARTMENT,200 BUNKER HILL DRIVE,AITKIN,MN,56431,"http://maps.google.com/maps?q=200 BUNKER HILL DRIVE,+AITKIN,+MN+56431&hl=en"
ALEXANDRIA POLICE DEPARTMENT,ALEXANDRIA FIRE STATION 210,5525 EISENHOWER AVE,ALEXANDRIA,VA,22304,"http://maps.google.com/maps?q=5525 EISENHOWER AVE,+ALEXANDRIA,+VA+22304&hl=en"
ALEXANDRIA POLICE DEPARTMENT,ALEXANDRIA POLICE HEADQUARTERS FRONT ENTRANCE,3600 WHEELER AVENUE,ALEXANDRIA,VA,22304,"http://maps.google.com/maps?q=3600 WHEELER AVENUE,+ALEXANDRIA,+VA+22304&hl=en"
ALEXANDRIA POLICE DEPARTMENT,FIRST BAPTIST CHURCH FRONT ENTRANCE,2932 KING STREET,ALEXANDRIA,VA,22302,"http://maps.google.com/maps?q=2932 KING STREET,+ALEXANDRIA,+VA+22302&hl=en"
ALEXANDRIA SHERIFF'S OFFICE,NEIGHBORHOOD PHARMACY FRONT OF THE BUILDING,2204 MT. VERNON AVENUE,ALEXANDRIA,VA,22301,"http://maps.google.com/maps?q=2204 MT. VERNON AVENUE,+ALEXANDRIA,+VA+22301&hl=en"
ANNAPOLIS POLICE DEPARTMENT,ANNAPOLIS POLICE DEPARTMENT,199 TAYLOR AVENUE,ANNAPOLIS,MD,21401,"http://maps.google.com/maps?q=199 TAYLOR AVENUE,+ANNAPOLIS,+MD+21401&hl=en"
ANNE ARUNDEL CO,EASTERN DISTRICT,204 PASADENA ROAD,PASADENA,MD,21122,"http://maps.google.com/maps?q=204 PASADENA ROAD,+PASADENA,+MD+21122&hl=en"
ANNE ARUNDEL CO,HEADQUARTERS,8495 VETERAN'S HIGHWAY,MILLERSVILLE,MD,21108,"http://maps.google.com/maps?q=8495 VETERAN'S HIGHWAY,+MILLERSVILLE,+MD+21108&hl=en"
ANNE ARUNDEL CO,NORTHERN DISTRICT,939 HAMMONDS LANE,BALTIMORE,MD,21225,"http://maps.google.com/maps?q=939 HAMMONDS LANE,+BALTIMORE,+MD+21225&hl=en"
ANNE ARUNDEL CO,SOUTHERN DISTRICT,35 STEPNEY'S LANE,EDGEWATER,MD,21037,"http://maps.google.com/maps?q=35 STEPNEY'S LANE,+EDGEWATER,+MD+21037&hl=en"
ANNE ARUNDEL CO,WESTERN DISTRICT,8273 TELEGRAPH ROAD,ODENTON,MD,21113,"http://maps.google.com/maps?q=8273 TELEGRAPH ROAD,+ODENTON,+MD+21113&hl=en"
ANTELOPE CO SHERIFF DEPT,ANTELOPE COUNTY SHERIFF DEPT,1102 L ST,NELIGH,NE,68756,"http://maps.google.com/maps?q=1102 L ST,+NELIGH,+NE+68756&hl=en"
ARLINGTON COUNTY POLICE DEPARTMENT,ARLINGTON FIRE STATION #2,4805 WILSON BLVD,ARLINGTON,VA,22203,"http://maps.google.com/maps?q=4805 WILSON BLVD,+ARLINGTON,+VA+22203&hl=en"
ARLINGTON COUNTY POLICE DEPARTMENT,ARLINGTON FIRE STATION #5,1750 SOUTH HAYES STREET,ARLINGTON,VA,22202,"http://maps.google.com/maps?q=1750 SOUTH HAYES STREET,+ARLINGTON,+VA+22202&hl=en"
ARLINGTON COUNTY POLICE DEPARTMENT,ARLINGTON FIRE STATION #9 MAIN LEVEL COMMUNITY ROOM,1900 SOUTH WALTER REED DRIVE,ARLINGTON,VA,22204,"http://maps.google.com/maps?q=1900 SOUTH WALTER REED DRIVE,+ARLINGTON,+VA+22204&hl=en"
BALTIMORE CITY POLICE DEPARTMENT,BALTIMORE CITY PD NORTHERN DISTRICT,2201 W. COLDSPRING LANE,BALTIMORE,MD,21215,"http://maps.google.com/maps?q=2201 W. COLDSPRING LANE,+BALTIMORE,+MD+21215&hl=en"
BALTIMORE CITY POLICE DEPARTMENT,BALTIMORE CITY PD NORTHWESTERN DISTRICT,5271 REISTERSTOWN ROAD,BALTIMORE,MD,21215,"http://maps.google.com/maps?q=5271 REISTERSTOWN ROAD,+BALTIMORE,+MD+21215&hl=en"
BALTIMORE CITY POLICE DEPARTMENT,BALTIMORE CITY PD SOUTHERN DISTRICT,10 CHERRY HILL ROAD,BROOKLYN,MD,21225,"http://maps.google.com/maps?q=10 CHERRY HILL ROAD,+BROOKLYN,+MD+21225&hl=en"
BALTIMORE CITY POLICE DEPARTMENT,BALTIMORE CITY PD SOUTHWESTERN DISTRICT,424 FONT HILL AVENUE,BALTIMORE,MD,21223,"http://maps.google.com/maps?q=424 FONT HILL AVENUE,+BALTIMORE,+MD+21223&hl=en"
BALTIMORE COUNTY POLICE DEPARTMENT,PRECINCT 1 WILKENS,901 WALKER AVE.,CATONSVILLE,MD,21228,"http://maps.google.com/maps?q=901 WALKER AVE.,+CATONSVILLE,+MD+21228&hl=en"
BALTIMORE COUNTY POLICE DEPARTMENT,PRECINCT 2 WOODLAWN,6424 WINDSOR MILL RD.,GWYNN OAK,MD,21207,"http://maps.google.com/maps?q=6424 WINDSOR MILL RD.,+GWYNN OAK,+MD+21207&hl=en"
BALTIMORE COUNTY POLICE DEPARTMENT,PRECINCT 4 PIKESVILLE,215 MILFORD MILL RD.,PIKESVILLE,MD,21208,"http://maps.google.com/maps?q=215 MILFORD MILL RD.,+PIKESVILLE,+MD+21208&hl=en"
BECKER PD,BECKER POLICE DEPARTMENT DROPBOX,12060 SHERBURNE AVENUE,BECKER,MN,55308,"http://maps.google.com/maps?q=12060 SHERBURNE AVENUE,+BECKER,+MN+55308&hl=en"
BENSON PD,BENSON PD,2110 HALL AVENUE,BENSON,MN,56215,"http://maps.google.com/maps?q=2110 HALL AVENUE,+BENSON,+MN+56215&hl=en"
BOWIE POLICE DEPARTMENT,BOWIE POLICE STATION,15901 EXCALIBUR ROAD,BOWIE,MD,20716,"http://maps.google.com/maps?q=15901 EXCALIBUR ROAD,+BOWIE,+MD+20716&hl=en"
BRANDON POLICE DEPARTMENT,BRANDON POLICE DEPT.,304 S MAIN AVE.,BRANDON,SD,57005,"http://maps.google.com/maps?q=304 S MAIN AVE.,+BRANDON,+SD+57005&hl=en"
BROOKINGS COUNTY SHERIFF'S OFFICE,BROOKINGS COUNTY SHERIFF'S OFFICE,315 7TH AVENUE,BROOKINGS,SD,57006,"http://maps.google.com/maps?q=315 7TH AVENUE,+BROOKINGS,+SD+57006&hl=en"
BUENA VISTA COUNTY SHERIFF'S OFFICE,NEWELL CITY HALL,207 E 2ND STREET,NEWELL,IA,50568,"http://maps.google.com/maps?q=207 E 2ND STREET,+NEWELL,+IA+50568&hl=en"
BUENA VISTA COUNTY SHERIFF'S OFFICE,SIOUX RAPIDS CITY HALL,100 FRONT STREET,SIOUX RAPIDS,IA,50585,"http://maps.google.com/maps?q=100 FRONT STREET,+SIOUX RAPIDS,+IA+50585&hl=en"
BUENA VISTA COUNTY SHERIFF'S OFFICE,WALMART,1831 LAKE AVE,STORM LAKE,IA,50588,"http://maps.google.com/maps?q=1831 LAKE AVE,+STORM LAKE,+IA+50588&hl=en"
CALVERT COUNTY SHERIFF'S OFFICE,MT. HOPE COMMUNITY CENTER,104 PUSHAW STATION RD.,SUNDERLAND,MD,20689,"http://maps.google.com/maps?q=104 PUSHAW STATION RD.,+SUNDERLAND,+MD+20689&hl=en"
CALVERT COUNTY SHERIFF'S OFFICE,NORTHEAST COMMUNITY CENTER,4075 GORDON STINNETT AVE.,CHESAPEAKE BEACH,MD,20732,"http://maps.google.com/maps?q=4075 GORDON STINNETT AVE.,+CHESAPEAKE BEACH,+MD+20732&hl=en"
CARLTON COUNTY SO,CARLTON COUNTY SHERIFF'S OFFICE MAIN FLOOR LOBBY,317 WALNUT AVENUE,CARLTON,MN,55718,"http://maps.google.com/maps?q=317 WALNUT AVENUE,+CARLTON,+MN+55718&hl=en"
CARLTON COUNTY SO,CLOQUET POLICE DEPARTMENT MAIN LOBBY,508 CLOQUET AVENUE,CLOQUET,MN,55720,"http://maps.google.com/maps?q=508 CLOQUET AVENUE,+CLOQUET,+MN+55720&hl=en"
CARLTON COUNTY SO,FON DU LAC POLICE DEPARTMENT MAIN LOBBY,930 TRETTEL LANE,CLOQUET,MN,55720,"http://maps.google.com/maps?q=930 TRETTEL LANE,+CLOQUET,+MN+55720&hl=en"
CARLTON COUNTY SO,MOOSE LAKE POLICE DEPARTMENT MAIN LOBBY,600 HIGHWAY 73,MOOSE LAKE,MN,55767,"http://maps.google.com/maps?q=600 HIGHWAY 73,+MOOSE LAKE,+MN+55767&hl=en"
CARLTON COUNTY SO,THOMSON TOWNSHIP MAIN LOBBY,25 EAST HARNEY ROAD,ESKO,MN,55733,"http://maps.google.com/maps?q=25 EAST HARNEY ROAD,+ESKO,+MN+55733&hl=en"
CARROLL COUNTY SHERIFF'S OFFICE,CARROLL COUNTY SHERIFF'S OFFICE,100 NORTH COURT STREET,WESTMINSTER,MD,21157,"http://maps.google.com/maps?q=100 NORTH COURT STREET,+WESTMINSTER,+MD+21157&hl=en"
CARROLL COUNTY SHERIFF'S OFFICE,MOUNT AIRY POLICE DEPARTMENT,"205 CENTER STREET,SUITE 203",MOUNT AIRY,MD,21771,"http://maps.google.com/maps?q=205 CENTER STREET,,+MOUNT AIRY,+MD+21771&hl=en"
CARROLL COUNTY SHERIFF'S OFFICE,SYKESVILLE POLICE DEPARTMENT POC: CHIEF SPAULDING,7547 MAIN STREET,SYKESVILLE,MD,21784,"http://maps.google.com/maps?q=7547 MAIN STREET,+SYKESVILLE,+MD+21784&hl=en"
CARROLL COUNTY SHERIFF'S OFFICE,TOTAL HEALTH EXPO,200 MEMORIAL AVENUE,WESTMINSTER,MD,21157,"http://maps.google.com/maps?q=200 MEMORIAL AVENUE,+WESTMINSTER,+MD+21157&hl=en"
CARROLL COUNTY SHERIFF'S OFFICE,WESTMINSTER POLICE DEPARTMENT POC: CHIEF SPAULDING,36 LOCUST STREET,WESTMINSTER,MD,21157,"http://maps.google.com/maps?q=36 LOCUST STREET,+WESTMINSTER,+MD+21157&hl=en"
CHARLES COUNTY GOVERNMENT,CHARLES COUNTY GOVERNMENT MAIN ENTRANCE PARKING LOT,200 BALTIMORE STREET,LA PLATA,MD,20646,"http://maps.google.com/maps?q=200 BALTIMORE STREET,+LA PLATA,+MD+20646&hl=en"
CHEROKEE COUNTY SHERIFF'S OFFICE,CHEROKEE COUNTY LAW ENFORCEMENT CENTER CHEROKEE COUNTY SHERIFF'S OFFICE,111 N 5TH ST.,CHEROKEE,IA,51012,"http://maps.google.com/maps?q=111 N 5TH ST.,+CHEROKEE,+IA+51012&hl=en"
CHEVY CHASE VILLAGE POLICE DEPARTMENT,CHEVY CHASE VILLAGE POLICE DEPARTMENT,5906 CONNECTICUT AVENUE,CHEVY CHASE,MD,20815,"http://maps.google.com/maps?q=5906 CONNECTICUT AVENUE,+CHEVY CHASE,+MD+20815&hl=en"
CHISAGO COUNTY SO,CHISAGO COUNTY SHERIFF'S OFFICE,15230 PER ROAD,CENTER CITY,MN,55012,"http://maps.google.com/maps?q=15230 PER ROAD,+CENTER CITY,+MN+55012&hl=en"
CODINGTON COUNTY SHERIFFS OFFICE,CODINGTON COUNTY SHERIFF'S OFFICE,14 1ST AVE SE,WATERTOWN,SD,57201,"http://maps.google.com/maps?q=14 1ST AVE SE,+WATERTOWN,+SD+57201&hl=en"
COTTONWOOD COUNTY SHERIFF'S OFFICE,COTTONWOOD COUNTY SHERIFFS OFFICE,902 5TH AVENUE,WINDOM,MN,56101,"http://maps.google.com/maps?q=902 5TH AVENUE,+WINDOM,+MN+56101&hl=en"
DAWSON BOYD PD,DAWSON BOYD POLICE DEPARTMENT,675 CHESTNUT STREET,DAWSON,MN,56232,"http://maps.google.com/maps?q=675 CHESTNUT STREET,+DAWSON,+MN+56232&hl=en"
DEA - HEADQUARTERS,AURORA HILLS LIBRARY,735 18TH STREET,ARLINGTON,VA,22202,"http://maps.google.com/maps?q=735 18TH STREET,+ARLINGTON,+VA+22202&hl=en"
DEA / MONTCLAIR LIONS CLUB,MONTCLAIR LIONS,5183 WATERWAY DR,DUMFRIES,VA,22025,"http://maps.google.com/maps?q=5183 WATERWAY DR,+DUMFRIES,+VA+22025&hl=en"
DEA / MONTCLAIR LIONS CLUB,MONTCLAIR SHOPPING CENTER IN FRONT OF FRAMING OUTLET,5183 WATERWAY DRIVE,DUMFRIES,VA,22025,"http://maps.google.com/maps?q=5183 WATERWAY DRIVE,+DUMFRIES,+VA+22025&hl=en"
ESTHERVILLE POLICE DEPARTMENT,AVERA HOLY FAMILY HOSPITAL NORTH ENTRANCE,826 N 8TH STREET,ESTHERVILLE,IA,51334,"http://maps.google.com/maps?q=826 N 8TH STREET,+ESTHERVILLE,+IA+51334&hl=en"
FAIRFAX CITY POLICE DEPARTMENT,FAIRFAX CITY POLICE DEPARTMENT FRONT LOBBY,3730 OLD LEE HIGHWAY,FAIRFAX,VA,22030,"http://maps.google.com/maps?q=3730 OLD LEE HIGHWAY,+FAIRFAX,+VA+22030&hl=en"
FAIRFAX COUNTY POLICE DEPARTMENT,FAIR OAKS DISTRICT STATION PARKING LOT -OPERATING 10 AM TO 2 PM-,12300 LEE JACKSON MEMORIAL HIGHWAY,FAIRFAX,VA,22033,"http://maps.google.com/maps?q=12300 LEE JACKSON MEMORIAL HIGHWAY,+FAIRFAX,+VA+22033&hl=en"
FAIRFAX COUNTY POLICE DEPARTMENT,FRANCONIA DISTRICT STATION FRONT PARKING LOT -OPERATING 10 AM TO 2 PM-,6121 FRANCONIA ROAD,ALEXANDRIA,VA,22310,"http://maps.google.com/maps?q=6121 FRANCONIA ROAD,+ALEXANDRIA,+VA+22310&hl=en"
FAIRFAX COUNTY POLICE DEPARTMENT,MASON DISTRICT STATION FRONT PARKING LOT -OPERATING 10 AM TO 2 PM-,6507 COLUMBIA PIKE,ANNANDALE,VA,22003,"http://maps.google.com/maps?q=6507 COLUMBIA PIKE,+ANNANDALE,+VA+22003&hl=en"
FAIRFAX COUNTY POLICE DEPARTMENT,MCLEAN DISTRICT POLICE STATION FRONT PARKING LOT -OPERATING 10 AM TO 2 PM-,1437 BALLS HILL ROAD,MCLEAN,VA,22101,"http://maps.google.com/maps?q=1437 BALLS HILL ROAD,+MCLEAN,+VA+22101&hl=en"
FAIRFAX COUNTY POLICE DEPARTMENT,MOUNT VERNON DISTRICT POLICE STATION FRONT PARKING LOT -OPERATING 10 AM TO 2 PM-,2511 PARKERS LANE,ALEXANDRIA,VA,22306,"http://maps.google.com/maps?q=2511 PARKERS LANE,+ALEXANDRIA,+VA+22306&hl=en"
FAIRFAX COUNTY POLICE DEPARTMENT,RESTON DISTRICT STATION PARKING LOT -OPERATING 10 AM TO 2 PM-,12000 BOWMAN TOWNE DRIVE,RESTON,VA,20190,"http://maps.google.com/maps?q=12000 BOWMAN TOWNE DRIVE,+RESTON,+VA+20190&hl=en"
FAIRFAX COUNTY POLICE DEPARTMENT,SULLY DISTRICT POLICE STATION FRONT PARKING LOT -OPERATING 10 AM TO 2 PM-,4900 STONECROFT BOULEVARD,CHANTILLY,VA,20151,"http://maps.google.com/maps?q=4900 STONECROFT BOULEVARD,+CHANTILLY,+VA+20151&hl=en"
FAIRFAX COUNTY POLICE DEPARTMENT,WEST SPRINGFIELD DISTRICT STATION PARKING LOT -OPERATING 10 AM TO 2 PM-,6140 ROLLING ROAD,SPRINGFIELD,VA,22152,"http://maps.google.com/maps?q=6140 ROLLING ROAD,+SPRINGFIELD,+VA+22152&hl=en"
FALLS CHURCH POLICE DEPARTMENT,FALLS CHURCH CITY HALL EXTERIOR,300 PARK AVE,FALLS CHURCH,VA,22046,"http://maps.google.com/maps?q=300 PARK AVE,+FALLS CHURCH,+VA+22046&hl=en"
GAITHERSBURG POLICE DEPARTMENT,GAITHERSBURG POLICE DEPARTMENT,14 FULKS CORNER AVENUE,GAITHERSBURG,MD,20877,"http://maps.google.com/maps?q=14 FULKS CORNER AVENUE,+GAITHERSBURG,+MD+20877&hl=en"
GEORGE MASON UNIVERSITY POLICE DEPARTMENT,GEORGE MASON UNIVERSITY POLICE STATION,4393 UNIVERSITY DRIVE,FAIRFAX,VA,22030,"http://maps.google.com/maps?q=4393 UNIVERSITY DRIVE,+FAIRFAX,+VA+22030&hl=en"
GRANT COUNTY SO,GRANT COUNTY SO,"10 2ND STREET, NE",ELBOW LAKE,MN,56531,"http://maps.google.com/maps?q=10 2ND STREET, NE,+ELBOW LAKE,+MN+56531&hl=en"
GREENBELT POLICE DEPARTMENT,GREENBELT POLICE DEPARTMENT,550 CRESCENT ROAD,GREENBELT,MD,20770,"http://maps.google.com/maps?q=550 CRESCENT ROAD,+GREENBELT,+MD+20770&hl=en"
HARRISON COUNTY SHERIFF'S OFFICE,HARRISON COUNTY SHERIFF'S OFFICE LOBBY,111 S. FIRST AVE,LOGAN,IA,51546,"http://maps.google.com/maps?q=111 S. FIRST AVE,+LOGAN,+IA+51546&hl=en"
HERNDON POLICE DEPARTMENT,HERNDON POLICE DEPARTMENT LOBBY AREA,397 HERNDON PARKWAY,HERNDON,VA,20170,"http://maps.google.com/maps?q=397 HERNDON PARKWAY,+HERNDON,+VA+20170&hl=en"
HOWARD COUNTY POLICE DEPARTMENT,GARY ARTHUR COMMUNITY CENTER,2400 RT. 97,COOKSVILLE,MD,21723,"http://maps.google.com/maps?q=2400 RT. 97,+COOKSVILLE,+MD+21723&hl=en"
HOWARD COUNTY POLICE DEPARTMENT,HC DRUGFREE,10451 TWIN RIVERS ROAD,COLUMBIA,MD,21045,"http://maps.google.com/maps?q=10451 TWIN RIVERS ROAD,+COLUMBIA,+MD+21045&hl=en"
HOWARD COUNTY POLICE DEPARTMENT,HOWARD COUNTY POLICE COMMUNITY OUTREACH,10785 LITTLE PATUXENT PARKWAY,COLUMBIA,MD,21044,"http://maps.google.com/maps?q=10785 LITTLE PATUXENT PARKWAY,+COLUMBIA,+MD+21044&hl=en"
HOWARD COUNTY POLICE DEPARTMENT,HOWARD COUNTY POLICE NORTHERN DISTRICT,3410 COURTHOUSE DR.,ELLICOTT CITY,MD,21043,"http://maps.google.com/maps?q=3410 COURTHOUSE DR.,+ELLICOTT CITY,+MD+21043&hl=en"
HOWARD COUNTY POLICE DEPARTMENT,HOWARD COUNTY POLICE SOUTHERN DISTRICT,11226 SCAGGSVILLE RD.,LAUREL,MD,20723,"http://maps.google.com/maps?q=11226 SCAGGSVILLE RD.,+LAUREL,+MD+20723&hl=en"
HURON POLICE DEPARTMENT,HURON POLICE DEPARTMENT SITE WILL BE LOCATED ON THE SOUTHSIDE OF CITY HALL,239 WISCONSIN AVE. SW,HURON,SD,57350,"http://maps.google.com/maps?q=239 WISCONSIN AVE. SW,+HURON,+SD+57350&hl=en"
HYATTSVILLE CITY POLICE,HYATTSVILLE CITY POLICE DEPARTMENT,4310 GALLATIN STREET,HYATTSVILLE,MD,20781,"http://maps.google.com/maps?q=4310 GALLATIN STREET,+HYATTSVILLE,+MD+20781&hl=en"
KANABEC COUNTY SHERIFF'S OFFICE,COBORNS,710 FRANKIE LANE,MORA,MN,55051,"http://maps.google.com/maps?q=710 FRANKIE LANE,+MORA,+MN+55051&hl=en"
KANDIYOHI COUNTY SO,KANDIYOHI COUNTY SO,2201 NE 23RD STREET SUITE 101,WILLMAR,MN,56201,"http://maps.google.com/maps?q=2201 NE 23RD STREET SUITE 101,+WILLMAR,+MN+56201&hl=en"
KING GEORGE SHERIFF'S OFFICE,KING GEORGE SHERIFF'S FRONT PARKING LOT,10445 GOVERNMENT CENTER BLVD.,KING GEORGE,VA,22485,"http://maps.google.com/maps?q=10445 GOVERNMENT CENTER BLVD.,+KING GEORGE,+VA+22485&hl=en"
KITTSON COUNTY SO,KITTSON COUNTY SHERIFF'S OFFICE,410 5TH STREET SOUTHSUITE #102,HALLOCK,MN,56728,"http://maps.google.com/maps?q=410 5TH STREET SOUTH,+HALLOCK,+MN+56728&hl=en"
LAC QUI PARLE SO,LAC QUI PARLE SHERIFF'S OFFICE,600 6TH STREET,MADISON,MN,56256,"http://maps.google.com/maps?q=600 6TH STREET,+MADISON,+MN+56256&hl=en"
LAKE COUNTY SHERIFF'S OFFICE,LAKE COUNTY SHERIFF'S OFFICE,219 NE 1ST STREET,MADISON,SD,57042,"http://maps.google.com/maps?q=219 NE 1ST STREET,+MADISON,+SD+57042&hl=en"
LAUREL POLICE DEPARTMENT,LAUREL POLICE DEPARTMENT,811 FIFTH STREET,LAUREL,MD,20707,"http://maps.google.com/maps?q=811 FIFTH STREET,+LAUREL,+MD+20707&hl=en"
LINCOLN COUNTY SHERIFF'S OFFICE,HARRISBURG CITY HALL,301 E. WILLOW STREET,HARRISBURG,SD,57032,"http://maps.google.com/maps?q=301 E. WILLOW STREET,+HARRISBURG,+SD+57032&hl=en"
LITTLE FALLS PD / MOTLEY PD / MORRISON COUNTY SO,LITTLE FALLS PD,207 1ST STREET NE,LITTLE FALLS,MN,56345,"http://maps.google.com/maps?q=207 1ST STREET NE,+LITTLE FALLS,+MN+56345&hl=en"
LONG PRAIRIE POLICE DEPARTMENT,LONG PRAIRIE POLICE DEPARTMENT,615 LAKE ST S,LONG PRAIRIE,MN,56347,"http://maps.google.com/maps?q=615 LAKE ST S,+LONG PRAIRIE,+MN+56347&hl=en"
LOUDOUN COUNTY SHERIFF'S OFFICE,ASHBURN STATION FRONT LOBBY,20272 SAVIN HILL DR,ASHBURN,VA,20147,"http://maps.google.com/maps?q=20272 SAVIN HILL DR,+ASHBURN,+VA+20147&hl=en"
LOUDOUN COUNTY SHERIFF'S OFFICE,DULLES SOUTH PUBLIC SAFETY CENTER FRONT LOBBY AREA,25216 LOUDOUN PARKWAY,CHANTILLY,VA,20152,"http://maps.google.com/maps?q=25216 LOUDOUN PARKWAY,+CHANTILLY,+VA+20152&hl=en"
LOUDOUN COUNTY SHERIFF'S OFFICE,EASTERN LOUDOUN STATION FRONT LOBBY AREA,46620 EAST FREDERICK DRIVE,STERLING,VA,20164,"http://maps.google.com/maps?q=46620 EAST FREDERICK DRIVE,+STERLING,+VA+20164&hl=en"
LOUDOUN COUNTY SHERIFF'S OFFICE,WEGMAN'S DULLES 28 CENTER,45131 COLUMBIA PL,STERLING,VA,20166,"http://maps.google.com/maps?q=45131 COLUMBIA PL,+STERLING,+VA+20166&hl=en"
LYON COUNTY SHERIFF'S OFFICE,LYON COUNTY SHERIFF'S OFFICE,410 SOUTH BOONE,ROCK RAPIDS,IA,51246,"http://maps.google.com/maps?q=410 SOUTH BOONE,+ROCK RAPIDS,+IA+51246&hl=en"
LYON COUNTY SO,LYON COUNTY SHERIFF'S OFFICE,611 WEST MAIN STREET,MARSHALL,MN,56258,"http://maps.google.com/maps?q=611 WEST MAIN STREET,+MARSHALL,+MN+56258&hl=en"
MANASSAS CITY POLICE DEPARTMENT,NOVANT HEALTH - PRINCE WILLIAM MEDICAL CENTER ENTRANCE TO WOMEN'S CENTER - OB/GYN,8700 SUDLEY ROAD,MANASSAS,VA,20110,"http://maps.google.com/maps?q=8700 SUDLEY ROAD,+MANASSAS,+VA+20110&hl=en"
MANASSAS PARK POLICE DEPARTMENT,MANASSAS PARK POLICE - COMMUNITY ROOM,329 MANASSAS DRIVE,MANASSAS PARK,VA,20111,"http://maps.google.com/maps?q=329 MANASSAS DRIVE,+MANASSAS PARK,+VA+20111&hl=en"
MARYLAND NATURAL RESOURCES POLICE,NATURAL RESOURCE POLICE BROADNECK OFFICE,1070 EAST COLLEGE PARKWAY,ANNAPOLIS,MD,21409,"http://maps.google.com/maps?q=1070 EAST COLLEGE PARKWAY,+ANNAPOLIS,+MD+21409&hl=en"
MARYLAND NATURAL RESOURCES POLICE,NATURAL RESOURCES POLICE GWYNNBROOK OFFICE,3738 GWYNNBROOK AVENUE,OWINGS MILLS,MD,21117,"http://maps.google.com/maps?q=3738 GWYNNBROOK AVENUE,+OWINGS MILLS,+MD+21117&hl=en"
MARYLAND STATE POLICE,MSP COLLEGE PARK BARRACK Q POC: LT. SEAN MORRIS,10100 RHODE ISLAND AVENUE,COLLEGE PARK,MD,20740,"http://maps.google.com/maps?q=10100 RHODE ISLAND AVENUE,+COLLEGE PARK,+MD+20740&hl=en"
MARYLAND STATE POLICE,MSP FORESTVILLE BARRACK POC: LT. ROLAND BUTLER,3500 FORESTVILLE ROAD,FORESTVILLE,MD,20747,"http://maps.google.com/maps?q=3500 FORESTVILLE ROAD,+FORESTVILLE,+MD+20747&hl=en"
MARYLAND STATE POLICE,MSP GLEN BURNIE BARRACK POC: SGT. EDWARD EICHER,6800 AVIATION BLVD.,GLEN BURNIE,MD,21061,"http://maps.google.com/maps?q=6800 AVIATION BLVD.,+GLEN BURNIE,+MD+21061&hl=en"
MARYLAND STATE POLICE,MSP LA PLATA BARRACK POC: D/SGT. KEVIN BEAUCHAMP,9500 MITCHELL ROAD,LA PLATA,MD,20646,"http://maps.google.com/maps?q=9500 MITCHELL ROAD,+LA PLATA,+MD+20646&hl=en"
MARYLAND STATE POLICE,MSP ROCKVILLE BARRACK POC: LT. H.B. MARTZ,7915 MONTROSE ROAD,ROCKVILLE,MD,20854,"http://maps.google.com/maps?q=7915 MONTROSE ROAD,+ROCKVILLE,+MD+20854&hl=en"
MARYLAND STATE POLICE,MSP WATERLOO BARRACK POC: D/SGT. MYERS,7777 WASHINGTON BLVD,JESSUP,MD,20794,"http://maps.google.com/maps?q=7777 WASHINGTON BLVD,+JESSUP,+MD+20794&hl=en"
MARYLAND STATE POLICE,MSP WESTMINSTER BARRACKS POC: LT. PATRICK MCCRORY,1100 BALTIMORE BLVD.,WESTMINSTER,MD,21157,"http://maps.google.com/maps?q=1100 BALTIMORE BLVD.,+WESTMINSTER,+MD+21157&hl=en"
MISSOURI VALLEY POLICE DEPARTMENT,RAND COMMUNITY CENTER,100 S. 4TH ST,MISSOURI VALLEY,IA,51555,"http://maps.google.com/maps?q=100 S. 4TH ST,+MISSOURI VALLEY,+IA+51555&hl=en"
MONTEVIDEO PD,MONTEVIDEO POLICE DEPARTMENT,103 CANTON AVENUE,MONTEVIDEO,MN,56265,"http://maps.google.com/maps?q=103 CANTON AVENUE,+MONTEVIDEO,+MN+56265&hl=en"
MONTGOMERY COUNTY DEPARTMENT OF POLICE,2ND DISTRICT POLICE STATION,4823 RUGBY AVENUE,BETHESDA,MD,20814,"http://maps.google.com/maps?q=4823 RUGBY AVENUE,+BETHESDA,+MD+20814&hl=en"
MONTGOMERY COUNTY DEPARTMENT OF POLICE,3RD DISTRICT POLICE STATION,1001 MILESTONE DRIVE,SILVER SPRING,MD,20904,"http://maps.google.com/maps?q=1001 MILESTONE DRIVE,+SILVER SPRING,+MD+20904&hl=en"
MONTGOMERY COUNTY DEPARTMENT OF POLICE,4TH DISTRICT POLICE STATION,2300 RANDOLPH ROAD,WHEATON,MD,20902,"http://maps.google.com/maps?q=2300 RANDOLPH ROAD,+WHEATON,+MD+20902&hl=en"
MONTGOMERY COUNTY DEPARTMENT OF POLICE,5TH DISTRICT POLICE STATION,20000 AIRCRAFT DRIVE,GERMANTOWN,MD,20874,"http://maps.google.com/maps?q=20000 AIRCRAFT DRIVE,+GERMANTOWN,+MD+20874&hl=en"
MONTGOMERY COUNTY DEPARTMENT OF POLICE,6TH DISTRICT NORTH CREEK COMMUNITY CENTER,20125 ARROWHEAD ROAD,MONTGOMERY VILLAGE,MD,20886,"http://maps.google.com/maps?q=20125 ARROWHEAD ROAD,+MONTGOMERY VILLAGE,+MD+20886&hl=en"
MONTGOMERY COUNTY DEPARTMENT OF POLICE,FIRE STATION 1,8110 GEORGIA AVE.,SILVER SPRING,MD,20910,"http://maps.google.com/maps?q=8110 GEORGIA AVE.,+SILVER SPRING,+MD+20910&hl=en"
MONTGOMERY COUNTY DEPARTMENT OF POLICE,JEWISH COMMUNITY CENTER,6125 MONTROSE RD.,ROCKVILLE,MD,20852,"http://maps.google.com/maps?q=6125 MONTROSE RD.,+ROCKVILLE,+MD+20852&hl=en"
MONTGOMERY COUNTY DEPARTMENT OF POLICE,LEISURE WORLD,3305 N. LEISURE WORLD BLVD.,SILVER SPRING,MD,20906,"http://maps.google.com/maps?q=3305 N. LEISURE WORLD BLVD.,+SILVER SPRING,+MD+20906&hl=en"
MONTGOMERY COUNTY DEPARTMENT OF POLICE,SENIOR LIVING KENTLANDS MANOR,217 BOOTH ST.,GAITHERSBURG,MD,20878,"http://maps.google.com/maps?q=217 BOOTH ST.,+GAITHERSBURG,+MD+20878&hl=en"
MONTGOMERY COUNTY DEPARTMENT OF POLICE,VILLAGE OF FRIENDSHIP HEIGHTS COMMUNITY CENTER,4433 SOUTH PARK AVENUE,CHEVY CHASE,MD,20815,"http://maps.google.com/maps?q=4433 SOUTH PARK AVENUE,+CHEVY CHASE,+MD+20815&hl=en"
MOORHEAD POLICE DEPARTMENT,HORNBACHERS PARKING LOT 12PM-2PM,950 40TH AVENUE SOUTH,MOORHEAD,MN,56560,"http://maps.google.com/maps?q=950 40TH AVENUE SOUTH,+MOORHEAD,+MN+56560&hl=en"
MOORHEAD POLICE DEPARTMENT,WALGREENS PARKING LOT 10AM -12PM,900 MAIN AVENUE,MOORHEAD,MN,56560,"http://maps.google.com/maps?q=900 MAIN AVENUE,+MOORHEAD,+MN+56560&hl=en"
NETT LAKE PD,BOIS FORTE TRIBAL GOVERNMENT BUILDING,5433 LAKESHORE DRIVE,NETT LAKE,MN,55772,"http://maps.google.com/maps?q=5433 LAKESHORE DRIVE,+NETT LAKE,+MN+55772&hl=en"
NETT LAKE PD,BOIS FORTE TRIBAL GOVERNMENT VERMILION,1610 FARM ROAD SOUTH,TOWER,MN,55790,"http://maps.google.com/maps?q=1610 FARM ROAD SOUTH,+TOWER,+MN+55790&hl=en"
NORTH BRANCH PD,NORTH BRANCH CITY HALL OPEN FROM 10 A.M. UNTIL 2 P.M.,6408 ELM STREET,NORTH BRANCH,MN,55056,"http://maps.google.com/maps?q=6408 ELM STREET,+NORTH BRANCH,+MN+55056&hl=en"
OSCEOLA COUNTY SHERIFF OFFICE,OSCEOLA COUNTY SHERIFF OFFICE,309 6TH STREET,SIBLEY,IA,51249,"http://maps.google.com/maps?q=309 6TH STREET,+SIBLEY,+IA+51249&hl=en"
PALO ALTO COUNTY SHERIFF'S OFFICE,PALO ALTO COUNTY SHERIFF'S OFFICE NO BOXES,2001 11TH STREET,EMMETSBURG,IA,50536,"http://maps.google.com/maps?q=2001 11TH STREET,+EMMETSBURG,+IA+50536&hl=en"
PAUL BUNYAN DRUG TASK FORCE,BELTRAMI COUNTY LAW ENFORCEMENT CENTER,613 MN AVENUE NW,BEMIDJI,MN,56601,"http://maps.google.com/maps?q=613 MN AVENUE NW,+BEMIDJI,+MN+56601&hl=en"
PINE TO PRAIRIE DRUG TASK FORCE,EAST GRAND FORKS PD,520 DEMERS AVENUE,EAST GRAND FORKS,MN,56721,"http://maps.google.com/maps?q=520 DEMERS AVENUE,+EAST GRAND FORKS,+MN+56721&hl=en"
PRAIRIE KNIGHTS CASINO,TESORO STATION,7932 ND-24,MEKINOCK,ND,58258,"http://maps.google.com/maps?q=7932 ND-24,+MEKINOCK,+ND+58258&hl=en"
PRINCE GEORGE'S COUNTY POLICE DEPARTMENT,"CENTRAL COLLECTION SITE DISTRICT III, PGPD",7600 BARLOWE ROAD,PALMER PARK,MD,20785,"http://maps.google.com/maps?q=7600 BARLOWE ROAD,+PALMER PARK,+MD+20785&hl=en"
PRINCE GEORGE'S COUNTY POLICE DEPARTMENT,DISTRICT 4 STATION - OXON HILL,5135 INDIAN HEAD HIGHWAY,OXON HILL,MD,20745,"http://maps.google.com/maps?q=5135 INDIAN HEAD HIGHWAY,+OXON HILL,+MD+20745&hl=en"
PRINCE GEORGE'S COUNTY POLICE DEPARTMENT,"NORTHERN COLLECTION SITE DISTRICT I, PGPD",5000 RHODE ISLAND AVENUE,HYATTSVILLE,MD,20784,"http://maps.google.com/maps?q=5000 RHODE ISLAND AVENUE,+HYATTSVILLE,+MD+20784&hl=en"
PRINCE WILLIAM CO. PD,NOVANT HEALTH HAYMARKET MEDICAL CENTER FRONT PARKING LOT,15225 HEATHCOTE BLVD,HAYMARKET,VA,20169,"http://maps.google.com/maps?q=15225 HEATHCOTE BLVD,+HAYMARKET,+VA+20169&hl=en"
PRINCE WILLIAM CO. PD,PWCPD CENTRAL DISTRICT STATION,5036 DAVIS FORD ROAD,WOODBRIDGE,VA,22192,"http://maps.google.com/maps?q=5036 DAVIS FORD ROAD,+WOODBRIDGE,+VA+22192&hl=en"
PRINCETON PD,PRINCETON PD,305 21ST AVENUE SOUTH,PRINCETON,MN,55371,"http://maps.google.com/maps?q=305 21ST AVENUE SOUTH,+PRINCETON,+MN+55371&hl=en"
QUANTICO MARINE CORPS BASE,QUANTICO MARINE CORPS EXCHANGE,4806 RUSSELL RD,QUANTICO,VA,22134,"http://maps.google.com/maps?q=4806 RUSSELL RD,+QUANTICO,+VA+22134&hl=en"
RENVILLE COUNTY SO,RENVILLE COUNTY SHERIFF'S OFFICE,"105 5TH STREET SOUTH, SUITE #210",OLIVIA,MN,56277,"http://maps.google.com/maps?q=105 5TH STREET SOUTH, SUITE #210,+OLIVIA,+MN+56277&hl=en"
ROCK COUNTY SO,ROCK COUNTY SO,1000 NORTH BLUE MOUND AVENUE,LUVERNE,MN,56156,"http://maps.google.com/maps?q=1000 NORTH BLUE MOUND AVENUE,+LUVERNE,+MN+56156&hl=en"
ROCKVILLE CITY POLICE DEPARTMENT,ROCKVILLE CITY POLICE DEPARTMENT,#2 W. MONTGOMERY AVENUE,ROCKVILLE,MD,20850,"http://maps.google.com/maps?q=#2 W. MONTGOMERY AVENUE,+ROCKVILLE,+MD+20850&hl=en"
SIOUX CITY POLICE DEPARTMENT,DRILLING PHARMACY,4010 MORNINGSIDE AVE,SIOUX CITY,IA,51106,"http://maps.google.com/maps?q=4010 MORNINGSIDE AVE,+SIOUX CITY,+IA+51106&hl=en"
SIOUX CITY POLICE DEPARTMENT,FAREWAY GROCERY STORE,4040 WAR EAGLE DRIVE,SIOUX CITY,IA,51109,"http://maps.google.com/maps?q=4040 WAR EAGLE DRIVE,+SIOUX CITY,+IA+51109&hl=en"
SIOUX CITY POLICE DEPARTMENT,HY VEE FOOD STORES,2827 HAMILTON BLVD.,SIOUX CITY,IA,51103,"http://maps.google.com/maps?q=2827 HAMILTON BLVD.,+SIOUX CITY,+IA+51103&hl=en"
SIOUX CITY POLICE DEPARTMENT,HY-VEE,4500 SERGEANT ROAD,SIOUX CITY,IA,51106,"http://maps.google.com/maps?q=4500 SERGEANT ROAD,+SIOUX CITY,+IA+51106&hl=en"
SIOUX CITY POLICE DEPARTMENT,TARGET,5775 SUNNYBROOK DRIVE,SIOUX CITY,IA,51101,"http://maps.google.com/maps?q=5775 SUNNYBROOK DRIVE,+SIOUX CITY,+IA+51101&hl=en"
SIOUX CITY POLICE DEPARTMENT,WALGREENS,101 PIERCE STREET,SIOUX CITY,IA,51101,"http://maps.google.com/maps?q=101 PIERCE STREET,+SIOUX CITY,+IA+51101&hl=en"
