Participant,CollectionSite,Address,City,State,Zip,MapURL
ALMA POLICE DEPARTMENT,ALMA POLICE DEPARTMENT PERMANENT DROP BOX,804 FAYETTEVILLE AVE,ALMA,AR,72921,"http://maps.google.com/maps?q=804 FAYETTEVILLE AVE,+ALMA,+AR+72921&hl=en"
ANADARKO AGENCY,ANADARKO AGENCY,STATE HIGHWAY 281 & PARKER MCKENZIE DRIVE,ANADARKO,OK,73005,"http://maps.google.com/maps?q=STATE HIGHWAY 281 & PARKER MCKENZIE DRIVE,+ANADARKO,+OK+73005&hl=en"
ANDOVER POLICE DEPARTMENT,WALGREENS,440 N ANDOVER RD,ANDOVER,KS,67002,"http://maps.google.com/maps?q=440 N ANDOVER RD,+ANDOVER,+KS+67002&hl=en"
ARKANSAS COMMUNITY CORRECTION,WASHINGTON COUNTY SHERIFFS OFFICE,1155 WEST CLYDESDALE,FAYETTEVILLE,AR,72703,"http://maps.google.com/maps?q=1155 WEST CLYDESDALE,+FAYETTEVILLE,+AR+72703&hl=en"
AUGUSTA DEPT. OF PUBLIC SAFETY,AUGUSTA DEPT. OF PUBLIC SAFETY,2100 N. OHIO,AUGUSTA,KS,67010,"http://maps.google.com/maps?q=2100 N. OHIO,+AUGUSTA,+KS+67010&hl=en"
BARTLESVILLE OKLAHOMA PD,BARTLESVILLE PD,615 S JOHNSTONE AVE,BARTLESVILLE,OK,74003,"http://maps.google.com/maps?q=615 S JOHNSTONE AVE,+BARTLESVILLE,+OK+74003&hl=en"
BARTLESVILLE OKLAHOMA PD,FIRE STATION NO. 3,100 SE MADISON BLVD,BARTLESVILLE,OK,74006,"http://maps.google.com/maps?q=100 SE MADISON BLVD,+BARTLESVILLE,+OK+74006&hl=en"
BARTLESVILLE OKLAHOMA PD,FIRE STATION NO. 4,3501 SE PRICE RD,BARTLESVILLE,OK,74006,"http://maps.google.com/maps?q=3501 SE PRICE RD,+BARTLESVILLE,+OK+74006&hl=en"
BELLA VISTA POLICE DEPARTMENT,BELLA VISTA POLICE DEPARTMENT PERMANENT DROP BOX,105 TOWN CENTER,BELLA VISTA,AR,72714,"http://maps.google.com/maps?q=105 TOWN CENTER,+BELLA VISTA,+AR+72714&hl=en"
BELLE PLAINE POLICE DEPARTMENT,BELLE PLAINE POLICE DEPARTMENT,419 N. LOGAN ST,CONWAY SPRINGS,KS,67031,"http://maps.google.com/maps?q=419 N. LOGAN ST,+CONWAY SPRINGS,+KS+67031&hl=en"
BELLE PLAINE POLICE DEPARTMENT,CONWAY SPRINGS POLICE DEPARTMENT,310 W SPRING AVE,CONWAY SPRINGS,KS,67031,"http://maps.google.com/maps?q=310 W SPRING AVE,+CONWAY SPRINGS,+KS+67031&hl=en"
BELLE PLAINE POLICE DEPARTMENT,OXFORD POLICE DEPARTMENT,121 S. SUMMER,OXFORD,KS,67119,"http://maps.google.com/maps?q=121 S. SUMMER,+OXFORD,+KS+67119&hl=en"
BELLE PLAINE POLICE DEPARTMENT,WELLINGTON POLICE DEPARTMENT,"200 N. C, STE 100",WELLINGTON,KS,67152,"http://maps.google.com/maps?q=200 N. C, STE 100,+WELLINGTON,+KS+67152&hl=en"
BENTON COUNTY SHERIFF'S OFFICE,ASP TROOP L HEADQUARTERS,900 SOUTH 48TH STREET,SPRINGDALE,AR,72766,"http://maps.google.com/maps?q=900 SOUTH 48TH STREET,+SPRINGDALE,+AR+72766&hl=en"
BENTON COUNTY SHERIFF'S OFFICE,BENTON COUNTY SHERIFF'S OFFICE PERMANENT DROP BOX,1300 SW 14TH STREET,BENTONVILLE,AR,72712,"http://maps.google.com/maps?q=1300 SW 14TH STREET,+BENTONVILLE,+AR+72712&hl=en"
BLAINE COUNTY SHERIFF'S DEPARTMENT,WATONGA EMS BUILDING,305 W. MAIN ST,WATONGA,OK,73772,"http://maps.google.com/maps?q=305 W. MAIN ST,+WATONGA,+OK+73772&hl=en"
BOONEVILLE POLICE DEPARTMENT,BOONEVILLE POLICE DEPARTMENT PERMANENT DROP BOX,497 EAST MAIN ST.,BOONEVILLE,AR,72927,"http://maps.google.com/maps?q=497 EAST MAIN ST.,+BOONEVILLE,+AR+72927&hl=en"
BRISTOW OKLAHOMA PD,WAL-MART,105 W HIGHWAY 16,BRISTOW,OK,74010,"http://maps.google.com/maps?q=105 W HIGHWAY 16,+BRISTOW,+OK+74010&hl=en"
BUREAU OF INDIAN AFFAIRS - OJS,NORTHERN TRIBAL HEALTH SYSTEMS,7600 S HIGHWAY 69 A,MIAMI,OK,74355,"http://maps.google.com/maps?q=7600 S HIGHWAY 69 A,+MIAMI,+OK+74355&hl=en"
BURLINGTON POLICE DEPT,COFFEY CO. HOSPITAL AMBULANCE BAY,801 N 4TH ST.,BURLINGTON,KS,66839,"http://maps.google.com/maps?q=801 N 4TH ST.,+BURLINGTON,+KS+66839&hl=en"
BUTLER POLICE DEPARTMENT,BATES COUNTY HEALTH DEPARTMENT,501 N ORANGE,BUTLER,MO,64730,"http://maps.google.com/maps?q=501 N ORANGE,+BUTLER,+MO+64730&hl=en"
BUTLER POLICE DEPT.,BATES COUNTY HEALTH DEPARTMENT,501 N. ORANGE,BUTLER,MO,64730,"http://maps.google.com/maps?q=501 N. ORANGE,+BUTLER,+MO+64730&hl=en"
CASSVILLE POLICE DEPARTMENT,CITY HALL/CASSVILLE POLICE DEPT,300 MAIN STREET,CASSVILLE,MO,65625,"http://maps.google.com/maps?q=300 MAIN STREET,+CASSVILLE,+MO+65625&hl=en"
CENTERTON POLICE DEPARTMENT,CENTERTON POLICE DEPARTMENT PERMANENT DROP BOX,220 MUNICIPAL DR,CENTERTON,AR,72719,"http://maps.google.com/maps?q=220 MUNICIPAL DR,+CENTERTON,+AR+72719&hl=en"
CHANUTE POLICE DEPT,MEDICINE SHOPPE,421 W. MAIN,CHANUTE,KS,66720,"http://maps.google.com/maps?q=421 W. MAIN,+CHANUTE,+KS+66720&hl=en"
CHENEY POLICE DEPT.,FIRE STATION,525 N MAIN,CHENEY,KS,67025,"http://maps.google.com/maps?q=525 N MAIN,+CHENEY,+KS+67025&hl=en"
CHEROKEE COUNTY SHERIFF'S OFFICE,APPLE MARKET,103 NORTH EAST AVENUE,COLUMBUS,KS,66725,"http://maps.google.com/maps?q=103 NORTH EAST AVENUE,+COLUMBUS,+KS+66725&hl=en"
CHEROKEE COUNTY SHERIFF'S OFFICE,GALENA CITY HALL,211 WEST 7TH STREET,GALENA,KS,66739,"http://maps.google.com/maps?q=211 WEST 7TH STREET,+GALENA,+KS+66739&hl=en"
CHEROKEE COUNTY SHERIFF'S OFFICE,MARVINS IGA,1400 MILITARY AVENUE,BAXTER SPRINGS,KS,66713,"http://maps.google.com/maps?q=1400 MILITARY AVENUE,+BAXTER SPRINGS,+KS+66713&hl=en"
COAL HILL POLICE DEPARTMENT,COAL HILL POLICE DEPARTMENT,101 EAST HIGHWAY 64,COAL HILL,AR,72832,"http://maps.google.com/maps?q=101 EAST HIGHWAY 64,+COAL HILL,+AR+72832&hl=en"
COFFEYVILLE POLICE DEPARTMENT,COFFEYVILLE POLICE DEPARTMENT,1206 W. 11TH STREET,COFFEYVILLE,KS,67337,"http://maps.google.com/maps?q=1206 W. 11TH STREET,+COFFEYVILLE,+KS+67337&hl=en"
COMANCHE NATION POLICE DEPARTMENT,COMANCHE NATION POLICE DEPT,8527 NW MADISCHE RD,LAWTON,OK,73507,"http://maps.google.com/maps?q=8527 NW MADISCHE RD,+LAWTON,+OK+73507&hl=en"
CONCHO AGENCY,CONCHO AGENCY,1621 B EAST HIGHWAY 66,EL RENO,OK,73036,"http://maps.google.com/maps?q=1621 B EAST HIGHWAY 66,+EL RENO,+OK+73036&hl=en"
COWLEY COUNTY SHERIFF'S OFFICE,COWLEY COUNTY SHERIFF'S OFFICE,911 FULLER ST,WINFIELD,KS,67156,"http://maps.google.com/maps?q=911 FULLER ST,+WINFIELD,+KS+67156&hl=en"
CRAWFORD COUNTY SHERIFF'S OFFICE,CRAWFORD COUNTY JUSTICE CENTER PERMANENT DROP BOX,4235 ALMA HWY,VAN BUREN,AR,72956,"http://maps.google.com/maps?q=4235 ALMA HWY,+VAN BUREN,+AR+72956&hl=en"
DADE COUNTY SHERIFF,GREENFIELD PHARMACY,105 SOUTH GRANDE,GREENFIELD,MO,65661,"http://maps.google.com/maps?q=105 SOUTH GRANDE,+GREENFIELD,+MO+65661&hl=en"
DADE COUNTY SHERIFF,MFA OIL,401 MAIN STREET,LOCKWOOD,MO,65682,"http://maps.google.com/maps?q=401 MAIN STREET,+LOCKWOOD,+MO+65682&hl=en"
DEA TULSA RESIDENT OFFICE,NEWS ON 6,303 N. BOSTON AVENUE,TULSA,OK,74103,"http://maps.google.com/maps?q=303 N. BOSTON AVENUE,+TULSA,+OK+74103&hl=en"
EL DORADO POLICE DEPARTMENT,EL DORADO POLICE DEPARTMENT,128 N. VINE STREET,EL DORADO,KS,67042,"http://maps.google.com/maps?q=128 N. VINE STREET,+EL DORADO,+KS+67042&hl=en"
EL DORADO SPRINGS POLICE DEPARTMENT,EL DORADO SPRINGS POLICE DEPT POLICE STATION,1207 SOUTH MAIN STREET,EL DORADO SPRINGS,MO,64744,"http://maps.google.com/maps?q=1207 SOUTH MAIN STREET,+EL DORADO SPRINGS,+MO+64744&hl=en"
EUREKA SPRINGS POLICE DEPARTMENT,EUREKA SPRINGS POLICE DEPARTMENT PERMANENT DROP BOX,147 PASSION PLAY ROAD,EUREKA SPRINGS,AR,72632,"http://maps.google.com/maps?q=147 PASSION PLAY ROAD,+EUREKA SPRINGS,+AR+72632&hl=en"
FARMINGTON POLICE DEPARTMENT,FARMINGTON POLICE DEPARTMENT PERMANENT DROP BOX,354 WEST MAIN,FARMINGTON,AR,72730,"http://maps.google.com/maps?q=354 WEST MAIN,+FARMINGTON,+AR+72730&hl=en"
FAYETTEVILLE POLICE DEPARTMENT,HARPS MARKETPLACE #124,1274 N. COLORADO DR,FAYETTEVILLE,AR,72704,"http://maps.google.com/maps?q=1274 N. COLORADO DR,+FAYETTEVILLE,+AR+72704&hl=en"
FORT SMITH POLICE DEPARTMENT,FORT SMITH POLICE DEPARTMENT PERMANENT DROP BOX,100 SOUTH 10TH STREET,FORT SMITH,AR,72901,"http://maps.google.com/maps?q=100 SOUTH 10TH STREET,+FORT SMITH,+AR+72901&hl=en"
GENTRY POLICE DEPARTMENT,GENTRY POLICE DEPARTMENT PERMANENT DROP BOX,628 E. THIRD ST.,GENTRY,AR,72734,"http://maps.google.com/maps?q=628 E. THIRD ST.,+GENTRY,+AR+72734&hl=en"
GRANBY POLICE DEPARTMENT,RAMSEY'S GROCERY,469 W VALLEY ST,GRANBY,MO,64844,"http://maps.google.com/maps?q=469 W VALLEY ST,+GRANBY,+MO+64844&hl=en"
GRAVETTE POLICE DEPARTMENT,GRAVETTE POLICE DEPARTMENT PERMANENT DROP BOX,606 1ST AVE SE,GRAVETTE,AR,72736,"http://maps.google.com/maps?q=606 1ST AVE SE,+GRAVETTE,+AR+72736&hl=en"
HARVEY COUNTY SHERIFF'S OFFICE,HARVEY COUNTY SHERIFF'S OFFICE,120 E 7TH,NEWTON,KS,67114,"http://maps.google.com/maps?q=120 E 7TH,+NEWTON,+KS+67114&hl=en"
HAYSVILLE POLICE DEPARTMENT,HAYSVILLE PD,200 W. GRAND,HAYSVILLE,KS,67060,"http://maps.google.com/maps?q=200 W. GRAND,+HAYSVILLE,+KS+67060&hl=en"
HENRY COUNTY SHERIFF'S OFFICE,SUMMERS PHARMACY OUT FRONT,605 PAWNEE,CLINTON,MO,64735,"http://maps.google.com/maps?q=605 PAWNEE,+CLINTON,+MO+64735&hl=en"
HILLSBORO POLICE DEPARTMENT,HILLSBORO POLICE DEPARTMENT,414 N. ASH ST.,HILLSBORO,KS,67063,"http://maps.google.com/maps?q=414 N. ASH ST.,+HILLSBORO,+KS+67063&hl=en"
JASPER COUNTY SHERIFF'S OFFICE,JASPER COUNTY COURTHOUSE,601 PEARL AVE,JOPLIN,MO,64801,"http://maps.google.com/maps?q=601 PEARL AVE,+JOPLIN,+MO+64801&hl=en"
KICKAPOO TRIBAL POLICE DEPARTMENT,KICKAPOO CASINO,25230 E. WHY 62,HARRAH,OK,73045,"http://maps.google.com/maps?q=25230 E. WHY 62,+HARRAH,+OK+73045&hl=en"
LA CYGNE POLICE DEPARTMENT,CITY HALL,206 N. COMMERCIAL ST,LACYGNE,KS,66040,"http://maps.google.com/maps?q=206 N. COMMERCIAL ST,+LACYGNE,+KS+66040&hl=en"
LAMAR POLICE DEPARTMENT,LAMAR CITY COMPLEX BUILDING FRONT OF BLDG.,505 SOUTH MAIN ST.,LAMAR,CO,81052,"http://maps.google.com/maps?q=505 SOUTH MAIN ST.,+LAMAR,+CO+81052&hl=en"
LAVACA POLICE DEPARTMENT,HEALTH WISE PHARMACY,1800 WEST MAIN STREET,LAVACA,AR,72941,"http://maps.google.com/maps?q=1800 WEST MAIN STREET,+LAVACA,+AR+72941&hl=en"
LAVACA POLICE DEPARTMENT,LAVACA POLICE DEPARTMENT PERMANENT DROP BOX,104 SOUTH DAVIS STREET,LAVACA,AR,72941,"http://maps.google.com/maps?q=104 SOUTH DAVIS STREET,+LAVACA,+AR+72941&hl=en"
LOGAN COUNTY SHERIFF'S OFFICE,LOGAN POLICE DEPARTMENT PERMANENT DROP BOX,508 W. GROBER ST,PARIS,AR,72855,"http://maps.google.com/maps?q=508 W. GROBER ST,+PARIS,+AR+72855&hl=en"
LOWELL POLICE DEPARTMENT,LOWELL POLICE DEPARTMENT,216 NORTH LINCOLN STREETPERMANENT DROP BOX,LOWELL,AR,72745,"http://maps.google.com/maps?q=216 NORTH LINCOLN STREET,+LOWELL,+AR+72745&hl=en"
MADISON COUNTY SHERIFF'S DEPARTMENT,MADISON COUNTY SHERIFF'S OFFICE PERMANENT DROP BOX,1 MAIN STREET,HUNTSVILLE,AR,72740,"http://maps.google.com/maps?q=1 MAIN STREET,+HUNTSVILLE,+AR+72740&hl=en"
MAIZE POLICE DEPARTMENT,MAIZE POLICE DEPARTMENT LOBBY,10100 W. GRADY,MAIZE,KS,67101,"http://maps.google.com/maps?q=10100 W. GRADY,+MAIZE,+KS+67101&hl=en"
MIAMI AGENCY,MIAMI AGENCY,34 A ST NE,MIAMI,OK,74355,"http://maps.google.com/maps?q=34 A ST NE,+MIAMI,+OK+74355&hl=en"
MIAMI NATION TRIBAL POLICE,MIAMI NATION TRIBAL POLICE,3410 P. STREET,MIAMI,OK,74354,"http://maps.google.com/maps?q=3410 P. STREET,+MIAMI,+OK+74354&hl=en"
MISSOURI SOUTHERN STATE UNIV POLICE DEPT,MSSU PD,726 N. MISSION HILLS DRIVE,JOPLIN,MO,64801,"http://maps.google.com/maps?q=726 N. MISSION HILLS DRIVE,+JOPLIN,+MO+64801&hl=en"
MONETT POLICE DEPARTMENT,MONETT POLICE DEPARTMENT,1901 EAST CLEVELAND AVE,MONETT,MO,65708,"http://maps.google.com/maps?q=1901 EAST CLEVELAND AVE,+MONETT,+MO+65708&hl=en"
MOUNT VERNON POLICE DEPARTMENT,MOUNT VERNON CITY HALL,319 EAST DALLAS,MOUNT VERNON,MO,65712,"http://maps.google.com/maps?q=319 EAST DALLAS,+MOUNT VERNON,+MO+65712&hl=en"
NEODESHA POLICE DEPARTMENT,NEODESHA POLICE DEPARTMENT,1407 N. 8TH STREET,NEODESHA,KS,66757,"http://maps.google.com/maps?q=1407 N. 8TH STREET,+NEODESHA,+KS+66757&hl=en"
NEOSHO POLICE DEPARTMENT,WILDCAT CORNER,817 S NEOSHO BLVD,NEOSHO,MO,64850,"http://maps.google.com/maps?q=817 S NEOSHO BLVD,+NEOSHO,+MO+64850&hl=en"
NEVADA POLICE DEPT,NEVADA POLICE DEPT,120 SOUTH ASH STEEET,NEVADA,MO,64772,"http://maps.google.com/maps?q=120 SOUTH ASH STEEET,+NEVADA,+MO+64772&hl=en"
NEWTON COUNTY SHERIFF'S OFFICE,NEWTON COUNTY SHERIFF'S OFFICE,208 W. COLER ST.,NEOSHO,MO,64850,"http://maps.google.com/maps?q=208 W. COLER ST.,+NEOSHO,+MO+64850&hl=en"
NORTHEASTERN STATE UNIVERSITY POLICE,NORTHEASTERN HEALTH SYSTEMS,1400 EAST DOWNING,TAHLEQUAH,OK,74464,"http://maps.google.com/maps?q=1400 EAST DOWNING,+TAHLEQUAH,+OK+74464&hl=en"
OKLAHOMA COUNTY SO,OCSO,201 N SHARTEL,OKLAHOMA CITY,OK,73102,"http://maps.google.com/maps?q=201 N SHARTEL,+OKLAHOMA CITY,+OK+73102&hl=en"
OKLAHOMA STATE UNIVERSITY PD,OKLAHOMA STATE UNIVERSITY IT,1801 E. 4TH ST.,OKMULGEE,OK,74447,"http://maps.google.com/maps?q=1801 E. 4TH ST.,+OKMULGEE,+OK+74447&hl=en"
OZARK POLICE DEPARTMENT,OZARK POLICE DEPARTMENT PERMANENT DROP BOX,2914 WEST COMMERCIAL STREET,OZARK,AR,72949,"http://maps.google.com/maps?q=2914 WEST COMMERCIAL STREET,+OZARK,+AR+72949&hl=en"
PARIS POLICE DEPARTMENT,PARIS POLICE DEPARTMENT PERMANENT DROP BOX,1810 EAST WALNUT STREET,PARIS,AR,72855,"http://maps.google.com/maps?q=1810 EAST WALNUT STREET,+PARIS,+AR+72855&hl=en"
PAWNEE AGENCY,PAWNEE AGENCY,123 WHITE EAGLE DRIVE,PONCA CITY,OK,74601,"http://maps.google.com/maps?q=123 WHITE EAGLE DRIVE,+PONCA CITY,+OK+74601&hl=en"
PEA RIDGE POLICE DEPARTMENT,PEA RIDGE POLICE DEPARTMENT PERMANENT DROP BOX,187 SLACK STREET,PEA RIDGE,AR,72751,"http://maps.google.com/maps?q=187 SLACK STREET,+PEA RIDGE,+AR+72751&hl=en"
PITTSBURG KANSAS POLICE DEPT.,PITTSBURG POLICE DEPARTMENT,201 N. PINE ST.,PITTSBURG,KS,66762,"http://maps.google.com/maps?q=201 N. PINE ST.,+PITTSBURG,+KS+66762&hl=en"
PITTSBURG SHERIFF DEPARTMENT,PITTSBURG SHERIFF DEPARTMENT,1210 N WEST ST,MCALESTER,OK,74501,"http://maps.google.com/maps?q=1210 N WEST ST,+MCALESTER,+OK+74501&hl=en"
POTTER COUNTY SO,POTTER COUNTY DETENTION CENTER,13100 NE 29TH,AMARILLO,TX,79111,"http://maps.google.com/maps?q=13100 NE 29TH,+AMARILLO,+TX+79111&hl=en"
PRAIRIE GROVE POLICE DEPARTMENT,HARPS FOOD STORE #125,319 E. BUCHANAN ST.,PRAIRIE GROVE,AR,72753,"http://maps.google.com/maps?q=319 E. BUCHANAN ST.,+PRAIRIE GROVE,+AR+72753&hl=en"
PRAIRIE GROVE POLICE DEPARTMENT,PRAIRIE GROVE POLICE DEPARTMENT,955 E. DOUGLAS ST.#1,PRAIRIE GROVE,AR,72753,"http://maps.google.com/maps?q=955 E. DOUGLAS ST.,+PRAIRIE GROVE,+AR+72753&hl=en"
PUEBLO POLICE DEPARTMENT,PUEBLO POLICE DEPARTMENT PARKING LOT,200 SOUTH MAIN ST.,PUEBLO,CO,81003,"http://maps.google.com/maps?q=200 SOUTH MAIN ST.,+PUEBLO,+CO+81003&hl=en"
PUEBLO SHERIFF'S OFFICE,PUEBLO COUNTY SHERIFF OFFICE WEST SUB STATION,320 JOE MARTINEZ BLVD,PUEBLO,CO,81003,"http://maps.google.com/maps?q=320 JOE MARTINEZ BLVD,+PUEBLO,+CO+81003&hl=en"
PUEBLO SHERIFF'S OFFICE,PUEBLO RURAL FIRE DEPARTMENT,29912 HIGHWAY 50 EAST,PUEBLO,CO,81001,"http://maps.google.com/maps?q=29912 HIGHWAY 50 EAST,+PUEBLO,+CO+81001&hl=en"
PUEBLO SHERIFF'S OFFICE,SOUTH COUNTY FIRE STATION,4495 BENT BROTHERS,PUEBLO,CO,81003,"http://maps.google.com/maps?q=4495 BENT BROTHERS,+PUEBLO,+CO+81003&hl=en"
ROGERS POLICE DEPARTMENT,MERCY CLINIC PARKING LOT,3101 SE 14TH STREET,BENTONVILLE,AR,72712,"http://maps.google.com/maps?q=3101 SE 14TH STREET,+BENTONVILLE,+AR+72712&hl=en"
ROGERS POLICE DEPARTMENT,ROGERS POLICE DEPARTMENT PERMANENT DROP BOX,1905 S. DIXIELAND,ROGERS,AR,72758,"http://maps.google.com/maps?q=1905 S. DIXIELAND,+ROGERS,+AR+72758&hl=en"
ROSE HILL POLICE DEPARTMENT,ROSE HILL POLICE DEPARTMENT,125 W ROSEWOOD ST,ROSE HILL,KS,67133,"http://maps.google.com/maps?q=125 W ROSEWOOD ST,+ROSE HILL,+KS+67133&hl=en"
SAPULPA POLICE DEPARTMENT,SAPULPA POLICE DEPARTMENT,20 N. WALNUT ST.,SAPULPA,OK,74066,"http://maps.google.com/maps?q=20 N. WALNUT ST.,+SAPULPA,+OK+74066&hl=en"
SEBASTIAN COUNTY SHERIFF'S OFFICE,BARLING POLICE DEPARTMENT,304 CHURCH STREET,BARLING,AR,72923,"http://maps.google.com/maps?q=304 CHURCH STREET,+BARLING,+AR+72923&hl=en"
SEBASTIAN COUNTY SHERIFF'S OFFICE,SEBASTIAN COUNTY SHERIFF'S OFFICE PERMANENT DROP BOX,800 SOUTH A STREET,FORT SMITH,AR,72901,"http://maps.google.com/maps?q=800 SOUTH A STREET,+FORT SMITH,+AR+72901&hl=en"
SEDGWICK COUNTY SHERIFF'S OFFICE,HOUSEHOLD HAZARDOUS WASTE,801 W. STILLWELL,WICHITA,KS,67213,"http://maps.google.com/maps?q=801 W. STILLWELL,+WICHITA,+KS+67213&hl=en"
SEDGWICK COUNTY SHERIFF'S OFFICE,OAKLAWN ACTIVITY CENTER,4900 SOUTH CLIFTON,WICHITA,KS,67203,"http://maps.google.com/maps?q=4900 SOUTH CLIFTON,+WICHITA,+KS+67203&hl=en"
SEDGWICK COUNTY SHERIFF'S OFFICE,SEDGWICK COUNTY ZOO,5500 W. ZOO BLVD.,WICHITA,KS,67212,"http://maps.google.com/maps?q=5500 W. ZOO BLVD.,+WICHITA,+KS+67212&hl=en"
SHAWNEE PD,SHAWNEE SENIOR CENTER,401 N. BELL,SHAWNEE,OK,74801,"http://maps.google.com/maps?q=401 N. BELL,+SHAWNEE,+OK+74801&hl=en"
SILOAM SPRINGS POLICE DEPARTMENT,SILOAM SPRINGS POLICE DEPARTMENT PERMANENT DROP BOX,100 US HIGHWAY 412 W.,SILOAM SPRINGS,AR,72761,"http://maps.google.com/maps?q=100 US HIGHWAY 412 W.,+SILOAM SPRINGS,+AR+72761&hl=en"
SOUTH HUTCHINSON POLICE DEPARTMENT,SOUTH HUTCHINSON POLICE DEPARTMENT,10 E BLANCHARD AVE,SOUTH HUTCHINSON,KS,67505,"http://maps.google.com/maps?q=10 E BLANCHARD AVE,+SOUTH HUTCHINSON,+KS+67505&hl=en"
SPRINGDALE POLICE DEPARTMENT,HARPS FOOD STORES,918 SOUTH GUTENSOHN ROAD,SPRINGDALE,AR,72764,"http://maps.google.com/maps?q=918 SOUTH GUTENSOHN ROAD,+SPRINGDALE,+AR+72764&hl=en"
SPRINGDALE POLICE DEPARTMENT,SPRINGDALE POLICE DEPARTMENT PERMANENT DROP BOX,201 N. SPRING ST.,SPRINGDALE,AR,72764,"http://maps.google.com/maps?q=201 N. SPRING ST.,+SPRINGDALE,+AR+72764&hl=en"
ST. CLAIR COUNTY JAIL,ST. CLAIR COUNTY JAIL,360 CHESTNUT ST,OSCEOLA,MO,64776,"http://maps.google.com/maps?q=360 CHESTNUT ST,+OSCEOLA,+MO+64776&hl=en"
TULSA PD,PATRICK HENRY ELEMENTARY,3820 E. 41ST ST,TULSA,OK,74135,"http://maps.google.com/maps?q=3820 E. 41ST ST,+TULSA,+OK+74135&hl=en"
TULSA PD,SPIRIT HALLOWEEN OLD GANDER MOUNTAIN,8310 S. OLYMPIA AVE.,TULSA,OK,74129,"http://maps.google.com/maps?q=8310 S. OLYMPIA AVE.,+TULSA,+OK+74129&hl=en"
UNIVERSITY OF ARKANSAS POLICE DEPARTMENT,UNIVERSITY OF ARKANSAS POLICE DEPARTMENT,155 SOUTH RAZORBACK ROAD,FAYETTEVILLE,AR,72701,"http://maps.google.com/maps?q=155 SOUTH RAZORBACK ROAD,+FAYETTEVILLE,+AR+72701&hl=en"
VAN BUREN POLICE DEPARTMENT,VAN BUREN POLICE DEPARTMENT PERMANENT DROP BOX,111 S. 11TH ST.,VAN BUREN,AR,72956,"http://maps.google.com/maps?q=111 S. 11TH ST.,+VAN BUREN,+AR+72956&hl=en"
WALDRON POLICE DEPARTMENT,HARPS FOOD PARKING LOT,1350 6TH STREET,WALDRON,AR,72958,"http://maps.google.com/maps?q=1350 6TH STREET,+WALDRON,+AR+72958&hl=en"
WALDRON POLICE DEPARTMENT,WALDRON POLICE DEPARTMENT PERMANENT DROP BOX,323 WASHINGTON ST.,WALDRON,AR,72958,"http://maps.google.com/maps?q=323 WASHINGTON ST.,+WALDRON,+AR+72958&hl=en"
WASHINGTON COUNTY SHERIFF'S OFFICE,VA MEDICAL CENTER PERMANENT DROP BOX,1100 NORTH COLLEGE AVE.1100 NORTH COLLEGE AVE.,FAYETTEVILLE,AR,72701,"http://maps.google.com/maps?q=1100 NORTH COLLEGE AVE.,+FAYETTEVILLE,+AR+72701&hl=en"
WASHINGTON COUNTY SHERIFF'S OFFICE,WASHINGTON COUNTY COURTHOUSE PERMANENT DROP BOX (MON-FRI ONLY),280 NORTH COLLEGE AVE.,FAYETTEVILLE,AR,72701,"http://maps.google.com/maps?q=280 NORTH COLLEGE AVE.,+FAYETTEVILLE,+AR+72701&hl=en"
WASHINGTON COUNTY SHERIFF'S OFFICE,WASHINGTON COUNTY SHERIFF'S DEPARTMENT PERMANENT DROP BOX,1155 CLYDESDALE DR.,FAYETTEVILLE,AR,72701,"http://maps.google.com/maps?q=1155 CLYDESDALE DR.,+FAYETTEVILLE,+AR+72701&hl=en"
WEST FORK POLICE DEPARTMENT,WEST FORK POLICE DEPARTMENT PERMANENT DROP BOX,262 WEST MAIN STREET,WEST FORK,AR,72774,"http://maps.google.com/maps?q=262 WEST MAIN STREET,+WEST FORK,+AR+72774&hl=en"
WICHITA POLICE DEPARTMENT,DILLONS PARKING LOT,9450 E HARRY,WICHITA,KS,67207,"http://maps.google.com/maps?q=9450 E HARRY,+WICHITA,+KS+67207&hl=en"
WYANDOTTE NATION TRIBAL POLICE,WYANDOTTE NATION TRIBAL POLICE,14 SOUTH MAIN,WYANDOTTE,OK,74370,"http://maps.google.com/maps?q=14 SOUTH MAIN,+WYANDOTTE,+OK+74370&hl=en"
