Participant,CollectionSite,Address,City,State,Zip,MapURL
MARYLAND STATE POLICE,MSP WATERLOO BARRACK POC: D/SGT. MYERS,7777 WASHINGTON BLVD,JESSUP,MD,20794,"http://maps.google.com/maps?q=7777 WASHINGTON BLVD,+JESSUP,+MD+20794&hl=en"
MARYLAND STATE POLICE,PRINCE FREDERICK BARRACK POC: RANDY STEVENS,210 MAIN STREET,PRINCE FREDERICK,MD,20678,"http://maps.google.com/maps?q=210 MAIN STREET,+PRINCE FREDERICK,+MD+20678&hl=en"
MILTON POLICE DEPARTMENT,MILTON POLICE DEPARTMENT,101 FEDERAL STREET,MILTON,DE,19968,"http://maps.google.com/maps?q=101 FEDERAL STREET,+MILTON,+DE+19968&hl=en"
MINERAL COUNTY SHERIFF'S OFFICE,MINERAL COUNTY DETENTION CENTER ACROSS STREET FROM COURTHOUSE,100 EAST STREET,KEYSER,WV,26726,"http://maps.google.com/maps?q=100 EAST STREET,+KEYSER,+WV+26726&hl=en"
MONROE COUNTY SHERIFF'S DEPT,MONROE CO SHERIFF'S DEPT,350 MAIN ST,UNION,WV,24983,"http://maps.google.com/maps?q=350 MAIN ST,+UNION,+WV+24983&hl=en"
MONTGOMERY COUNTY DEPARTMENT OF POLICE,2ND DISTRICT POLICE STATION,4823 RUGBY AVENUE,BETHESDA,MD,20814,"http://maps.google.com/maps?q=4823 RUGBY AVENUE,+BETHESDA,+MD+20814&hl=en"
MONTGOMERY COUNTY DEPARTMENT OF POLICE,3RD DISTRICT POLICE STATION,1001 MILESTONE DRIVE,SILVER SPRING,MD,20904,"http://maps.google.com/maps?q=1001 MILESTONE DRIVE,+SILVER SPRING,+MD+20904&hl=en"
MONTGOMERY COUNTY DEPARTMENT OF POLICE,4TH DISTRICT POLICE STATION,2300 RANDOLPH ROAD,WHEATON,MD,20902,"http://maps.google.com/maps?q=2300 RANDOLPH ROAD,+WHEATON,+MD+20902&hl=en"
MONTGOMERY COUNTY DEPARTMENT OF POLICE,5TH DISTRICT POLICE STATION,20000 AIRCRAFT DRIVE,GERMANTOWN,MD,20874,"http://maps.google.com/maps?q=20000 AIRCRAFT DRIVE,+GERMANTOWN,+MD+20874&hl=en"
MONTGOMERY COUNTY DEPARTMENT OF POLICE,6TH DISTRICT NORTH CREEK COMMUNITY CENTER,20125 ARROWHEAD ROAD,MONTGOMERY VILLAGE,MD,20886,"http://maps.google.com/maps?q=20125 ARROWHEAD ROAD,+MONTGOMERY VILLAGE,+MD+20886&hl=en"
MONTGOMERY COUNTY DEPARTMENT OF POLICE,FIRE STATION 1,8110 GEORGIA AVE.,SILVER SPRING,MD,20910,"http://maps.google.com/maps?q=8110 GEORGIA AVE.,+SILVER SPRING,+MD+20910&hl=en"
MONTGOMERY COUNTY DEPARTMENT OF POLICE,JEWISH COMMUNITY CENTER,6125 MONTROSE RD.,ROCKVILLE,MD,20852,"http://maps.google.com/maps?q=6125 MONTROSE RD.,+ROCKVILLE,+MD+20852&hl=en"
MONTGOMERY COUNTY DEPARTMENT OF POLICE,LEISURE WORLD,3305 N. LEISURE WORLD BLVD.,SILVER SPRING,MD,20906,"http://maps.google.com/maps?q=3305 N. LEISURE WORLD BLVD.,+SILVER SPRING,+MD+20906&hl=en"
MONTGOMERY COUNTY DEPARTMENT OF POLICE,SENIOR LIVING KENTLANDS MANOR,217 BOOTH ST.,GAITHERSBURG,MD,20878,"http://maps.google.com/maps?q=217 BOOTH ST.,+GAITHERSBURG,+MD+20878&hl=en"
MONTGOMERY COUNTY DEPARTMENT OF POLICE,VILLAGE OF FRIENDSHIP HEIGHTS COMMUNITY CENTER,4433 SOUTH PARK AVENUE,CHEVY CHASE,MD,20815,"http://maps.google.com/maps?q=4433 SOUTH PARK AVENUE,+CHEVY CHASE,+MD+20815&hl=en"
MOOREFIELD POLICE DEPARTMENT,MOOREFIELD POLICE DEPT/TOWN OFFICE,206 WINCHESTER AVE,MOOREFIELD,WV,26836,"http://maps.google.com/maps?q=206 WINCHESTER AVE,+MOOREFIELD,+WV+26836&hl=en"
NC STATE UNIVERSITY POLICE DEPT.,NC STATE UNIVERSITY POLICE DEPARTMENT FRONT LOBBY,2610 WOLF VILLAGE WAYCAMPUS BOX 7220,RALEIGH,NC,27695,"http://maps.google.com/maps?q=2610 WOLF VILLAGE WAY,+RALEIGH,+NC+27695&hl=en"
NEW KENT COUNTY SHERIFF'S OFFICE,NEW KENT SHERIFF'S OFFICE,11995 COURTHOUSE CIRCLE,NEW KENT,VA,23124,"http://maps.google.com/maps?q=11995 COURTHOUSE CIRCLE,+NEW KENT,+VA+23124&hl=en"
NEWPORT NEWS POLICE DEPARTMENT,NEWPORT NEWS PD NORTH PRECINCT LOT BETWEEN POLICE AND FIRE DEPARTMENTS,368 DESHAZOR DRIVE,NEWPORT NEWS,VA,23608,"http://maps.google.com/maps?q=368 DESHAZOR DRIVE,+NEWPORT NEWS,+VA+23608&hl=en"
NEWPORT NEWS POLICE DEPARTMENT,NEWPORT NEWS PD SOUTH PRECINCT,3303 JEFFERSON AVENUE,NEWPORT NEWS,VA,23607,"http://maps.google.com/maps?q=3303 JEFFERSON AVENUE,+NEWPORT NEWS,+VA+23607&hl=en"
NEWPORT NEWS POLICE DEPARTMENT,SENTARA PORT WARWICK AT THE EMERGENCY ROOM ENTRANCE,1031 LOFTIS BLVD.,NEWPORT NEWS,VA,23606,"http://maps.google.com/maps?q=1031 LOFTIS BLVD.,+NEWPORT NEWS,+VA+23606&hl=en"
NICHOLAS COUNTY SHERIFF'S DEPARTMENT,NICHOLAS COUNTY COURTHOUSE,700 MAIN ST,SUMMERSVILLE,WV,26651,"http://maps.google.com/maps?q=700 MAIN ST,+SUMMERSVILLE,+WV+26651&hl=en"
NORFOLK POLICE DEPARTMENT,NORFOLK POLICE 3RD DIVISION FRONT ENTRANCE,901 ASBURY AVENUE,NORFOLK,VA,23513,"http://maps.google.com/maps?q=901 ASBURY AVENUE,+NORFOLK,+VA+23513&hl=en"
NORFOLK POLICE DEPARTMENT,NORFOLK POLICE OPERATIONS CENTER FRONT ENTRANCE,3661 E. VIRGINIA BEACH BLVD,NORFOLK,VA,23502,"http://maps.google.com/maps?q=3661 E. VIRGINIA BEACH BLVD,+NORFOLK,+VA+23502&hl=en"
NORFOLK POLICE DEPARTMENT,NORFOLK POLICE TRAINING CENTER FRONT ENTRANCE,2500 N. MILITARY HWY,NORFOLK,VA,23502,"http://maps.google.com/maps?q=2500 N. MILITARY HWY,+NORFOLK,+VA+23502&hl=en"
NORFOLK STATE UNIVERSITY POLICE DEPARTMENT,NORFOLK STATE UNIVERSITY PD LOBBY AREA,2501 CORPREW AVE,NORFOLK,VA,23504,"http://maps.google.com/maps?q=2501 CORPREW AVE,+NORFOLK,+VA+23504&hl=en"
NORTHAMPTON COUNTY SHERIFF'S OFFICE,NORTHAMPTON COUNTY SHERIFF'S OFFICE FRONT LOBBY,5211 THE HORNES,EASTVILLE,VA,23347,"http://maps.google.com/maps?q=5211 THE HORNES,+EASTVILLE,+VA+23347&hl=en"
NORTHUMBERLAND COUNTY SHERIFF'S OFFICE,NORTHUMBERLAND COUNTY SHERIFF'S OFFICE,195 JUDICIAL PLACE,HEATHSVILLE,VA,22473,"http://maps.google.com/maps?q=195 JUDICIAL PLACE,+HEATHSVILLE,+VA+22473&hl=en"
OAKLAND CITY POLICE,OAKLAND POLICE DEPARTMENT,15 SOUTH THIRD STREET,OAKLAND,MD,21550,"http://maps.google.com/maps?q=15 SOUTH THIRD STREET,+OAKLAND,+MD+21550&hl=en"
OCEAN VIEW POLICE DEPARTMENT,OCEAN VIEW POLICE DEPARTMENT,201 CENTRAL AVENUE,OCEAN VIEW,DE,19970,"http://maps.google.com/maps?q=201 CENTRAL AVENUE,+OCEAN VIEW,+DE+19970&hl=en"
OLD DOMINION UNIVERSITY POLICE DEPARTMENT,CVS,3717 HAMPTON BLVD,NORFOLK,VA,23508,"http://maps.google.com/maps?q=3717 HAMPTON BLVD,+NORFOLK,+VA+23508&hl=en"
ORANGE (TOWN OF) POLICE DEPARTMENT,CVS PHARMACY FRONT SIDEWALK,308 RADNEY ROAD,ORANGE,VA,22960,"http://maps.google.com/maps?q=308 RADNEY ROAD,+ORANGE,+VA+22960&hl=en"
ORANGE (TOWN OF) POLICE DEPARTMENT,ORANGE PHARMACY FRONT SIDEWALK,130 WEST MAIN STREET,ORANGE,VA,22960,"http://maps.google.com/maps?q=130 WEST MAIN STREET,+ORANGE,+VA+22960&hl=en"
ORANGE COUNTY SHERIFF'S OFFICE,LOW CLUBHOUSE LOWER PARKING LOT,205 LAKE OF THE WOODS PARKWAY,LOCUST GROVE,VA,22508,"http://maps.google.com/maps?q=205 LAKE OF THE WOODS PARKWAY,+LOCUST GROVE,+VA+22508&hl=en"
ORANGE COUNTY SHERIFF'S OFFICE,SHADY GROVE BAPTIST CHURCH COMMUNITY HEALTH FAIR,21024 PINEY WOODS ROAD,ORANGE,VA,22960,"http://maps.google.com/maps?q=21024 PINEY WOODS ROAD,+ORANGE,+VA+22960&hl=en"
ORANGE COUNTY SHERIFFS OFFICE,CHAPEL HILL NORTH HARRIS TEETER ON OCTOBER 27TH,1800 MARTIN LUTHER KING JR BLVD,CHAPEL HILL,NC,27514,"http://maps.google.com/maps?q=1800 MARTIN LUTHER KING JR BLVD,+CHAPEL HILL,+NC+27514&hl=en"
ORANGE COUNTY SHERIFFS OFFICE,ORANGE COUNTY SHERIFFS OFFICE,106 E MARGARET LANE,HILLSBOROUGH,NC,27278,"http://maps.google.com/maps?q=106 E MARGARET LANE,+HILLSBOROUGH,+NC+27278&hl=en"
PATRICK COUNTY SHERIFF'S OFFICE,PATRICK COUNTY SHERIFF'S OFFICE,742 COMMERCE STREET,STUART,VA,24171,"http://maps.google.com/maps?q=742 COMMERCE STREET,+STUART,+VA+24171&hl=en"
PENDLETON COUNTY SHERIFF'S OFFICE,PENDLETON COUNTY SHERIFF'S DEPARTMENT,100 SOUTH MAIN STREET,FRANKLIN,WV,26807,"http://maps.google.com/maps?q=100 SOUTH MAIN STREET,+FRANKLIN,+WV+26807&hl=en"
PETERSBURG POLICE DEPARTMENT,CVS PHARMACY,2100 SOUTH CRATER RD,PETERSBURG,VA,23805,"http://maps.google.com/maps?q=2100 SOUTH CRATER RD,+PETERSBURG,+VA+23805&hl=en"
PETERSBURG SHERIFF'S OFFICE,WALMART #2160 PARKING LOT-PETERSBURG,3500 SOUTH CRATER ROAD,PETERSBURG,VA,23805,"http://maps.google.com/maps?q=3500 SOUTH CRATER ROAD,+PETERSBURG,+VA+23805&hl=en"
PITTSYLVANIA COUNTY SHERIFF'S OFFICE,MT. HERMON SHOPPING CENTER FOOD LION PARKING LOT,4048 FRANKLIN TURNPIKE,DANVILLE,VA,24540,"http://maps.google.com/maps?q=4048 FRANKLIN TURNPIKE,+DANVILLE,+VA+24540&hl=en"
PITTSYLVANIA COUNTY SHERIFF'S OFFICE,PITTSYLVANIA COUNTY SHERIFF'S OFFICE IN FRONT OF SHERIFF'S OFFICE,21 NORTH MAIN STREET,CHATHAM,VA,24531,"http://maps.google.com/maps?q=21 NORTH MAIN STREET,+CHATHAM,+VA+24531&hl=en"
POCAHONTAS COUNTY SHERIFF'S OFFICE,POCAHONTAS COUNTY SHERIFF'S DEPT,900 JAIL LANE,MARLINTON,WV,24954,"http://maps.google.com/maps?q=900 JAIL LANE,+MARLINTON,+WV+24954&hl=en"
POQUOSON POLICE DEPARTMENT,POQUOSON PHARMACY PARKING LOT,498 WYTHE CREEK ROAD,POQUOSON,VA,23662,"http://maps.google.com/maps?q=498 WYTHE CREEK ROAD,+POQUOSON,+VA+23662&hl=en"
PORTSMOUTH POLICE DEPARTMENT,PORTSMOUTH FIRE STATION #3 FRONT DOOR,4001 RIVERSHORE ROAD,PORTSMOUTH,VA,23703,"http://maps.google.com/maps?q=4001 RIVERSHORE ROAD,+PORTSMOUTH,+VA+23703&hl=en"
PORTSMOUTH POLICE DEPARTMENT,PORTSMOUTH POLICE DEPARTMENT HEADQUARTERS,801 WATER ST,PORTSMOUTH,VA,23704,"http://maps.google.com/maps?q=801 WATER ST,+PORTSMOUTH,+VA+23704&hl=en"
PORTSMOUTH POLICE DEPARTMENT,PORTSMOUTH SAFETY TOWN OUTSIDE FRONT DOOR,4404 DEEP CREEK BLVD,PORTSMOUTH,VA,23702,"http://maps.google.com/maps?q=4404 DEEP CREEK BLVD,+PORTSMOUTH,+VA+23702&hl=en"
POWHATAN COUNTY SHERIFF'S OFFICE,POWHATAN COUNTY COURTHOUSE,3880 OLD BUCKINGHAM ROAD,POWHATAN,VA,23139,"http://maps.google.com/maps?q=3880 OLD BUCKINGHAM ROAD,+POWHATAN,+VA+23139&hl=en"
PRESTON COUNTY SHERIFF,PRESTON COUNTY SHERIFF'S OFFICE,103 W MAIN ST,KINGWOOD,WV,26537,"http://maps.google.com/maps?q=103 W MAIN ST,+KINGWOOD,+WV+26537&hl=en"
PRESTON COUNTY SHERIFF,TERRA ALTA TOWN HALL,701-A EAST STATE AVENUE,TERRA ALTA,WV,26764,"http://maps.google.com/maps?q=701-A EAST STATE AVENUE,+TERRA ALTA,+WV+26764&hl=en"
PRINCE GEORGE COUNTY POLICE DEPARTMENT,PRINCE GEORGE COUNTY POLICE DEPARTMENT SIDE PARKING LOT,6600 COURTHOUSE ROAD,PRINCE GEORGE,VA,23875,"http://maps.google.com/maps?q=6600 COURTHOUSE ROAD,+PRINCE GEORGE,+VA+23875&hl=en"
PRINCE GEORGE'S COUNTY POLICE DEPARTMENT,"CENTRAL COLLECTION SITE DISTRICT III, PGPD",7600 BARLOWE ROAD,PALMER PARK,MD,20785,"http://maps.google.com/maps?q=7600 BARLOWE ROAD,+PALMER PARK,+MD+20785&hl=en"
PRINCE GEORGE'S COUNTY POLICE DEPARTMENT,DISTRICT 4 STATION - OXON HILL,5135 INDIAN HEAD HIGHWAY,OXON HILL,MD,20745,"http://maps.google.com/maps?q=5135 INDIAN HEAD HIGHWAY,+OXON HILL,+MD+20745&hl=en"
PRINCE GEORGE'S COUNTY POLICE DEPARTMENT,"NORTHERN COLLECTION SITE DISTRICT I, PGPD",5000 RHODE ISLAND AVENUE,HYATTSVILLE,MD,20784,"http://maps.google.com/maps?q=5000 RHODE ISLAND AVENUE,+HYATTSVILLE,+MD+20784&hl=en"
PRINCE WILLIAM CO. PD,NOVANT HEALTH HAYMARKET MEDICAL CENTER FRONT PARKING LOT,15225 HEATHCOTE BLVD,HAYMARKET,VA,20169,"http://maps.google.com/maps?q=15225 HEATHCOTE BLVD,+HAYMARKET,+VA+20169&hl=en"
PRINCE WILLIAM CO. PD,PWCPD CENTRAL DISTRICT STATION,5036 DAVIS FORD ROAD,WOODBRIDGE,VA,22192,"http://maps.google.com/maps?q=5036 DAVIS FORD ROAD,+WOODBRIDGE,+VA+22192&hl=en"
PRINCESS ANNE POLICE DEPARTMENT,PRINCESS ANNE POLICE DEPARTMENT,11780 BECKFORD AVENUE,PRINCESS ANNE,MD,21853,"http://maps.google.com/maps?q=11780 BECKFORD AVENUE,+PRINCESS ANNE,+MD+21853&hl=en"
PULASKI (TOWN OF) POLICE DEPARTMENT,FOOD CITY PARKING LOT NEAR ENTRANCE TO STORE,1400 BOB WHITE BLVD,PULASKI,VA,24301,"http://maps.google.com/maps?q=1400 BOB WHITE BLVD,+PULASKI,+VA+24301&hl=en"
PULASKI SHERIFF'S OFFICE,"FAIRLAWN WALMART APRIL 28, 2018 LOCATION",7373 PEPPERS FERRY BLVD,RADFORD,VA,24141,"http://maps.google.com/maps?q=7373 PEPPERS FERRY BLVD,+RADFORD,+VA+24141&hl=en"
PURCELLVILLE POLICE DEPARTMENT,FIREMAN'S FIELD,250 S. NURSERY AVENUE,PURCELLVILLE,VA,20132,"http://maps.google.com/maps?q=250 S. NURSERY AVENUE,+PURCELLVILLE,+VA+20132&hl=en"
QUANTICO MARINE CORPS BASE,QUANTICO MARINE CORPS EXCHANGE,4806 RUSSELL RD,QUANTICO,VA,22134,"http://maps.google.com/maps?q=4806 RUSSELL RD,+QUANTICO,+VA+22134&hl=en"
RADFORD CITY POLICE DEPARTMENT,RADFORD FIRE DEPARTMENT PARKING LOT,1500 WADSWORTH STREET,RADFORD,VA,24141,"http://maps.google.com/maps?q=1500 WADSWORTH STREET,+RADFORD,+VA+24141&hl=en"
RALEIGH POLICE DEPARTMENT,FALLS RIVER PHARMACY,10930 RAVEN RIDGE RD,RALEIGH,NC,27614,"http://maps.google.com/maps?q=10930 RAVEN RIDGE RD,+RALEIGH,+NC+27614&hl=en"
RALEIGH POLICE DEPARTMENT,HAYES BARTON PHARMACY,2000 FAIRVIEW RD,RALEIGH,NC,27608,"http://maps.google.com/maps?q=2000 FAIRVIEW RD,+RALEIGH,+NC+27608&hl=en"
RALEIGH POLICE DEPARTMENT,WELLNESS PHARMACY AND COMPOUNDING CENTER,2601 BLUE RIDGE RD,RALEIGH,NC,27607,"http://maps.google.com/maps?q=2601 BLUE RIDGE RD,+RALEIGH,+NC+27607&hl=en"
RANSON POLICE DEPARTMENT,RANSON POLICE DEPARTMENT,700 N. PRESTON ST,RANSON,WV,25438,"http://maps.google.com/maps?q=700 N. PRESTON ST,+RANSON,+WV+25438&hl=en"
REHOBOTH BEACH POLICE DEPT,REHOBOTH BEACH POLICE DEPT,229 REHOBOTH AVE,REHOBOTH BEACH,DE,19971,"http://maps.google.com/maps?q=229 REHOBOTH AVE,+REHOBOTH BEACH,+DE+19971&hl=en"
ROANOKE CITY POLICE DEPARTMENT,CVS 9TH STREET SE,702 9TH STREET SE,ROANOKE,VA,24013,"http://maps.google.com/maps?q=702 9TH STREET SE,+ROANOKE,+VA+24013&hl=en"
ROANOKE CITY POLICE DEPARTMENT,CVS AT TARGET,4737 VALLEY VIEW BLVD,ROANOKE,VA,24012,"http://maps.google.com/maps?q=4737 VALLEY VIEW BLVD,+ROANOKE,+VA+24012&hl=en"
ROANOKE CITY POLICE DEPARTMENT,CVS AT TOWERS SHOPPING CENTER,2001 COLONIAL AVE SW,ROANOKE,VA,24015,"http://maps.google.com/maps?q=2001 COLONIAL AVE SW,+ROANOKE,+VA+24015&hl=en"
ROANOKE COUNTY POLICE DEPARTMENT,KROGER @ TANGLEWOOD MALL FRONT PARKING LOT,4488 ELECTRIC ROAD,ROANOKE,VA,24015,"http://maps.google.com/maps?q=4488 ELECTRIC ROAD,+ROANOKE,+VA+24015&hl=en"
ROANOKE COUNTY POLICE DEPARTMENT,KROGER AT VALLEY GATEWAY NEAR FRONT ENTRANCE,3970 VALLEY GATEWAY BLVD,ROANOKE,VA,24012,"http://maps.google.com/maps?q=3970 VALLEY GATEWAY BLVD,+ROANOKE,+VA+24012&hl=en"
ROANOKE COUNTY POLICE DEPARTMENT,WALGREENS CORNER OF ELECTRIC ROAD & BRAMBLETON AVE,4049 BRAMBLETON AVE,ROANOKE,VA,24018,"http://maps.google.com/maps?q=4049 BRAMBLETON AVE,+ROANOKE,+VA+24018&hl=en"
ROANOKE COUNTY SHERIFF'S OFFICE,ROANOKE COUNTY FIRE STATION #1 PARKING LOT,150 HERSHBERGER ROAD,ROANOKE,VA,24019,"http://maps.google.com/maps?q=150 HERSHBERGER ROAD,+ROANOKE,+VA+24019&hl=en"
ROCKVILLE CITY POLICE DEPARTMENT,ROCKVILLE CITY POLICE DEPARTMENT,#2 W. MONTGOMERY AVENUE,ROCKVILLE,MD,20850,"http://maps.google.com/maps?q=#2 W. MONTGOMERY AVENUE,+ROCKVILLE,+MD+20850&hl=en"
ROCKY MOUNT POLICE DEPARTMENT,WAL MART,550 OLD FRANKLIN TURNPIKE ROCKY MOUNT,ROCKY MOUNT,VA,24151,"http://maps.google.com/maps?q=550 OLD FRANKLIN TURNPIKE ROCKY MOUNT,+ROCKY MOUNT,+VA+24151&hl=en"
SALEM POLICE DEPARTMENT,SUPER SHOES FRONT PARKING LOT,1838 W. MAIN STREET,SALEM,VA,24153,"http://maps.google.com/maps?q=1838 W. MAIN STREET,+SALEM,+VA+24153&hl=en"
SAS INSTITUTE COMPANY POLICE,SAS INSTITUTE,100 SAS CAMPUS DRIVE,CARY,NC,27513,"http://maps.google.com/maps?q=100 SAS CAMPUS DRIVE,+CARY,+NC+27513&hl=en"
SELBYVILLE POLICE DEPT,CVS,36252 LIGHTHOUSE RD,SELBYVILLE,DE,19975,"http://maps.google.com/maps?q=36252 LIGHTHOUSE RD,+SELBYVILLE,+DE+19975&hl=en"
SELBYVILLE POLICE DEPT,SELBYVILLE TOWN HALL,68 W CHURCH ST,SELBYVILLE,DE,19975,"http://maps.google.com/maps?q=68 W CHURCH ST,+SELBYVILLE,+DE+19975&hl=en"
SHENANDOAH COUNTY SHERIFF'S OFFICE,CVS PHARMACY PARKING LOT FACING RESERVOIR RD.,221 WEST RESERVOIR ROAD,WOODSTOCK,VA,22664,"http://maps.google.com/maps?q=221 WEST RESERVOIR ROAD,+WOODSTOCK,+VA+22664&hl=en"
SHEPERDSTOWN POLICE DEPARTMENT,SHEPERDSTOWN POLICE DEPARTMENT,104 N. KING ST.,SHEPHERDSTOWN,WV,25443,"http://maps.google.com/maps?q=104 N. KING ST.,+SHEPHERDSTOWN,+WV+25443&hl=en"
ST. MARY'S COUNTY SHERIFF'S OFFICE,ST. MARY'S COUNTY ELK'S LODGE,45779 FIRE DEPARTMENT LANE,CALIFORNIA,MD,20619,"http://maps.google.com/maps?q=45779 FIRE DEPARTMENT LANE,+CALIFORNIA,+MD+20619&hl=en"
ST. MARY'S COUNTY SHERIFF'S OFFICE,ST. MARY'S COUNTY SHERIFF'S OFFICE HQ,23150 LEONARD HALL DRIVE,LEONARDTOWN,MD,20650,"http://maps.google.com/maps?q=23150 LEONARD HALL DRIVE,+LEONARDTOWN,+MD+20650&hl=en"
STAFFORD COUNTY SHERIFF'S OFFICE,STAFFORD HOSPITAL CENTER SOUTH SIDE OF HOSPITAL NEAR ER,101 HOSPITAL CENTER BLVD,STAFFORD,VA,22554,"http://maps.google.com/maps?q=101 HOSPITAL CENTER BLVD,+STAFFORD,+VA+22554&hl=en"
STAUNTON POLICE DEPARTMENT,AUGUSTA HEALTH STAUNTON URGENT CARE FISHER AUTO PARKING LEFT OF URGENT CARE BUILDING,795 STATLER BLVD,STAUNTON,VA,24401,"http://maps.google.com/maps?q=795 STATLER BLVD,+STAUNTON,+VA+24401&hl=en"
STRASBURG POLICE DEPARTMENT,STRASBURG TOWN HALL SIDE PARKING LOT,174 EAST KING STREET,STRASBURG,VA,22657,"http://maps.google.com/maps?q=174 EAST KING STREET,+STRASBURG,+VA+22657&hl=en"
SURRY COUNTY SHERIFF'S OFFICE,SURRY COUNTY CIRCUIT COURT HOUSE PARKING LOT,28 COLONIAL TRAIL EAST,SURRY,VA,23883,"http://maps.google.com/maps?q=28 COLONIAL TRAIL EAST,+SURRY,+VA+23883&hl=en"
TAKOMA PARK POLICE DEPARTMENT,TAKOMA PARK POLICE DEPARTMENT LOBBY,7500 MAPLE AVENUE,TAKOMA PARK,MD,20912,"http://maps.google.com/maps?q=7500 MAPLE AVENUE,+TAKOMA PARK,+MD+20912&hl=en"
TAPPAHANNOCK PD / ESSEX COUNTY SO,WAL-MART PARKING LOT OUTSIDE BETWEEN TWO ENTRANCES,1660 TAPPAHANNOCK BLVD,TAPPAHANNOCK,VA,22560,"http://maps.google.com/maps?q=1660 TAPPAHANNOCK BLVD,+TAPPAHANNOCK,+VA+22560&hl=en"
TOWN OF BATH POLICE DEPARTMENT,MORGAN COUNTY HEALTH DEPARTMENT POC: BILL KEARNS,137 WAR MEMORIAL DR.,BERKELEY SPRINGS,WV,25411,"http://maps.google.com/maps?q=137 WAR MEMORIAL DR.,+BERKELEY SPRINGS,+WV+25411&hl=en"
TOWN OF DUCK POLICE DEPARTMENT,TOWN OF DUCK POLICE DEPARTMENT LT. JEFFREY ACKERMAN,1259 DUCK RD,DUCK,NC,27949,"http://maps.google.com/maps?q=1259 DUCK RD,+DUCK,+NC+27949&hl=en"
UNIVERSITY OF MD POLICE DEPT OF PUBLIC SAFETY,UNIVERSITY OF MD POLICE DEPT OF PUBLIC SAFETY,7569 BALTIMORE AVENUE,COLLEGE PARK,MD,20742,"http://maps.google.com/maps?q=7569 BALTIMORE AVENUE,+COLLEGE PARK,+MD+20742&hl=en"
US DEPARTMENT OF VETERANS AFFAIRS POLICE- SALEM,DEPARTMENT OF VETERANS AFFAIRS ENTRANCE TO BUILDING 143; MAIN HOSPITAL,1970 ROANOKE BOULEVARD,SALEM,VA,24153,"http://maps.google.com/maps?q=1970 ROANOKE BOULEVARD,+SALEM,+VA+24153&hl=en"
VIENNA POLICE DEPARTMENT,VIENNA POLICE DEPARTMENT,215 CENTER STREET SOUTH,VIENNA,VA,22180,"http://maps.google.com/maps?q=215 CENTER STREET SOUTH,+VIENNA,+VA+22180&hl=en"
VINTON POLICE DEPARTMENT,KROGER PARKING LOT LAKE DRIVE PLAZA,915 HARDY ROAD,VINTON,VA,24179,"http://maps.google.com/maps?q=915 HARDY ROAD,+VINTON,+VA+24179&hl=en"
VIRGINIA STATE POLICE,HALIFAX/SOUTH BOSTON REGIONAL TASK FORCE POC: SA JAY GEORGE,640 HAMILTON BOULEVARD(SOUTH BOSTON POLICE DEPARTMENT),APPOMATTOX,VA,24522,"http://maps.google.com/maps?q=640 HAMILTON BOULEVARD,+APPOMATTOX,+VA+24522&hl=en"
VIRGINIA STATE POLICE,VIRGINIA STATE POLICE - AREA 47 STATION POC: SGT ANDREA FISCHER,1557 S. MILITARY HIGHWAY,CHESAPEAKE,VA,23320,"http://maps.google.com/maps?q=1557 S. MILITARY HIGHWAY,+CHESAPEAKE,+VA+23320&hl=en"
VIRGINIA STATE POLICE,VIRGINIA STATE POLICE DIVISION I HQS POC: SGT MELANIE MCKENNEY,9300 BROOK ROAD,GLEN ALLEN,VA,23060,"http://maps.google.com/maps?q=9300 BROOK ROAD,+GLEN ALLEN,+VA+23060&hl=en"
VIRGINIA STATE POLICE,VIRGINIA STATE POLICE DIVISION II HQS POC: LT. JEFFREY LANE,15148 STATE POLICE ROAD,CULPEPER,VA,22701,"http://maps.google.com/maps?q=15148 STATE POLICE ROAD,+CULPEPER,+VA+22701&hl=en"
VIRGINIA STATE POLICE,VIRGINIA STATE POLICE DIVISION III HQS POC: SGT DREW MCCORMICK,240 THIRD DIVISION LOOP,APPOMATTOX,VA,24522,"http://maps.google.com/maps?q=240 THIRD DIVISION LOOP,+APPOMATTOX,+VA+24522&hl=en"
VIRGINIA STATE POLICE,VIRGINIA STATE POLICE DIVISION VI HQS POC: SGT. GLENN ARMSTRONG,3775 W. MAIN STREET,SALEM,VA,24153,"http://maps.google.com/maps?q=3775 W. MAIN STREET,+SALEM,+VA+24153&hl=en"
VIRGINIA STATE POLICE,VIRGINIA STATE POLICE DIVISION VII HQS POC: SGT BILL JOYNER,4977 ALLIANCE DRIVE,FAIRFAX,VA,22030,"http://maps.google.com/maps?q=4977 ALLIANCE DRIVE,+FAIRFAX,+VA+22030&hl=en"
WARREN COUNTY SHERIFF'S OFFICE,VALLEY HEALTH REHABILITATION SERVICES,120 NORTH COMMERCE AVE,FRONT ROYAL,VA,22630,"http://maps.google.com/maps?q=120 NORTH COMMERCE AVE,+FRONT ROYAL,+VA+22630&hl=en"
WASHINGTON METROPOLITAN POLICE DEPT,FIFTH POLICE DISTRICT,"1805 BLADENSBURG ROAD, NE",WASHINGTON,DC,20002,"http://maps.google.com/maps?q=1805 BLADENSBURG ROAD, NE,+WASHINGTON,+DC+20002&hl=en"
WASHINGTON METROPOLITAN POLICE DEPT,FIRST POLICE DISTRICT,"101 M STREET, SW",WASHINGTON,DC,20024,"http://maps.google.com/maps?q=101 M STREET, SW,+WASHINGTON,+DC+20024&hl=en"
WASHINGTON METROPOLITAN POLICE DEPT,FOURTH POLICE DISTRICT,"6001 GEORGIA AVENUE, NW",WASHINGTON,DC,20011,"http://maps.google.com/maps?q=6001 GEORGIA AVENUE, NW,+WASHINGTON,+DC+20011&hl=en"
WASHINGTON METROPOLITAN POLICE DEPT,SECOND POLICE DISTRICT,"3320 IDAHO AVENUE, NW",WASHINGTON,DC,20016,"http://maps.google.com/maps?q=3320 IDAHO AVENUE, NW,+WASHINGTON,+DC+20016&hl=en"
WASHINGTON METROPOLITAN POLICE DEPT,SEVENTH POLICE DISTRICT,"2455 ALABAMA AVENUE, SE",WASHINGTON,DC,20020,"http://maps.google.com/maps?q=2455 ALABAMA AVENUE, SE,+WASHINGTON,+DC+20020&hl=en"
WASHINGTON METROPOLITAN POLICE DEPT,SIXTH POLICE DISTRICT,5002 HAYES STREET NE,WASHINGTON,DC,20019,"http://maps.google.com/maps?q=5002 HAYES STREET NE,+WASHINGTON,+DC+20019&hl=en"
WASHINGTON METROPOLITAN POLICE DEPT,THIRD POLICE DISTRIST,"1620 V STREET, NW",WASHINGTON,DC,20009,"http://maps.google.com/maps?q=1620 V STREET, NW,+WASHINGTON,+DC+20009&hl=en"
WASHINGTON SUBURBAN SANITARY COMMISSION,WSSC POLICE DEPARTMENT,14501 SWEITZER LANE,LAUREL,MD,20707,"http://maps.google.com/maps?q=14501 SWEITZER LANE,+LAUREL,+MD+20707&hl=en"
WAYNESBORO POLICE DEPARTMENT,NEIGHBORHOOD MARKET PARKING LOT,1211 WEST BROAD STREET,WAYNESBORO,VA,22980,"http://maps.google.com/maps?q=1211 WEST BROAD STREET,+WAYNESBORO,+VA+22980&hl=en"
WEBSTER COUNTY SHERIFF,COWEN MUNICIPAL BLDG,3RD AVENUE,COWEN,WV,26206,"http://maps.google.com/maps?q=3RD AVENUE,+COWEN,+WV+26206&hl=en"
WEBSTER COUNTY SHERIFF,HACKER VALLEY FIRE DEPT,4999 HACKER VALLEY RD,HACKER VALLEY,WV,26222,"http://maps.google.com/maps?q=4999 HACKER VALLEY RD,+HACKER VALLEY,+WV+26222&hl=en"
WEBSTER COUNTY SHERIFF,WEBSTER COUNTY SHERIFF DEPT,"2 COURT SQUARE,G3",WEBSTER SPRINGS,WV,26288,"http://maps.google.com/maps?q=2 COURT SQUARE,,+WEBSTER SPRINGS,+WV+26288&hl=en"
WEST VIRGINIA STATE POLICE,WEST VIRGINIA STATE POLICE SGT J.R FLETCHER/3048223561,525 DEPOT STREET,ROMNEY,WV,26757,"http://maps.google.com/maps?q=525 DEPOT STREET,+ROMNEY,+WV+26757&hl=en"
WEST VIRGINIA STATE POLICE,WVSP-CHARLES TOWN SGT J.S. CHUMLEY/304-725-9779,409 INDUSTRIAL BLVD.,KEARNEYSVILLE,WV,25430,"http://maps.google.com/maps?q=409 INDUSTRIAL BLVD.,+KEARNEYSVILLE,+WV+25430&hl=en"
WEST VIRGINIA STATE POLICE,WVSP-KEYSER SGT. S.B. HUFFMAN/3047881101,"730 FORT ASHBY RDRT 1, BOX 172D",KEYSER,WV,26726,"http://maps.google.com/maps?q=730 FORT ASHBY RD,+KEYSER,+WV+26726&hl=en"
WEST VIRGINIA STATE POLICE,WVSP-LEWISBURG SGT D.A EVANS/3046477600,381 GREENBRIAR RD,LEWISBURG,WV,24901,"http://maps.google.com/maps?q=381 GREENBRIAR RD,+LEWISBURG,+WV+24901&hl=en"
WEST VIRGINIA STATE POLICE,WVSP-MARTINSBURG SGT M.A. COLE/3042670001,14 TROOPER DR,MARTINSBURG,WV,25404,"http://maps.google.com/maps?q=14 TROOPER DR,+MARTINSBURG,+WV+25404&hl=en"
WILLIAMSBURG POLICE DEPARTMENT,WILLIAMSBURG FIRE DEPARTMENT,WILLIAMSBURG FIRE DEPARTMENT440 N BOUNDARY STREET,WILLIAMSBURG,VA,23185,"http://maps.google.com/maps?q=WILLIAMSBURG FIRE DEPARTMENT,+WILLIAMSBURG,+VA+23185&hl=en"
WINCHESTER CITY SHERIFF'S OFFICE,COURTHOUSE,5 NORTH KENT ST,WINCHESTER,VA,22601,"http://maps.google.com/maps?q=5 NORTH KENT ST,+WINCHESTER,+VA+22601&hl=en"
WINCHESTER CITY SHERIFF'S OFFICE,CVS PHARMACY,840 BERRYVILLE AV,WINCHESTER,VA,22601,"http://maps.google.com/maps?q=840 BERRYVILLE AV,+WINCHESTER,+VA+22601&hl=en"
WINCHESTER CITY SHERIFF'S OFFICE,ROTZ PHARMACY,1338 AMHERST ST,WINCHESTER,VA,22601,"http://maps.google.com/maps?q=1338 AMHERST ST,+WINCHESTER,+VA+22601&hl=en"
WOODSTOCK POLICE DEPARTMENT,WALMART NEAR FRONT ENTRANCE,461 W. RESERVOIR RD,WOODSTOCK,VA,22664,"http://maps.google.com/maps?q=461 W. RESERVOIR RD,+WOODSTOCK,+VA+22664&hl=en"
YORK-POQUOSON SHERIFF'S OFFICE,YORK-POQUOSON SHERIFF'S OFFICE D.A.R.E. OFFICE NEXT TO SUBWAY,5338-D GEORGE WASHINGTON MEMORIAL HWY,YORKTOWN,VA,23692,"http://maps.google.com/maps?q=5338-D GEORGE WASHINGTON MEMORIAL HWY,+YORKTOWN,+VA+23692&hl=en"
