Participant,CollectionSite,Address,City,State,Zip,MapURL
ADAIR COUNTY SHERIFF'S OFFICE,ADAIR COUNTY SHERIFF'S OFFICE,215 N. FRANKLIN,KIRKSVILLE,MO,63501,"http://maps.google.com/maps?q=215 N. FRANKLIN,+KIRKSVILLE,+MO+63501&hl=en"
ALBIA POLICE DEPARTMENT,MONROE COUNTY LAW ENFORCEMENT CENTER,114 19TH AVE WEST,ALBIA,IA,52531,"http://maps.google.com/maps?q=114 19TH AVE WEST,+ALBIA,+IA+52531&hl=en"
ALEDO POLICE DEPARTMENT,ALEDO POLICE DEPARTMENT PARKING AREA ADJACENT TO NORTH SIDE OF BLDG,200 NE 2ND ST,ALEDO,IL,61231,"http://maps.google.com/maps?q=200 NE 2ND ST,+ALEDO,+IL+61231&hl=en"
ALGONQUIN POLICE,ALGONQUIN POLICE DEPARTMENT,2200 HARNISH DRIVE,ALGONQUIN,IL,60102,"http://maps.google.com/maps?q=2200 HARNISH DRIVE,+ALGONQUIN,+IL+60102&hl=en"
ALTOONA POLICE DEPARTMENT,ALTOONA FIRE DEPT,950 VENBURY DRIVE,ALTOONA,IA,50009,"http://maps.google.com/maps?q=950 VENBURY DRIVE,+ALTOONA,+IA+50009&hl=en"
ALTOONA POLICE DEPARTMENT,ALTOONA POLICE DEPARTMENT EVENT 10:00AM-2:00PM,1904 SPOONER AVE,ALTOONA,WI,54720,"http://maps.google.com/maps?q=1904 SPOONER AVE,+ALTOONA,+WI+54720&hl=en"
AMES IOWA POLICE DEPARMENT,CITY HALL 1ST FLR WEST SIDE OF BLDG,515 CLARK AVE,AMES,IA,50010,"http://maps.google.com/maps?q=515 CLARK AVE,+AMES,+IA+50010&hl=en"
ANKENY POLICE DEPARTMENT,ANKENY POLICE DEPARTMENT,411 SW ORDNANCE RD,ANKENY,IA,50023,"http://maps.google.com/maps?q=411 SW ORDNANCE RD,+ANKENY,+IA+50023&hl=en"
APPANOOSE COUNTY SHERIFF,APPANOOSE COUNTY SHERIFF'S OFFICE,1125 W. VAN BUREN ST.,CENTERVILLE,IA,52544,"http://maps.google.com/maps?q=1125 W. VAN BUREN ST.,+CENTERVILLE,+IA+52544&hl=en"
APPLE VALLEY PD,APPLE VALLEY PD,7100 147TH STREET WEST,APPLE VALLEY,MN,55124,"http://maps.google.com/maps?q=7100 147TH STREET WEST,+APPLE VALLEY,+MN+55124&hl=en"
ARCADIA POLICE DEPARTMENT,ARCADIA POLICE DEPARTMENT EVENT 9:00AM-11:00AM,203 W MAIN STREET,ARCADIA,WI,54612,"http://maps.google.com/maps?q=203 W MAIN STREET,+ARCADIA,+WI+54612&hl=en"
ARLINGTON PD,ARLINGTON POLICE DEPARTMENT,108 4TH AVENUE NW,ARLINGTON,MN,55307,"http://maps.google.com/maps?q=108 4TH AVENUE NW,+ARLINGTON,+MN+55307&hl=en"
ATLANTIC POLICE DEPARTMENT,ATLANTIC POLICE DEPARTMENT NATHAN L KINNEY,23 E 4TH STREET,ATLANTIC,IA,50022,"http://maps.google.com/maps?q=23 E 4TH STREET,+ATLANTIC,+IA+50022&hl=en"
AURORA POLICE DEPARTMENT,AURORA POLICE DEPARTMENT,1200 E. INDIAN TRAIL,AURORA,IL,60505,"http://maps.google.com/maps?q=1200 E. INDIAN TRAIL,+AURORA,+IL+60505&hl=en"
BELVIDERE POLICE DEPARTMENT,BELVIDERE TOWNSHIP OFFICE 9 A.M. TO NOON,8200 FAIRGROUNDS RD,BELVIDERE,IL,61008,"http://maps.google.com/maps?q=8200 FAIRGROUNDS RD,+BELVIDERE,+IL+61008&hl=en"
BENTON COUNTY SHERIFF'S OFFICE,BENTON COUNTY SHERIFF'S OFFICE,113 E 3 STREET,VINTON,IA,52349,"http://maps.google.com/maps?q=113 E 3 STREET,+VINTON,+IA+52349&hl=en"
BLACK RIVER FALLS POLICE DEPARTMENT,THEISEN'S EVENT 10:00AM-1:00PM,616 E HWY 54,BLACK RIVER FALLS,WI,54615,"http://maps.google.com/maps?q=616 E HWY 54,+BLACK RIVER FALLS,+WI+54615&hl=en"
BLAIR POLICE DEPARTMENT,BLAIR POLICE DEPARTMENT,1730 LINCOLN STREET,BLAIR,NE,68008,"http://maps.google.com/maps?q=1730 LINCOLN STREET,+BLAIR,+NE+68008&hl=en"
BLAIR POLICE DEPARTMENT,BLAIR POLICE DEPARTMENT 9:00AM-1:00PM,122 S. URBERG AVE,BLAIR,WI,54616,"http://maps.google.com/maps?q=122 S. URBERG AVE,+BLAIR,+WI+54616&hl=en"
BLOOMINGTON PD,BLOOMINGTON PD,1800 W OLD SHAKOPEE ROAD,BLOOMINGTON,MN,55431,"http://maps.google.com/maps?q=1800 W OLD SHAKOPEE ROAD,+BLOOMINGTON,+MN+55431&hl=en"
BOONE IOWA POLICE DEPARTMENT,BOONE POLICE DEPARTMENT 10:00 AM-12:00 PM.,525 STORY STREET,BOONE,IA,50036,"http://maps.google.com/maps?q=525 STORY STREET,+BOONE,+IA+50036&hl=en"
BROWN COUNTY SHERIFF'S OFFICE,BROWN COUNTY SHERIFFS OFFICE NO BOXES,709 UTAH STREET,HIAWATHA,KS,66434,"http://maps.google.com/maps?q=709 UTAH STREET,+HIAWATHA,+KS+66434&hl=en"
BROWN COUNTY SHERIFF'S OFFICE,MT. STERLING IGA,200 PITTSFIELD ROAD,MOUNT STERLING,IL,62353,"http://maps.google.com/maps?q=200 PITTSFIELD ROAD,+MOUNT STERLING,+IL+62353&hl=en"
BUCHANAN COUNTY SHERIFF'S OFFICE,"BCSO DEA DROP SITE (FAREWAY) LOCATED AT FAREWAY, INDEPENDENCE, IA",1400 3RD AVENUE SE,INDEPENDENCE,IA,50644,"http://maps.google.com/maps?q=1400 3RD AVENUE SE,+INDEPENDENCE,+IA+50644&hl=en"
BURNSVILLE PD,BURNSVILLE POLICE DEPARTMENT,100 CIVIC CENTER PARKWAY,BURNSVILLE,MN,55337,"http://maps.google.com/maps?q=100 CIVIC CENTER PARKWAY,+BURNSVILLE,+MN+55337&hl=en"
CAMPBELL POLICE DEPARTMENT,CAMPBELL TOWN HALL EVENT 10:00AM-2:00PM,2219 BAINBRIDGE ST,LA CROSSE,WI,54603,"http://maps.google.com/maps?q=2219 BAINBRIDGE ST,+LA CROSSE,+WI+54603&hl=en"
CANTON POLICE DEPARTMENT,CANTON POLICE DEPARTMENT,2 N. MAIN STREET,CANTON,IL,61520,"http://maps.google.com/maps?q=2 N. MAIN STREET,+CANTON,+IL+61520&hl=en"
CARLISLE POLICE DEPARTMENT,CARLISLE FIRE DEPARTMENT,135 N. 2ND STREET,CARLISLE,IA,50047,"http://maps.google.com/maps?q=135 N. 2ND STREET,+CARLISLE,+IA+50047&hl=en"
CARVER COUNTY SHERIFF'S OFFICE,CITY OF CARVER CARVER PLACE,113 3RD STREET EAST,CARVER,MN,55315,"http://maps.google.com/maps?q=113 3RD STREET EAST,+CARVER,+MN+55315&hl=en"
CARVER COUNTY SHERIFF'S OFFICE,CITY OF MAYER CITY HALL,413 BLUE JAY AVENUE NORTH,MAYER,MN,55360,"http://maps.google.com/maps?q=413 BLUE JAY AVENUE NORTH,+MAYER,+MN+55360&hl=en"
CARVER COUNTY SHERIFF'S OFFICE,CITY OF VICTORIA REC CENTER,8475 KOCHIA LANE,VICTORIA,MN,55386,"http://maps.google.com/maps?q=8475 KOCHIA LANE,+VICTORIA,+MN+55386&hl=en"
CEDAR COUNTY SHERIFF'S OFFICE,CEDAR COUNTY SHERIFF'S OFFICE,711 E. SOUTH STREET,TIPTON,IA,52772,"http://maps.google.com/maps?q=711 E. SOUTH STREET,+TIPTON,+IA+52772&hl=en"
CEDAR FALLS POLICE DEPARTMENT,CEDAR FALLS POLICE DEPARTMENT,220 CLAY STREET,CEDAR FALLS,IA,50613,"http://maps.google.com/maps?q=220 CLAY STREET,+CEDAR FALLS,+IA+50613&hl=en"
CEDAR RAPIDS POLICE DEPT.,CEDAR RAPIDS POLICE DEPARTMENT,505 1ST ST SW,CEDAR RAPIDS,IA,52404,"http://maps.google.com/maps?q=505 1ST ST SW,+CEDAR RAPIDS,+IA+52404&hl=en"
CHARLES CITY POLICE DEPARTMENT,CHARLES CITY POLICE DEPARTMENT,105 MILWAUKEE MALL,CHARLES CITY,IA,50616,"http://maps.google.com/maps?q=105 MILWAUKEE MALL,+CHARLES CITY,+IA+50616&hl=en"
CITY OF DELAVAN POLICE DEPARTMENT,DELAVAN CITY HALL EVENT 10:00AM-2:00PM,123 S 2ND ST #1,DELAVAN,WI,53115,"http://maps.google.com/maps?q=123 S 2ND ST #1,+DELAVAN,+WI+53115&hl=en"
CITY OF LODI POLICE DEPARTMENT,CITY OF LODI POLICE DEPARTMENT EVENT 8:00AM -11:00AM,142 S MAIN ST,LODI,WI,53555,"http://maps.google.com/maps?q=142 S MAIN ST,+LODI,+WI+53555&hl=en"
CLAY CENTER KANSAS POLICE DEPARTMENT,CLAY COUNTY HEALTH DEPARTMENT,820 SPELLMAN CIRCLE,CLAY CENTER,KS,67432,"http://maps.google.com/maps?q=820 SPELLMAN CIRCLE,+CLAY CENTER,+KS+67432&hl=en"
CLINTON COUNTY SHERIFF'S OFFICE,CLINTON COUNTY SHERIFF'S OFFICE SATELLITE OFFICE,226 11TH STREET,DE WITT,IA,52742,"http://maps.google.com/maps?q=226 11TH STREET,+DE WITT,+IA+52742&hl=en"
CLINTON POLICE DEPARTMENT,CLINTON POLICE DEPARTMENT WILLIAM GREENWALT,537 BALLPARK DRIVE,CLINTON,IA,52732,"http://maps.google.com/maps?q=537 BALLPARK DRIVE,+CLINTON,+IA+52732&hl=en"
COLONA POLICE DEPARTMENT,COLONA POLICE DEPARTMENT LOBBY,215 1ST STREET,COLONA,IL,61241,"http://maps.google.com/maps?q=215 1ST STREET,+COLONA,+IL+61241&hl=en"
CONCORDIA POLICE DEPARTMENT,CONCORDIA CITY HALL ENTER THROUGH WEST GLASS DOORS,701 WASHINGTONCONCORDIA,CONCORDIA,KS,66901,"http://maps.google.com/maps?q=701 WASHINGTON,+CONCORDIA,+KS+66901&hl=en"
CORALVILLE POLICE DEPARTMENT,CORALVILLE POLICE DEPARTMENT,1503 5TH ST.,CORALVILLE,IA,52241,"http://maps.google.com/maps?q=1503 5TH ST.,+CORALVILLE,+IA+52241&hl=en"
CORALVILLE POLICE DEPARTMENT,WALGREENS- 2ND ST.,102 2ND ST.,CORALVILLE,IA,52241,"http://maps.google.com/maps?q=102 2ND ST.,+CORALVILLE,+IA+52241&hl=en"
CORALVILLE POLICE DEPARTMENT,WALGREENS- HEARTLAND DR,2751 HEARTLAND DR.,CORALVILLE,IA,52241,"http://maps.google.com/maps?q=2751 HEARTLAND DR.,+CORALVILLE,+IA+52241&hl=en"
COUNCIL BLUFFS POLICE DEPARTMENT,WALGREENS,535 E BROADWAY,COUNCIL BLUFFS,IA,51503,"http://maps.google.com/maps?q=535 E BROADWAY,+COUNCIL BLUFFS,+IA+51503&hl=en"
CROSS PLAINS POLICE DEPARTMENT,CROSS PLAINS POLICE DEPARTMENT EVENT 10:00 AM TO 2:00 PM,2417 BREWERY RD,CROSS PLAINS,WI,53528,"http://maps.google.com/maps?q=2417 BREWERY RD,+CROSS PLAINS,+WI+53528&hl=en"
CRYSTAL LAKE POLICE DEPARTMENT,CRYSTAL LAKE POLICE DEPARTMENT,100 W WOODSTOCK STREET,CRYSTAL LAKE,IL,60014,"http://maps.google.com/maps?q=100 W WOODSTOCK STREET,+CRYSTAL LAKE,+IL+60014&hl=en"
DAKOTA COUNTY SO,DAKOTA COUNTY SHERIFFS OFFICE,1580 HIGHWAY 55,HASTINGS,MN,55033,"http://maps.google.com/maps?q=1580 HIGHWAY 55,+HASTINGS,+MN+55033&hl=en"
DECATUR COUNTY SHERIFF'S OFFICE,DECATUR COUNTY SHERIFF'S OFFICE TRACY MOORE,203 NE IDAHO,LEON,IA,50144,"http://maps.google.com/maps?q=203 NE IDAHO,+LEON,+IA+50144&hl=en"
DEFOREST POLICE DEPARTMENT,DEFOREST POLICE DEPARTMENT EVENT 10:00 AM - 2:00 PM,110 SOUTH STEVENSON STREET,DEFOREST,WI,53532,"http://maps.google.com/maps?q=110 SOUTH STEVENSON STREET,+DEFOREST,+WI+53532&hl=en"
DEKALB POLICE DEPARTMENT,DEKALB POLICE DEPARTMENT,700 W. LINCOLN HWY,DEKALB,IL,60115,"http://maps.google.com/maps?q=700 W. LINCOLN HWY,+DEKALB,+IL+60115&hl=en"
DICKEYVILLE POLICE DEPARTMENT,DICKEYVILLE POLICE DEPARTMENT EVENT 9:00AM-12:00PM,500 EAST AVENUE,DICKEYVILLE,WI,53808,"http://maps.google.com/maps?q=500 EAST AVENUE,+DICKEYVILLE,+WI+53808&hl=en"
DOUGLAS COUNTY SHERIFF'S DEPARTMENT,HYVEE,1000 S 178TH STREET,OMAHA,NE,68118,"http://maps.google.com/maps?q=1000 S 178TH STREET,+OMAHA,+NE+68118&hl=en"
DOUGLAS COUNTY SHERIFF'S DEPARTMENT,HYVEE,3410 N 156TH STREET,OMAHA,NE,68116,"http://maps.google.com/maps?q=3410 N 156TH STREET,+OMAHA,+NE+68116&hl=en"
DOUGLAS COUNTY SHERIFF'S DEPARTMENT,WALGREENS,13155 W CENTER RD,OMAHA,NE,68144,"http://maps.google.com/maps?q=13155 W CENTER RD,+OMAHA,+NE+68144&hl=en"
DUBUQUE DRUG TASK FORCE,SAM'S CLUB,4400 ASBURY RD,DUBUQUE,IA,52002,"http://maps.google.com/maps?q=4400 ASBURY RD,+DUBUQUE,+IA+52002&hl=en"
EAST MOLINE POLICE DEPARTMENT,EAST MOLINE POLICE DEPARTMENT 1ST FLOOR COMMUNITY ROOM,915 16TH AVENUE,EAST MOLINE,IL,61244,"http://maps.google.com/maps?q=915 16TH AVENUE,+EAST MOLINE,+IL+61244&hl=en"
EAST PEORIA POLICE DEPARTMENT,EAST PEORIA FIRE DEPARTMENT CENTRAL HOUSE - FIRE BAYS,201 W. WASHINGTON STREET,EAST PEORIA,IL,61611,"http://maps.google.com/maps?q=201 W. WASHINGTON STREET,+EAST PEORIA,+IL+61611&hl=en"
EAU CLAIRE COUNTY SHERIFF'S OFFICE,MARSHFIELD CLINIC-EAU CLAIRE CENTER EVENT 10:00AM-2:00PM,2216 CRAIG ROAD,EAU CLAIRE,WI,54701,"http://maps.google.com/maps?q=2216 CRAIG ROAD,+EAU CLAIRE,+WI+54701&hl=en"
EDEN PRAIRIE PD,EDEN PRAIRIE SENIOR CENTER,8950 EDEN PRAIRIE ROAD,EDEN PRAIRIE,MN,55347,"http://maps.google.com/maps?q=8950 EDEN PRAIRIE ROAD,+EDEN PRAIRIE,+MN+55347&hl=en"
EDGERTON POLICE DEPARTMENT,EDGERTON POLICE DEPARTMENT EVENT 11:00AM-2:00PM,215 W FULTON ST,EDGERTON,WI,53534,"http://maps.google.com/maps?q=215 W FULTON ST,+EDGERTON,+WI+53534&hl=en"
EL PASO POLICE DEPARTMENT,EL PASO POLICE DEPARTMENT,540 E. MAIN STREET,EL PASO,IL,61738,"http://maps.google.com/maps?q=540 E. MAIN STREET,+EL PASO,+IL+61738&hl=en"
ELKHORN POLICE DEPARTMENT,PHARMACY STATION EVENT 10:00AM-2:00PM,3 E GENEVA ST,ELKHORN,WI,53121,"http://maps.google.com/maps?q=3 E GENEVA ST,+ELKHORN,+WI+53121&hl=en"
ELROY POLICE DEPARTMENT,ELROY POLICE DEPARTMENT EVENT 9:00AM-11:30AM,1717 OMAHA STREET,ELROY,WI,53929,"http://maps.google.com/maps?q=1717 OMAHA STREET,+ELROY,+WI+53929&hl=en"
EVANSVILLE POLICE DEPARTMENT,EVANSVILLE POLICE DEPARTMENT EVENT 8:00 AM TO 11:00 AM,10 WEST CHURCH STREET,EVANSVILLE,WI,53536,"http://maps.google.com/maps?q=10 WEST CHURCH STREET,+EVANSVILLE,+WI+53536&hl=en"
EXCELSIOR SPRING POLICE DEPARTMENT,EXCELSIOR SPRINGS POLICE DEPARTMENT LOBBY,301 S. MAIN STREET,EXCELSIOR SPRINGS,MO,64024,"http://maps.google.com/maps?q=301 S. MAIN STREET,+EXCELSIOR SPRINGS,+MO+64024&hl=en"
FARIBAULT COUNTY SO,FARIBAULT COUNTY SO,320 DR. H. RUSS STREET,BLUE EARTH,MN,56013,"http://maps.google.com/maps?q=320 DR. H. RUSS STREET,+BLUE EARTH,+MN+56013&hl=en"
FARMINGTON POLICE DEPARTMENT,FARMINGTON POLICE DEPARTMENT,322 E. FORST STREET,FARMINGTON,IL,61531,"http://maps.google.com/maps?q=322 E. FORST STREET,+FARMINGTON,+IL+61531&hl=en"
FILLMORE COUNTY SO,FILLMORE COUNTY SHERIFF'S OFFICE,901 HOUSTON STREET NW,PRESTON,MN,55965,"http://maps.google.com/maps?q=901 HOUSTON STREET NW,+PRESTON,+MN+55965&hl=en"
FILLMORE COUNTY SO,LANESBORO CITY HALL,202 PARKWAY AVENUE NORTH,LANESBORO,MN,55949,"http://maps.google.com/maps?q=202 PARKWAY AVENUE NORTH,+LANESBORO,+MN+55949&hl=en"
FILLMORE COUNTY SO,MABEL CITY HALL,201 SOUTH MAIN STREET,MABEL,MN,55954,"http://maps.google.com/maps?q=201 SOUTH MAIN STREET,+MABEL,+MN+55954&hl=en"
FILLMORE COUNTY SO,RUSHFORD POLICE DEPARTMENT,405 ELM STREET SOUTH,RUSHFORD,MN,55971,"http://maps.google.com/maps?q=405 ELM STREET SOUTH,+RUSHFORD,+MN+55971&hl=en"
FILLMORE COUNTY SO,SPRING VALLEY FIRE DEPARTMENT,120 WEST COURTLAND STREET,SPRING VALLEY,MN,55975,"http://maps.google.com/maps?q=120 WEST COURTLAND STREET,+SPRING VALLEY,+MN+55975&hl=en"
FOX LAKE POLICE DEPARTMENT,FOX LAKE POLICE DEPARTMENT EVENT 10:00AM-2:00PM,248 E STATE ST,FOX LAKE,WI,53933,"http://maps.google.com/maps?q=248 E STATE ST,+FOX LAKE,+WI+53933&hl=en"
FREEBORN COUNTY SO/ALBERT LEA PD,FREEBORN COUNTY FAIRGROUNDS,1029 BRIDGE AVENUE,ALBERT LEA,MN,56007,"http://maps.google.com/maps?q=1029 BRIDGE AVENUE,+ALBERT LEA,+MN+56007&hl=en"
FREMONT POLICE DEPARTMENT,BAKERS STORE PAKING LOT(NO BOXES),1531 NORTH BELL ST,FREMONT,NE,68025,"http://maps.google.com/maps?q=1531 NORTH BELL ST,+FREMONT,+NE+68025&hl=en"
FREMONT POLICE DEPARTMENT,FREMONT POLICE DEPARTMENT LOBBY,725 N. PARK AVE,FREMONT,NE,68025,"http://maps.google.com/maps?q=725 N. PARK AVE,+FREMONT,+NE+68025&hl=en"
GAGE COUNTY SHERIFF,CAGE COUNTY SHERIFF,612 LINCOLN ST,BEATRICE,NE,68310,"http://maps.google.com/maps?q=612 LINCOLN ST,+BEATRICE,+NE+68310&hl=en"
GALESVILLE POLICE DEPARTMENT,HOMETOWN PHARMACY EVENT 8:00AM-12:00PM,16812 SOUTH MAIN STREET,GALESVILLE,WI,54630,"http://maps.google.com/maps?q=16812 SOUTH MAIN STREET,+GALESVILLE,+WI+54630&hl=en"
GALLATIN POLICE DEPARTMENT,GALLATIN POLICE DEPARTMENT,112 E GRAND,GALLATIN,MO,64640,"http://maps.google.com/maps?q=112 E GRAND,+GALLATIN,+MO+64640&hl=en"
GENESEO POLICE DEPARTMENT,GENESEO MUNICIPAL BUILDING CITY HALL AND POLICE DEPARTMENT,115 SOUTH OAKWOOD AVE,GENESEO,IL,61254,"http://maps.google.com/maps?q=115 SOUTH OAKWOOD AVE,+GENESEO,+IL+61254&hl=en"
GLENWOOD POLICE DEPARTMENT,MEDICAP PHARMACY,1206 S LOCUST,GLENWOOD,IA,51534,"http://maps.google.com/maps?q=1206 S LOCUST,+GLENWOOD,+IA+51534&hl=en"
GRUNDY COUNTY LAW ENFORCEMENT CENTER,GRUNDY COUNTY LAW ENFORCEMENT CENTER,610 MAIN STREET,TRENTON,MO,64683,"http://maps.google.com/maps?q=610  MAIN STREET,+TRENTON,+MO+64683&hl=en"
HAMILTON COUNTY SHERIFF'S OFFICE,HY-VEE FOOD STORE,823 2ND STREET,WEBSTER CITY,IA,50595,"http://maps.google.com/maps?q=823 2ND STREET,+WEBSTER CITY,+IA+50595&hl=en"
HANCOCK COUNTY SHERIFF'S OFFICE,DALLAS CITY HALL DALLAS CITY POLICE DEPARTMENT,120 W. 1ST STREET,DALLAS CITY,IL,62330,"http://maps.google.com/maps?q=120 W. 1ST STREET,+DALLAS CITY,+IL+62330&hl=en"
HANCOCK COUNTY SHERIFF'S OFFICE,HAMILTON POLICE DEPARTMENT,1010 BROADWAY ST,HAMILTON,IL,62341,"http://maps.google.com/maps?q=1010 BROADWAY ST,+HAMILTON,+IL+62341&hl=en"
HANCOCK COUNTY SHERIFF'S OFFICE,HANCOCK COUNTY SHERIFF'S OFFICE,98 BUCHANAN ST,CARTHAGE,IL,62321,"http://maps.google.com/maps?q=98 BUCHANAN ST,+CARTHAGE,+IL+62321&hl=en"
HANCOCK COUNTY SHERIFF'S OFFICE,JIFFI STOP,101 S. WORRELL STREET,BOWEN,IL,62316,"http://maps.google.com/maps?q=101 S. WORRELL STREET,+BOWEN,+IL+62316&hl=en"
HANCOCK COUNTY SHERIFF'S OFFICE,LAHARPE POLICE DEPARTMENT,207 E. MAIN STREET,LA HARPE,IL,61450,"http://maps.google.com/maps?q=207 E. MAIN STREET,+LA HARPE,+IL+61450&hl=en"
HANCOCK COUNTY SHERIFF'S OFFICE,NAUVOO POLICE DEPARTMENT,60 N BLUFF ST,NAUVOO,IL,62354,"http://maps.google.com/maps?q=60 N BLUFF ST,+NAUVOO,+IL+62354&hl=en"
HANCOCK COUNTY SHERIFF'S OFFICE,WARSAW CITY HALL WARSAW POLICE DEPARTMENT,210 N 4TH ST,WARSAW,IL,62379,"http://maps.google.com/maps?q=210 N 4TH ST,+WARSAW,+IL+62379&hl=en"
HARRISON COUNTY SHERIFF'S OFFICE,HARRISON COUNTY SHERIFF'S OFFICE LOBBY,111 S. FIRST AVE,LOGAN,IA,51546,"http://maps.google.com/maps?q=111 S. FIRST AVE,+LOGAN,+IA+51546&hl=en"
HARVARD POLICE DEPARTMENT,HARVARD POLICE DEPARTMENT,201 W. FRONT ST.,HARVARD,IL,60033,"http://maps.google.com/maps?q=201 W. FRONT ST.,+HARVARD,+IL+60033&hl=en"
HENRY COUNTY SHERIFF'S OFFICE,HENRY COUNTY SHERIFF'S OFFICE NO BOXES NEEDED FOR ANY SITE,106 EAST CLAY STREET,MOUNT PLEASANT,IA,52641,"http://maps.google.com/maps?q=106 EAST CLAY STREET,+MOUNT PLEASANT,+IA+52641&hl=en"
HENRY COUNTY SHERIFF'S OFFICE,NEW LONDON POLICE DEPARTMENT,509 EAST MAIN STREET,NEW LONDON,IA,52645,"http://maps.google.com/maps?q=509 EAST MAIN STREET,+NEW LONDON,+IA+52645&hl=en"
HENRY COUNTY SHERIFF'S OFFICE,SALEM CITY HALL,201 SOUTH MAIN STREET,SALEM,IA,52649,"http://maps.google.com/maps?q=201 SOUTH MAIN STREET,+SALEM,+IA+52649&hl=en"
HENRY COUNTY SHERIFF'S OFFICE,WAYLAND FIRE DEPARTMENT,211 NORTH WASHINGTON STREET,WAYLAND,IA,52654,"http://maps.google.com/maps?q=211 NORTH WASHINGTON STREET,+WAYLAND,+IA+52654&hl=en"
HENRY COUNTY SHERIFF'S OFFICE,WINFIELD POLICE DEPARTMENT,115 NORTH LOCUST STREET,WINFIELD,IA,52659,"http://maps.google.com/maps?q=115 NORTH LOCUST STREET,+WINFIELD,+IA+52659&hl=en"
HIAWATHA POLICE DEPT,"HIAWATHA POLICE DEPT LOBBY, SOUTH WALL",101 EMMONS ST,HIAWATHA,IA,52233,"http://maps.google.com/maps?q=101 EMMONS ST,+HIAWATHA,+IA+52233&hl=en"
HIGHLAND POLICE DEPARTMENT,HIGHLAND POLICE DEPARTMENT EVENT 10:00 AM TO 2:00 PM,530 MAIN STREET,HIGHLAND,WI,53543,"http://maps.google.com/maps?q=530 MAIN STREET,+HIGHLAND,+WI+53543&hl=en"
HOLT COUNTY SHERIFF OFFICE,HOLT COUNTY SHERIFF OFFICE,107 S MAIN,OREGON,MO,64473,"http://maps.google.com/maps?q=107 S MAIN,+OREGON,+MO+64473&hl=en"
HUNTLEY POLICE DEPARTMENT,HUNTLEY POLICE DEPARTMENT,10911 MAIN STREET,HUNTLEY,IL,60142,"http://maps.google.com/maps?q=10911 MAIN STREET,+HUNTLEY,+IL+60142&hl=en"
IOWA CITY POLICE DEPARTMENT,EAST SIDE RECYCLING CENTER,2401 SCOTT BLVD SE,IOWA CITY,IA,52240,"http://maps.google.com/maps?q=2401 SCOTT BLVD SE,+IOWA CITY,+IA+52240&hl=en"
IOWA COUNTY SHERIFF'S OFFICE,IOWA COUNTY SHERIFF'S OFFICE,960 FRANKLYN AVE.,MARENGO,IA,52301,"http://maps.google.com/maps?q=960 FRANKLYN AVE.,+MARENGO,+IA+52301&hl=en"
JACKSON COUNTY SHERIFF'S OFFICE,BUILDING NEXT TO JACKSON COUNTY RECYCLING EVENT 8:00 AM TO 2:00 PM,115 HARRISON STREET,BLACK RIVER FALLS,WI,54615,"http://maps.google.com/maps?q=115 HARRISON STREET,+BLACK RIVER FALLS,+WI+54615&hl=en"
JACKSON COUNTY SHERIFF'S OFFICE,JACKSON COUNTY SHERIFF'S OFFICE,210 US HWY 75,HOLTON,KS,66436,"http://maps.google.com/maps?q=210  US HWY 75,+HOLTON,+KS+66436&hl=en"
JACKSON COUNTY SHERIFF'S OFFICE,MAQUOKETA POLICE DEPARTMENT,102 S NIAGARA ST,MAQUOKETA,IA,52060,"http://maps.google.com/maps?q=102 S NIAGARA ST,+MAQUOKETA,+IA+52060&hl=en"
JACKSON COUNTY SHERIFF'S OFFICE,SABULA POLICE DEPARTMENT,411 BROAD ST,SABULA,IA,52070,"http://maps.google.com/maps?q=411 BROAD ST,+SABULA,+IA+52070&hl=en"
JEFFERSON COUNTY SHERIFF'S OFFICE,JEFFERSON COUNTY LAW ENFOCEMENT CENTER NE CORNER OF THE LEC BUILDING,606 3RD STREET,FAIRBURY,NE,68352,"http://maps.google.com/maps?q=606 3RD STREET,+FAIRBURY,+NE+68352&hl=en"
JOHNSON COUNTY SHERIFF'S OFFICE,JOHNSON COUNTY SHERIFF'S OFFICE LOBBY- (DOUBLE BOXES),511 S CAPITOL STREET,IOWA CITY,IA,52240,"http://maps.google.com/maps?q=511 S CAPITOL STREET,+IOWA CITY,+IA+52240&hl=en"
JOHNSTON POLICE DEPARTMENT,JOHNSTON PUBLIC SAFETY BUILDING,6373 MERLE HAY ROAD,JOHNSTON,IA,50131,"http://maps.google.com/maps?q=6373 MERLE HAY ROAD,+JOHNSTON,+IA+50131&hl=en"
JORDAN PD,JORDAN POLICE DEPARTMENT LOBBY: OPEN DAILY FROM 8AM TO 8PM,705 SYNDICATE STREET,JORDAN,MN,55352,"http://maps.google.com/maps?q=705 SYNDICATE STREET,+JORDAN,+MN+55352&hl=en"
JUNEAU POLICE DEPT,JUNEAU PUBLIC SAFETY BLDG EVENT 10:00 AM TO 2:00 PM,128 E CROSS ST,JUNEAU,WI,53039,"http://maps.google.com/maps?q=128 E CROSS ST,+JUNEAU,+WI+53039&hl=en"
KANE COUNTY CORONER OFFICE,KANE COUNTY CORONER OFFICE STEVE LAKER,719 S. BATAVIA AVE. BUILDING E,GENEVA,IL,60134,"http://maps.google.com/maps?q=719 S. BATAVIA AVE. BUILDING E,+GENEVA,+IL+60134&hl=en"
KANE COUNTY SHERIFF'S OFFICE,KANE COUNTY SHERIFF'S OFFICE,37W755 IL ROUTE 38,SAINT CHARLES,IL,60175,"http://maps.google.com/maps?q=37W755 IL ROUTE 38,+SAINT CHARLES,+IL+60175&hl=en"
KANSAS CITY MISSOURI POLICE DEPT.,CHILDREN'S MERCY NORTH CAMPUS,501 NW BARRY RD,KANSAS CITY,MO,64155,"http://maps.google.com/maps?q=501 NW BARRY RD,+KANSAS CITY,+MO+64155&hl=en"
KANSAS CITY MISSOURI POLICE DEPT.,KCMO PD NORTH PATROL STATION BRAD STOTT,11000 NW PRAIRIE VIEW RD,KANSAS CITY,MO,64153,"http://maps.google.com/maps?q=11000 NW PRAIRIE VIEW RD,+KANSAS CITY,+MO+64153&hl=en"
KANSAS CITY MISSOURI POLICE DEPT.,KCMO PD SHOAL CREEK STATION,6801 PLEASANT VALLEY ROAD,KANSAS CITY,MO,64119,"http://maps.google.com/maps?q=6801 PLEASANT VALLEY ROAD,+KANSAS CITY,+MO+64119&hl=en"
KANSAS CITY MISSOURI POLICE DEPT.,LIBERTY HOSPITAL,2525 GLENN HENDREN DR.,LIBERTY,MO,64068,"http://maps.google.com/maps?q=2525 GLENN HENDREN DR.,+LIBERTY,+MO+64068&hl=en"
KEARNEY MO POLICE DEPARTMENT,KEARNEY POLICE STATION,725 WEST MO-92 HIGHWAY,KEARNEY,MO,64060,"http://maps.google.com/maps?q=725 WEST MO-92 HIGHWAY,+KEARNEY,+MO+64060&hl=en"
KOSSUTH COUNTY SHERIFF'S OFFICE,HY VEE FOOD STORE NO BOXES,1500 HYW.169 N.,ALGONA,IA,50511,"http://maps.google.com/maps?q=1500 HYW.169 N.,+ALGONA,+IA+50511&hl=en"
LA VISTA POLICE DEPARTMENT,LA VISTA POLICE DEPARTMENT,7701 S 96TH STREET,LA VISTA,NE,68128,"http://maps.google.com/maps?q=7701 S 96TH STREET,+LA VISTA,+NE+68128&hl=en"
LAFAYETTE COUNTY MISSOURI SHERIFF OFFICE,WAVERLY MISSIOURI POLICE DEPARTMENT/CITY HALL,111 EAST KELLING STREET,WAVERLY,MO,64096,"http://maps.google.com/maps?q=111 EAST KELLING STREET,+WAVERLY,+MO+64096&hl=en"
LAKE IN THE HILLS POLICE DEPARTMENT,LAKE IN THE HILLS POLICE DEPARTMENT,1115 CRYSTAL LAKE RD,LAKE IN THE HILLS,IL,60156,"http://maps.google.com/maps?q=1115 CRYSTAL LAKE RD,+LAKE IN THE HILLS,+IL+60156&hl=en"
LAKE MILLS POLICE DEPARTMENT,LAKE MILLS POLICE DEPARTMENT,304 S. MILL STREET,LAKE MILLS,IA,50450,"http://maps.google.com/maps?q=304 S. MILL STREET,+LAKE MILLS,+IA+50450&hl=en"
LAKE WAUKOMIS POLICE DEPT.,LAKE WAUKOMIS CITY HALL COMPLEX,1147 NW SOUTH SHORE DRIVE,LAKE WAUKOMIS,MO,64151,"http://maps.google.com/maps?q=1147 NW SOUTH SHORE DRIVE,+LAKE WAUKOMIS,+MO+64151&hl=en"
LAKEWOOD POLICE DEPARTMENT,LAKEWOOD POLICE DEPARTMENT,2500 LAKE AVENUE,CRYSTAL LAKE,IL,60014,"http://maps.google.com/maps?q=2500 LAKE AVENUE,+CRYSTAL LAKE,+IL+60014&hl=en"
LANSING POLICE DEPT.,LANSING CITY HALL,800 1ST TERRACE,LANSING,KS,66043,"http://maps.google.com/maps?q=800 1ST TERRACE,+LANSING,+KS+66043&hl=en"
LASALLE COUNTY CORONER & SHERIFF,LASALLE COUNTY CORONER AND SHERIFF NORTH ENTRY POINT,707 EAST ETNA ROAD,OTTAWA,IL,61350,"http://maps.google.com/maps?q=707 EAST ETNA ROAD,+OTTAWA,+IL+61350&hl=en"
LEAVENWORTH COUNTY SHERIFFS OFFICE,CVS PHARMACY,390 LIMIT ST,LEAVENWORTH,KS,66048,"http://maps.google.com/maps?q=390 LIMIT ST,+LEAVENWORTH,+KS+66048&hl=en"
LEAVENWORTH POLICE DEPARTMENT,PRICE CHOPPER,2107 S. 4TH ST.,LEAVENWORTH,KS,66048,"http://maps.google.com/maps?q=2107 S. 4TH ST.,+LEAVENWORTH,+KS+66048&hl=en"
LEE COUNTY SHERIFF'S OFFICE,LEE COUNTY SHERIFF'S OFFICE,2530 255TH ST,MONTROSE,IA,52639,"http://maps.google.com/maps?q=2530 255TH ST,+MONTROSE,+IA+52639&hl=en"
LIBERTY POLICE DEPT.,LIBERTY POLICE DEPT.,101 E. KANSAS STREET,LIBERTY,MO,64068,"http://maps.google.com/maps?q=101 E. KANSAS STREET,+LIBERTY,+MO+64068&hl=en"
LINN COUNTY SHERIFF'S OFFICE,CENTRAL CITY FIRE STATION,137 N 4TH ST,CENTRAL CITY,IA,52214,"http://maps.google.com/maps?q=137 N 4TH ST,+CENTRAL CITY,+IA+52214&hl=en"
LINN COUNTY SHERIFF'S OFFICE,LINN COUNTY SHERIFF'S OFFICE,310 2ND AV SW,CEDAR RAPIDS,IA,52404,"http://maps.google.com/maps?q=310 2ND AV SW,+CEDAR RAPIDS,+IA+52404&hl=en"
LINN COUNTY SHERIFF'S OFFICE,SPRINGVILLE FIRE STATION,300 BROADWAY ST,SPRINGVILLE,IA,52336,"http://maps.google.com/maps?q=300 BROADWAY ST,+SPRINGVILLE,+IA+52336&hl=en"
LOVES PARK POLICE DEPARTMENT,LOVES PARK POLICE @ WALGREENS,5900 N. 2ND ST.,LOVES PARK,IL,61111,"http://maps.google.com/maps?q=5900 N. 2ND ST.,+LOVES PARK,+IL+61111&hl=en"
MADRID POLICE DEPARTMENT,MADRID CITY HALL,304 S WATER STREET,MADRID,IA,50156,"http://maps.google.com/maps?q=304 S WATER STREET,+MADRID,+IA+50156&hl=en"
MANCHESTER POLICE DEPARTMENT,BLAKESLEY DRUG,220 EAST MAIN ST.,MANCHESTER,IA,52057,"http://maps.google.com/maps?q=220 EAST MAIN ST.,+MANCHESTER,+IA+52057&hl=en"
MAPLE BLUFF POLICE DEPARTMENT,VILLAGE OF MAPLE BLUFF POLICE DEPARTMENT EVENT 10:00AM-2:00PM,18 OXFORD PLACE,MADISON,WI,53704,"http://maps.google.com/maps?q=18 OXFORD PLACE,+MADISON,+WI+53704&hl=en"
MAR-MAC POLICE DEPARTMENT,MCGREGOR PUBLIC LIBRARY,334 MAIN STREET,MC GREGOR,IA,52157,"http://maps.google.com/maps?q=334 MAIN STREET,+MC GREGOR,+IA+52157&hl=en"
MARENGO POLICE DEPARTMENT,MARENGO POLICE DEPARTMENT,142 E. PRAIRIE STREET,MARENGO,IL,60152,"http://maps.google.com/maps?q=142 E. PRAIRIE STREET,+MARENGO,+IL+60152&hl=en"
MARION COUNTY SHERIFFS OFFICE,MARION COUNTY SHERIFF'S OFFICE,211 N. GODFREY LN,KNOXVILLE,IA,50138,"http://maps.google.com/maps?q=211 N. GODFREY LN,+KNOXVILLE,+IA+50138&hl=en"
MARION POLICE DEPARTMENT,MARION POLICE DEPARTMENT FRONT PARKING LOT,6315 HWY 151MARION,MARION,IA,52302,"http://maps.google.com/maps?q=6315 HWY 151,+MARION,+IA+52302&hl=en"
MARQUETTE COUNTY SHERIFF'S OFFICE,MARQUETTE COUNTY SHERIFF'S OFFICE EVENT 8:00AM-2:00PM,67 W PARK STREET,MONTELLO,WI,53949,"http://maps.google.com/maps?q=67 W PARK STREET,+MONTELLO,+WI+53949&hl=en"
MARSHALL COUNTY HEALTH DEPARTMENT/SHERIFF'S OFFICE,MARSHALL COUNTY HEALTH DEPARTMENT,600 BROADWAY,MARYSVILLE,KS,66508,"http://maps.google.com/maps?q=600 BROADWAY,+MARYSVILLE,+KS+66508&hl=en"
