Participant,CollectionSite,Address,City,State,Zip,MapURL
VIRGINIA STATE POLICE,VIRGINIA STATE POLICE DIVISION I HQS POC: SGT MELANIE MCKENNEY,9300 BROOK ROAD,GLEN ALLEN,VA,23060,"http://maps.google.com/maps?q=9300 BROOK ROAD,+GLEN ALLEN,+VA+23060&hl=en"
VIRGINIA STATE POLICE,VIRGINIA STATE POLICE DIVISION III HQS POC: SGT DREW MCCORMICK,240 THIRD DIVISION LOOP,APPOMATTOX,VA,24522,"http://maps.google.com/maps?q=240 THIRD DIVISION LOOP,+APPOMATTOX,+VA+24522&hl=en"
VIRGINIA STATE POLICE,VIRGINIA STATE POLICE DIVISION VI HQS POC: SGT. GLENN ARMSTRONG,3775 W. MAIN STREET,SALEM,VA,24153,"http://maps.google.com/maps?q=3775 W. MAIN STREET,+SALEM,+VA+24153&hl=en"
WEST CABARRUS YMCA,WEST CABARRUS YMCA ROBERT KIRK,5325 LANGFORD AVE,CONCORD,NC,28027,"http://maps.google.com/maps?q=5325 LANGFORD AVE,+CONCORD,+NC+28027&hl=en"
WEST VIRGINIA STATE POLICE,WVSP-LEWISBURG SGT D.A EVANS/3046477600,381 GREENBRIAR RD,LEWISBURG,WV,24901,"http://maps.google.com/maps?q=381 GREENBRIAR RD,+LEWISBURG,+WV+24901&hl=en"
WHITEVILLE POLICE DEPARTMENT,COLUMBUS REGIONAL HEALTHCARE 500 JEFFERSON STREET,500 JEFFERSON STREET,WHITEVILLE,NC,28472,"http://maps.google.com/maps?q=500 JEFFERSON STREET,+WHITEVILLE,+NC+28472&hl=en"
WHITEVILLE POLICE DEPARTMENT,WHITEVILLE POLICE DEPARTMENT,117 E. COLUMBUS ST,WHITEVILLE,NC,28472,"http://maps.google.com/maps?q=117 E. COLUMBUS ST,+WHITEVILLE,+NC+28472&hl=en"
WILLIAMSBURG POLICE DEPARTMENT,WILLIAMSBURG FIRE DEPARTMENT,WILLIAMSBURG FIRE DEPARTMENT440 N BOUNDARY STREET,WILLIAMSBURG,VA,23185,"http://maps.google.com/maps?q=WILLIAMSBURG FIRE DEPARTMENT,+WILLIAMSBURG,+VA+23185&hl=en"
YORK-POQUOSON SHERIFF'S OFFICE,YORK-POQUOSON SHERIFF'S OFFICE D.A.R.E. OFFICE NEXT TO SUBWAY,5338-D GEORGE WASHINGTON MEMORIAL HWY,YORKTOWN,VA,23692,"http://maps.google.com/maps?q=5338-D GEORGE WASHINGTON MEMORIAL HWY,+YORKTOWN,+VA+23692&hl=en"
TOWN OF DUCK POLICE DEPARTMENT,TOWN OF DUCK POLICE DEPARTMENT LT. JEFFREY ACKERMAN,1259 DUCK RD,DUCK,NC,27949,"http://maps.google.com/maps?q=1259 DUCK RD,+DUCK,+NC+27949&hl=en"
NORTHAMPTON COUNTY SHERIFF'S OFFICE,NORTHAMPTON COUNTY SHERIFF'S OFFICE FRONT LOBBY,5211 THE HORNES,EASTVILLE,VA,23347,"http://maps.google.com/maps?q=5211 THE HORNES,+EASTVILLE,+VA+23347&hl=en"
BRUNSWICK COUNTY SHERIFF'S OFFICE,DOSHER MEMORIAL HOSPITAL,924 N. HOWE STREET,SOUTHPORT,NC,28461,"http://maps.google.com/maps?q=924 N. HOWE STREET,+SOUTHPORT,+NC+28461&hl=en"
