Participant,CollectionSite,Address,City,State,Zip,MapURL
5TH JUDICIAL DRUG TASK FORCE,BLOUNT COUNTY JUSTICE CENTER,940 EAST LAMAR ALEXANDER PARKWAY,MARYVILLE,TN,37804,"http://maps.google.com/maps?q=940 EAST LAMAR ALEXANDER PARKWAY,+MARYVILLE,+TN+37804&hl=en"
AFOSI DET 310,BASE EXCHANGE (BX) AIR BASE MUST HAVE ACCESS TO BASE,101 LAWSON DRIVEBLDG 1990,CHARLESTON AFB,SC,29404,"http://maps.google.com/maps?q=101 LAWSON DRIVE,+CHARLESTON AFB,+SC+29404&hl=en"
AIKEN DEPARTMENT OF PUBLIC SAFETY,CLYBURN CENTER FOR PRIMARY CARE,1000 CLYBURN PLACE,AIKEN,SC,29801,"http://maps.google.com/maps?q=1000 CLYBURN PLACE,+AIKEN,+SC+29801&hl=en"
ASHE COUNTY SHERIFF'S OFFICE,CVS PHARMACY,2 CRESCENT DRIVE,WEST JEFFERSON,NC,28694,"http://maps.google.com/maps?q=2 CRESCENT DRIVE,+WEST JEFFERSON,+NC+28694&hl=en"
ASHE COUNTY SHERIFF'S OFFICE,FOOD LION,733 E MAIN STREET,JEFFERSON,NC,28640,"http://maps.google.com/maps?q=733 E MAIN STREET,+JEFFERSON,+NC+28640&hl=en"
ASHE COUNTY SHERIFF'S OFFICE,WARRENSVILLE DRUG,5121 NC HIGHWAY 88 W,WARRENSVILLE,NC,28693,"http://maps.google.com/maps?q=5121 NC HIGHWAY 88 W,+WARRENSVILLE,+NC+28693&hl=en"
BAILEYTON POLICE DEPT.,BAILEYTON POLICE DEPT.,6530 HORTON HWY,GREENEVILLE,TN,37745,"http://maps.google.com/maps?q=6530 HORTON HWY,+GREENEVILLE,+TN+37745&hl=en"
BARNWELL COUNTY SHERIFF'S OFFICE,CVS,9912 DUNBARTON BLVD.,BARNWELL,SC,29812,"http://maps.google.com/maps?q=9912 DUNBARTON BLVD.,+BARNWELL,+SC+29812&hl=en"
BEAUFORT COUNTY SHERIFF'S OFFICE,BEAUFORT COUNTY CONVENIENCE CENTER,80 SHANKLIN RD,BEAUFORT,SC,29906,"http://maps.google.com/maps?q=80 SHANKLIN RD,+BEAUFORT,+SC+29906&hl=en"
BEAUFORT COUNTY SHERIFF'S OFFICE,SOLID WASTE & RECYCLING CENTER,104 SIMMONSVILLE ROAD,BLUFFTON,SC,29910,"http://maps.google.com/maps?q=104 SIMMONSVILLE ROAD,+BLUFFTON,+SC+29910&hl=en"
BERKELEY COUNTY SHERIFF'S OFFICE,BERKELEY COUNTY SHERIFF'S OFFICE ALVIN SUB-STATION,2184 SANTEE RIVER ROAD,SAINT STEPHEN,SC,29479,"http://maps.google.com/maps?q=2184 SANTEE RIVER ROAD,+SAINT STEPHEN,+SC+29479&hl=en"
BERKELEY COUNTY SHERIFF'S OFFICE,BERKELEY COUNTY SHERIFF'S OFFICE CROSS SUB-STATION,1659 OLD HIGHWAY 6,CROSS,SC,29436,"http://maps.google.com/maps?q=1659 OLD HIGHWAY 6,+CROSS,+SC+29436&hl=en"
BERKELEY COUNTY SHERIFF'S OFFICE,BERKELEY COUNTY SHERIFF'S OFFICE HUGER SUB-STATION,1501 RECREATION ROAD,HUGER,SC,29450,"http://maps.google.com/maps?q=1501 RECREATION ROAD,+HUGER,+SC+29450&hl=en"
BERKELEY COUNTY SHERIFF'S OFFICE,BERKELEY COUNTY SHERIFF'S OFFICE MAGISTRATES OFFICE,223 N. LIVE OAK DRIVE,MONCKS CORNER,SC,29461,"http://maps.google.com/maps?q=223 N. LIVE OAK DRIVE,+MONCKS CORNER,+SC+29461&hl=en"
BERKELEY COUNTY SHERIFF'S OFFICE,GOOSE CREEK POLICE DEPARTMENT,519 N. GOOSE CREEK BLVD,GOOSE CREEK,SC,29445,"http://maps.google.com/maps?q=519 N. GOOSE CREEK BLVD,+GOOSE CREEK,+SC+29445&hl=en"
BON SECOURS ST. FRANCIS HEALTH SYSTEM,BON SECOURS MILLENIUM DRIVE,2 INNOVATION DR,GREENVILLE,SC,29607,"http://maps.google.com/maps?q=2 INNOVATION DR,+GREENVILLE,+SC+29607&hl=en"
BRISTOL TENNESSEE POLICE DEPARTMENT,BRISTOL POLICE DEPARTMENT MUNICIPAL PARKING LOT,801 ANDERSON STREET,BRISTOL,TN,37620,"http://maps.google.com/maps?q=801 ANDERSON STREET,+BRISTOL,+TN+37620&hl=en"
BRUNSWICK COUNTY SHERIFF'S OFFICE,DOSHER MEMORIAL HOSPITAL,924 N. HOWE STREET,SOUTHPORT,NC,28461,"http://maps.google.com/maps?q=924 N. HOWE STREET,+SOUTHPORT,+NC+28461&hl=en"
BRUNSWICK COUNTY SHERIFF'S OFFICE,NOVANT HEALTH BRUNSWICK MEDICAL CENTER,240 HOSPITAL DRIVE NE,BOLIVIA,NC,28422,"http://maps.google.com/maps?q=240 HOSPITAL DRIVE NE,+BOLIVIA,+NC+28422&hl=en"
BUNCOMBE COUNTY SHERIFF'S OFFICE,ASHEVILLE REGIONAL AIRPORT,61 TERMINAL DRIVE,FLETCHER,NC,28732,"http://maps.google.com/maps?q=61 TERMINAL DRIVE,+FLETCHER,+NC+28732&hl=en"
BUNCOMBE COUNTY SHERIFF'S OFFICE,CVS PHARMACY,425 W. STATE STREET,BLACK MOUNTAIN,NC,28711,"http://maps.google.com/maps?q=425 W. STATE STREET,+BLACK MOUNTAIN,+NC+28711&hl=en"
BUNCOMBE COUNTY SHERIFF'S OFFICE,CVS PHARMACY,505 SMOKEY PARK HIGHWAY,ASHEVILLE,NC,28806,"http://maps.google.com/maps?q=505 SMOKEY PARK HIGHWAY,+ASHEVILLE,+NC+28806&hl=en"
BUNCOMBE COUNTY SHERIFF'S OFFICE,SONA PHARMACY,805 FAIRVIEW RD,ASHEVILLE,NC,28803,"http://maps.google.com/maps?q=805 FAIRVIEW RD,+ASHEVILLE,+NC+28803&hl=en"
BUNCOMBE COUNTY SHERIFF'S OFFICE,WALGREEN'S,1124 PATTON AVE,ASHEVILLE,NC,28806,"http://maps.google.com/maps?q=1124 PATTON AVE,+ASHEVILLE,+NC+28806&hl=en"
BUNCOMBE COUNTY SHERIFF'S OFFICE,WALGREEN'S,1835 HENDERSONVILLE RD,ASHEVILLE,NC,28803,"http://maps.google.com/maps?q=1835 HENDERSONVILLE RD,+ASHEVILLE,+NC+28803&hl=en"
BUNCOMBE COUNTY SHERIFF'S OFFICE,WALGREEN'S,841 MERRIMON AVE,ASHEVILLE,NC,28804,"http://maps.google.com/maps?q=841 MERRIMON AVE,+ASHEVILLE,+NC+28804&hl=en"
BUNCOMBE COUNTY SHERIFF'S OFFICE,WALGREEN'S,91 S. TUNNEL RD,ASHEVILLE,NC,28805,"http://maps.google.com/maps?q=91 S. TUNNEL RD,+ASHEVILLE,+NC+28805&hl=en"
CAMDEN POLICE DEPARTMENT,CAMDEN POLICE DEPARTMENT,816 W. DEKALB ST.,CAMDEN,SC,29020,"http://maps.google.com/maps?q=816 W. DEKALB ST.,+CAMDEN,+SC+29020&hl=en"
CANDLER COUNTY SHERIFF'S OFFICE,IHS PHARMACY,150 SOUTH LEROY STREET,METTER,GA,30439,"http://maps.google.com/maps?q=150 SOUTH LEROY STREET,+METTER,+GA+30439&hl=en"
CANNON PHARMACY,CANNON PHARMACY,1706 S CANNON BLVD,KANNAPOLIS,NC,28083,"http://maps.google.com/maps?q=1706 S CANNON BLVD,+KANNAPOLIS,+NC+28083&hl=en"
CANNON PHARMACY,CANNON PHARMACY,1706 S. CANNON BLVD,KANNAPOLIS,NC,28083,"http://maps.google.com/maps?q=1706 S. CANNON BLVD,+KANNAPOLIS,+NC+28083&hl=en"
CANNON PHARMACY,CANNON PHARMACY,760 CABARRUS AVE,CONCORD,NC,28027,"http://maps.google.com/maps?q=760 CABARRUS AVE,+CONCORD,+NC+28027&hl=en"
CANNON PHARMACY,CANNON PHARMACY,760 CABARRUS AVE W,CONCORD,NC,28025,"http://maps.google.com/maps?q=760 CABARRUS AVE W,+CONCORD,+NC+28025&hl=en"
CARTER COUNTY SO,CARTER COUNTY SHERIFF'S OFFICE- LOBBY DRUG DROP BOX IN DETENTION CENTER LOBBY,900 3RD STREET,ELIZABETHTON,TN,37643,"http://maps.google.com/maps?q=900 3RD STREET,+ELIZABETHTON,+TN+37643&hl=en"
CARTER COUNTY SO,ELIZABETHTON POLICE DEPT,525 E F STREET,ELIZABETHTON,TN,37643,"http://maps.google.com/maps?q=525 E F STREET,+ELIZABETHTON,+TN+37643&hl=en"
CAYCE DEPARTMENT OF PUBLIC SAFETY,CVS,2410 CHARLESTON HWY,CAYCE,SC,29033,"http://maps.google.com/maps?q=2410 CHARLESTON HWY,+CAYCE,+SC+29033&hl=en"
CAYCE DEPARTMENT OF PUBLIC SAFETY,CVS,500 KNOX ABBOTT DR,CAYCE,SC,29033,"http://maps.google.com/maps?q=500 KNOX ABBOTT DR,+CAYCE,+SC+29033&hl=en"
CHARLESTON CO SHERIFF'S OFFICE,LAW ENFORCEMENT CENTER,3691 LEEDS AVENUE,NORTH CHARLESTON,SC,29405,"http://maps.google.com/maps?q=3691 LEEDS AVENUE,+NORTH CHARLESTON,+SC+29405&hl=en"
CHARLESTON CO SHERIFF'S OFFICE,VINCENT DRUG STORE,110 PLANTED ROW LANE,JOHNS ISLAND,SC,29455,"http://maps.google.com/maps?q=110 PLANTED ROW LANE,+JOHNS ISLAND,+SC+29455&hl=en"
CHARLESTON POLICE DEPARTMENT,CHARLESTON POLICE DEPARTMENT LOBBY,180 LOCKWOOD BLVD.,CHARLESTON,SC,29403,"http://maps.google.com/maps?q=180 LOCKWOOD BLVD.,+CHARLESTON,+SC+29403&hl=en"
CHARLESTON POLICE DEPARTMENT,CITADEL MALL OUTSIDE PLANET FITNESS,2070 SAM RITTENBERG BLVD.,CHARLESTON,SC,29407,"http://maps.google.com/maps?q=2070 SAM RITTENBERG BLVD.,+CHARLESTON,+SC+29407&hl=en"
CHATHAM SAVANNAH NARCOTICS TEAM,CHATHAM COUNTY POLICE DEPARTMENT,295 POLICE MEMORIAL DRIVE,SAVANNAH,GA,31405,"http://maps.google.com/maps?q=295 POLICE MEMORIAL DRIVE,+SAVANNAH,+GA+31405&hl=en"
CHEROKEE COUNTY SHERIFF'S OFFICE,CHEROKEE CO. SHERIFF'S OFFICE LAW ENFORCEMENT CENTER,312 EAST FREDERICK ST.,GAFFNEY,SC,29340,"http://maps.google.com/maps?q=312 EAST FREDERICK ST.,+GAFFNEY,+SC+29340&hl=en"
CHESTER POLICE DEPARTMENT,BLACK'S DRUG STORE,121 CHURCH ST,CHESTER,SC,29706,"http://maps.google.com/maps?q=121 CHURCH ST,+CHESTER,+SC+29706&hl=en"
CHESTER POLICE DEPARTMENT,WAL-MART,1691 JA COCHRAN BYPASS,CHESTER,SC,29706,"http://maps.google.com/maps?q=1691 JA COCHRAN BYPASS,+CHESTER,+SC+29706&hl=en"
CITY OF COLUMBIA POLICE DEPARTMENT,CITY OF COLUMBIA POLICE DEPARTMENT,1 JUSTICE SQUARE,COLUMBIA,SC,29201,"http://maps.google.com/maps?q=1 JUSTICE SQUARE,+COLUMBIA,+SC+29201&hl=en"
COCKE COUNTY SHERIFF'S OFFICE,WALGREENS,102 E BROADWAY,NEWPORT,TN,37821,"http://maps.google.com/maps?q=102 E BROADWAY,+NEWPORT,+TN+37821&hl=en"
COLUMBIA COUNTY SHERIFF'S OFFICE,EVANS SUB STATION,650-A RONALD REAGAN DRIVE,EVANS,GA,30809,"http://maps.google.com/maps?q=650-A RONALD REAGAN DRIVE,+EVANS,+GA+30809&hl=en"
COLUMBIA COUNTY SHERIFF'S OFFICE,KROGER MARKET PLACE,435 LEWISTON ROAD,GROVETOWN,GA,30813,"http://maps.google.com/maps?q=435 LEWISTON ROAD,+GROVETOWN,+GA+30813&hl=en"
CONWAY POLICE DEPARTMENT,WALGREENS,1601 CHURCH ST,CONWAY,SC,29526,"http://maps.google.com/maps?q=1601 CHURCH ST,+CONWAY,+SC+29526&hl=en"
DANDRIDGE POLICE DEPARTMENT,FOOD CITY,123 WEST HWY 25/70,DANDRIDGE,TN,37725,"http://maps.google.com/maps?q=123 WEST HWY 25/70,+DANDRIDGE,+TN+37725&hl=en"
ELGIN POLICE DEPARTMENT,ELGIN TOWN HALL,2469 MAIN STREET,ELGIN,SC,29045,"http://maps.google.com/maps?q=2469 MAIN STREET,+ELGIN,+SC+29045&hl=en"
ELIZABETHTON TN POLICE DEPARTMENT,ELIZABETHTON POLICE DEPARTMENT,525 EAST F STREET,ELIZABETHTON,TN,37643,"http://maps.google.com/maps?q=525 EAST F STREET,+ELIZABETHTON,+TN+37643&hl=en"
ELKIN POLICE DEPARTMENT,WALGREENS COLLECTION WILL BE SET UP IN THE PARKING LOT,1209 N. BRIDGE ST.,ELKIN,NC,28621,"http://maps.google.com/maps?q=1209 N. BRIDGE ST.,+ELKIN,+NC+28621&hl=en"
FLETCHER POLICE DEPARTMENT,INGLES MARKET (FLETCHER),2901 HENDERSONVILLE ROAD,FLETCHER,NC,28732,"http://maps.google.com/maps?q=2901 HENDERSONVILLE ROAD,+FLETCHER,+NC+28732&hl=en"
FLORENCE POLICE DEPARTMENT,FIRST BAPTIST CHURCH,300 S. IRBY STREET,FLORENCE,SC,29501,"http://maps.google.com/maps?q=300 S. IRBY STREET,+FLORENCE,+SC+29501&hl=en"
FLORENCE POLICE DEPARTMENT,WEST FLORENCE HIGH SCHOOL,221 N. BELTLINE DR.,FLORENCE,SC,29505,"http://maps.google.com/maps?q=221 N. BELTLINE DR.,+FLORENCE,+SC+29505&hl=en"
FOREST ACRES POLICE DEPARTMENT,FOREST ACRES POLICE DEPARTMENT,5205 N. TRENHOLM ROAD,COLUMBIA,SC,29206,"http://maps.google.com/maps?q=5205 N. TRENHOLM ROAD,+COLUMBIA,+SC+29206&hl=en"
FORT JACKSON POLICE DEPARTMENT,FORT JACKSON MAIN POST EXCHANGE,4110 MOSEBY STREET,COLUMBIA,SC,29207,"http://maps.google.com/maps?q=4110 MOSEBY STREET,+COLUMBIA,+SC+29207&hl=en"
FOUNTAIN INN POLICE DEPT.,FOUNTAIN INN POLICE DEPT.,300 N. MAIN STREET,FOUNTAIN INN,SC,29644,"http://maps.google.com/maps?q=300 N. MAIN STREET,+FOUNTAIN INN,+SC+29644&hl=en"
FRANKLIN COUNTY SHERIFF'S OFFICE,FRANKLIN COUNTY SHERIFF,1 JAMES LITTLE STREET,CARNESVILLE,GA,30521,"http://maps.google.com/maps?q=1 JAMES LITTLE STREET,+CARNESVILLE,+GA+30521&hl=en"
FRANKLIN COUNTY SHERIFF'S OFFICE,FRANKLIN COUNTY SHERIFF CID,159 A. T. MAULDIN DRIVE,CARNESVILLE,GA,30521,"http://maps.google.com/maps?q=159 A. T. MAULDIN DRIVE,+CARNESVILLE,+GA+30521&hl=en"
GLYNN/BRUNSWICK NARCOTICS ENFORCEMENT UNIT,BRUNSWICK POLICE DEPARTMENT,206 MANSFIELD STREET,BRUNSWICK,GA,31520,"http://maps.google.com/maps?q=206 MANSFIELD STREET,+BRUNSWICK,+GA+31520&hl=en"
GLYNN/BRUNSWICK NARCOTICS ENFORCEMENT UNIT,GLYNN COUNTY POLICE DEPARTMENT,157 PUBLIC SAFETY BLVD.,BRUNSWICK,GA,31525,"http://maps.google.com/maps?q=157 PUBLIC SAFETY BLVD.,+BRUNSWICK,+GA+31525&hl=en"
GRAINGER COUNTY SHERIFF'S DEPARTMENT,SMITH DRUG STORE,8120 RUTLEDGE PIKE,RUTLEDGE,TN,37861,"http://maps.google.com/maps?q=8120 RUTLEDGE PIKE,+RUTLEDGE,+TN+37861&hl=en"
GREENE COUNTY SHERIFF'S DEPT.,SOUTH GREENE HIGH SCHOOL PARKING LOT,7469 ASHEVILLE HWY.,GREENEVILLE,TN,37743,"http://maps.google.com/maps?q=7469 ASHEVILLE HWY.,+GREENEVILLE,+TN+37743&hl=en"
GREENE COUNTY SHERIFF'S DEPT.,WEST GREENE HIGH SCHOOL PARKING LOT,275 W. GREENE DR.,MOSHEIM,TN,37818,"http://maps.google.com/maps?q=275 W. GREENE DR.,+MOSHEIM,+TN+37818&hl=en"
GREENE COUNTY SHERIFF'S OFFICE,PUBLIX,6350 LAKE OCONEE PARKWAY,GREENSBORO,GA,30642,"http://maps.google.com/maps?q=6350 LAKE OCONEE PARKWAY,+GREENSBORO,+GA+30642&hl=en"
GREENVILLE CITY POLICE,GREENVILLE CITY COURT HOUSE PARKING LOT,426 N. MAIN ST.,GREENVILLE,SC,29601,"http://maps.google.com/maps?q=426 N. MAIN ST.,+GREENVILLE,+SC+29601&hl=en"
GREENVILLE HEALTH SYSTEM PD,GREENVILLE MEMORIAL HOSPITAL,701 GROVE RD,GREENVILLE,SC,29605,"http://maps.google.com/maps?q=701 GROVE RD,+GREENVILLE,+SC+29605&hl=en"
GREENVILLE HEALTH SYSTEM PD,GREER MEMORIAL HOSPITAL,830 S. BUNCOMBE RD.,GREER,SC,29650,"http://maps.google.com/maps?q=830 S. BUNCOMBE RD.,+GREER,+SC+29650&hl=en"
GREENVILLE HEALTH SYSTEM PD,HILLCREST MEMORIAL HOSPITAL,729 SE MAIN STREET,SIMPSONVILLE,SC,29681,"http://maps.google.com/maps?q=729 SE MAIN STREET,+SIMPSONVILLE,+SC+29681&hl=en"
GREENVILLE HEALTH SYSTEM PD,OCONEE MEMORIAL HOSPITAL,298 MEMORIAL DR,SENECA,SC,29672,"http://maps.google.com/maps?q=298 MEMORIAL DR,+SENECA,+SC+29672&hl=en"
GREENVILLE POLICE DEPARTMENT,GREENEVILLE POLICE DEPARTMENT,200 N. COLLEGE STREET,GREENEVILLE,TN,37745,"http://maps.google.com/maps?q=200 N. COLLEGE STREET,+GREENEVILLE,+TN+37745&hl=en"
GREER POLICE DEPARTMENT,GREER CPW,301 MCCALL ST.,GREER,SC,29651,"http://maps.google.com/maps?q=301 MCCALL ST.,+GREER,+SC+29651&hl=en"
GROVETOWN POLICE DEPARTMENT,CVS,869 HORIZON SOUTH PARKWAY,GROVETOWN,GA,30813,"http://maps.google.com/maps?q=869 HORIZON SOUTH PARKWAY,+GROVETOWN,+GA+30813&hl=en"
HALL COUNTY SHERIFF'S OFFICE,KROGER,4025 WINDER HWY,FLOWERY BRANCH,GA,30542,"http://maps.google.com/maps?q=4025 WINDER HWY,+FLOWERY BRANCH,+GA+30542&hl=en"
HAMPTON COUNTY SHERIFF'S OFFICE,HAMPTON COUNTY SHERIFF'S OFFICE,411 CEMETERY RD,VARNVILLE,SC,29944,"http://maps.google.com/maps?q=411 CEMETERY RD,+VARNVILLE,+SC+29944&hl=en"
HENDERSON COUNTY NC SHERIFF'S OFFICE,HENDERSON COUNTY NC SHERIFF'S OFFICE,100 N. GROVE ST.,HENDERSONVILLE,NC,28792,"http://maps.google.com/maps?q=100 N. GROVE ST.,+HENDERSONVILLE,+NC+28792&hl=en"
IRMO POLICE DEPARTMENT,IRMO POLICE DEPARTMENT,1230 COLUMBIA AVE.,IRMO,SC,29063,"http://maps.google.com/maps?q=1230 COLUMBIA AVE.,+IRMO,+SC+29063&hl=en"
JACKSON COUNTY SHERIFF'S OFFICE,JACKSON COUNTY SHERIFF'S OFFICE,555 STAN EVANS DRIVE,JEFFERSON,GA,30549,"http://maps.google.com/maps?q=555 STAN EVANS DRIVE,+JEFFERSON,+GA+30549&hl=en"
JOHNSON CITY POLICE DEPARTMENT,JOHNSON CITY POLICE DEPT. PARKING LOT,601 E. MAIN ST.,JOHNSON CITY,TN,37601,"http://maps.google.com/maps?q=601 E. MAIN ST.,+JOHNSON CITY,+TN+37601&hl=en"
JOHNSON COUNTY SHERIFF'S OFFICE,JOHNSON COUNTY SHERIFF'S DEPT,216 HONEYSUCKLE ST,MOUNTAIN CITY,TN,37683,"http://maps.google.com/maps?q=216 HONEYSUCKLE ST,+MOUNTAIN CITY,+TN+37683&hl=en"
JONES COUNTY SHERIFF'S OFFICE,JONES COUNTY SHERIFF'S OFFICE,123 HOLMES HAWKINS DRIVE,GRAY,GA,31032,"http://maps.google.com/maps?q=123 HOLMES HAWKINS DRIVE,+GRAY,+GA+31032&hl=en"
JONESBOROUGH DEPT. OF PUBLIC SAFETY,JONESBOROUGH FIRE DEPT.,123 BOONE STREET,JONESBOROUGH,TN,37659,"http://maps.google.com/maps?q=123 BOONE STREET,+JONESBOROUGH,+TN+37659&hl=en"
KERSHAW COUNTY SHERIFF'S OFFICE,KERSHAW CO. SHERIFF'S OFFICE,821 RIDGEWAY RD.,LUGOFF,SC,29078,"http://maps.google.com/maps?q=821 RIDGEWAY RD.,+LUGOFF,+SC+29078&hl=en"
KINGSPORT POLICE DEPARTMENT,DOBBINS-BENNETT HIGH SCHOOL,1 TRIBE WAY,KINGSPORT,TN,37660,"http://maps.google.com/maps?q=1 TRIBE WAY,+KINGSPORT,+TN+37660&hl=en"
KNOXVILLE POLICE DEPARTMENT,FOOD CITY,4805 N BROADWAY,KNOXVILLE,TN,37918,"http://maps.google.com/maps?q=4805 N BROADWAY,+KNOXVILLE,+TN+37918&hl=en"
LENOIR POLICE DEPT.,FOOTHILLS PHARMACY,202 A HARPER AVE,LENOIR,NC,28645,"http://maps.google.com/maps?q=202 A HARPER AVE,+LENOIR,+NC+28645&hl=en"
LEXINGTON CO. SHERIFF'S DEPARTMENT,LEXINGTON COUNTY SHERIFF'S DEPT. HEADQUARTERS,521 GIBSON ROAD,LEXINGTON,SC,29072,"http://maps.google.com/maps?q=521 GIBSON ROAD,+LEXINGTON,+SC+29072&hl=en"
LOGANVILLE POLICE DEPARTMENT,KROGER,4753 ATLANTA HIGHWAY,LOGANVILLE,GA,30052,"http://maps.google.com/maps?q=4753 ATLANTA HIGHWAY,+LOGANVILLE,+GA+30052&hl=en"
MARS HILL POLICE DEPARTMENT,CVS,191 CARL ELLER ROAD,MARS HILL,NC,28754,"http://maps.google.com/maps?q=191 CARL ELLER ROAD,+MARS HILL,+NC+28754&hl=en"
MC CORMICK POLICE DEPARTMENT,FOOD LION PARKING LOT,SOUTH MINE ST.,MC CORMICK,SC,29835,"http://maps.google.com/maps?q=SOUTH MINE ST.,+MC CORMICK,+SC+29835&hl=en"
MONROE POLICE DEPARTMENT,MONROE POLICE DEPARTMENT,116 SOUTH BROAD STREET,MONROE,GA,30655,"http://maps.google.com/maps?q=116 SOUTH BROAD STREET,+MONROE,+GA+30655&hl=en"
MORGAN COUNTY SHERIFF¿S OFFICE,MORGAN COUNTY SHERIFF¿S OFFICE,1380 MONTICELLO RD,MADISON,GA,30650,"http://maps.google.com/maps?q=1380 MONTICELLO RD,+MADISON,+GA+30650&hl=en"
MOUNT PLEASANT POLICE DEPT.,SOMERBY RETIREMENT HOME,3100 TRADITION CIR,MOUNT PLEASANT,SC,29464,"http://maps.google.com/maps?q=3100 TRADITION CIR,+MOUNT PLEASANT,+SC+29464&hl=en"
MOUNT PLEASANT POLICE DEPT.,TIDEWATER PHARMACY,421 JOHNNIE DODDS BLVD,MOUNT PLEASANT,SC,29464,"http://maps.google.com/maps?q=421 JOHNNIE DODDS BLVD,+MOUNT PLEASANT,+SC+29464&hl=en"
MOUNT PLEASANT POLICE DEPT.,WALMART,1481 N. HIGHWAY 17,MOUNT PLEASANT,SC,29464,"http://maps.google.com/maps?q=1481 N. HIGHWAY 17,+MOUNT PLEASANT,+SC+29464&hl=en"
MUSC PUBLIC SAFETY,MUSC BIO-ENGINEERING BUILDING ACROSS FROM 99 JONATHAN LUCAS ST,99 JONATHAN LUCAS ST,CHARLESTON,SC,29425,"http://maps.google.com/maps?q=99 JONATHAN LUCAS ST,+CHARLESTON,+SC+29425&hl=en"
MYRTLE BEACH PD,CVS,1308 38TH AVE NORTH,MYRTLE BEACH,SC,29577,"http://maps.google.com/maps?q=1308 38TH AVE NORTH,+MYRTLE BEACH,+SC+29577&hl=en"
NEW HANOVER COUNTY SENIOR RESOURCE CENTER,SENIOR RESOURCE CENTER NEW HANOVER COUNTY,2222 S. COLLEGE RD.,WILMINGTON,NC,28403,"http://maps.google.com/maps?q=2222 S. COLLEGE RD.,+WILMINGTON,+NC+28403&hl=en"
NEW HANOVER REGIONAL MEDICAL CENTER,NEW HANOVER MEDICAL GROUP - MYRTLE GROVE,5145 SOUTH COLLEGE ROAD,WILMINGTON,NC,28412,"http://maps.google.com/maps?q=5145 SOUTH COLLEGE ROAD,+WILMINGTON,+NC+28412&hl=en"
NEW HANOVER REGIONAL MEDICAL CENTER,NHRMC ATLANTIC SURGICENTER,9104 MARKET STREET,WILMINGTON,NC,28411,"http://maps.google.com/maps?q=9104 MARKET STREET,+WILMINGTON,+NC+28411&hl=en"
NEW HANOVER REGIONAL MEDICAL CENTER,NHRMC BRUNSWICK FOREST,1333 SOUTH DICKINSON DRIVE,LELAND,NC,28451,"http://maps.google.com/maps?q=1333 SOUTH DICKINSON DRIVE,+LELAND,+NC+28451&hl=en"
NEW HANOVER REGIONAL MEDICAL CENTER,NHRMC EXPRESS CARE - AUTUM HALL,510 CAROLINA BAY DRIVE,WILMINGTON,NC,28403,"http://maps.google.com/maps?q=510 CAROLINA BAY DRIVE,+WILMINGTON,+NC+28403&hl=en"
NEW HANOVER REGIONAL MEDICAL CENTER,NHRMC MEDICAL MALL,2243 SOUTH 17TH STREET,WILMINGTON,NC,28401,"http://maps.google.com/maps?q=2243 SOUTH 17TH STREET,+WILMINGTON,+NC+28401&hl=en"
NEW HANOVER REGIONAL MEDICAL CENTER,PENDER MEMORIAL HOSPITAL,507 EAST FREMONT STREET,BURGAW,NC,28425,"http://maps.google.com/maps?q=507 EAST FREMONT STREET,+BURGAW,+NC+28425&hl=en"
NEWBERRY COUNTY SHERIFF'S OFFICE,NEWBERRY COUNTY SHERIFF'S OFFICE,550 WILSON RD.,NEWBERRY,SC,29108,"http://maps.google.com/maps?q=550 WILSON RD.,+NEWBERRY,+SC+29108&hl=en"
NEWPORT POLICE DEPT.,WALGREENS PHARMACY,102 EAST BROADWAY,NEWPORT,TN,37821,"http://maps.google.com/maps?q=102  EAST BROADWAY,+NEWPORT,+TN+37821&hl=en"
NORTH AUGUSTA PUBLIC SAFETY,PARK'S PHARMACY,437 GEORGIA AVE,NORTH AUGUSTA,SC,29841,"http://maps.google.com/maps?q=437 GEORGIA AVE,+NORTH AUGUSTA,+SC+29841&hl=en"
NORTH CHARLESTON POLICE DEPARTMENT,NORTH CHARLESTON CITY HALL,2555 CITY HALL BLVD,CHARLESTON,SC,29406,"http://maps.google.com/maps?q=2555 CITY HALL BLVD,+CHARLESTON,+SC+29406&hl=en"
NORTH WILKESBORO POLICE DEPARTMENT,WALGREENS PHARMACY,1395 WEST D STREET,NORTH WILKESBORO,NC,28659,"http://maps.google.com/maps?q=1395 WEST D STREET,+NORTH WILKESBORO,+NC+28659&hl=en"
OCONEE COUNTY SHERIFF'S OFFICE,OCONEE COUNTY SHERIFF'S OFFICE,300 S. CHURCH ST.,WALHALLA,SC,29691,"http://maps.google.com/maps?q=300 S. CHURCH ST.,+WALHALLA,+SC+29691&hl=en"
OCONEE COUNTY SHERIFF'S OFFICE,OCONEE COUNTY SHERIFF'S OFFICE SUBSTATION,302 MEMORIAL DRIVE,SENECA,SC,29678,"http://maps.google.com/maps?q=302 MEMORIAL DRIVE,+SENECA,+SC+29678&hl=en"
ORANGEBURG COUNTY SHERIFF'S OFFICE,EUTAWVILLE IGA,225 BRANCHDALE HWY,EUTAWVILLE,SC,29048,"http://maps.google.com/maps?q=225 BRANCHDALE HWY,+EUTAWVILLE,+SC+29048&hl=en"
ORANGEBURG COUNTY SHERIFF'S OFFICE,PIGGLY WIGGLY,2526 OLD EDISTO DR.US 301 SOUTH,ORANGEBURG,SC,29115,"http://maps.google.com/maps?q=2526 OLD EDISTO DR.,+ORANGEBURG,+SC+29115&hl=en"
PALMETTO HEALTH RICHLAND,PALMETTO HEALTH RICHLAND FACING HARDEN STREET,5 RICHLAND MEDICAL PARK DRSUITE 470,COLUMBIA,SC,29203,"http://maps.google.com/maps?q=5 RICHLAND MEDICAL PARK DR,+COLUMBIA,+SC+29203&hl=en"
PEMBROKE POLICE DEPARTMENT,PEMBROKE POLICE DEPARTMENT,154 W. RAILROAD ST.,PEMBROKE,GA,31321,"http://maps.google.com/maps?q=154 W. RAILROAD ST.,+PEMBROKE,+GA+31321&hl=en"
PICKENS COUNTY SHERIFF'S OFFICE,ANMED HEALTH COMMUNITY HOSPITAL,123 W G ACKER DR,PICKENS,SC,29671,"http://maps.google.com/maps?q=123 W G ACKER DR,+PICKENS,+SC+29671&hl=en"
PICKENS COUNTY SHERIFF'S OFFICE,BAPTIST EASLEY HOSPITAL,200 FLEET DR,EASLEY,SC,29640,"http://maps.google.com/maps?q=200 FLEET DR,+EASLEY,+SC+29640&hl=en"
PICKENS COUNTY SHERIFF'S OFFICE,CLEMSON FREE CLINIC,1200 CLEMSON,CLEMSON,SC,29631,"http://maps.google.com/maps?q=1200 CLEMSON,+CLEMSON,+SC+29631&hl=en"
PIGEON FORGE POLICE DEPARTMENT,WALGREENS,3071 PARKWAY,PIGEON FORGE,TN,37863,"http://maps.google.com/maps?q=3071 PARKWAY,+PIGEON FORGE,+TN+37863&hl=en"
RICHLAND CO. SHERIFF'S DEPARTMENT,RICHLAND CO. SHERIFF'S DEPARTMENT,5623 TWO NOTCH RD,COLUMBIA,SC,29223,"http://maps.google.com/maps?q=5623 TWO NOTCH RD,+COLUMBIA,+SC+29223&hl=en"
RICHMOND COUNTY SHERIFF'S OFFICE,CVS,1520 WALTON WAY,AUGUSTA,GA,30904,"http://maps.google.com/maps?q=1520 WALTON WAY,+AUGUSTA,+GA+30904&hl=en"
RICHMOND COUNTY SHERIFF'S OFFICE,CVS,2902 PEACH ORCHARD,AUGUSTA,GA,30906,"http://maps.google.com/maps?q=2902 PEACH ORCHARD,+AUGUSTA,+GA+30906&hl=en"
RICHMOND HILL POLICE DEPARTMENT,RICHMOND HILL POLICE DEPARTMENT,120 RICHARD DAVIS DRIVE,RICHMOND HILL,GA,31324,"http://maps.google.com/maps?q=120 RICHARD DAVIS DRIVE,+RICHMOND HILL,+GA+31324&hl=en"
ROYSTON POLICE DEPARTMENT,ROYSTON POLICE DEPARTMENT,830 CHURCH STREET,ROYSTON,GA,30662,"http://maps.google.com/maps?q=830 CHURCH STREET,+ROYSTON,+GA+30662&hl=en"
RUTLEDGE POLICE DEPT.,RUTLEDGE CITY HALL,8028 RUTLEDGE PIKE,RUTLEDGE,TN,37861,"http://maps.google.com/maps?q=8028 RUTLEDGE PIKE,+RUTLEDGE,+TN+37861&hl=en"
SAFE KIDS CHARLOTTE MECKLENBURG,BIRKDALE VILLAGE- HARRIS TEETER,9759 SAM FURR RD,HUNTERSVILLE,NC,28078,"http://maps.google.com/maps?q=9759 SAM FURR RD,+HUNTERSVILLE,+NC+28078&hl=en"
SAFE KIDS CHARLOTTE MECKLENBURG,DAVIS LAKE SHOPS- HARRIS TEETER,8445 DAVIS LAKE PKWY,CHARLOTTE,NC,28269,"http://maps.google.com/maps?q=8445 DAVIS LAKE PKWY,+CHARLOTTE,+NC+28269&hl=en"
SAFE KIDS CHARLOTTE MECKLENBURG,HARRIS TEETER - STONECREST,7852 REA RD,CHARLOTTE,NC,28277,"http://maps.google.com/maps?q=7852 REA RD,+CHARLOTTE,+NC+28277&hl=en"
SAFE KIDS CHARLOTTE MECKLENBURG,HARRIS TEETER- MORROCROFT,6701 MORRISON BLVD,CHARLOTTE,NC,28210,"http://maps.google.com/maps?q=6701 MORRISON BLVD,+CHARLOTTE,+NC+28210&hl=en"
SAFE KIDS CHARLOTTE MECKLENBURG,HARRIS TEETER- STEELECROFT,13000 S TRYON,CHARLOTTE,NC,28278,"http://maps.google.com/maps?q=13000 S TRYON,+CHARLOTTE,+NC+28278&hl=en"
SAFE KIDS CHARLOTTE MECKLENBURG,NORTHCROSS SHOPPING CENTER- HARRIS TEETER,7036 BRIGHTON PARK DR,CHARLOTTE,NC,28226,"http://maps.google.com/maps?q=7036 BRIGHTON PARK DR,+CHARLOTTE,+NC+28226&hl=en"
SAFE KIDS CHARLOTTE MECKLENBURG,WAL MART- PINEVILLE,8322 PINEVILLE MATTHEWS RD,CHARLOTTE,NC,28226,"http://maps.google.com/maps?q=8322 PINEVILLE MATTHEWS RD,+CHARLOTTE,+NC+28226&hl=en"
SANTEE COOPER/SC PUBLIC SVC AUTHORITY,SANTEE COOPER,1 RIVERWOOD DRIVE,MONCKS CORNER,SC,29461,"http://maps.google.com/maps?q=1 RIVERWOOD DRIVE,+MONCKS CORNER,+SC+29461&hl=en"
SEVIER COUNTY SHERIFF'S OFFICE,SCSO SPECIAL OPERATIONS CENTER,735 MIDDLE CREEK ROAD,SEVIERVILLE,TN,37862,"http://maps.google.com/maps?q=735 MIDDLE CREEK ROAD,+SEVIERVILLE,+TN+37862&hl=en"
SEVIERVILLE PD,SEVIERVILLE POLICE DEPARTMENT,300 GARY WADE BLVD,SEVIERVILLE,TN,37862,"http://maps.google.com/maps?q=300 GARY WADE BLVD,+SEVIERVILLE,+TN+37862&hl=en"
SOCIAL CIRCLE POLICE DEPARTMENT,SOCIAL CIRCLE POLICE DEPARTMENT,138 E. HIGHTOWER TRAIL,SOCIAL CIRCLE,GA,30025,"http://maps.google.com/maps?q=138 E. HIGHTOWER TRAIL,+SOCIAL CIRCLE,+GA+30025&hl=en"
SPARTANBURG POLICE DEPARTMENT,BI-LO,2199 SOUTHPORT RD.,SPARTANBURG,SC,29306,"http://maps.google.com/maps?q=2199 SOUTHPORT RD.,+SPARTANBURG,+SC+29306&hl=en"
SPARTANBURG POLICE DEPARTMENT,CVS PHARMACY,87 GARNER RD.,SPARTANBURG,SC,29303,"http://maps.google.com/maps?q=87 GARNER RD.,+SPARTANBURG,+SC+29303&hl=en"
SPRINGDALE POLICE DEPT,SPRINGDALE POLICE DEPT,2915 PLATT SPRINGS RD,WEST COLUMBIA,SC,29170,"http://maps.google.com/maps?q=2915 PLATT SPRINGS RD,+WEST COLUMBIA,+SC+29170&hl=en"
ST. MATTHEWS POLICE DEPT,ST. MATTHEWS POLICE DEPT.,304 AGNES ST.,ST MATTHEWS,SC,29135,"http://maps.google.com/maps?q=304 AGNES ST.,+ST MATTHEWS,+SC+29135&hl=en"
SUMTER COUNTY SHERIFF'S OFFICE,SUMTER COUNTY SHERIFF'S OFFICE,1281 N. MAIN STREET,SUMTER,SC,29150,"http://maps.google.com/maps?q=1281 N. MAIN STREET,+SUMTER,+SC+29150&hl=en"
SUMTER POLICE DEPARTMENT,SUMTER POLICE DEPARTMENT,335 NORTH LAFAYETTE DR,SUMTER,SC,29151,"http://maps.google.com/maps?q=335 NORTH LAFAYETTE DR,+SUMTER,+SC+29151&hl=en"
TRANSYLVANIA COUNTY SHERIFF'S OFFICE,CVS,371 ASHEVILLE HWY,BREVARD,NC,28712,"http://maps.google.com/maps?q=371 ASHEVILLE HWY,+BREVARD,+NC+28712&hl=en"
TUSCULUM POLICE DEPARTMENT,DOAK ELEMENTARY SCHOOL,70 WEST STREET,GREENEVILLE,TN,37745,"http://maps.google.com/maps?q=70 WEST STREET,+GREENEVILLE,+TN+37745&hl=en"
TYBEE ISLAND POLICE DEPARTMENT,TYBEE ISLAND YMCA,204 5TH STREET,TYBEE ISLAND,GA,31328,"http://maps.google.com/maps?q=204 5TH STREET,+TYBEE ISLAND,+GA+31328&hl=en"
UNCW POLICE,UNCW POLICE DEPARTMENT,5126 LIONFISH DR,WILMINGTON,NC,28403,"http://maps.google.com/maps?q=5126 LIONFISH DR,+WILMINGTON,+NC+28403&hl=en"
UNION COUNTY SHERIFF'S OFFICE,UNION COUNTY SHERIFFS OFFICE,130 VETERANS STREET,MAYNARDVILLE,TN,37807,"http://maps.google.com/maps?q=130 VETERANS STREET,+MAYNARDVILLE,+TN+37807&hl=en"
