Participant,CollectionSite,Address,City,State,Zip,MapURL
TOWN AND COUNTRY PD,TOWN AND COUNTRY PD,1011 MUNICIPAL CENTER DRIVE,TOWN AND COUNTRY,MO,63131,"http://maps.google.com/maps?q=1011 MUNICIPAL CENTER DRIVE,+TOWN AND COUNTRY,+MO+63131&hl=en"
TRUESDALE POLICE DEPARTMENT,TRUESDALE POLICE DEPARTMENT,109 PINCKNEY STREET,TRUESDALE,MO,63380,"http://maps.google.com/maps?q=109 PINCKNEY STREET,+TRUESDALE,+MO+63380&hl=en"
TULSA PD,PATRICK HENRY ELEMENTARY,3820 E. 41ST ST,TULSA,OK,74135,"http://maps.google.com/maps?q=3820 E. 41ST ST,+TULSA,+OK+74135&hl=en"
TULSA PD,SPIRIT HALLOWEEN OLD GANDER MOUNTAIN,8310 S. OLYMPIA AVE.,TULSA,OK,74129,"http://maps.google.com/maps?q=8310 S. OLYMPIA AVE.,+TULSA,+OK+74129&hl=en"
UNIVERSITY CITY POLICE DEPARTMENT,MILLBROOK PHARMACY,7010 PERSHING AVENUE,UNIVERSITY CITY,MO,63130,"http://maps.google.com/maps?q=7010 PERSHING AVENUE,+UNIVERSITY CITY,+MO+63130&hl=en"
UNIVERSITY OF ARKANSAS POLICE DEPARTMENT,UNIVERSITY OF ARKANSAS POLICE DEPARTMENT,155 SOUTH RAZORBACK ROAD,FAYETTEVILLE,AR,72701,"http://maps.google.com/maps?q=155 SOUTH RAZORBACK ROAD,+FAYETTEVILLE,+AR+72701&hl=en"
VAN BUREN POLICE DEPARTMENT,VAN BUREN POLICE DEPARTMENT PERMANENT DROP BOX,111 S. 11TH ST.,VAN BUREN,AR,72956,"http://maps.google.com/maps?q=111 S. 11TH ST.,+VAN BUREN,+AR+72956&hl=en"
WARRENSBURG MO POLICE DEPARTMENT,BI-LO MARKET,410 E YOUNG ST,WARRENSBURG,MO,64093,"http://maps.google.com/maps?q=410 E YOUNG ST,+WARRENSBURG,+MO+64093&hl=en"
WARSAW POLICE DEPARTMENT,WARSAW POLICE DEPARTMENT,181 W HARRISON STREET,WARSAW,MO,65355,"http://maps.google.com/maps?q=181 W HARRISON STREET,+WARSAW,+MO+65355&hl=en"
WASHINGTON COUNTY SHERIFF'S OFFICE,VA MEDICAL CENTER PERMANENT DROP BOX,1100 NORTH COLLEGE AVE.1100 NORTH COLLEGE AVE.,FAYETTEVILLE,AR,72701,"http://maps.google.com/maps?q=1100 NORTH COLLEGE AVE.,+FAYETTEVILLE,+AR+72701&hl=en"
WASHINGTON COUNTY SHERIFF'S OFFICE,WASHINGTON COUNTY COURTHOUSE PERMANENT DROP BOX (MON-FRI ONLY),280 NORTH COLLEGE AVE.,FAYETTEVILLE,AR,72701,"http://maps.google.com/maps?q=280 NORTH COLLEGE AVE.,+FAYETTEVILLE,+AR+72701&hl=en"
WASHINGTON COUNTY SHERIFF'S OFFICE,WASHINGTON COUNTY SHERIFF'S DEPARTMENT PERMANENT DROP BOX,1155 CLYDESDALE DR.,FAYETTEVILLE,AR,72701,"http://maps.google.com/maps?q=1155 CLYDESDALE DR.,+FAYETTEVILLE,+AR+72701&hl=en"
WATERLOO POLICE DEPARTMENT,SCHNUCKS,150 WATERLOO COMMONS DRIVE,WATERLOO,IL,62298,"http://maps.google.com/maps?q=150 WATERLOO COMMONS DRIVE,+WATERLOO,+IL+62298&hl=en"
WATERLOO POLICE DEPARTMENT,WATERLOO POLICE DEPARMTMENT LOBBY,"301 S, MAIN STREET",WATERLOO,IL,62298,"http://maps.google.com/maps?q=301 S, MAIN STREET,+WATERLOO,+IL+62298&hl=en"
WEBSTER COUNTY SHERIFF'S OFFICE,WEBSTER COUNTY HEALTH UNIT,233 E. WASHINGTON ST,MARSHFIELD,MO,65706,"http://maps.google.com/maps?q=233 E. WASHINGTON ST,+MARSHFIELD,+MO+65706&hl=en"
WEBSTER GROVES POLICE DEPARTMENT,WEBSTER GROVES RECREATION COMPLEX,33 EAST GLENDALE AVENUE,WEBSTER GROVES,MO,63119,"http://maps.google.com/maps?q=33 EAST GLENDALE AVENUE,+WEBSTER GROVES,+MO+63119&hl=en"
WENTZVILLE POLICE DEPARTMENT,WENTZVILLE POLICE DEPARTMENT,1019 SCHROEDER CREEK BLVD,WENTZVILLE,MO,63385,"http://maps.google.com/maps?q=1019 SCHROEDER CREEK BLVD,+WENTZVILLE,+MO+63385&hl=en"
WEST FORK POLICE DEPARTMENT,WEST FORK POLICE DEPARTMENT PERMANENT DROP BOX,262 WEST MAIN STREET,WEST FORK,AR,72774,"http://maps.google.com/maps?q=262 WEST MAIN STREET,+WEST FORK,+AR+72774&hl=en"
WILLARD POLICE DEPT.,FAMILY PHARMACY,520 E JACKSONSUITE 10,WILLARD,MO,65781,"http://maps.google.com/maps?q=520 E JACKSON,+WILLARD,+MO+65781&hl=en"
WRIGHT COUNTY SHERIFF'S OFFICE,ANN SHORT TURNER COMMUNITY CENTER,205 N MISSOURI AVE,MANSFIELD,MO,65704,"http://maps.google.com/maps?q=205 N MISSOURI AVE,+MANSFIELD,+MO+65704&hl=en"
WRIGHT COUNTY SHERIFF'S OFFICE,WRIGHT COUNTY SHERIFF'S OFFICE,PO BOX 250125 COURT SQUARE,HARTVILLE,MO,65667,"http://maps.google.com/maps?q=PO BOX 250,+HARTVILLE,+MO+65667&hl=en"
WYANDOTTE COUNTY SHERIFF,CVS,3750 STATE AVEKANSAS CITY,KANSAS CITY,KS,66102,"http://maps.google.com/maps?q=3750 STATE AVE,+KANSAS CITY,+KS+66102&hl=en"
WYANDOTTE COUNTY SHERIFF,CVS,4300 RAINBOW,KANSAS CITY,KS,66103,"http://maps.google.com/maps?q=4300 RAINBOW,+KANSAS CITY,+KS+66103&hl=en"
WYANDOTTE COUNTY SHERIFF,CVS,4645 SHAWNEE DRIVEKANSAS CITY,KANSAS CITY,KS,66106,"http://maps.google.com/maps?q=4645 SHAWNEE DRIVE,+KANSAS CITY,+KS+66106&hl=en"
WYANDOTTE COUNTY SHERIFF,CVS,950 MINNESOTAKANSAS CITY,KANSAS CITY,KS,66101,"http://maps.google.com/maps?q=950 MINNESOTA,+KANSAS CITY,+KS+66101&hl=en"
WYANDOTTE NATION TRIBAL POLICE,WYANDOTTE NATION TRIBAL POLICE,14 SOUTH MAIN,WYANDOTTE,OK,74370,"http://maps.google.com/maps?q=14 SOUTH MAIN,+WYANDOTTE,+OK+74370&hl=en"
