Participant,CollectionSite,Address,City,State,Zip,MapURL
193 SPECIAL OPERATIONS WING,193 SOW PA AIR NATIONAL GUARD MILITARY ONLY- NOT OPEN TO PUBLIC,81 CONSTELLATION CT,MIDDLETOWN,PA,17057,"http://maps.google.com/maps?q=81 CONSTELLATION CT,+MIDDLETOWN,+PA+17057&hl=en"
AKRON BOROUGH POLICE DEPT,ROYER PHARMACY,113 S 7TH ST,AKRON,PA,17501,"http://maps.google.com/maps?q=113 S 7TH ST,+AKRON,+PA+17501&hl=en"
ALLEGANY COUNTY SHERIFF'S OFFICE,CANASERGA FIRE HALL,10 MAIN STREET,CANASERAGA,NY,14822,"http://maps.google.com/maps?q=10 MAIN STREET,+CANASERAGA,+NY+14822&hl=en"
ALLEGANY COUNTY SHERIFF'S OFFICE,CUBA FIRE HALL,51 EAST MAIN STREET,CUBA,NY,14727,"http://maps.google.com/maps?q=51 EAST MAIN STREET,+CUBA,+NY+14727&hl=en"
ALLEGHENY COUNTY POLICE - DISTRICT II,ALLEGHENY COUNTY POLICE DISTRICT II,1801 BROWNSVILLE RD.,SOUTH PARK,PA,15129,"http://maps.google.com/maps?q=1801 BROWNSVILLE RD.,+SOUTH PARK,+PA+15129&hl=en"
ALLEGHENY COUNTY POLICE DEPARTMENT,NORTH PARK STATION,700 WEST RIDGE DRIVE,ALLISON PARK,PA,15101,"http://maps.google.com/maps?q=700 WEST RIDGE DRIVE,+ALLISON PARK,+PA+15101&hl=en"
ALLEGHENY COUNTY POLICE DEPARTMENT,SOUTH PARK STATION,1801 BROWNSVILLE ROAD,SOUTH PARK,PA,15129,"http://maps.google.com/maps?q=1801 BROWNSVILLE ROAD,+SOUTH PARK,+PA+15129&hl=en"
ALLEGHENY COUNTY POLICE DEPARTMENT,WILMERDING STATION,315 STATION ST,WILMERDING,PA,15148,"http://maps.google.com/maps?q=315 STATION ST,+WILMERDING,+PA+15148&hl=en"
ALLEGHENY COUNTY POLICE DISTRICT III,ALLEGHENY COUNTY PD,700 WEST RIDGE RD,ALLISON PARK,PA,15101,"http://maps.google.com/maps?q=700 WEST RIDGE RD,+ALLISON PARK,+PA+15101&hl=en"
AMHERST POLICE DEPARTMENT,MILLARD FILLMORE HOSPITAL,1540 MAPLE RD.,AMHERST,NY,14221,"http://maps.google.com/maps?q=1540 MAPLE RD.,+AMHERST,+NY+14221&hl=en"
ANDOVER POLICE DEPARTMENT,ANDOVER POLICE DEPARTMENT,134 MAPLE ST,ANDOVER,OH,44003,"http://maps.google.com/maps?q=134 MAPLE ST,+ANDOVER,+OH+44003&hl=en"
ASHTABULA COUNTY SHERIFF'S OFFICE,ASHTABULA COUNTY SHERIFF'S OFFICE,25 W. JEFFERSON ST.,JEFFERSON,OH,44047,"http://maps.google.com/maps?q=25 W. JEFFERSON ST.,+JEFFERSON,+OH+44047&hl=en"
ASPINWALL POLICE DEPARTMENT,ASPINWALL POLICE STATION,217 COMMERCIAL AVENUE,ASPINWALL,PA,15215,"http://maps.google.com/maps?q=217 COMMERCIAL AVENUE,+ASPINWALL,+PA+15215&hl=en"
AUBURN POLICE DEPARTMENT,KINNEY DRUGS,62 OWASCO ST.,AUBURN,NY,13021,"http://maps.google.com/maps?q=62 OWASCO ST.,+AUBURN,+NY+13021&hl=en"
AUBURN POLICE DEPARTMENT,WEGMANS,1 LOOP ROAD,AUBURN,NY,13021,"http://maps.google.com/maps?q=1 LOOP ROAD,+AUBURN,+NY+13021&hl=en"
BALDWINSVILLE POLICE DEPARTMENT,KINNEY DRUGS,21 E. GENESEE STREET,BALDWINSVILLE,NY,13027,"http://maps.google.com/maps?q=21 E. GENESEE STREET,+BALDWINSVILLE,+NY+13027&hl=en"
BALTIMORE COUNTY POLICE DEPARTMENT,PRECINCT 3 FRANKLIN,606 NICODEMUS RD.,REISTERSTOWN,MD,21136,"http://maps.google.com/maps?q=606 NICODEMUS RD.,+REISTERSTOWN,+MD+21136&hl=en"
BATAVIA POLICE DEPARTMENT,BATAVIA POLICE DEPARTMENT,10 W. MAIN STREET,BATAVIA,NY,14020,"http://maps.google.com/maps?q=10 W. MAIN STREET,+BATAVIA,+NY+14020&hl=en"
BAZETTA TOWNSHIP POLICE DEPARTMENT,BAZETTA TOWNSHIP POLICE DEPARTMENT,2671 MCCLEARY JACOBY RD.,CORTLAND,OH,44410,"http://maps.google.com/maps?q=2671 MCCLEARY JACOBY RD.,+CORTLAND,+OH+44410&hl=en"
BEAVER POLICE DEPARTMENT,BEAVER POLICE DEPARTMENT FRONT LOBBY,601 W SOUTH RANGE RD,NORTH LIMA,OH,44452,"http://maps.google.com/maps?q=601 W SOUTH RANGE RD,+NORTH LIMA,+OH+44452&hl=en"
BELLEVUE BOROUGH POLICE DEPARTMENT,BELLEVUE BOROUGH POLICE DEPARTMENT,537 BAYNE AVENUE,PITTSBURGH,PA,15202,"http://maps.google.com/maps?q=537 BAYNE AVENUE,+PITTSBURGH,+PA+15202&hl=en"
BERWICK PD,BERWICK PD,1800 N MARKET ST,BERWICK,PA,18603,"http://maps.google.com/maps?q=1800 N MARKET ST,+BERWICK,+PA+18603&hl=en"
BIGLERVILLE BOROUGH POLICE DEPARTMENT,BIGLERVILLE FIRE DEPARTMENT,111 SOUTH MAIN STREET,BIGLERVILLE,PA,17307,"http://maps.google.com/maps?q=111 SOUTH MAIN STREET,+BIGLERVILLE,+PA+17307&hl=en"
BLAIR COUNTY SHERIFF'S OFFICE,BLAIR COUNTY COURTHOUSE,423 ALLEGHENY ST,HOLLIDAYSBURG,PA,16648,"http://maps.google.com/maps?q=423 ALLEGHENY ST,+HOLLIDAYSBURG,+PA+16648&hl=en"
BLOOMSBURG UNIVERSITY PD,BLOOMSBURG UNIVERSITY PD,400 EAST SECOND ST,BLOOMSBURG,PA,17815,"http://maps.google.com/maps?q=400 EAST SECOND ST,+BLOOMSBURG,+PA+17815&hl=en"
BOARDMAN POLICE DEPARTMENT,BOARDMAN POLICE DEPARTMENT,8299 MARKET STREET,BOARDMAN,OH,44512,"http://maps.google.com/maps?q=8299 MARKET STREET,+BOARDMAN,+OH+44512&hl=en"
BROOME COUNTY SHERIFF'S DEPARTMENT,AMERICAN LEGION POST 1700,305 MAPLE STREET,ENDICOTT,NY,13760,"http://maps.google.com/maps?q=305 MAPLE STREET,+ENDICOTT,+NY+13760&hl=en"
BUFFALO POLICE DEPARTMENT,BUFFALO STATE COLLEGE CLEVELAND HALL,1300 ELMWOOD AVE.,BUFFALO,NY,14222,"http://maps.google.com/maps?q=1300 ELMWOOD AVE.,+BUFFALO,+NY+14222&hl=en"
CANONSBURG POLICE DEPARTMENT,SHOP AND SAVE GROCERY STORE,617 WEST PIKE STREET,CANONSBURG,PA,15317,"http://maps.google.com/maps?q=617 WEST PIKE STREET,+CANONSBURG,+PA+15317&hl=en"
CARLOW UNIVERSITY POLICE,CARLOW UNIVERSITY,3333 FIFTH AVE,PITTSBURGH,PA,15213,"http://maps.google.com/maps?q=3333 FIFTH AVE,+PITTSBURGH,+PA+15213&hl=en"
CARNEGIE MELLON UNIVERSITY POLICE DEPT,CMU POLICE STATION (LOBBY),300 S CRAIG ST,PITTSBURGH,PA,15213,"http://maps.google.com/maps?q=300 S CRAIG ST,+PITTSBURGH,+PA+15213&hl=en"
CARROLL COUNTY SHERIFF'S OFFICE,CARROLL COUNTY SHERIFF'S OFFICE,100 NORTH COURT STREET,WESTMINSTER,MD,21157,"http://maps.google.com/maps?q=100 NORTH COURT STREET,+WESTMINSTER,+MD+21157&hl=en"
CARROLL COUNTY SHERIFF'S OFFICE,HAMPSTEAD POLICE DEPARTMENT POC: LT. GAEGLER,1112 MAIN STREET,HAMPSTEAD,MD,21074,"http://maps.google.com/maps?q=1112 MAIN STREET,+HAMPSTEAD,+MD+21074&hl=en"
CARROLL COUNTY SHERIFF'S OFFICE,MOUNT AIRY POLICE DEPARTMENT,"205 CENTER STREET,SUITE 203",MOUNT AIRY,MD,21771,"http://maps.google.com/maps?q=205 CENTER STREET,,+MOUNT AIRY,+MD+21771&hl=en"
CARROLL COUNTY SHERIFF'S OFFICE,SYKESVILLE POLICE DEPARTMENT POC: CHIEF SPAULDING,7547 MAIN STREET,SYKESVILLE,MD,21784,"http://maps.google.com/maps?q=7547 MAIN STREET,+SYKESVILLE,+MD+21784&hl=en"
CARROLL COUNTY SHERIFF'S OFFICE,TOTAL HEALTH EXPO,200 MEMORIAL AVENUE,WESTMINSTER,MD,21157,"http://maps.google.com/maps?q=200 MEMORIAL AVENUE,+WESTMINSTER,+MD+21157&hl=en"
CARROLL COUNTY SHERIFF'S OFFICE,WESTMINSTER POLICE DEPARTMENT POC: CHIEF SPAULDING,36 LOCUST STREET,WESTMINSTER,MD,21157,"http://maps.google.com/maps?q=36 LOCUST STREET,+WESTMINSTER,+MD+21157&hl=en"
CARROLL TOWNSHIP POLICE DEPARTMENT,"MONONGAHELA VALLEY HOSPITAL, INC.",1163 COUNTRY CLUB ROAD,MONONGAHELA,PA,15063,"http://maps.google.com/maps?q=1163 COUNTRY CLUB ROAD,+MONONGAHELA,+PA+15063&hl=en"
CARROLL VALLEY BOROUGH POLICE DEPARTMENT,CARROLL VALLEY BOROUGH OFFICE,5685 FAIRFIELD ROAD,FAIRFIELD,PA,17320,"http://maps.google.com/maps?q=5685 FAIRFIELD ROAD,+FAIRFIELD,+PA+17320&hl=en"
CATTARAUGUS COUNTY SHERIFF'S DEPARTMENT,CATTARAUGUS COUNTY OFFICE BUILDING,1 LEO MOSS DRIVE,OLEAN,NY,14760,"http://maps.google.com/maps?q=1 LEO MOSS DRIVE,+OLEAN,+NY+14760&hl=en"
CATTARAUGUS COUNTY SHERIFF'S DEPARTMENT,CATTARAUGUS INDIAN RESERVATION HEALTH CENTER,36 THOMAS INDIAN SCHOOL DRIVE,IRVING,NY,14081,"http://maps.google.com/maps?q=36 THOMAS INDIAN SCHOOL DRIVE,+IRVING,+NY+14081&hl=en"
CATTARAUGUS COUNTY SHERIFF'S DEPARTMENT,CORNER DRUG STORE,1 WASHINGTON STREET,CATTARAUGUS,NY,14719,"http://maps.google.com/maps?q=1 WASHINGTON STREET,+CATTARAUGUS,+NY+14719&hl=en"
CATTARAUGUS COUNTY SHERIFF'S DEPARTMENT,DELEVAN HEALTH CENTER,38 N. MAIN ST.,DELEVAN,NY,14042,"http://maps.google.com/maps?q=38 N. MAIN ST.,+DELEVAN,+NY+14042&hl=en"
CATTARAUGUS COUNTY SHERIFF'S DEPARTMENT,LIONEL R. JOHN HEALTH CENTER,987 R.C. HOAG DRIVE,SALAMANCA,NY,14779,"http://maps.google.com/maps?q=987 R.C. HOAG DRIVE,+SALAMANCA,+NY+14779&hl=en"
CATTARAUGUS COUNTY SHERIFF'S DEPARTMENT,SALAMANCA CITY MUNICIPAL BUILDING FIRE DEPARTMENT,225 WILDWOOD AVE,SALAMANCA,NY,14779,"http://maps.google.com/maps?q=225 WILDWOOD AVE,+SALAMANCA,+NY+14779&hl=en"
CAYUGA COUNTY SHERIFF'S DEPARTMENT,CAYUGA COUNTY SHERIFF'S HQ DROP BOX,7445 COUNTY HOUSE ROAD,AUBURN,NY,13021,"http://maps.google.com/maps?q=7445 COUNTY HOUSE ROAD,+AUBURN,+NY+13021&hl=en"
CAYUGA COUNTY SHERIFF'S DEPARTMENT,KINNEY DRUGS,130 MAIN STREET,MORAVIA,NY,13118,"http://maps.google.com/maps?q=130 MAIN STREET,+MORAVIA,+NY+13118&hl=en"
CHARTIERS TOWNSHIP POLICE DEPARTMENT,CHARTIERS TOWNSHIP POLICE DEPARTMENT,2 BUCCANEER DRIVE,HOUSTON,PA,15342,"http://maps.google.com/maps?q=2 BUCCANEER DRIVE,+HOUSTON,+PA+15342&hl=en"
CHAUTAUQUA COUNTY SHERIFF'S DEPARTMENT,ALSTAR HQS. NORTH,738 MONROE STREET,DUNKIRK,NY,14048,"http://maps.google.com/maps?q=738 MONROE STREET,+DUNKIRK,+NY+14048&hl=en"
CHAUTAUQUA COUNTY SHERIFF'S DEPARTMENT,CHAUTAUQUE MALL,318 EAST FAIRMOUNT AVE,LAKEWOOD,NY,14750,"http://maps.google.com/maps?q=318 EAST FAIRMOUNT AVE,+LAKEWOOD,+NY+14750&hl=en"
CHAUTAUQUA COUNTY SHERIFF'S DEPARTMENT,SOUTHSIDE PHARMACY,766 FOOTE AVE.,JAMESTOWN,NY,14701,"http://maps.google.com/maps?q=766 FOOTE AVE.,+JAMESTOWN,+NY+14701&hl=en"
CHAUTAUQUA COUNTY SHERIFF'S DEPARTMENT,WESTFIELD FAMILY PHYSICIANS,138 E. MAIN ST.,WESTFIELD,NY,14787,"http://maps.google.com/maps?q=138 E. MAIN ST.,+WESTFIELD,+NY+14787&hl=en"
CHEEKTOWAGA POLICE DEPARTMENT,ST. JOSEPH'S HOSPITAL,2605 HARLEM RD.,CHEEKTOWAGA,NY,14227,"http://maps.google.com/maps?q=2605 HARLEM RD.,+CHEEKTOWAGA,+NY+14227&hl=en"
CHESTER POLICE DEPT,CHESTER POLICE DEPT,600 INDIANA AVE,CHESTER,WV,26034,"http://maps.google.com/maps?q=600 INDIANA AVE,+CHESTER,+WV+26034&hl=en"
CITY OF CLAIRTON POLICE DEPARTMENT,RITE AID DRUG STORE,623 ST. CLAIR AVE.,CLAIRTON,PA,15025,"http://maps.google.com/maps?q=623 ST. CLAIR AVE.,+CLAIRTON,+PA+15025&hl=en"
CITY OF ERIE BUREAU OF POLICE,CITY OF ERIE MUNICIPAL BUILDING,626 STATE STREET,ERIE,PA,16501,"http://maps.google.com/maps?q=626 STATE STREET,+ERIE,+PA+16501&hl=en"
CITY OF WARREN POLICE DEPARTMENT,WARREN POLICE DEPARTMENT,318 W. THIRD AVENUE,WARREN,PA,16365,"http://maps.google.com/maps?q=318 W. THIRD AVENUE,+WARREN,+PA+16365&hl=en"
CITY OF WASHINGTON POLICE DEPT,CITY OF WASHINGTON POLICE DEPT,56 WEST STRAWBERRY AVE,WASHINGTON,PA,15301,"http://maps.google.com/maps?q=56 WEST STRAWBERRY AVE,+WASHINGTON,+PA+15301&hl=en"
CONEWAGO TOWNSHIP POLICE DEPARTMENT,CONEWAGO TOWNSHIP POLICE DEPARTMENT,541 OXFORD AVENUE,HANOVER,PA,17331,"http://maps.google.com/maps?q=541 OXFORD AVENUE,+HANOVER,+PA+17331&hl=en"
CONNEAUT POLICE DEPARTMENT,CITY OF CONNEAUT POLICE DEPT UNIVERSITY HOSPITAL CONNEAUT MEDICAL CENTER,158 W. MAIN ST.,CONNEAUT,OH,44030,"http://maps.google.com/maps?q=158 W. MAIN ST.,+CONNEAUT,+OH+44030&hl=en"
CRANBERRY TWP POLICE DEPT,CRANBERRY TWP POLICE DEPT,2525 ROCHESTER RD,CRANBERRY TOWNSHIP,PA,16066,"http://maps.google.com/maps?q=2525 ROCHESTER RD,+CRANBERRY TOWNSHIP,+PA+16066&hl=en"
CRESCENT TOWNSHIP POLICE,CRESCENT TOWNSHIP POLICE,225 SPRING RUN RD.,CRESCENT,PA,15046,"http://maps.google.com/maps?q=225 SPRING RUN RD.,+CRESCENT,+PA+15046&hl=en"
CUMBERLAND TOWNSHIP POLICE,SAINT FRACIS XAVIER CENTER,465 TABLE ROCK ROAD,GETTYSBURG,PA,17325,"http://maps.google.com/maps?q=465 TABLE ROCK ROAD,+GETTYSBURG,+PA+17325&hl=en"
DANVILLE POLICE DEPARTMENT,DANVILLE POLICE DEPARTMENT,453 MILL STREET,DANVILLE,PA,17821,"http://maps.google.com/maps?q=453 MILL STREET,+DANVILLE,+PA+17821&hl=en"
DEA - HAGERSTOWN RESIDENT OFFICE,HEALTH FAIR FREDERICK FAIRGROUNDS,797 EAST PATRICK STREET,FREDERICK,MD,21701,"http://maps.google.com/maps?q=797 EAST PATRICK STREET,+FREDERICK,+MD+21701&hl=en"
DEPEW POLICE DEPARTMENT,WEGMAN'S,651 DICK ROAD,DEPEW,NY,14043,"http://maps.google.com/maps?q=651 DICK ROAD,+DEPEW,+NY+14043&hl=en"
DERRY TOWNSHIP POLICE DEPARTMENT,PENN STATE HERSHEY MEDICAL CENTER ACADEMIC SUPPORT BUILDING,90 HOPE DR.,HERSHEY,PA,17033,"http://maps.google.com/maps?q=90 HOPE DR.,+HERSHEY,+PA+17033&hl=en"
DORMONT POLICE DEPARTMENT,CVS PHARMACY,3075 WEST LIBERTY AVENUE,PITTSBURGH,PA,15216,"http://maps.google.com/maps?q=3075 WEST LIBERTY AVENUE,+PITTSBURGH,+PA+15216&hl=en"
DUQUESNE UNIVERSITY POLICE DEPT,BAYER SCHOOL,MCNAULTY DR,PITTSBURGH,PA,15282,"http://maps.google.com/maps?q=MCNAULTY DR,+PITTSBURGH,+PA+15282&hl=en"
DURYEA POLICE DEPARTMENT,DURYEA BOROUGH TOWN HALL BUILDING,315 MAIN STREET,DURYEA,PA,18642,"http://maps.google.com/maps?q=315 MAIN STREET,+DURYEA,+PA+18642&hl=en"
EAST LAMPERTER TWP POLICE DEPT,ROYER PHARMACY,335 W MAIN ST,LEOLA,PA,17540,"http://maps.google.com/maps?q=335 W MAIN ST,+LEOLA,+PA+17540&hl=en"
EASTERN ADAMS REGIONAL POLICE DEPARTMENT,EASTERN ADAMS REGIONAL POLICE DEPARTMENT,110 N. BERLIN AVE,NEW OXFORD,PA,17350,"http://maps.google.com/maps?q=110 N. BERLIN AVE,+NEW OXFORD,+PA+17350&hl=en"
ELLWOOD CITY POLICE DEPARTMENT,ELLWOOD CITY MUNICIPAL BUILDING,525 LAWRENCE AVENUE,ELLWOOD CITY,PA,16117,"http://maps.google.com/maps?q=525 LAWRENCE AVENUE,+ELLWOOD CITY,+PA+16117&hl=en"
EPHRATA POLICE DEPT,EPHRATA PD,124 SOUTH STATE ST,EPHRATA,PA,17522,"http://maps.google.com/maps?q=124 SOUTH STATE ST,+EPHRATA,+PA+17522&hl=en"
ERIE COUNTY SHERIFF'S OFFICE,BERTRAND CHAFFEE HOSPITAL,224 E. MAIN STREET,SPRINGVILLE,NY,14141,"http://maps.google.com/maps?q=224 E. MAIN STREET,+SPRINGVILLE,+NY+14141&hl=en"
ERIE COUNTY SHERIFF'S OFFICE,GOWANDA VILLAGE MUNICIPAL BUILDING,27 E. MAIN STREET,GOWANDA,NY,14070,"http://maps.google.com/maps?q=27 E. MAIN STREET,+GOWANDA,+NY+14070&hl=en"
ERIE COUNTY SHERIFF'S OFFICE,GRAND ISLAND TOWN HALL,2255 BASELINE ROAD,GRAND ISLAND,NY,14072,"http://maps.google.com/maps?q=2255 BASELINE ROAD,+GRAND ISLAND,+NY+14072&hl=en"
EVANS POLICE DEPARTMENT,EVANS MUNICIPAL CENTER,8787 ERIE RD. RT. #5,ANGOLA,NY,14006,"http://maps.google.com/maps?q=8787 ERIE RD. RT. #5,+ANGOLA,+NY+14006&hl=en"
FAIRFAX COUNTY POLICE DEPARTMENT,RESTON DISTRICT STATION PARKING LOT -OPERATING 10 AM TO 2 PM-,12000 BOWMAN TOWNE DRIVE,RESTON,VA,20190,"http://maps.google.com/maps?q=12000 BOWMAN TOWNE DRIVE,+RESTON,+VA+20190&hl=en"
FAIRFAX COUNTY POLICE DEPARTMENT,SULLY DISTRICT POLICE STATION FRONT PARKING LOT -OPERATING 10 AM TO 2 PM-,4900 STONECROFT BOULEVARD,CHANTILLY,VA,20151,"http://maps.google.com/maps?q=4900 STONECROFT BOULEVARD,+CHANTILLY,+VA+20151&hl=en"
FINDLAY TOWNSHIP POLICE DEPARTMENT,FINDLAY TOWNSHIP POLICE DEPARTMENT,1271 ROUTE 30,CLINTON,PA,15026,"http://maps.google.com/maps?q=1271 ROUTE 30,+CLINTON,+PA+15026&hl=en"
FORT DETRICK EMERGENCY SERVICES,COMMISSARY BUILDING 1510 POC DET. LESTER MUMMERT,BUILDING # 1510,FORT DETRICK,MD,21702,"http://maps.google.com/maps?q=BUILDING # 1510,+FORT DETRICK,+MD+21702&hl=en"
FORT DETRICK EMERGENCY SERVICES,DIRECTORATE OF EMERGENCY SERVICES POC DET. LESTER MUMMERT,BUILDING # 1419,FORT DETRICK,MD,21702,"http://maps.google.com/maps?q=BUILDING # 1419,+FORT DETRICK,+MD+21702&hl=en"
FREDERICK COUNTY SHERIFF'S OFFICE,FREDERICK COUNTY PUBLIC SAFETY BUILDING,1080 COVERSTONE DRIVE,WINCHESTER,VA,22602,"http://maps.google.com/maps?q=1080 COVERSTONE DRIVE,+WINCHESTER,+VA+22602&hl=en"
FREDERICK COUNTY SHERIFF'S OFFICE,WALGREENS,131 VALLEY MILL ROAD,WINCHESTER,VA,22602,"http://maps.google.com/maps?q=131 VALLEY MILL ROAD,+WINCHESTER,+VA+22602&hl=en"
FREDERICK POLICE DEPARTMENT,WEGMANS,7830 WORMANS MILL ROAD,FREDERICK,MD,21701,"http://maps.google.com/maps?q=7830 WORMANS MILL ROAD,+FREDERICK,+MD+21701&hl=en"
FULTON POLICE DEPARTMENT,KINNEY DRUGS,115 ONEIDA STREET,FULTON,NY,13069,"http://maps.google.com/maps?q=115 ONEIDA STREET,+FULTON,+NY+13069&hl=en"
GAITHERSBURG POLICE DEPARTMENT,GAITHERSBURG POLICE DEPARTMENT,14 FULKS CORNER AVENUE,GAITHERSBURG,MD,20877,"http://maps.google.com/maps?q=14 FULKS CORNER AVENUE,+GAITHERSBURG,+MD+20877&hl=en"
GARRETT COUNTY SHERIFF'S OFFICE,GARRETT COUNTY SHERIFF'S OFFICE POC ROB CORELY,311 EAST ALDER STREET,OAKLAND,MD,21550,"http://maps.google.com/maps?q=311 EAST ALDER STREET,+OAKLAND,+MD+21550&hl=en"
GEISTOWN POLICE DEPT,RICHLAND VOLUNTEER FIRE DEPT GEISTOWN STATION,631 LAMBERD AVE,JOHNSTOWN,PA,15904,"http://maps.google.com/maps?q=631 LAMBERD AVE,+JOHNSTOWN,+PA+15904&hl=en"
GENESEE COUNTY SHERIFF'S DEPARTMENT,PEMBROKE TOWN HIGWAY BARNS,ROUTES 5 & 77,EAST PEMBROKE,NY,14056,"http://maps.google.com/maps?q=ROUTES 5 & 77,+EAST PEMBROKE,+NY+14056&hl=en"
GETTYSBURG BOROUGH POLICE DEPARTMENT,ADAMS COUNTY HOUSING AUTHORITY,40 EAST HIGH STREET,GETTYSBURG,PA,17325,"http://maps.google.com/maps?q=40 EAST HIGH STREET,+GETTYSBURG,+PA+17325&hl=en"
GREEN TREE BOROUGH POLICE DEPARTMENT,GREEN TREE BOROUGH BUILDING,10 WEST MANILLA AVE.,PITTSBURGH,PA,15220,"http://maps.google.com/maps?q=10 WEST MANILLA AVE.,+PITTSBURGH,+PA+15220&hl=en"
HAGERSTOWN CITY POLICE DEPARTMENT,HAGERSTOWN CITY POLICE DEPARTMENT,925 N. BURHANS BOULEVARD,HAGERSTOWN,MD,21740,"http://maps.google.com/maps?q=925 N. BURHANS BOULEVARD,+HAGERSTOWN,+MD+21740&hl=en"
HAMBURG POLICE DEPARTMENT,TOWN OF HAMBURG DEPT. OF YOUTH RECREATION & SENIOR SERVICES,4540 SOUTHWESTERN BLVD.,HAMBURG,NY,14075,"http://maps.google.com/maps?q=4540 SOUTHWESTERN BLVD.,+HAMBURG,+NY+14075&hl=en"
HAMPSHIRE COUNTY SHERIFF'S OFFICE,HAMPSHIRE COUNTY SD,66 N HIGH STREET,ROMNEY,WV,26757,"http://maps.google.com/maps?q=66 N HIGH STREET,+ROMNEY,+WV+26757&hl=en"
HANCOCK COUNTY SHERIFF'S OFFICE,HANCOCK COUNTY SHERIFF'S OFFICE,102 NORTH COURT STREET,NEW CUMBERLAND,WV,26047,"http://maps.google.com/maps?q=102 NORTH COURT STREET,+NEW CUMBERLAND,+WV+26047&hl=en"
HEIDELBERG POLICE DEPARTMENT,WALGREENS,2055 WASHINGTON PIKE,CARNEGIE,PA,15106,"http://maps.google.com/maps?q=2055 WASHINGTON PIKE,+CARNEGIE,+PA+15106&hl=en"
HERNDON POLICE DEPARTMENT,HERNDON POLICE DEPARTMENT LOBBY AREA,397 HERNDON PARKWAY,HERNDON,VA,20170,"http://maps.google.com/maps?q=397 HERNDON PARKWAY,+HERNDON,+VA+20170&hl=en"
HIGHSPIRE BOROUGH POLICE DEPARTMENT,HIGHSPIRE BOROUGH BUILDING,640 ESHELMAN ST.,HIGHSPIRE,PA,17034,"http://maps.google.com/maps?q=640 ESHELMAN ST.,+HIGHSPIRE,+PA+17034&hl=en"
HOWARD COUNTY POLICE DEPARTMENT,GARY ARTHUR COMMUNITY CENTER,2400 RT. 97,COOKSVILLE,MD,21723,"http://maps.google.com/maps?q=2400 RT. 97,+COOKSVILLE,+MD+21723&hl=en"
HUBBARD CITY POLICE DEPARTMENT,HUBBARD CITY POLICE DEPARTMENT,233 SCHOOL STREET,HUBBARD,OH,44425,"http://maps.google.com/maps?q=233 SCHOOL STREET,+HUBBARD,+OH+44425&hl=en"
INDIANA COUNTY SHERIFF'S OFFICE,DIAMOND DRUG PHARMACY *COLLECTION TIME FROM 10 AM TO NOON ONLY*,670 PHILADELPHIA STREET,INDIANA,PA,15701,"http://maps.google.com/maps?q=670 PHILADELPHIA STREET,+INDIANA,+PA+15701&hl=en"
ITHACA POLICE DEPARTMENT,KINNEY DRUGS,513 N. CAYUGA STREET,ITHACA,NY,14850,"http://maps.google.com/maps?q=513 N. CAYUGA STREET,+ITHACA,+NY+14850&hl=en"
ITHACA POLICE DEPARTMENT,WEGMANS,500 S. MEADOW STREET,ITHACA,NY,14850,"http://maps.google.com/maps?q=500 S. MEADOW STREET,+ITHACA,+NY+14850&hl=en"
JEFFERSON COUNTY SHERIFF'S OFFICE,JEFFERSON COUNTY SHERIFF,102 INDUSTRIAL BOULEVARD,KEARNEYSVILLE,WV,25430,"http://maps.google.com/maps?q=102 INDUSTRIAL BOULEVARD,+KEARNEYSVILLE,+WV+25430&hl=en"
KINGSTON TOWNSHIP POLICE DEPARTMENT,KINGSTON TOWNSHIP POLICE DEPARTMENT,180 EAST CENTER STREET,SHAVERTOWN,PA,18708,"http://maps.google.com/maps?q=180 EAST CENTER STREET,+SHAVERTOWN,+PA+18708&hl=en"
KULPMONT POLICE DEPARTMENT,KULPMONT POLICE DEPARTMENT,9 NORTH 8TH STREET,KULPMONT,PA,17834,"http://maps.google.com/maps?q=9 NORTH 8TH STREET,+KULPMONT,+PA+17834&hl=en"
LACKAWANNA POLICE DEPARTMENT,LACKAWANNA POLICE DEPARTMENT,714 RIDGE ROAD,BUFFALO,NY,14218,"http://maps.google.com/maps?q=714 RIDGE ROAD,+BUFFALO,+NY+14218&hl=en"
LANCASTER POLICE DEPARTMENT,TWIN DISTRICT FIRE DEPARTMENT,4999 WILLIAM STREET,LANCASTER,NY,14086,"http://maps.google.com/maps?q=4999 WILLIAM STREET,+LANCASTER,+NY+14086&hl=en"
LATIMORE TOWNSHIP POLICE,BERMUDIAN SPRINGS SCHOOL DISTRICT,7335 CARLISLE PIKE,YORK SPRINGS,PA,17372,"http://maps.google.com/maps?q=7335 CARLISLE PIKE,+YORK SPRINGS,+PA+17372&hl=en"
LEROY POLICE DEPARTMENT,LEROY POLICE DEPARTMENT VILLAGE HALL,3 WEST MAIN STREETRTS 5 & 19,LE ROY,NY,14482,"http://maps.google.com/maps?q=3 WEST MAIN STREET,+LE ROY,+NY+14482&hl=en"
LIBERTY TOWNSHIP POLICE DEPARTMENT,LIBERTY TOWNSHIP GOVERNMENT BUILDING,1315 CHURCHILL-HUBBARD ROAD,YOUNGSTOWN,OH,44505,"http://maps.google.com/maps?q=1315 CHURCHILL-HUBBARD ROAD,+YOUNGSTOWN,+OH+44505&hl=en"
LITTLESTOWN POLICE DEPARTMENT,MAPLE AVE MIDDLE SCHOOL,75 MAPLE AVE,LITTLESTOWN,PA,17340,"http://maps.google.com/maps?q=75 MAPLE AVE,+LITTLESTOWN,+PA+17340&hl=en"
LOCUST TOWNSHIP PD,LOCUST TOWNSHIP PD,1223 A NUMIDIA DR,CATAWISSA,PA,17820,"http://maps.google.com/maps?q=1223 A NUMIDIA DR,+CATAWISSA,+PA+17820&hl=en"
LOUDOUN COUNTY SHERIFF'S OFFICE,ASHBURN STATION FRONT LOBBY,20272 SAVIN HILL DR,ASHBURN,VA,20147,"http://maps.google.com/maps?q=20272 SAVIN HILL DR,+ASHBURN,+VA+20147&hl=en"
LOUDOUN COUNTY SHERIFF'S OFFICE,DULLES SOUTH PUBLIC SAFETY CENTER FRONT LOBBY AREA,25216 LOUDOUN PARKWAY,CHANTILLY,VA,20152,"http://maps.google.com/maps?q=25216 LOUDOUN PARKWAY,+CHANTILLY,+VA+20152&hl=en"
LOUDOUN COUNTY SHERIFF'S OFFICE,EASTERN LOUDOUN STATION FRONT LOBBY AREA,46620 EAST FREDERICK DRIVE,STERLING,VA,20164,"http://maps.google.com/maps?q=46620 EAST FREDERICK DRIVE,+STERLING,+VA+20164&hl=en"
LOUDOUN COUNTY SHERIFF'S OFFICE,WEGMAN'S DULLES 28 CENTER,45131 COLUMBIA PL,STERLING,VA,20166,"http://maps.google.com/maps?q=45131 COLUMBIA PL,+STERLING,+VA+20166&hl=en"
LOUDOUN COUNTY SHERIFF'S OFFICE,WESTERN LOUDOUN STATION,47 W LOUDOUN ST,ROUND HILL,VA,20141,"http://maps.google.com/maps?q=47 W LOUDOUN ST,+ROUND HILL,+VA+20141&hl=en"
LOWER PAXTON TOWNSHIP POLICE DEPARTMENT,LOWER PAXTON TOWNSHIP POLICE DEPARTMENT,425 PRINCE STREET,HARRISBURG,PA,17109,"http://maps.google.com/maps?q=425 PRINCE STREET,+HARRISBURG,+PA+17109&hl=en"
MANHEIM TOWNSHIP PD,WEGMAN'S,2000 CROSSINGS BLVD,LANCASTER,PA,17601,"http://maps.google.com/maps?q=2000 CROSSINGS BLVD,+LANCASTER,+PA+17601&hl=en"
MARTINSBURG POLICE DEPARTMENT,JAMES DRUG STORE,119 W. ALLEGHENY STREET,MARTINSBURG,PA,16662,"http://maps.google.com/maps?q=119 W. ALLEGHENY STREET,+MARTINSBURG,+PA+16662&hl=en"
MARYLAND NATURAL RESOURCES POLICE,NATURAL RESOURCES POLICE ECHO LAKE OFFICE,2011 MONUMENT ROAD,MYERSVILLE,MD,21773,"http://maps.google.com/maps?q=2011 MONUMENT ROAD,+MYERSVILLE,+MD+21773&hl=en"
MARYLAND STATE POLICE,MSP CUMBERLAND BARRACK POC: LT. MICHAEL FLUHARTY,1125 NATIONAL HIGHWAY,CUMBERLAND,MD,21502,"http://maps.google.com/maps?q=1125 NATIONAL HIGHWAY,+CUMBERLAND,+MD+21502&hl=en"
MARYLAND STATE POLICE,MSP FREDERICK BARRACK POC: LT. TODD MAY,110 AIRPORT DRIVE EAST,FREDERICK,MD,21701,"http://maps.google.com/maps?q=110 AIRPORT DRIVE EAST,+FREDERICK,+MD+21701&hl=en"
MARYLAND STATE POLICE,MSP HAGERSTOWN BARRACK POC- LT. WOODWARD,18345 COL. HENRY K. DOUGLAS DR.,HAGERSTOWN,MD,21740,"http://maps.google.com/maps?q=18345 COL. HENRY K. DOUGLAS DR.,+HAGERSTOWN,+MD+21740&hl=en"
MARYLAND STATE POLICE,MSP MCHENRY BARRACK POC: JAMES PRITTS,67 FRIENDSVILLE ROAD,MC HENRY,MD,21541,"http://maps.google.com/maps?q=67 FRIENDSVILLE ROAD,+MC HENRY,+MD+21541&hl=en"
MARYLAND STATE POLICE,MSP ROCKVILLE BARRACK POC: LT. H.B. MARTZ,7915 MONTROSE ROAD,ROCKVILLE,MD,20854,"http://maps.google.com/maps?q=7915 MONTROSE ROAD,+ROCKVILLE,+MD+20854&hl=en"
MARYLAND STATE POLICE,MSP WESTMINSTER BARRACKS POC: LT. PATRICK MCCRORY,1100 BALTIMORE BLVD.,WESTMINSTER,MD,21157,"http://maps.google.com/maps?q=1100 BALTIMORE BLVD.,+WESTMINSTER,+MD+21157&hl=en"
MCDONALD POLICE DEPARTMENT,MCDONALD POLICE DEPARTMENT,151 SCHOOL STREET,MC DONALD,PA,15057,"http://maps.google.com/maps?q=151 SCHOOL STREET,+MC DONALD,+PA+15057&hl=en"
MCSHERRYSTOWN POLICE DEPT,MCSHERRYSTOWN MOOSE LODGE,534 SOUTH ST,MC SHERRYSTOWN,PA,17344,"http://maps.google.com/maps?q=534 SOUTH ST,+MC SHERRYSTOWN,+PA+17344&hl=en"
MERCERSBURG PD,MERCERSBURG BOROUGH HALL,113 SOUTH MAIN ST,MERCERSBURG,PA,17236,"http://maps.google.com/maps?q=113 SOUTH MAIN ST,+MERCERSBURG,+PA+17236&hl=en"
MIDDLETOWN POLICE,GIANT PHARMACY,450 EAST MAINT STREET,MIDDLETOWN,PA,17057,"http://maps.google.com/maps?q=450 EAST MAINT STREET,+MIDDLETOWN,+PA+17057&hl=en"
MILLCREEK TOWNSHIP POLICE DEPARTMENT,MILLCREEK TOWNSHIP,3608 WEST 26TH STREET,ERIE,PA,16506,"http://maps.google.com/maps?q=3608 WEST 26TH STREET,+ERIE,+PA+16506&hl=en"
MILLCREEK TOWNSHIP POLICE DEPARTMENT,WEGMAN'S,5028 W RIDGE RDERIE,ERIE,PA,16506,"http://maps.google.com/maps?q=5028 W RIDGE RD,+ERIE,+PA+16506&hl=en"
MILLCREEK TOWNSHIP POLICE DEPARTMENT,WEGMAN'S,6143 PEACH STERIE,ERIE,PA,16509,"http://maps.google.com/maps?q=6143 PEACH ST,+ERIE,+PA+16509&hl=en"
MILLVALE POLICE DEPARTMENT,MILLVALE POLICE STATION,501 LINCOLN AVENUE,PITTSBURGH,PA,15209,"http://maps.google.com/maps?q=501 LINCOLN AVENUE,+PITTSBURGH,+PA+15209&hl=en"
MILTON PD,MILTON PD,1 FILBERT ST,MILTON,PA,17847,"http://maps.google.com/maps?q=1 FILBERT ST,+MILTON,+PA+17847&hl=en"
MINERAL COUNTY SHERIFF'S OFFICE,MINERAL COUNTY DETENTION CENTER ACROSS STREET FROM COURTHOUSE,100 EAST STREET,KEYSER,WV,26726,"http://maps.google.com/maps?q=100 EAST STREET,+KEYSER,+WV+26726&hl=en"
MONROEVILLE POLICE DEPARTMENT,MONROEVILLE POLICE DEPARTMENT,2700 MONROEVILLE BLVD.,MONROEVILLE,PA,15146,"http://maps.google.com/maps?q=2700 MONROEVILLE BLVD.,+MONROEVILLE,+PA+15146&hl=en"
MONTGOMERY COUNTY DEPARTMENT OF POLICE,5TH DISTRICT POLICE STATION,20000 AIRCRAFT DRIVE,GERMANTOWN,MD,20874,"http://maps.google.com/maps?q=20000 AIRCRAFT DRIVE,+GERMANTOWN,+MD+20874&hl=en"
MONTGOMERY COUNTY DEPARTMENT OF POLICE,6TH DISTRICT NORTH CREEK COMMUNITY CENTER,20125 ARROWHEAD ROAD,MONTGOMERY VILLAGE,MD,20886,"http://maps.google.com/maps?q=20125 ARROWHEAD ROAD,+MONTGOMERY VILLAGE,+MD+20886&hl=en"
MONTGOMERY COUNTY DEPARTMENT OF POLICE,SENIOR LIVING KENTLANDS MANOR,217 BOOTH ST.,GAITHERSBURG,MD,20878,"http://maps.google.com/maps?q=217 BOOTH ST.,+GAITHERSBURG,+MD+20878&hl=en"
MONTOUR COUNTY SHERIFF'S OFFICE,MONTOUR COUNTY COURTHOUSE,253 MILL ST,DANVILLE,PA,17821,"http://maps.google.com/maps?q=253 MILL ST,+DANVILLE,+PA+17821&hl=en"
MOON TOWNSHIP POLICE,MOON TOWNSHIP POLICE,1000 BEAVER GRADE RD,CORAOPOLIS,PA,15108,"http://maps.google.com/maps?q=1000 BEAVER GRADE RD,+CORAOPOLIS,+PA+15108&hl=en"
MOOREFIELD POLICE DEPARTMENT,MOOREFIELD POLICE DEPT/TOWN OFFICE,206 WINCHESTER AVE,MOOREFIELD,WV,26836,"http://maps.google.com/maps?q=206 WINCHESTER AVE,+MOOREFIELD,+WV+26836&hl=en"
