Participant,CollectionSite,Address,City,State,Zip,MapURL
APACHE JUNCTION POLICE DEPARTMENT,APACHE JUNCTION POLICE DEPARTMENT INSIDE LOBBY,1001 N. IDAHO ROAD,APACHE JUNCTION,AZ,85119,"http://maps.google.com/maps?q=1001 N. IDAHO ROAD,+APACHE JUNCTION,+AZ+85119&hl=en"
AVONDALE POLICE DEPARTMENT,CVS BY THE FRONT ENTRANCE,280 N. AVONDALE BLVD,AVONDALE,AZ,85323,"http://maps.google.com/maps?q=280 N.  AVONDALE BLVD,+AVONDALE,+AZ+85323&hl=en"
BUCKEYE POLICE DEPARTMENT,BUCKEYE POLICE DEPARTMENT,21699 WEST YUMA RD. SUITE 104,BUCKEYE,AZ,85326,"http://maps.google.com/maps?q=21699 WEST YUMA RD. SUITE 104,+BUCKEYE,+AZ+85326&hl=en"
BULLHEAD CITY POLICE DEPARTMENT,BULLHEAD CITY POLICE DEPARTMENT,1255 MARINA BLVD,BULLHEAD CITY,AZ,86442,"http://maps.google.com/maps?q=1255 MARINA BLVD,+BULLHEAD CITY,+AZ+86442&hl=en"
BUREAU OF INDIAN AFFAIRS,IHS INDIAN HEALTH CLINIC,1 MAIN STREET,SUPAI,AZ,86435,"http://maps.google.com/maps?q=1 MAIN STREET,+SUPAI,+AZ+86435&hl=en"
CAMP VERDE MARSHALS OFFICE,CAMP VERDE MARSHAL'S OFFICE,646 SOUTH 1ST STREET,CAMP VERDE,AZ,86322,"http://maps.google.com/maps?q=646 SOUTH 1ST STREET,+CAMP VERDE,+AZ+86322&hl=en"
CHANDLER POLICE DEPARTMENT,HAMILTON HIGH SCHOOL,3700 S. ARIZONA AVE.,CHANDLER,AZ,85248,"http://maps.google.com/maps?q=3700 S. ARIZONA AVE.,+CHANDLER,+AZ+85248&hl=en"
CHANDLER POLICE DEPARTMENT,WALGREENS,1919 N. DOBSON RD.,CHANDLER,AZ,85224,"http://maps.google.com/maps?q=1919 N. DOBSON RD.,+CHANDLER,+AZ+85224&hl=en"
CHANDLER POLICE DEPARTMENT,WALGREENS,1975 S. ALMA SCHOOL RD,CHANDLER,AZ,85286,"http://maps.google.com/maps?q=1975 S. ALMA SCHOOL RD,+CHANDLER,+AZ+85286&hl=en"
CHINO VALLEY POLICE DEPARTMENT,CHINO VALLEY POLICE DEPARTMENT ENTRY LOBBY,1950 N. VOSS DRIVE,CHINO VALLEY,AZ,86323,"http://maps.google.com/maps?q=1950 N. VOSS DRIVE,+CHINO VALLEY,+AZ+86323&hl=en"
CIBOLA COUNTY SHERIFFS OFFICE,CIBOLA COUNTY (505) 876-2040,114 MCBRIDE RD,GRANTS,NM,87020,"http://maps.google.com/maps?q=114 MCBRIDE RD,+GRANTS,+NM+87020&hl=en"
COTTONWOOD POLICE DEPARTMENT,COTTONWOOD POLICE DEPARTMENT MAIN LOBBY,199 S 6TH ST,COTTONWOOD,AZ,86326,"http://maps.google.com/maps?q=199 S 6TH ST,+COTTONWOOD,+AZ+86326&hl=en"
DAVIS-MONTHAN AFB,DAVIS MONTHAN BX/PHARMACY BLDG #2527,5405 E. GRANITE RD,TUCSON,AZ,85707,"http://maps.google.com/maps?q=5405 E. GRANITE RD,+TUCSON,+AZ+85707&hl=en"
DEA/FLAGSTAFF POLICE DEPARTMENT,FLAGSTAFF POLICE/COCONINO COUNTY SHERIFF'S BLDG FRONT PARKING LOT,911 SAWMILL ROAD,FLAGSTAFF,AZ,86001,"http://maps.google.com/maps?q=911 SAWMILL ROAD,+FLAGSTAFF,+AZ+86001&hl=en"
DPS,DEPARTMENT OF PUBLIC SAFETY,410 W. CENTENNIAL BLVD,CASA GRANDE,AZ,85122,"http://maps.google.com/maps?q=410 W. CENTENNIAL BLVD,+CASA GRANDE,+AZ+85122&hl=en"
EL MIRAGE POLICE DEPARTMENT,EL MIRAGE POLICE DEPARTMENT,12401 W. CINNABAR AVE,EL MIRAGE,AZ,85335,"http://maps.google.com/maps?q=12401 W. CINNABAR AVE,+EL MIRAGE,+AZ+85335&hl=en"
EL MIRAGE POLICE DEPARTMENT,FRY'S STORE,13982 WEST WADDELL,SURPRISE,AZ,85379,"http://maps.google.com/maps?q=13982 WEST WADDELL,+SURPRISE,+AZ+85379&hl=en"
FARMINGTON PD REGION II,SAN JUAN COUNTY SHERIFF'S OFFICE KIRTLAND SUB-STATION,6 COUNTY ROAD 6360,KIRTLAND,NM,87417,"http://maps.google.com/maps?q=6 COUNTY ROAD 6360,+KIRTLAND,+NM+87417&hl=en"
FARMINGTON PD REGION II,WALGREENS,701 E 20TH ST,FARMINGTON,NM,87401,"http://maps.google.com/maps?q=701 E 20TH ST,+FARMINGTON,+NM+87401&hl=en"
FORT MCDOWELL POLICE DEPARTMENT,FORT MCDOWELL PUBLIC SAFETY BLDG IN FRONT OF THE FIRE DEPARMENT,10755 N. FORT MCDOWELL ROAD,FORT MCDOWELL,AZ,85264,"http://maps.google.com/maps?q=10755 N. FORT MCDOWELL ROAD,+FORT MCDOWELL,+AZ+85264&hl=en"
GALLUP POLICE DEPARTMENT,GALLUP PD,451 BOARDMAN DR,GALLUP,NM,87301,"http://maps.google.com/maps?q=451 BOARDMAN DR,+GALLUP,+NM+87301&hl=en"
GALLUP POLICE DEPARTMENT,RIO WEST MALL,1300 W. I40 FRONTAGE RD,GALLUP,NM,87301,"http://maps.google.com/maps?q=1300 W. I40 FRONTAGE RD,+GALLUP,+NM+87301&hl=en"
GILA RIVER POLICE DEPARTMENT,GILA RIVER FIRE DEPARTMENT FIRE STATION #423,599 W. SEEDFARM RD.,SACATON,AZ,85147,"http://maps.google.com/maps?q=599 W. SEEDFARM RD.,+SACATON,+AZ+85147&hl=en"
GILBERT POLICE DEPARTMENT,GILBERT POLICE DEPARTMENT,75 E. CIVIC CENTER DR.,GILBERT,AZ,85296,"http://maps.google.com/maps?q=75 E. CIVIC CENTER DR.,+GILBERT,+AZ+85296&hl=en"
GLENDALE POLICE DEPARTMENT,CVS PHARMACY PARKING LOT SOUTHWEST CORNER OF OLIVE AND 51ST AVE,5125 W. OLIVE AVE,GLENDALE,AZ,85308,"http://maps.google.com/maps?q=5125 W. OLIVE AVE,+GLENDALE,+AZ+85308&hl=en"
GLOBE POLICE DEPARTMENT,FRY'S FOOD AND DRUG STORE (PARKING LOT),2115 HWY 60 #200,GLOBE,AZ,85501,"http://maps.google.com/maps?q=2115 HWY 60 #200,+GLOBE,+AZ+85501&hl=en"
GRANTS POLICE DEPARTMENT,GRANTS POLICE DEPARTMENT,105 E. ROOSEVELT AVE,GRANTS,NM,87020,"http://maps.google.com/maps?q=105 E. ROOSEVELT AVE,+GRANTS,+NM+87020&hl=en"
HOPI RESOURCE ENFORCEMENT SERVICES,HOPI VETERANS MEMORIAL CENTER,ARIZONA STATE HIGHWAY 264 MILE POST #388,POLACCA,AZ,86042,"http://maps.google.com/maps?q=ARIZONA STATE HIGHWAY 264 MILE POST #388,+POLACCA,+AZ+86042&hl=en"
HUALAPAI POLICE DEPARTMENT,HUALAPAI NATION POLICE DEPARTMENT LOBBY,468 DIAMOND CREEK ROAD,PEACH SPRINGS,AZ,86434,"http://maps.google.com/maps?q=468 DIAMOND CREEK ROAD,+PEACH SPRINGS,+AZ+86434&hl=en"
IRON COUNTY SHERIFFS OFFICE,SMITH'S FOOD AND DRUG,633 SOUTH MAIN STREET,CEDAR CITY,UT,84720,"http://maps.google.com/maps?q=633 SOUTH MAIN STREET,+CEDAR CITY,+UT+84720&hl=en"
LAGUNA POLICE DEPARTMENT,LAGUNA POLICE DEPARTMENT,"1 INDUSTRIAL PARKWAY LOOP, MESITA VILLAGE",LAGUNA,NM,87026,"http://maps.google.com/maps?q=1 INDUSTRIAL PARKWAY  LOOP, MESITA VILLAGE,+LAGUNA,+NM+87026&hl=en"
LAKE HAVASU CITY POLICE DEPARTMENT,LAKE HAVASU CITY POLICE DEPARTMENT (IN FRONT),2360 MCCULLOCH BLVD,LAKE HAVASU CITY,AZ,86403,"http://maps.google.com/maps?q=2360 MCCULLOCH BLVD,+LAKE HAVASU CITY,+AZ+86403&hl=en"
MAMMOTH POLICE DEPARTMENT,MAMMOTH POLICE DEPARTMENT,125 N. CLARK ST.,MAMMOTH,AZ,85618,"http://maps.google.com/maps?q=125 N. CLARK ST.,+MAMMOTH,+AZ+85618&hl=en"
MARANA POLICE DEPARTMENT,TARGET FRONT ENTRANCE - SIDEWALK,3901 W. INA ROAD,TUCSON,AZ,85741,"http://maps.google.com/maps?q=3901 W. INA ROAD,+TUCSON,+AZ+85741&hl=en"
MARICOPA COUNTY SHERIFF'S OFFICE,DREAMLAND VILLA,5502 EAST BUTTE,MESA,AZ,85205,"http://maps.google.com/maps?q=5502 EAST BUTTE,+MESA,+AZ+85205&hl=en"
MARICOPA COUNTY SHERIFF'S OFFICE,HERMOSA PARK,2030 EAST SOUTHERN AVE,PHOENIX,AZ,85040,"http://maps.google.com/maps?q=2030 EAST SOUTHERN AVE,+PHOENIX,+AZ+85040&hl=en"
MARICOPA COUNTY SHERIFF'S OFFICE,LEISURE WORLD,908 SOUTH POWER RD.,MESA,AZ,85206,"http://maps.google.com/maps?q=908 SOUTH POWER RD.,+MESA,+AZ+85206&hl=en"
MARICOPA COUNTY SHERIFF'S OFFICE,"MCSO DISTRICT IV, ANTHEM SUB-STATION",3701 WEST ANTHEM WAY(ANTHEM WAY & VENTURE CT),ANTHEM,AZ,85086,"http://maps.google.com/maps?q=3701 WEST ANTHEM WAY,+ANTHEM,+AZ+85086&hl=en"
MARICOPA COUNTY SHERIFF'S OFFICE,"MCSO DISTRICT IV,CAVE CREEK STATION",37622 NORTH CAVE CREEK ROAD,CAVE CREEK,AZ,85331,"http://maps.google.com/maps?q=37622 NORTH CAVE CREEK ROAD,+CAVE CREEK,+AZ+85331&hl=en"
MARICOPA COUNTY SHERIFF'S OFFICE,SUN CITY WEST POSSE OFFICE,20450 STARDUST BLVD,SUN CITY WEST,AZ,85375,"http://maps.google.com/maps?q=20450 STARDUST BLVD,+SUN CITY WEST,+AZ+85375&hl=en"
MARICOPA COUNTY SHERIFF'S OFFICE,WALGREENS,5101 WEST INDIAN SCHOOL RD.,PHOENIX,AZ,85031,"http://maps.google.com/maps?q=5101 WEST INDIAN SCHOOL RD.,+PHOENIX,+AZ+85031&hl=en"
MCAT,SAFEWAY,1601 NORTHPARK DRIVE,WINSLOW,AZ,86047,"http://maps.google.com/maps?q=1601 NORTHPARK DRIVE,+WINSLOW,+AZ+86047&hl=en"
MCAT,SAFEWAY,702 WEST HOPI,HOLBROOK,AZ,86025,"http://maps.google.com/maps?q=702 WEST HOPI,+HOLBROOK,+AZ+86025&hl=en"
MCKINLEY COUNTY SHERIFF'S OFFICE,THOREAU SUBSTATION,109 HWY 371,THOREAU,NM,87323,"http://maps.google.com/maps?q=109 HWY 371,+THOREAU,+NM+87323&hl=en"
MESA POLICE DEPARTMENT,CENTRAL DISTRICT SUBSTATION (IN THE LOBBY),120 N. ROBSON,MESA,AZ,85201,"http://maps.google.com/maps?q=120 N. ROBSON,+MESA,+AZ+85201&hl=en"
MESA POLICE DEPARTMENT,FIESTA DISTRICT SUBSTATION (IN THE FRONT LOBBY),1010 W GROVE AVENUE,MESA,AZ,85210,"http://maps.google.com/maps?q=1010 W GROVE AVENUE,+MESA,+AZ+85210&hl=en"
MESA POLICE DEPARTMENT,FRY'S FOOD AND DRUG STORE-MCKELLIPS RD,5941 E. MCKELLIPS RD,MESA,AZ,85215,"http://maps.google.com/maps?q=5941 E. MCKELLIPS RD,+MESA,+AZ+85215&hl=en"
MESA POLICE DEPARTMENT,FRY'S FOOD AND DRUG STORE-SIGNAL BUTTE RD,2724 S. SIGNAL BUTTE RD,MESA,AZ,85209,"http://maps.google.com/maps?q=2724 S. SIGNAL BUTTE RD,+MESA,+AZ+85209&hl=en"
MESA POLICE DEPARTMENT,RED MOUNTAIN DISTRICT SUBSTATION (FRONT PARKING LOT),4333 E. UNIVERSITY DR.,MESA,AZ,85205,"http://maps.google.com/maps?q=4333 E. UNIVERSITY DR.,+MESA,+AZ+85205&hl=en"
MESA POLICE DEPARTMENT,SUPERSTITION DISTRICT SUBSTATION (PARKING LOT),2430 S. ELLSWORTH ROAD,MESA,AZ,85209,"http://maps.google.com/maps?q=2430 S. ELLSWORTH ROAD,+MESA,+AZ+85209&hl=en"
NAVAJO NATION POLICE,CROWNPOINT POLICE DEPT,CHACO BLVD & ROUTE 9,CROWNPOINT,NM,87313,"http://maps.google.com/maps?q=CHACO BLVD & ROUTE 9,+CROWNPOINT,+NM+87313&hl=en"
NM STATE POLICE,NM STATE POLICE,4200 E. HISTORIC HWY. 66,GALLUP,NM,87301,"http://maps.google.com/maps?q=4200 E. HISTORIC HWY. 66,+GALLUP,+NM+87301&hl=en"
NOGALES POLICE DEPARTMENT,NOGALES POLICE DEPARTMENT LOBBY,777 N GRAND AVE,NOGALES,AZ,85621,"http://maps.google.com/maps?q=777 N GRAND AVE,+NOGALES,+AZ+85621&hl=en"
ORO VALLEY POLICE DEPARTMENT,FRY'S,10661 N. ORACLE RD.,ORO VALLEY,AZ,85737,"http://maps.google.com/maps?q=10661 N. ORACLE RD.,+ORO VALLEY,+AZ+85737&hl=en"
PARADISE VALLEY POLICE DEPARTMENT,PARADISE VALLEY POLICE DEPARTMENT POLICE DEPARTMENT LOBBY,6433 EAST LINCOLN DRIVE,PARADISE VALLEY,AZ,85253,"http://maps.google.com/maps?q=6433 EAST LINCOLN DRIVE,+PARADISE VALLEY,+AZ+85253&hl=en"
PASCUA YAQUI TRIBAL PD,SAN XAVIER DISTRICT OFFICE PARKING LOT,2018 SAN XAVIER RD.,TUCSON,AZ,85746,"http://maps.google.com/maps?q=2018 SAN XAVIER RD.,+TUCSON,+AZ+85746&hl=en"
PAYSON POLICE DEPARTMENT,WAL-MART (PARKING LOT) IN THE PARKING LOT ON THE FAR EAST SIDE.,300 N BEELINE HWY,PAYSON,AZ,85541,"http://maps.google.com/maps?q=300 N BEELINE HWY,+PAYSON,+AZ+85541&hl=en"
PEORIA POLICE DEPARTMENT,RIO VISTA COMMUNITY PARK INSIDE THE RECREATION CENTER,8866 WEST THUNDERBIRD RD.,PEORIA,AZ,85382,"http://maps.google.com/maps?q=8866 WEST THUNDERBIRD RD.,+PEORIA,+AZ+85382&hl=en"
PHOENIX POLICE DEPARTMENT,AHWATUKEE TARGET STORE SOUTH MOUNTAIN PRECINCT,4734 E. RAY RD.,PHOENIX,AZ,85044,"http://maps.google.com/maps?q=4734 E. RAY RD.,+PHOENIX,+AZ+85044&hl=en"
PHOENIX POLICE DEPARTMENT,BLACK MOUNTAIN PRECINCT FRY'S #694,2708 W. DOVE VALLEY RD.,PHOENIX,AZ,85085,"http://maps.google.com/maps?q=2708 W. DOVE VALLEY RD.,+PHOENIX,+AZ+85085&hl=en"
PHOENIX POLICE DEPARTMENT,BLACK MOUNTAIN PRECINCT FRY'S #698,1311 E. BELL RD.,PHOENIX,AZ,85022,"http://maps.google.com/maps?q=1311 E. BELL RD.,+PHOENIX,+AZ+85022&hl=en"
PHOENIX POLICE DEPARTMENT,CACTUS PARK PRECINCT FRY'S #127,4202 W. CACTUS RD.,PHOENIX,AZ,85029,"http://maps.google.com/maps?q=4202 W. CACTUS RD.,+PHOENIX,+AZ+85029&hl=en"
PHOENIX POLICE DEPARTMENT,CACTUS PARK PRECINCT WALGREENS,4249 W. GLENDALE AVE.,PHOENIX,AZ,85051,"http://maps.google.com/maps?q=4249 W. GLENDALE AVE.,+PHOENIX,+AZ+85051&hl=en"
PHOENIX POLICE DEPARTMENT,CENTRAL CITY PRECINCT,1902 SOUTH 16TH ST,PHOENIX,AZ,85034,"http://maps.google.com/maps?q=1902 SOUTH 16TH ST,+PHOENIX,+AZ+85034&hl=en"
PHOENIX POLICE DEPARTMENT,DESERT HORIZON PRECINCT FRY'S #120,6321 E. GREENWAY RD.,SCOTTSDALE,AZ,85254,"http://maps.google.com/maps?q=6321 E. GREENWAY RD.,+SCOTTSDALE,+AZ+85254&hl=en"
PHOENIX POLICE DEPARTMENT,MARYVALE PRECINCT FRY'S #126,6601 W. INDIAN SCHOOL RD.,PHOENIX,AZ,85033,"http://maps.google.com/maps?q=6601 W. INDIAN SCHOOL RD.,+PHOENIX,+AZ+85033&hl=en"
PHOENIX POLICE DEPARTMENT,MARYVALE PRECINCT FRY'S #79,2626 S. 83RD AVE.,PHOENIX,AZ,85043,"http://maps.google.com/maps?q=2626 S. 83RD AVE.,+PHOENIX,+AZ+85043&hl=en"
PHOENIX POLICE DEPARTMENT,MOUNTAIN VIEW PRECINCT FRY'S #135,4505 E. THOMAS RD.,PHOENIX,AZ,85018,"http://maps.google.com/maps?q=4505 E. THOMAS RD.,+PHOENIX,+AZ+85018&hl=en"
PHOENIX POLICE DEPARTMENT,MOUNTAIN VIEW PRECINCT WALGREENS,3402 N. CENTRAL AVE,PHOENIX,AZ,85012,"http://maps.google.com/maps?q=3402 N. CENTRAL AVE,+PHOENIX,+AZ+85012&hl=en"
PIMA COUNTY SHERIFF'S DEPARTMENT,JOYNER GREEN VALLEY LIBRARY,601 N. LA CANADA DRIVE,GREEN VALLEY,AZ,85614,"http://maps.google.com/maps?q=601 N. LA CANADA DRIVE,+GREEN VALLEY,+AZ+85614&hl=en"
PIMA COUNTY SHERIFF'S DEPARTMENT,NANINI LIBRARY,7300 N. SHANNON RD.,TUCSON,AZ,85741,"http://maps.google.com/maps?q=7300 N. SHANNON RD.,+TUCSON,+AZ+85741&hl=en"
PRESCOTT POLICE DEPARTMENT,PRESCOTT POLICE DEPARTMENT,222 SOUTH MARINA STREET,PRESCOTT,AZ,86303,"http://maps.google.com/maps?q=222 SOUTH MARINA STREET,+PRESCOTT,+AZ+86303&hl=en"
PRESCOTT VALLEY POLICE DEPARTMENT,PRESCOTT VALLEY POLICE DEPARTMENT,7601 E. CIVIC CIRCLE,PRESCOTT VALLEY,AZ,86314,"http://maps.google.com/maps?q=7601 E. CIVIC CIRCLE,+PRESCOTT VALLEY,+AZ+86314&hl=en"
QUARTZSITE POLICE DEPT,QUARTZSITE POLICE DEPARTMENT,305 N PLYMOUTH AVE,QUARTZSITE,AZ,85346,"http://maps.google.com/maps?q=305 N PLYMOUTH AVE,+QUARTZSITE,+AZ+85346&hl=en"
RAMAH NAVAJO POLICE,RAMAH POLICE DEPT PINE HILL CENTER,INDIAN SERVICE RTE 140,PINEHILL,NM,87357,"http://maps.google.com/maps?q=INDIAN SERVICE RTE 140,+PINEHILL,+NM+87357&hl=en"
SAHUARITA POLICE DEPARTMENT,SAHUARITA POLICE DEPARTMENT,315 W. SAHUARITA CENTER WAY,SAHUARITA,AZ,85629,"http://maps.google.com/maps?q=315 W. SAHUARITA CENTER WAY,+SAHUARITA,+AZ+85629&hl=en"
SAN BERNARDINO CTY SHERIFF DEPT,NEEDLES S.D./COLORADO RIVER STATION SGT. JIMMY TRAHIN 9288460307,1111 BAILEY AVE.,NEEDLES,CA,92363,"http://maps.google.com/maps?q=1111 BAILEY AVE.,+NEEDLES,+CA+92363&hl=en"
SAN CARLOS APACHE POLICE DEPARTMENT,SAN CARLOS TRIBAL PD,103 MEDICINE WAY RD.,SAN CARLOS,AZ,85550,"http://maps.google.com/maps?q=103 MEDICINE WAY RD.,+SAN CARLOS,+AZ+85550&hl=en"
SAN JUAN COUNTY SHERIFF'S OFFICE,SAN JUAN COUNTY PUBLIC SAFETY BUILDING,297 SOUTH MAIN STREET,MONTICELLO,UT,84535,"http://maps.google.com/maps?q=297 SOUTH MAIN STREET,+MONTICELLO,+UT+84535&hl=en"
SANTA CRUZ COUNTY SHERIFF'S OFFICE,GARRETT'S SUPERMARKET RIO RICO PLAZA,1060 YAVAPAI DR. #10,RIO RICO,AZ,85648,"http://maps.google.com/maps?q=1060 YAVAPAI DR. #10,+RIO RICO,+AZ+85648&hl=en"
SCOTTSDALE POLICE DEPARTMENT,FOOTHILLS DISTRICT STATION PIMA AND MARKET ST BY THE FIRE STATION,20363 N PIMA RD.,SCOTTSDALE,AZ,85255,"http://maps.google.com/maps?q=20363 N PIMA RD.,+SCOTTSDALE,+AZ+85255&hl=en"
SCOTTSDALE POLICE DEPARTMENT,GRANITE REEF SENIOR CENTER (INTERSECTION GRANITE REEF & MCDOWELL) MAIN ENTRANCE,1700 N. GRANITE REEF ROADIS JUST NORTH OF THE INTERSECTION,SCOTTSDALE,AZ,85257,"http://maps.google.com/maps?q=1700 N. GRANITE REEF ROAD,+SCOTTSDALE,+AZ+85257&hl=en"
SEDONA POLICE DEPARTMENT,SEDONA POLICE DEPARTMENT SEDONA CITY COMPLEX SOUTH PARKING LOT (LOOK FOR SIGNS),100 ROADRUNNER DR,SEDONA,AZ,86336,"http://maps.google.com/maps?q=100 ROADRUNNER DR,+SEDONA,+AZ+86336&hl=en"
SHOW LOW POLICE DEPARTMENT,SHOW LOW POLICE DEPARTMENT LOBBY,411 E. DEUCE OF CLUBS,SHOW LOW,AZ,85902,"http://maps.google.com/maps?q=411 E. DEUCE OF CLUBS,+SHOW LOW,+AZ+85902&hl=en"
SHOW LOW POLICE DEPARTMENT,SUMMIT HEALTHCARE REGIONAL MEDICAL CENTER OUTSIDE BY THE FRONT HOSPITAL ENTRANCE,2200 E. SHOW LOW LAKE RD,SHOW LOW,AZ,85901,"http://maps.google.com/maps?q=2200 E. SHOW LOW LAKE RD,+SHOW LOW,+AZ+85901&hl=en"
SILVER CITY POLICE DEPARTMENT,SILVER CITY POLICE DEPARTMENT,1011 N. HUDSON,SILVER CITY,NM,88061,"http://maps.google.com/maps?q=1011 N. HUDSON,+SILVER CITY,+NM+88061&hl=en"
SOUTH TUCSON POLICE DEPARTMENT,SOUTH TUCSON POLICE DEPARTMENT LOBBY ENTRANCE,1601 S. 6TH AVENUE,TUCSON,AZ,85713,"http://maps.google.com/maps?q=1601 S. 6TH AVENUE,+TUCSON,+AZ+85713&hl=en"
ST. GEORGE POLICE DEPARTMENT,SMITH'S PARKING LOT,20 NORTH BLUFF STREET,SAINT GEORGE,UT,84770,"http://maps.google.com/maps?q=20 NORTH BLUFF STREET,+SAINT GEORGE,+UT+84770&hl=en"
TEMPE POLICE DEPARTMENT,"TEMPE POLICE SOUTH SUBSTATION S/E CORNER OF HARDY & CARVER, BETWEEN ELLIOT & WARNER",8201 S. HARDY DRIVE,TEMPE,AZ,85284,"http://maps.google.com/maps?q=8201 S. HARDY DRIVE,+TEMPE,+AZ+85284&hl=en"
TOHONO O'DHAM NATION POLICE DEPARTMENT,TOHONO O'DHAM NATION POLICE DEPARTMENT TENT WILL BE SET UP IN FRONT OF TOPD,PD ROAD AND HWY 86,SELLS,AZ,85634,"http://maps.google.com/maps?q=PD ROAD AND HWY 86,+SELLS,+AZ+85634&hl=en"
TONTO APACHE POLICE DEPARTMENT,TONTO APACHE POLICE DEPARTMENT,30 TONTO APACHE RESERVATION,PAYSON,AZ,85541,"http://maps.google.com/maps?q=30 TONTO APACHE RESERVATION,+PAYSON,+AZ+85541&hl=en"
TUCSON POLICE DEPARTMENT,FRY'S FOOD AND DRUG PHARMACY,7050 E. 22ND ST.,TUCSON,AZ,85710,"http://maps.google.com/maps?q=7050 E. 22ND ST.,+TUCSON,+AZ+85710&hl=en"
WICKENBURG POLICE DEPARTMENT,WICKENBURG POLICE DEPARTMENT,155 N. TEGNER STREETSUITE C,WICKENBURG,AZ,85390,"http://maps.google.com/maps?q=155 N. TEGNER STREET,+WICKENBURG,+AZ+85390&hl=en"
YAVAPAI APACHE TRIBAL POLICE DEPARTMENT,YAVAPAI APACHE TRIBAL POLICE DEPARTMENT,2372 KINSEY STREET,CAMP VERDE,AZ,86322,"http://maps.google.com/maps?q=2372 KINSEY STREET,+CAMP VERDE,+AZ+86322&hl=en"
YAVAPAI COUNTY SHERIFF'S OFFICE,YCSO MAYER SUB-STATION RED BRICK SCHOOL HOUSE,12606 MAIN STREET,MAYER,AZ,86333,"http://maps.google.com/maps?q=12606 MAIN STREET,+MAYER,+AZ+86333&hl=en"
ZUNI POLICE DEPARTMENT,ZUNI TRIBAL BUILDING,1203B STATE HIGHWAY 53,ZUNI,NM,87327,"http://maps.google.com/maps?q=1203B STATE HIGHWAY 53,+ZUNI,+NM+87327&hl=en"
