Participant,CollectionSite,Address,City,State,Zip,MapURL
20TH JUDICIAL DISCTICT DRUG CRIME TASK FORCE,GOODS CASH SAVER FOOD STORE,129 BONE ST.,CLINTON,AR,72031,"http://maps.google.com/maps?q=129 BONE ST.,+CLINTON,+AR+72031&hl=en"
5TH DRUG TASK FORCE,FALL FEST,DOWNTOWN,RUSSELLVILLE,AR,72801,"http://maps.google.com/maps?q=DOWNTOWN,+RUSSELLVILLE,+AR+72801&hl=en"
ADAIR COUNTY SHERIFF'S OFFICE,ADAIR COUNTY SHERIFF'S OFFICE,215 N. FRANKLIN,KIRKSVILLE,MO,63501,"http://maps.google.com/maps?q=215 N. FRANKLIN,+KIRKSVILLE,+MO+63501&hl=en"
ALMA POLICE DEPARTMENT,ALMA POLICE DEPARTMENT PERMANENT DROP BOX,804 FAYETTEVILLE AVE,ALMA,AR,72921,"http://maps.google.com/maps?q=804 FAYETTEVILLE AVE,+ALMA,+AR+72921&hl=en"
ALTON POLICE DEPARTMENT,ALTON POLICE DEPARTMENT,1700 E. BROADWAY,ALTON,IL,62002,"http://maps.google.com/maps?q=1700 E. BROADWAY,+ALTON,+IL+62002&hl=en"
ARKANSAS COMMUNITY CORRECTION,WASHINGTON COUNTY SHERIFFS OFFICE,1155 WEST CLYDESDALE,FAYETTEVILLE,AR,72703,"http://maps.google.com/maps?q=1155 WEST CLYDESDALE,+FAYETTEVILLE,+AR+72703&hl=en"
ARNOLD POLICE DEPARTMENT,ARNOLD CITY HALL,2101 JEFFCO BLVD.,ARNOLD,MO,63010,"http://maps.google.com/maps?q=2101 JEFFCO BLVD.,+ARNOLD,+MO+63010&hl=en"
AUXVASSE POLICE DEPARTMENT,GRAND PRAIRIE BAPTIST CHURCH,108 N. MAIN STREET,AUXVASSE,MO,65231,"http://maps.google.com/maps?q=108 N. MAIN STREET,+AUXVASSE,+MO+65231&hl=en"
BALDWIN CITY POLICE DEPARTMENT,BALDWIN CITY POLICE DEPARTMENT,811 8TH STREET,BALDWIN CITY,KS,66006,"http://maps.google.com/maps?q=811 8TH STREET,+BALDWIN CITY,+KS+66006&hl=en"
BALLWIN POLICE DEPARTMENT,BALLWIN POLICE DEPARTMENT,300 PARK DRIVE,BALLWIN,MO,63011,"http://maps.google.com/maps?q=300 PARK DRIVE,+BALLWIN,+MO+63011&hl=en"
BARTLESVILLE OKLAHOMA PD,BARTLESVILLE PD,615 S JOHNSTONE AVE,BARTLESVILLE,OK,74003,"http://maps.google.com/maps?q=615 S JOHNSTONE AVE,+BARTLESVILLE,+OK+74003&hl=en"
BARTLESVILLE OKLAHOMA PD,FIRE STATION NO. 3,100 SE MADISON BLVD,BARTLESVILLE,OK,74006,"http://maps.google.com/maps?q=100 SE MADISON BLVD,+BARTLESVILLE,+OK+74006&hl=en"
BARTLESVILLE OKLAHOMA PD,FIRE STATION NO. 4,3501 SE PRICE RD,BARTLESVILLE,OK,74006,"http://maps.google.com/maps?q=3501 SE PRICE RD,+BARTLESVILLE,+OK+74006&hl=en"
BASEHOR POLICE DEPT.,BASEHOR LIBRARY DIANA WEAVER - CONTACT PERSON,1400 158TH ST.,BASEHOR,KS,66007,"http://maps.google.com/maps?q=1400 158TH ST.,+BASEHOR,+KS+66007&hl=en"
BAXTER COUNTY SHERIFFS DEPARTMENT,BAXTER COUNTY SHERIFF'S OFFICE PERMANENT DROP BOX,904 HIGHWAY 62 WEST,MOUNTAIN HOME,AR,72653,"http://maps.google.com/maps?q=904 HIGHWAY 62 WEST,+MOUNTAIN HOME,+AR+72653&hl=en"
BAXTER COUNTY SHERIFFS DEPARTMENT,LOWE'S HARDWARE STORE,124 CHARLES BLACKBURN DR,MOUNTAIN HOME,AR,72653,"http://maps.google.com/maps?q=124 CHARLES BLACKBURN DR,+MOUNTAIN HOME,+AR+72653&hl=en"
BELLA VISTA POLICE DEPARTMENT,BELLA VISTA POLICE DEPARTMENT PERMANENT DROP BOX,105 TOWN CENTER,BELLA VISTA,AR,72714,"http://maps.google.com/maps?q=105 TOWN CENTER,+BELLA VISTA,+AR+72714&hl=en"
BELLEFONTAINE NEIGHBORS POLICE DEPARTMENT,BELLEFONTAINE NEIGHBORS POLICE DEPARTMENT,9641 BELLEFONTAINE RD,SAINT LOUIS,MO,63137,"http://maps.google.com/maps?q=9641 BELLEFONTAINE RD,+SAINT LOUIS,+MO+63137&hl=en"
BENTON COUNTY SHERIFF'S OFFICE,ASP TROOP L HEADQUARTERS,900 SOUTH 48TH STREET,SPRINGDALE,AR,72766,"http://maps.google.com/maps?q=900 SOUTH 48TH STREET,+SPRINGDALE,+AR+72766&hl=en"
BENTON COUNTY SHERIFF'S OFFICE,BENTON COUNTY SHERIFF'S OFFICE PERMANENT DROP BOX,1300 SW 14TH STREET,BENTONVILLE,AR,72712,"http://maps.google.com/maps?q=1300 SW 14TH STREET,+BENTONVILLE,+AR+72712&hl=en"
BLUE SPRINGS POLICE DEPARTMENT,BLUE SPRINGS POLICE DEPARTMENT,1100 SW SMITH STREET,BLUE SPRINGS,MO,64015,"http://maps.google.com/maps?q=1100 SW SMITH STREET,+BLUE SPRINGS,+MO+64015&hl=en"
BLUE SPRINGS POLICE DEPARTMENT,PRICE CHOPPER AT PHARMACY,1100 SW 7 HIGHWAY,BLUE SPRINGS,MO,64014,"http://maps.google.com/maps?q=1100 SW 7 HIGHWAY,+BLUE SPRINGS,+MO+64014&hl=en"
BLUE SPRINGS POLICE DEPARTMENT,PRICE CHOPPER AT PHARMACY,1305 NW 7 HIGHWAY,BLUE SPRINGS,MO,64015,"http://maps.google.com/maps?q=1305 NW 7 HIGHWAY,+BLUE SPRINGS,+MO+64015&hl=en"
BOLIVAR POLICE DEPARTMENT,PUBLIC SAFETY BUILDING BOLIVAR POLICE DEPARTMENT,211 W WALNUT ST,BOLIVAR,MO,65613,"http://maps.google.com/maps?q=211 W WALNUT ST,+BOLIVAR,+MO+65613&hl=en"
BONNER SPRINGS POLICE DEPARTMENT,BONNER SPRINGS PRICE CHOPPER,501 COMMERCIAL DRIVE,BONNER SPRINGS,KS,66012,"http://maps.google.com/maps?q=501 COMMERCIAL DRIVE,+BONNER SPRINGS,+KS+66012&hl=en"
BOONE COUNTY SHERIFF'S DEPT.,ASHLAND POLICE DEPARTMENT,109 E. BROADWAY,ASHLAND,MO,65010,"http://maps.google.com/maps?q=109 E. BROADWAY,+ASHLAND,+MO+65010&hl=en"
BOONE COUNTY SHERIFF'S DEPT.,CENTRALIA POLICE DEPT. LOBBY,114 S. ROLLINS,CENTRALIA,MO,65240,"http://maps.google.com/maps?q=114 S. ROLLINS,+CENTRALIA,+MO+65240&hl=en"
BOONE COUNTY SHERIFF'S DEPT.,HALLSVILLE POLICE DEPARTMENT,202 HIGHWAY 124 EAST,HALLSVILLE,MO,65255,"http://maps.google.com/maps?q=202 HIGHWAY 124 EAST,+HALLSVILLE,+MO+65255&hl=en"
BOONE COUNTY SHERIFF'S DEPT.,HARRY S. TRUMAN VA HOSPITAL,800 HOSPITAL DRIVE,COLUMBIA,MO,65201,"http://maps.google.com/maps?q=800 HOSPITAL DRIVE,+COLUMBIA,+MO+65201&hl=en"
BOONE COUNTY SHERIFF'S DEPT.,HICKMAN HIGH SCHOOL,1104 N. PROVIDENCE RD.,COLUMBIA,MO,65203,"http://maps.google.com/maps?q=1104 N. PROVIDENCE RD.,+COLUMBIA,+MO+65203&hl=en"
BOONE COUNTY SHERIFF'S DEPT.,MU STUDENT CENTER UNIVERSITY OF MISSOURI - COLUMBIA,2500 MU STUDENT CENTER,COLUMBIA,MO,65211,"http://maps.google.com/maps?q=2500 MU STUDENT CENTER,+COLUMBIA,+MO+65211&hl=en"
BOONE COUNTY SHERIFF'S DEPT.,ROCK BRIDGE HIGH SCHOOL,4303 S. PROVIDENCE RD.,COLUMBIA,MO,65203,"http://maps.google.com/maps?q=4303 S. PROVIDENCE RD.,+COLUMBIA,+MO+65203&hl=en"
BOONE COUNTY SHERIFF'S OFFICE,BOONE COUNTY SHERIFF'S OFFICE PERMANENT DROP BOX,5800 LAW DRIVE,HARRISON,AR,72601,"http://maps.google.com/maps?q=5800 LAW DRIVE,+HARRISON,+AR+72601&hl=en"
BOONEVILLE POLICE DEPARTMENT,BOONEVILLE POLICE DEPARTMENT PERMANENT DROP BOX,497 EAST MAIN ST.,BOONEVILLE,AR,72927,"http://maps.google.com/maps?q=497 EAST MAIN ST.,+BOONEVILLE,+AR+72927&hl=en"
BOONVILLE POLICE DEPARTMENT,BOONVILLE FIRE DEPT.,500 BINGHAM ROAD,BOONVILLE,MO,65233,"http://maps.google.com/maps?q=500 BINGHAM ROAD,+BOONVILLE,+MO+65233&hl=en"
BRANSON POLICE DEPARTMENT,COX MEDICAL CENTER BRANSON PHARMACY,525 BRANSON LANDING BLVD,BRANSON,MO,65616,"http://maps.google.com/maps?q=525 BRANSON LANDING BLVD,+BRANSON,+MO+65616&hl=en"
BRENTWOOD POLICE DEPARTMENT,BRENTWOOD POLICE DEPARTMENT,272 HANLEY INDUSTRIAL COURT,SAINT LOUIS,MO,63144,"http://maps.google.com/maps?q=272 HANLEY INDUSTRIAL COURT,+SAINT LOUIS,+MO+63144&hl=en"
BRIDGETON POLICE DEPARTMENT,BRIDGETON POLICE DEPARTMENT,12355 NATURAL BRIDGE RD,BRIDGETON,MO,63044,"http://maps.google.com/maps?q=12355 NATURAL BRIDGE RD,+BRIDGETON,+MO+63044&hl=en"
BRISTOW OKLAHOMA PD,WAL-MART,105 W HIGHWAY 16,BRISTOW,OK,74010,"http://maps.google.com/maps?q=105 W HIGHWAY 16,+BRISTOW,+OK+74010&hl=en"
BROWN COUNTY SHERIFF'S OFFICE,MT. STERLING IGA,200 PITTSFIELD ROAD,MOUNT STERLING,IL,62353,"http://maps.google.com/maps?q=200 PITTSFIELD ROAD,+MOUNT STERLING,+IL+62353&hl=en"
BUREAU OF INDIAN AFFAIRS - OJS,NORTHERN TRIBAL HEALTH SYSTEMS,7600 S HIGHWAY 69 A,MIAMI,OK,74355,"http://maps.google.com/maps?q=7600 S HIGHWAY 69 A,+MIAMI,+OK+74355&hl=en"
BURLINGTON POLICE DEPT,COFFEY CO. HOSPITAL AMBULANCE BAY,801 N 4TH ST.,BURLINGTON,KS,66839,"http://maps.google.com/maps?q=801 N 4TH ST.,+BURLINGTON,+KS+66839&hl=en"
BUTLER POLICE DEPARTMENT,BATES COUNTY HEALTH DEPARTMENT,501 N ORANGE,BUTLER,MO,64730,"http://maps.google.com/maps?q=501 N ORANGE,+BUTLER,+MO+64730&hl=en"
BUTLER POLICE DEPT.,BATES COUNTY HEALTH DEPARTMENT,501 N. ORANGE,BUTLER,MO,64730,"http://maps.google.com/maps?q=501 N. ORANGE,+BUTLER,+MO+64730&hl=en"
CALIFORNIA POLICE DEPARTMENT,CALIFORNIA POLICE DEPARTMENT LOBBY,500 S. OAK,CALIFORNIA,MO,65018,"http://maps.google.com/maps?q=500 S. OAK,+CALIFORNIA,+MO+65018&hl=en"
CALLAWAY COUNTY SHERIFF'S OFFICE,CALLAWAY 2 WATER DISTRICT,2610 N. WESTMINSTER AVE,FULTON,MO,65251,"http://maps.google.com/maps?q=2610 N. WESTMINSTER AVE,+FULTON,+MO+65251&hl=en"
CAMDEN COUNTY SHERIFF'S OFFICE,CAMDEN COUNTY SHERIFF'S OFFICE,1 COURT CIR STE 13,CAMDENTON,MO,65020,"http://maps.google.com/maps?q=1 COURT CIR STE 13,+CAMDENTON,+MO+65020&hl=en"
CASSVILLE POLICE DEPARTMENT,CITY HALL/CASSVILLE POLICE DEPT,300 MAIN STREET,CASSVILLE,MO,65625,"http://maps.google.com/maps?q=300 MAIN STREET,+CASSVILLE,+MO+65625&hl=en"
CENTERTON POLICE DEPARTMENT,CENTERTON POLICE DEPARTMENT PERMANENT DROP BOX,220 MUNICIPAL DR,CENTERTON,AR,72719,"http://maps.google.com/maps?q=220 MUNICIPAL DR,+CENTERTON,+AR+72719&hl=en"
CHANUTE POLICE DEPT,MEDICINE SHOPPE,421 W. MAIN,CHANUTE,KS,66720,"http://maps.google.com/maps?q=421 W. MAIN,+CHANUTE,+KS+66720&hl=en"
CHEROKEE COUNTY SHERIFF'S OFFICE,APPLE MARKET,103 NORTH EAST AVENUE,COLUMBUS,KS,66725,"http://maps.google.com/maps?q=103 NORTH EAST AVENUE,+COLUMBUS,+KS+66725&hl=en"
CHEROKEE COUNTY SHERIFF'S OFFICE,GALENA CITY HALL,211 WEST 7TH STREET,GALENA,KS,66739,"http://maps.google.com/maps?q=211 WEST 7TH STREET,+GALENA,+KS+66739&hl=en"
CHEROKEE COUNTY SHERIFF'S OFFICE,MARVINS IGA,1400 MILITARY AVENUE,BAXTER SPRINGS,KS,66713,"http://maps.google.com/maps?q=1400 MILITARY AVENUE,+BAXTER SPRINGS,+KS+66713&hl=en"
CHESTERFIELD POLICE DEPARTMENT,CHESTERFIELD CITY HALL,690 CHESTERFIELD PARKWAY WEST,CHESTERFIELD,MO,63017,"http://maps.google.com/maps?q=690 CHESTERFIELD PARKWAY WEST,+CHESTERFIELD,+MO+63017&hl=en"
CHESTERFIELD POLICE DEPARTMENT,CLARKSON VALLEY CITY HALL PARKING LOT,15933 CLAYTON ROAD(CLARKSON VALLEY),BALLWIN,MO,63011,"http://maps.google.com/maps?q=15933 CLAYTON ROAD,+BALLWIN,+MO+63011&hl=en"
CLARKSVILLE POLICE DEPARTMENT,CLARKSVILLE POLICE DEPARTMENT PERMANENT DROP BOX,1008 WEST MAIN STREET,CLARKSVILLE,AR,72830,"http://maps.google.com/maps?q=1008 WEST MAIN STREET,+CLARKSVILLE,+AR+72830&hl=en"
CLAYTON POLICE DEPARTMENT,CENTER OF CLAYTON,50 GAY AVENUE,CLAYTON,MO,63105,"http://maps.google.com/maps?q=50 GAY AVENUE,+CLAYTON,+MO+63105&hl=en"
COAL HILL POLICE DEPARTMENT,COAL HILL POLICE DEPARTMENT,101 EAST HIGHWAY 64,COAL HILL,AR,72832,"http://maps.google.com/maps?q=101 EAST HIGHWAY 64,+COAL HILL,+AR+72832&hl=en"
COFFEYVILLE POLICE DEPARTMENT,COFFEYVILLE POLICE DEPARTMENT,1206 W. 11TH STREET,COFFEYVILLE,KS,67337,"http://maps.google.com/maps?q=1206 W. 11TH STREET,+COFFEYVILLE,+KS+67337&hl=en"
COLUMBIA POLICE DEPARTMENT,COLUMBIA POLICE DEPARTMENT LOBBY (TRIPLE BOXES),1020 NORTH MAIN STREET,COLUMBIA,IL,62236,"http://maps.google.com/maps?q=1020 NORTH MAIN STREET,+COLUMBIA,+IL+62236&hl=en"
COTTLEVILLE POLICE DEPT.,COTTLEVILLE POLICE DEPT,5490 5TH STREET,SAINT CHARLES,MO,63304,"http://maps.google.com/maps?q=5490 5TH STREET,+SAINT CHARLES,+MO+63304&hl=en"
COTTLEVILLE POLICE DEPT.,COTTLEVILLE POLICE DEPT.,5490 FIFTH STREET,COTTLEVILLE,MO,63304,"http://maps.google.com/maps?q=5490 FIFTH STREET,+COTTLEVILLE,+MO+63304&hl=en"
CRAWFORD COUNTY SHERIFF'S OFFICE,CRAWFORD COUNTY JUSTICE CENTER PERMANENT DROP BOX,4235 ALMA HWY,VAN BUREN,AR,72956,"http://maps.google.com/maps?q=4235 ALMA HWY,+VAN BUREN,+AR+72956&hl=en"
CREVE COEUR POLICE DEPT,CREVE COEUR POLICE DEPT. FRONT LOBBY,300 NORTH NEW BALLAS,CREVE COEUR,MO,63141,"http://maps.google.com/maps?q=300 NORTH NEW BALLAS,+CREVE COEUR,+MO+63141&hl=en"
CROCKER POLICE DEPARTMENT,CROCKER POLICE DEPARTMENT CITY HALL,108 S COMMERCIAL ST.PO,CROCKER,MO,65452,"http://maps.google.com/maps?q=108 S COMMERCIAL ST.,+CROCKER,+MO+65452&hl=en"
CRYSTAL CITY POLICE DEPARTMENT,CRYSTAL CITY POLICE DEPARTMENT LOBBY,130 MISSISSIPPI AVE,CRYSTAL CITY,MO,63019,"http://maps.google.com/maps?q=130 MISSISSIPPI AVE,+CRYSTAL CITY,+MO+63019&hl=en"
DADE COUNTY SHERIFF,GREENFIELD PHARMACY,105 SOUTH GRANDE,GREENFIELD,MO,65661,"http://maps.google.com/maps?q=105 SOUTH GRANDE,+GREENFIELD,+MO+65661&hl=en"
DADE COUNTY SHERIFF,MFA OIL,401 MAIN STREET,LOCKWOOD,MO,65682,"http://maps.google.com/maps?q=401 MAIN STREET,+LOCKWOOD,+MO+65682&hl=en"
DEA TULSA RESIDENT OFFICE,NEWS ON 6,303 N. BOSTON AVENUE,TULSA,OK,74103,"http://maps.google.com/maps?q=303 N. BOSTON AVENUE,+TULSA,+OK+74103&hl=en"
DENT COUNTY SHERIFF'S OFFICE,RIVERWAYS BANK PARKING LOT,600 S. MAIN,SALEM,MO,65560,"http://maps.google.com/maps?q=600 S. MAIN,+SALEM,+MO+65560&hl=en"
DES PERES DEPARTMENT OF PUBLIC SAFETY,THE LODGE,1050 DES PERES ROAD,DES PERES,MO,63131,"http://maps.google.com/maps?q=1050 DES PERES ROAD,+DES PERES,+MO+63131&hl=en"
DESLOGE POLICE DEPARTMENT,PARKLAND HEALTH MART PHARMACY,617 NORTH COWLING ST,PARK HILLS,MO,63601,"http://maps.google.com/maps?q=617 NORTH COWLING ST,+PARK HILLS,+MO+63601&hl=en"
DOUGLAS COUNTY SHERIFF'S OFFICE,DOUGLAS COUNTY SHERIFF'S OFFICE GARAGE PARKING LOT ON EAST SIDE OF BUILDING,111 E. 11TH STREET,LAWRENCE,KS,66044,"http://maps.google.com/maps?q=111 E. 11TH STREET,+LAWRENCE,+KS+66044&hl=en"
DOUGLAS COUNTY SHERIFF'S OFFICE,HY-VEE,4000 W 6TH ST,LAWRENCE,KS,66049,"http://maps.google.com/maps?q=4000 W 6TH ST,+LAWRENCE,+KS+66049&hl=en"
DOUGLAS COUNTY SHERIFFS OFFICE,DOUGLAS COUNTY SHERIFF'S OFFICE,209 SE 2ND AVE209 SE LINCOLN AVE,AVA,MO,65608,"http://maps.google.com/maps?q=209 SE 2ND AVE,+AVA,+MO+65608&hl=en"
EAST ALTON POLICE DEPT,EAST ALTON POLICE DEPARTMENT,211 N SHAMROCK,EAST ALTON,IL,62024,"http://maps.google.com/maps?q=211 N SHAMROCK,+EAST ALTON,+IL+62024&hl=en"
EDWARDSVILLE POLICE DEPARTMENT,EDWARDSVILLE POLICE DEPARTMENT FRONT / MAIN LOBBY,333 SOUTH MAIN STREET,EDWARDSVILLE,IL,62025,"http://maps.google.com/maps?q=333 SOUTH MAIN STREET,+EDWARDSVILLE,+IL+62025&hl=en"
EL DORADO SPRINGS POLICE DEPARTMENT,EL DORADO SPRINGS POLICE DEPT POLICE STATION,1207 SOUTH MAIN STREET,EL DORADO SPRINGS,MO,64744,"http://maps.google.com/maps?q=1207 SOUTH MAIN STREET,+EL DORADO SPRINGS,+MO+64744&hl=en"
ELLISVILLE POLICE DEPARTMENT,ELLISVILLE POLICE DEPARTMENT,37 WEIS AVENUE,ELLISVILLE,MO,63011,"http://maps.google.com/maps?q=37 WEIS AVENUE,+ELLISVILLE,+MO+63011&hl=en"
EMPORIA POLICE DEPT.,FLINT HILLS COMMUNITY HEALTH CENTER,420 WEST 15TH AVE,EMPORIA,KS,66801,"http://maps.google.com/maps?q=420 WEST 15TH AVE,+EMPORIA,+KS+66801&hl=en"
EUREKA POLICE DEPARTMENT,EUREKA PD,120 CITY HALL DRIVE,EUREKA,MO,63025,"http://maps.google.com/maps?q=120 CITY HALL DRIVE,+EUREKA,+MO+63025&hl=en"
EUREKA SPRINGS POLICE DEPARTMENT,EUREKA SPRINGS POLICE DEPARTMENT PERMANENT DROP BOX,147 PASSION PLAY ROAD,EUREKA SPRINGS,AR,72632,"http://maps.google.com/maps?q=147 PASSION PLAY ROAD,+EUREKA SPRINGS,+AR+72632&hl=en"
EXCELSIOR SPRING POLICE DEPARTMENT,EXCELSIOR SPRINGS POLICE DEPARTMENT LOBBY,301 S. MAIN STREET,EXCELSIOR SPRINGS,MO,64024,"http://maps.google.com/maps?q=301 S. MAIN STREET,+EXCELSIOR SPRINGS,+MO+64024&hl=en"
FAIR GROVE POLICE DEPARTMENT,FAMILY PHARMACY,49 E. OLD MILL RD,FAIR GROVE,MO,65648,"http://maps.google.com/maps?q=49 E. OLD MILL RD,+FAIR GROVE,+MO+65648&hl=en"
FAIRFIELD BAY POLICE DEPARTMENT,FAIRFIELD BAY POLICE DEPARTMENT PERMANENT DROP BOX,101 LITTLE ROCK DRIVE,FAIRFIELD BAY,AR,72088,"http://maps.google.com/maps?q=101 LITTLE ROCK DRIVE,+FAIRFIELD BAY,+AR+72088&hl=en"
FAIRVIEW HEIGHTS POLICE DEPARTMENT,FAIRVIEW HEIGHTS POLICE DEPT.,10027 BUNKUM ROAD,FAIRVIEW HEIGHTS,IL,62208,"http://maps.google.com/maps?q=10027 BUNKUM ROAD,+FAIRVIEW HEIGHTS,+IL+62208&hl=en"
FAIRVIEW HEIGHTS POLICE DEPARTMENT,ST CLAIR SQUARE,134 ST CLAIR SQUARE,FAIRVIEW HEIGHTS,IL,62208,"http://maps.google.com/maps?q=134 ST CLAIR SQUARE,+FAIRVIEW HEIGHTS,+IL+62208&hl=en"
FAIRWAY POLICE DEPT.,HEN HOUSE GROCERY PHARMACY SITE,2724 W. 53RD STREET,FAIRWAY,KS,66205,"http://maps.google.com/maps?q=2724 W. 53RD STREET,+FAIRWAY,+KS+66205&hl=en"
FARMINGTON POLICE DEPARTMENT,FARMINGTON POLICE DEPARTMENT PERMANENT DROP BOX,354 WEST MAIN,FARMINGTON,AR,72730,"http://maps.google.com/maps?q=354 WEST MAIN,+FARMINGTON,+AR+72730&hl=en"
FARMINGTON POLICE DEPARTMENT,FARMINGTON POLICE DEPT.,310 STE. GENEVIEVE AVE,FARMINGTON,MO,63640,"http://maps.google.com/maps?q=310 STE. GENEVIEVE AVE,+FARMINGTON,+MO+63640&hl=en"
FAYETTEVILLE POLICE DEPARTMENT,HARPS MARKETPLACE #124,1274 N. COLORADO DR,FAYETTEVILLE,AR,72704,"http://maps.google.com/maps?q=1274 N. COLORADO DR,+FAYETTEVILLE,+AR+72704&hl=en"
FESTUS POLICE DEPARTMENT,FESTUS POLICE DEPARTMENT,100 PARK AVE,FESTUS,MO,63028,"http://maps.google.com/maps?q=100 PARK AVE,+FESTUS,+MO+63028&hl=en"
FLORISSANT POLICE DEPARTMENT,FLORISSANT POLICE DEPARTMENT LOBBY,1700 NORTH HIGHWAY 67,FLORISSANT,MO,63033,"http://maps.google.com/maps?q=1700 NORTH HIGHWAY 67,+FLORISSANT,+MO+63033&hl=en"
FORSYTH POLICE DEPARTMENT,COUNTRY MART,15720 US HWY 160,FORSYTH,MO,65653,"http://maps.google.com/maps?q=15720 US HWY 160,+FORSYTH,+MO+65653&hl=en"
FORT SMITH POLICE DEPARTMENT,FORT SMITH POLICE DEPARTMENT PERMANENT DROP BOX,100 SOUTH 10TH STREET,FORT SMITH,AR,72901,"http://maps.google.com/maps?q=100 SOUTH 10TH STREET,+FORT SMITH,+AR+72901&hl=en"
FRANKLIN COUNTY NARCOTICS ENFORCEMENT UNIT,SULLIVAN POLICE DEPARTMENT,106 PROGRESS PKWY,SULLIVAN,MO,63080,"http://maps.google.com/maps?q=106 PROGRESS PKWY,+SULLIVAN,+MO+63080&hl=en"
FRANKLIN COUNTY NARCOTICS ENFORCEMENT UNIT,UNION POLICE DEPARTMENT,119 S CHURCH ST,UNION,MO,63084,"http://maps.google.com/maps?q=119 S CHURCH ST,+UNION,+MO+63084&hl=en"
FRANKLIN COUNTY NARCOTICS ENFORCEMENT UNIT,WASHINGTON POLICE DEPARTMENT,301 JEFFERSON STREET,WASHINGTON,MO,63090,"http://maps.google.com/maps?q=301 JEFFERSON STREET,+WASHINGTON,+MO+63090&hl=en"
FRONTENAC POLICE DEPARTMENT,FRONTENAC POLICE STATION DEPARTMENT LOBBY,10555 CLAYTON ROAD,FRONTENAC,MO,63131,"http://maps.google.com/maps?q=10555 CLAYTON ROAD,+FRONTENAC,+MO+63131&hl=en"
FULTON POLICE DEPARTMENT,FULTON FIRE DEPARTMENT,151 W. TENNYSON ROAD,FULTON,MO,65251,"http://maps.google.com/maps?q=151 W. TENNYSON ROAD,+FULTON,+MO+65251&hl=en"
GALLATIN POLICE DEPARTMENT,GALLATIN POLICE DEPARTMENT,112 E GRAND,GALLATIN,MO,64640,"http://maps.google.com/maps?q=112 E GRAND,+GALLATIN,+MO+64640&hl=en"
GARDEN CITY POLICE DEPARTMENT,GARDEN CITY POLICE DEPARTMENT,106 N. 3RD,GARDEN CITY,MO,64747,"http://maps.google.com/maps?q=106 N. 3RD,+GARDEN CITY,+MO+64747&hl=en"
GARDNER POLICE DEPT.,PRICE CHOPPER,830 E. MAIN STREET,GARDNER,KS,66030,"http://maps.google.com/maps?q=830 E. MAIN STREET,+GARDNER,+KS+66030&hl=en"
GENTRY POLICE DEPARTMENT,GENTRY POLICE DEPARTMENT PERMANENT DROP BOX,628 E. THIRD ST.,GENTRY,AR,72734,"http://maps.google.com/maps?q=628 E. THIRD ST.,+GENTRY,+AR+72734&hl=en"
GLENDALE POLICE DEPARTMENT,GLENDALE CITY AUDITORIUM,424 N SAPPINGTON ROAD,GLENDALE,MO,63122,"http://maps.google.com/maps?q=424 N SAPPINGTON ROAD,+GLENDALE,+MO+63122&hl=en"
GRAIN VALLEY POLICE DEPARTMENT,CITY HALL PARKING LOT,711 MAIN STREET,GRAIN VALLEY,MO,64029,"http://maps.google.com/maps?q=711 MAIN STREET,+GRAIN VALLEY,+MO+64029&hl=en"
GRANBY POLICE DEPARTMENT,RAMSEY'S GROCERY,469 W VALLEY ST,GRANBY,MO,64844,"http://maps.google.com/maps?q=469 W VALLEY ST,+GRANBY,+MO+64844&hl=en"
GRANDVIEW POLICE DEPT.,PRICE CHOPPER,12220 SOUTH US 71 HWY,GRANDVIEW,MO,64030,"http://maps.google.com/maps?q=12220 SOUTH US 71 HWY,+GRANDVIEW,+MO+64030&hl=en"
GRAVETTE POLICE DEPARTMENT,GRAVETTE POLICE DEPARTMENT PERMANENT DROP BOX,606 1ST AVE SE,GRAVETTE,AR,72736,"http://maps.google.com/maps?q=606 1ST AVE SE,+GRAVETTE,+AR+72736&hl=en"
GREENE COUNTY SHERIFF'S OFFICE,COX SOUTH TURNER CENTER,1000 E. PRIMROSE,SPRINGFIELD,MO,65807,"http://maps.google.com/maps?q=1000 E. PRIMROSE,+SPRINGFIELD,+MO+65807&hl=en"
GREENE COUNTY SHERIFF'S OFFICE,DAN'S DRUG MART,2625 N. KANSAS EXPRESSWAY,SPRINGFIELD,MO,65803,"http://maps.google.com/maps?q=2625 N. KANSAS EXPRESSWAY,+SPRINGFIELD,+MO+65803&hl=en"
GREENE COUNTY SHERIFF'S OFFICE,FAMILY PHARMACY,527 W. KEARNEY,SPRINGFIELD,MO,65803,"http://maps.google.com/maps?q=527 W. KEARNEY,+SPRINGFIELD,+MO+65803&hl=en"
GREENE COUNTY SHERIFF'S OFFICE,GROVE PHARMACY,1636 S. GLENSTONE,SPRINGFIELD,MO,65804,"http://maps.google.com/maps?q=1636 S. GLENSTONE,+SPRINGFIELD,+MO+65804&hl=en"
GREENE COUNTY SHERIFF'S OFFICE,HYVEE PHARMACY,1720 W. BATTLEFIELD,SPRINGFIELD,MO,65807,"http://maps.google.com/maps?q=1720 W. BATTLEFIELD,+SPRINGFIELD,+MO+65807&hl=en"
GREENE COUNTY SHERIFF'S OFFICE,ORCHARD HILLS PHARMACY,3816A W. CHESTNUT EXPWY,SPRINGFIELD,MO,65802,"http://maps.google.com/maps?q=3816A W. CHESTNUT EXPWY,+SPRINGFIELD,+MO+65802&hl=en"
GRUNDY COUNTY LAW ENFORCEMENT CENTER,GRUNDY COUNTY LAW ENFORCEMENT CENTER,610 MAIN STREET,TRENTON,MO,64683,"http://maps.google.com/maps?q=610  MAIN STREET,+TRENTON,+MO+64683&hl=en"
HARRISON POLICE DEPARTMENT,HARRISON POLICE DEPARTMENT,116 SOUTH SPRING STREET,HARRISON,AR,72601,"http://maps.google.com/maps?q=116 SOUTH SPRING STREET,+HARRISON,+AR+72601&hl=en"
HARRISONVILLE POLICE DEPARTMENT,CVS PHARMACY,300 S. COMMERICAL ST.,HARRISONVILLE,MO,64701,"http://maps.google.com/maps?q=300 S. COMMERICAL ST.,+HARRISONVILLE,+MO+64701&hl=en"
HARRISONVILLE POLICE DEPARTMENT,HARRISONVILLE POLICE DEPARTMENT,205 N. LEXINGTON,HARRISONVILLE,MO,64701,"http://maps.google.com/maps?q=205 N. LEXINGTON,+HARRISONVILLE,+MO+64701&hl=en"
HAZELWOOD POLICE DEPARTMENT,CITY HALL/POLICE COMPLEX,415 ELM GROVE,HAZELWOOD,MO,63042,"http://maps.google.com/maps?q=415 ELM GROVE,+HAZELWOOD,+MO+63042&hl=en"
HENRY COUNTY SHERIFF'S OFFICE,MERRYFIELD PHARMACY,200 WEST BENTON,WINDSOR,MO,65360,"http://maps.google.com/maps?q=200 WEST BENTON,+WINDSOR,+MO+65360&hl=en"
HENRY COUNTY SHERIFF'S OFFICE,SUMMERS PHARMACY OUT FRONT,605 PAWNEE,CLINTON,MO,64735,"http://maps.google.com/maps?q=605 PAWNEE,+CLINTON,+MO+64735&hl=en"
HIGGINSVILLE POLICE DEPARTMENT,WALMART PARKING LOT,1180 W. 19TH ST.,HIGGINSVILLE,MO,64037,"http://maps.google.com/maps?q=1180  W.  19TH ST.,+HIGGINSVILLE,+MO+64037&hl=en"
HOLLISTER POLICE DEPARTMENT,FAMILY PHARMACY,180 MALL ROAD,HOLLISTER,MO,65672,"http://maps.google.com/maps?q=180 MALL ROAD,+HOLLISTER,+MO+65672&hl=en"
HOLT COUNTY SHERIFF OFFICE,HOLT COUNTY SHERIFF OFFICE,107 S MAIN,OREGON,MO,64473,"http://maps.google.com/maps?q=107 S MAIN,+OREGON,+MO+64473&hl=en"
HOLTS SUMMIT POLICE DEPARTMENT,HOLTS SUMMIT CITY HALL PARKING LOT,245 SOUTH SUMMIT DRIVE,HOLTS SUMMIT,MO,65043,"http://maps.google.com/maps?q=245 SOUTH SUMMIT DRIVE,+HOLTS SUMMIT,+MO+65043&hl=en"
HOWELL COUNTY SHERIFF'S OFFICE,HOWELL COUNTY SHERIFF'S OFFICE NORTH END OF PARKING LOT,1106 MISSOURI AVENUE,WEST PLAINS,MO,65775,"http://maps.google.com/maps?q=1106 MISSOURI AVENUE,+WEST PLAINS,+MO+65775&hl=en"
INDEPENDENCE POLICE DEPT.,INDEPENDENCE MISSOURI CITY HALL ACROSS THE STREET FROM THE POLICE DEPT IN THE PARKING LOT,111 E. MAPLE,INDEPENDENCE,MO,64050,"http://maps.google.com/maps?q=111 E. MAPLE,+INDEPENDENCE,+MO+64050&hl=en"
JACKSON COUNTY SHERIFF'S OFFICE,JACKSON COUNTY SHERIFF'S OFFICE,210 US HWY 75,HOLTON,KS,66436,"http://maps.google.com/maps?q=210  US HWY 75,+HOLTON,+KS+66436&hl=en"
JACKSON COUNTY SHERIFF'S OFFICE,JACKSON COUNTY SHERIFF'S OFFICE LOBBY,4001 NE LAKEWOOD CT,LEES SUMMIT,MO,64064,"http://maps.google.com/maps?q=4001 NE LAKEWOOD CT,+LEES SUMMIT,+MO+64064&hl=en"
JACKSON COUNTY SHERIFF'S OFFICE,JOHN KNOX VILLAGE PLACES RESTAURANT,1001 NW CHIPMAN ROAD,LEES SUMMIT,MO,64081,"http://maps.google.com/maps?q=1001 NW CHIPMAN ROAD,+LEES SUMMIT,+MO+64081&hl=en"
JACKSON COUNTY SHERIFF'S OFFICE,LEE'S SUMMIT MEDICAL CENTER EMERGENCY ROOM ENTRANCE,2100 SE BLUE PARKWAY,LEES SUMMIT,MO,64063,"http://maps.google.com/maps?q=2100 SE BLUE PARKWAY,+LEES SUMMIT,+MO+64063&hl=en"
JACKSON COUNTY SHERIFF'S OFFICE,LEE'S SUMMIT POLICE DEPARTMENT LOBBY,10 NE TUDOR ROAD,LEES SUMMIT,MO,64086,"http://maps.google.com/maps?q=10 NE TUDOR ROAD,+LEES SUMMIT,+MO+64086&hl=en"
JACKSON COUNTY SHERIFF'S OFFICE,ST. LUKE'S EAST HOSPITAL DIAGNOSTIC CENTER,100 NE ST. LUKE'S BLVD,LEES SUMMIT,MO,64086,"http://maps.google.com/maps?q=100 NE ST. LUKE'S BLVD,+LEES SUMMIT,+MO+64086&hl=en"
JASPER COUNTY SHERIFF'S OFFICE,JASPER COUNTY COURTHOUSE,601 PEARL AVE,JOPLIN,MO,64801,"http://maps.google.com/maps?q=601 PEARL AVE,+JOPLIN,+MO+64801&hl=en"
JEFFERSON CITY MISSOURI POLICE DEPARTMENT,JEFFERSON CITY POLICE HEADQUARTERS TRAINING ROOM ENTRANCE - SOUTHSIDE OF BUILDING,401 MONROE ST,JEFFERSON CITY,MO,65101,"http://maps.google.com/maps?q=401 MONROE ST,+JEFFERSON CITY,+MO+65101&hl=en"
JOHNSON CO COMM COLLEGE POLICE DEPT,JCCC CARLSEN CENTER NORTH MAIN ENTRANCE INTERSECTION OF COLLEGE BLVD & QUIVIRA,12345 COLLEGE BLVD,OVERLAND PARK,KS,66210,"http://maps.google.com/maps?q=12345 COLLEGE BLVD,+OVERLAND PARK,+KS+66210&hl=en"
JOHNSON COUNTY SHERIFF'S OFFICE,JOHNSON COUNTY COURTHOUSE,125 N CHERRY ST,OLATHE,KS,66061,"http://maps.google.com/maps?q=125 N CHERRY ST,+OLATHE,+KS+66061&hl=en"
KANSAS CITY KANSAS POLICE,CVS,4645 SHAWNEE DR,KANSAS CITY,KS,66106,"http://maps.google.com/maps?q=4645 SHAWNEE DR,+KANSAS CITY,+KS+66106&hl=en"
KANSAS CITY MISSOURI POLICE DEPT.,CHILDREN'S MERCY EAST CAMPUS,20300 E. VALLEY VIEW PKWY,INDEPENDENCE,MO,64057,"http://maps.google.com/maps?q=20300 E. VALLEY VIEW PKWY,+INDEPENDENCE,+MO+64057&hl=en"
KANSAS CITY MISSOURI POLICE DEPT.,CHILDREN'S MERCY KC,2401 GILLHAM ROAD,KANSAS CITY,MO,64108,"http://maps.google.com/maps?q=2401 GILLHAM ROAD,+KANSAS CITY,+MO+64108&hl=en"
KANSAS CITY MISSOURI POLICE DEPT.,CHILDREN'S MERCY NORTH CAMPUS,501 NW BARRY RD,KANSAS CITY,MO,64155,"http://maps.google.com/maps?q=501 NW BARRY RD,+KANSAS CITY,+MO+64155&hl=en"
KANSAS CITY MISSOURI POLICE DEPT.,CVS,4750 LEES SUMMIT RD,KANSAS CITY,MO,64136,"http://maps.google.com/maps?q=4750 LEES SUMMIT RD,+KANSAS CITY,+MO+64136&hl=en"
KANSAS CITY MISSOURI POLICE DEPT.,KCMO PD NORTH PATROL STATION BRAD STOTT,11000 NW PRAIRIE VIEW RD,KANSAS CITY,MO,64153,"http://maps.google.com/maps?q=11000 NW PRAIRIE VIEW RD,+KANSAS CITY,+MO+64153&hl=en"
KANSAS CITY MISSOURI POLICE DEPT.,KCMO PD SHOAL CREEK STATION,6801 PLEASANT VALLEY ROAD,KANSAS CITY,MO,64119,"http://maps.google.com/maps?q=6801 PLEASANT VALLEY ROAD,+KANSAS CITY,+MO+64119&hl=en"
KANSAS CITY MISSOURI POLICE DEPT.,KCMO PD SOUTH PATROL STATION,9701 MARION PARK,KANSAS CITY,MO,64137,"http://maps.google.com/maps?q=9701 MARION PARK,+KANSAS CITY,+MO+64137&hl=en"
KANSAS CITY MISSOURI POLICE DEPT.,LIBERTY HOSPITAL,2525 GLENN HENDREN DR.,LIBERTY,MO,64068,"http://maps.google.com/maps?q=2525 GLENN HENDREN DR.,+LIBERTY,+MO+64068&hl=en"
