Participant,CollectionSite,Address,City,State,Zip,MapURL
BLACKFEET LAW ENFORCEMENT,BLACKFEET COLLECTION,46 MUSEUM LOOP,BROWNING,MT,59417,"http://maps.google.com/maps?q=46 MUSEUM LOOP,+BROWNING,+MT+59417&hl=en"
BUREAU OF INDIAN AFFAIRS (BIA),BIA LAME DEER,100 SUNBEAR RD,LAME DEER,MT,59043,"http://maps.google.com/maps?q=100 SUNBEAR RD,+LAME DEER,+MT+59043&hl=en"
BUREAU OF INDIAN AFFAIRS (BIA),BIA OJS CROW AGENCY PD,124 RIVER ROAD,CROW AGENCY,MT,59022,"http://maps.google.com/maps?q=124 RIVER ROAD,+CROW AGENCY,+MT+59022&hl=en"
BUTTE_SILVER BOW LAW ENFORCEMENT,BUTTE PLAZA MALL,3100 HARRISON AVENUE,BUTTE,MT,59701,"http://maps.google.com/maps?q=3100 HARRISON AVENUE,+BUTTE,+MT+59701&hl=en"
CAMPBELL COUNTY SHERIFF'S OFFICE,CAMPBELL COUNTY SHERIFFS OFFICE,600 W. BOXELDER RD,GILLETTE,WY,82718,"http://maps.google.com/maps?q=600 W. BOXELDER RD,+GILLETTE,+WY+82718&hl=en"
CHIPPAWA CREE LAW ENFORCEMENT,CHIPPAWA CREE,535 CLINIC ROAD,BOX ELDER,MT,59521,"http://maps.google.com/maps?q=535 CLINIC ROAD,+BOX ELDER,+MT+59521&hl=en"
DEA - BILLINGS RESIDENT OFFICE,ELKS LODGE PARKING LOT,934 LEWIS AVENUE,BILLINGS,MT,59101,"http://maps.google.com/maps?q=934 LEWIS AVENUE,+BILLINGS,+MT+59101&hl=en"
FT. BELKNAP LAW ENFORCEMENT,FT. BELKNAP,456 GROS VENTRE AVENUE,HARLEM,MT,59526,"http://maps.google.com/maps?q=456 GROS VENTRE AVENUE,+HARLEM,+MT+59526&hl=en"
FT. PECK TRIBAL LAW ENFORCEMENT,POPLAR COMMUNITY HOSPITAL,211H ST. E POPLAR,POPLAR,MT,59255,"http://maps.google.com/maps?q=211H ST. E POPLAR,+POPLAR,+MT+59255&hl=en"
GALLATIN COUNTY SHERIFF'S OFFICE/ BOZEMAN CITY POL,GALLATIN COUNTY LAW AND JUSTICE CENTER,615 SOUTH 16TH AVE,BOZEMAN,MT,59715,"http://maps.google.com/maps?q=615 SOUTH 16TH AVE,+BOZEMAN,+MT+59715&hl=en"
GARFIELD COUNTY SHERIFF'S OFFICE,GARFIELD COUNTY SHERIFF'S OFFICE,352 LEAVITT AVE,JORDAN,MT,59337,"http://maps.google.com/maps?q=352 LEAVITT AVE,+JORDAN,+MT+59337&hl=en"
GLACIER COUNTY SHERIFF'S OFFICE,GLACIER COUNTY SHERIFF SITE#1,913 EAST RAILROAD ST,CUT BANK,MT,59427,"http://maps.google.com/maps?q=913 EAST RAILROAD ST,+CUT BANK,+MT+59427&hl=en"
GLACIER COUNTY SHERIFF'S OFFICE,GLACIER PEAK'S CASINO,416 W CENTRAL AVEINTERSECTION US 2 & HWY 89N,BROWNING,MT,59417,"http://maps.google.com/maps?q=416 W CENTRAL AVE,+BROWNING,+MT+59417&hl=en"
GLENDIVE POLICE DEPARTMENT,GLENDIVE POLICE DEPARTMENT,440 COLORADO BLVD,GLENDIVE,MT,59330,"http://maps.google.com/maps?q=440 COLORADO BLVD,+GLENDIVE,+MT+59330&hl=en"
HAVRE POLICE DEPARTMENT,HAVRE POLICE DEPARTMENT,520 4TH ST,HAVRE,MT,59501,"http://maps.google.com/maps?q=520 4TH ST,+HAVRE,+MT+59501&hl=en"
JOHNSON COUNTY SHERIFF'S OFFICE,JOHNSON COUNTY JUSTICE CENTER,639 FORT STREET,BUFFALO,WY,82834,"http://maps.google.com/maps?q=639 FORT STREET,+BUFFALO,+WY+82834&hl=en"
LAWRENCE COUNTY SHERIFF'S OFFICE,LAWRENCE COUNTY SHERIFF'S OFFICE,80 SHERMAN STREET,DEADWOOD,SD,57732,"http://maps.google.com/maps?q=80 SHERMAN STREET,+DEADWOOD,+SD+57732&hl=en"
LEWIS AND CLARK COUNTY SHERIFF'S OFFICE,LINCOLN POST OFFICE,237 MAIN STREET,LINCOLN,MT,59639,"http://maps.google.com/maps?q=237 MAIN STREET,+LINCOLN,+MT+59639&hl=en"
LEWIS AND CLARK COUNTY SHERIFF'S OFFICE,SHOPKO,3101 N MONTANA AVENUE,HELENA,MT,59602,"http://maps.google.com/maps?q=3101 N MONTANA AVENUE,+HELENA,+MT+59602&hl=en"
LEWIS AND CLARK COUNTY SHERIFF'S OFFICE,WALGREENS,1150 11TH AVE,HELENA,MT,59601,"http://maps.google.com/maps?q=1150 11TH AVE,+HELENA,+MT+59601&hl=en"
LEWISTOWN POLICE DEPARTMENT,LEWISTOWN POLICE DEPARTMENT,305 WEST WATSON STREET,LEWISTOWN,MT,59457,"http://maps.google.com/maps?q=305 WEST WATSON STREET,+LEWISTOWN,+MT+59457&hl=en"
LINCOLN COUNTY SHERIFF'S OFFICE,LINCOLN COUNTY SHERIFF'S OFFICE,512 CALIFORNIA AVE,LIBBY,MT,59923,"http://maps.google.com/maps?q=512 CALIFORNIA AVE,+LIBBY,+MT+59923&hl=en"
LIVINGSTON POLICE DEPARTMENT AND ELKS CLUB,ELKS LODGE #246,130 SOUTH 2ND STREET,LIVINGSTON,MT,59047,"http://maps.google.com/maps?q=130 SOUTH 2ND STREET,+LIVINGSTON,+MT+59047&hl=en"
MISSOULA POLICE DEPARTMENT,SOUTHGATE MALL,2901 BROOKS AVENUE,MISSOULA,MT,59801,"http://maps.google.com/maps?q=2901 BROOKS AVENUE,+MISSOULA,+MT+59801&hl=en"
MONTANA HIGHWAY PATROL - GREAT FALLS,MONTANA HIGHWAY PATROL,812 - 14TH STREET NORTH,GREAT FALLS,MT,59401,"http://maps.google.com/maps?q=812 - 14TH STREET NORTH,+GREAT FALLS,+MT+59401&hl=en"
MONTANA HIGHWAY PATROL - HELENA,HELENA FAMILY YMCA,1200 N LAST CHANCE GULCH,HELENA,MT,59601,"http://maps.google.com/maps?q=1200 N LAST CHANCE GULCH,+HELENA,+MT+59601&hl=en"
MONTANA HIGHWAY PATROL - HELENA,HELENA SHOPKO,3101 N. MONTANA AVE.,HELENA,MT,59601,"http://maps.google.com/maps?q=3101 N. MONTANA AVE.,+HELENA,+MT+59601&hl=en"
MSU BOZEMEN POLICE DEPT,MSU BOZEMAN POLICE DEPT,101 HUFFMAN BUILDING,BOZEMAN,MT,59717,"http://maps.google.com/maps?q=101 HUFFMAN BUILDING,+BOZEMAN,+MT+59717&hl=en"
MT DCI,HOLY ROSARY HEALTHCARE,2600 WILSON ST,MILES CITY,MT,59301,"http://maps.google.com/maps?q=2600 WILSON ST,+MILES CITY,+MT+59301&hl=en"
MUSSELSHELL COUNTY SHERIFF'S DEPT.,MUSSELSHELL COUNTY SHERIFF DEPARTMENT,820 MAIN STREET,ROUNDUP,MT,59072,"http://maps.google.com/maps?q=820 MAIN STREET,+ROUNDUP,+MT+59072&hl=en"
NEWCASTLE POLICE DEPT,NEWCASTLE POLICE DEPT,25 NORTH SUMNER AVE,NEWCASTLE,WY,82701,"http://maps.google.com/maps?q=25 NORTH SUMNER AVE,+NEWCASTLE,+WY+82701&hl=en"
PERKINS COUNTY SHERIFF'S OFFICE,PERKINS COUNTY SHERIFF'S OFFICE,100 EAST MAIN STREET,BISON,SD,57620,"http://maps.google.com/maps?q=100 EAST MAIN STREET,+BISON,+SD+57620&hl=en"
PERKINS COUNTY SHERIFF'S OFFICE,PERKINS COUNTY SHERIFF'S OFFICE,100 MAIN AVENUE,LEMMON,SD,57638,"http://maps.google.com/maps?q=100 MAIN AVENUE,+LEMMON,+SD+57638&hl=en"
RAPID CITY POLICE DEPARTMENT,PUBLIC SAFETY BUILDING,300 KANSAS CITY STREET,RAPID CITY,SD,57701,"http://maps.google.com/maps?q=300 KANSAS CITY STREET,+RAPID CITY,+SD+57701&hl=en"
RONAN POLICE DEPARTMENT,RONAN POLICE DEPARTMENT,109 2ND AVE SW,RONAN,MT,59864,"http://maps.google.com/maps?q=109 2ND AVE SW,+RONAN,+MT+59864&hl=en"
SHERIDAN POLICE DEPARTMENT,WALGREENS,1766 COFFEEN AVENUE,SHERIDAN,WY,82801,"http://maps.google.com/maps?q=1766 COFFEEN AVENUE,+SHERIDAN,+WY+82801&hl=en"
SPEARFISH POLICE DEPARTMENT,SPEARFISH POLICE DEPT.,225 W ILLINOIS ST,SPEARFISH,SD,57783,"http://maps.google.com/maps?q=225 W ILLINOIS ST,+SPEARFISH,+SD+57783&hl=en"
STILLWATER COUNTY SHERIFF'S OFFICE,STILLWATER COUNTY SHERIFF'S OFFICE,400 E 3RD AVE N,COLUMBUS,MT,59019,"http://maps.google.com/maps?q=400 E 3RD AVE N,+COLUMBUS,+MT+59019&hl=en"
SWEET GRASS COUNTY SHERIFF,SWEET GRASS COUNTY SHERIFF'S OFFICE,200 WEST FIRST STREET,BIG TIMBER,MT,59011,"http://maps.google.com/maps?q=200 WEST FIRST STREET,+BIG TIMBER,+MT+59011&hl=en"
WHEATLAND COUNTY SHERIFF'S OFFICE,WHEATLAND COUNTY SHERIFF'S OFFICE,203 A AVENUE NW,HARLOWTON,MT,59036,"http://maps.google.com/maps?q=203 A AVENUE NW,+HARLOWTON,+MT+59036&hl=en"
WHITEFISH POLICE DEPARTMENT,WHITEFISH POLICE DEPARTMENT,275 FLATHEAD AVE,WHITEFISH,MT,59937,"http://maps.google.com/maps?q=275 FLATHEAD AVE,+WHITEFISH,+MT+59937&hl=en"
MINERAL COUNTY SHERIFF'S OFFICE,MINERAL COUNTY SHERIFF'S OFFICE,310 RIVER STREET,SUPERIOR,MT,59872,"http://maps.google.com/maps?q=310 RIVER STREET,+SUPERIOR,+MT+59872&hl=en"
CARBON COUNTY SHERIFF'S OFFICE,CARBON COUNTY SHERIFF'S OFFICE,102 N. BROADWAY,RED LODGE,MT,59068,"http://maps.google.com/maps?q=102 N. BROADWAY,+RED LODGE,+MT+59068&hl=en"
