Participant,CollectionSite,Address,City,State,Zip,MapURL
MARSHALL POLICE DEPARTMENT,"MARSHALL POLICE DEPARTMENT 7:30AM-4:30PM, 7:30AM-1:30AM",130 S PARDEE STREET,MARSHALL,WI,53559,"http://maps.google.com/maps?q=130 S PARDEE STREET,+MARSHALL,+WI+53559&hl=en"
MARSHFIELD POLICE DEPARTMENT,SHOPKO EVENT 10:00 AM - 2:00 PM,1306 N CENTRAL AVE,MARSHFIELD,WI,54449,"http://maps.google.com/maps?q=1306 N CENTRAL AVE,+MARSHFIELD,+WI+54449&hl=en"
MARYVILLE DEPARTMENT OF PUBLIC SAFETY,MARYVILLE DEPARTMENT OF PUBLIC SAFETY,222 E. 3RD ST.,MARYVILLE,MO,64468,"http://maps.google.com/maps?q=222 E. 3RD ST.,+MARYVILLE,+MO+64468&hl=en"
MASON COUNTY SHERIFF'S OFFICE,IGA STORE - MASON CITY 10:00 AM - 11:00 AM (PARKING LOT),201 WEST ELM,MASON CITY,IL,62664,"http://maps.google.com/maps?q=201 WEST ELM,+MASON CITY,+IL+62664&hl=en"
MASON COUNTY SHERIFF'S OFFICE,ONEY FOOD'S PARKING LOT PARKING LOT 1:00 PM - 2:00 PM,500 S. PROMENADE,HAVANA,IL,62644,"http://maps.google.com/maps?q=500 S. PROMENADE,+HAVANA,+IL+62644&hl=en"
MASON COUNTY SHERIFF'S OFFICE,THE LODGE AT MANITO 11:30 AM - 12:30 PM (PARKING LOT),1303 S. EAST AVENUE,MANITO,IL,61546,"http://maps.google.com/maps?q=1303 S. EAST AVENUE,+MANITO,+IL+61546&hl=en"
MAUSTON POLICE DEPARTMENT,MAUSTON POLICE DEPARTMENT EVENT 8:00AM-1:00PM,303 MANSION,MAUSTON,WI,53948,"http://maps.google.com/maps?q=303 MANSION,+MAUSTON,+WI+53948&hl=en"
MAYO CLINIC / OLMSTED COUNTY SO,MAYO CLINIC,200 FIRST STREET SW,ROCHESTER,MN,55905,"http://maps.google.com/maps?q=200 FIRST STREET SW,+ROCHESTER,+MN+55905&hl=en"
MELCHER-DALLAS POLICE DEPARTMENT,CITY HALL NO BOXES,305 EAST D. MAIN STREET,MELCHER DALLAS,IA,50062,"http://maps.google.com/maps?q=305 EAST D. MAIN STREET,+MELCHER DALLAS,+IA+50062&hl=en"
MENARD COUNTY SHERIFF'S DEPT.,MENARD COUNTY JAIL,315 S. SIXTH STREET,PETERSBURG,IL,62675,"http://maps.google.com/maps?q=315 S. SIXTH STREET,+PETERSBURG,+IL+62675&hl=en"
MENDOTA HEIGHTS PD,MENDOTA HEIGHTS POLICE DEPARTMENT,1101 VICTORIA CURVE,MENDOTA HEIGHTS,MN,55118,"http://maps.google.com/maps?q=1101 VICTORIA CURVE,+MENDOTA HEIGHTS,+MN+55118&hl=en"
MERCER COUNTY SHERIFF'S OFFICE,MERCER COUNTY SHERIFF'S OFFICE,802 EAST MAIN STREET,PRINCETON,MO,64673,"http://maps.google.com/maps?q=802 EAST MAIN STREET,+PRINCETON,+MO+64673&hl=en"
MILAN POLICE DEPARTMENT,MILAN MUNICIPAL BUILDING,405 E. 1ST ST.,MILAN,IL,61264,"http://maps.google.com/maps?q=405 E. 1ST ST.,+MILAN,+IL+61264&hl=en"
"MINNESOTA STATE UNIVERSITY, MANKATO STUDENT HEALTH",MINNESOTA STATE UNIVERSITY MANKATO STUDENT HEALTH SERVICES,21 CARKOSKI COMMONS,MANKATO,MN,56001,"http://maps.google.com/maps?q=21 CARKOSKI COMMONS,+MANKATO,+MN+56001&hl=en"
MISSOURI VALLEY POLICE DEPARTMENT,RAND COMMUNITY CENTER,100 S. 4TH ST,MISSOURI VALLEY,IA,51555,"http://maps.google.com/maps?q=100 S. 4TH ST,+MISSOURI VALLEY,+IA+51555&hl=en"
MOLINE POLICE DEPARTMENT,MOLINE POLICE DEPARTMENT,1640 6TH AVE,MOLINE,IL,61265,"http://maps.google.com/maps?q=1640 6TH AVE,+MOLINE,+IL+61265&hl=en"
MONONA POLICE DEPARTMENT,THE MEDICINE SHOPPE PHARMACY EVENT 9:00AM-1:00PM,4205 MONONA DR,MONONA,WI,53716,"http://maps.google.com/maps?q=4205 MONONA DR,+MONONA,+WI+53716&hl=en"
MONROE POLICE DEPARTMENT,MONROE CITY HALL,206 W. SHERMAN ST.,MONROE,IA,50170,"http://maps.google.com/maps?q=206 W. SHERMAN ST.,+MONROE,+IA+50170&hl=en"
MONTGOMERY COUNTY SHERIFFS OFFICE,HY VEE PHARMACY,1605 N BROADWAY ST,RED OAK,IA,51566,"http://maps.google.com/maps?q=1605 N BROADWAY ST,+RED OAK,+IA+51566&hl=en"
MORTON POLICE DEPARTMENT,MORTON POLICE DEPARTMENT,375 W. BIRCHWOOD STREET,MORTON,IL,61550,"http://maps.google.com/maps?q=375 W. BIRCHWOOD STREET,+MORTON,+IL+61550&hl=en"
MOSINEE POLICE DEPARTMENT,MOSINEE POLICE DEPARTMENT EVENT 9:00AM-12:00PM,225 MAIN STREET,MOSINEE,WI,54455,"http://maps.google.com/maps?q=225 MAIN STREET,+MOSINEE,+WI+54455&hl=en"
MOUND CITY POLICE DEPARTMENT,MOUND CITY POLICE DEPARTMENT,205 EAST SIXTH STREET,MOUND CITY,MO,64470,"http://maps.google.com/maps?q=205 EAST SIXTH STREET,+MOUND CITY,+MO+64470&hl=en"
MOUNT HOREB POLICE DEPARTMENT,MOUNT HOREB POLICE DEPARTMENT EVENT 2:00PM-5:00PM,222 E FRONT ST,MOUNT HOREB,WI,53572,"http://maps.google.com/maps?q=222 E FRONT ST,+MOUNT HOREB,+WI+53572&hl=en"
MOUNT PLEASANT POLICE DEPT.,MOUNT PLEASANT POLICE DEPT.,204 E. WASHINGTON ST.,MOUNT PLEASANT,IA,52641,"http://maps.google.com/maps?q=204 E. WASHINGTON ST.,+MOUNT PLEASANT,+IA+52641&hl=en"
NEMAHA CO. SHERIFF'S OFFICE,NEMAHA CO. SHERIFF'S OFFICE,212 N. 6TH ST,SENECA,KS,66538,"http://maps.google.com/maps?q=212 N. 6TH ST,+SENECA,+KS+66538&hl=en"
NORTH LIBERTY IOWA POLICE DEPARTMENT,NORTH LIBERTY POLICE DEPT.,5 E. CHERRY ST.,NORTH LIBERTY,IA,52317,"http://maps.google.com/maps?q=5 E. CHERRY ST.,+NORTH LIBERTY,+IA+52317&hl=en"
NORTHEAST IOWA DRUG TASK FORCE,CALMAR TRAIN DEPOT,202 MARYVILLE STREET,CALMAR,IA,52132,"http://maps.google.com/maps?q=202 MARYVILLE STREET,+CALMAR,+IA+52132&hl=en"
NORTHEAST IOWA DRUG TASK FORCE,CHESTER CITY HALL,302 MAIN STREET,CHESTER,IA,52134,"http://maps.google.com/maps?q=302 MAIN STREET,+CHESTER,+IA+52134&hl=en"
NORTHEAST IOWA DRUG TASK FORCE,CHICKASAW COUNTY COMMUNITY CENTER,260 EAST PROSPECT ST.,NEW HAMPTON,IA,50659,"http://maps.google.com/maps?q=260 EAST PROSPECT ST.,+NEW HAMPTON,+IA+50659&hl=en"
NORTHEAST IOWA DRUG TASK FORCE,CLAYTON COUNTY SHERIFF'S OFFICE,22680 230TH ST,SAINT OLAF,IA,52072,"http://maps.google.com/maps?q=22680 230TH ST,+SAINT OLAF,+IA+52072&hl=en"
NORTHEAST IOWA DRUG TASK FORCE,DONLON'S PHARMACY,201 WEST WATER STREET,DECORAH,IA,52101,"http://maps.google.com/maps?q=201 WEST WATER STREET,+DECORAH,+IA+52101&hl=en"
NORTHEAST IOWA DRUG TASK FORCE,ELKADER OPERA HOUSE,207 NORTH MAIN ST.,ELKADER,IA,52043,"http://maps.google.com/maps?q=207 NORTH MAIN ST.,+ELKADER,+IA+52043&hl=en"
NORTHEAST IOWA DRUG TASK FORCE,ELMA FIRE DEPARTMENT,107 ORCHARD STREET,ELMA,IA,50628,"http://maps.google.com/maps?q=107 ORCHARD STREET,+ELMA,+IA+50628&hl=en"
NORTHEAST IOWA DRUG TASK FORCE,FAYETTE COUNTY SHERIFF'S OFFICE,220 NORTH INDISTRIAL PARKWAY,WEST UNION,IA,52175,"http://maps.google.com/maps?q=220 NORTH INDISTRIAL PARKWAY,+WEST UNION,+IA+52175&hl=en"
NORTHEAST IOWA DRUG TASK FORCE,HOWARD COUNTY SHERIFF'S OFFICE,124 S. PARK PLACE,CRESCO,IA,52136,"http://maps.google.com/maps?q=124 S. PARK PLACE,+CRESCO,+IA+52136&hl=en"
NORTHEAST IOWA DRUG TASK FORCE,LANSING FIRE DEPT.,51 NORTH FRONT ST.,LANSING,IA,52151,"http://maps.google.com/maps?q=51 NORTH FRONT ST.,+LANSING,+IA+52151&hl=en"
NORTHEAST IOWA DRUG TASK FORCE,LIME SPRINGS CITY HALL,201 CENTER STREET,LIME SPRINGS,IA,52155,"http://maps.google.com/maps?q=201 CENTER STREET,+LIME SPRINGS,+IA+52155&hl=en"
NORTHEAST IOWA DRUG TASK FORCE,MONONA POLICE DEPT.,104 EAST CENTER ST.,MONONA,IA,52159,"http://maps.google.com/maps?q=104 EAST CENTER ST.,+MONONA,+IA+52159&hl=en"
NORTHEAST IOWA DRUG TASK FORCE,POSTVILLE CITY HALL,147 N. LAWLWER ST.,POSTVILLE,IA,52162,"http://maps.google.com/maps?q=147 N. LAWLWER ST.,+POSTVILLE,+IA+52162&hl=en"
NORTHEAST IOWA DRUG TASK FORCE,PROTIVIN FIRE DEPARTMENT,132 LARSON STREET,PROTIVIN,IA,52163,"http://maps.google.com/maps?q=132 LARSON STREET,+PROTIVIN,+IA+52163&hl=en"
NORTHEAST IOWA DRUG TASK FORCE,RICEVILLE FIRE DEPARTMENT,106 WALNUT STREET,RICEVILLE,IA,50466,"http://maps.google.com/maps?q=106 WALNUT STREET,+RICEVILLE,+IA+50466&hl=en"
NORTHEAST IOWA DRUG TASK FORCE,STEEGE PHARMACY,119 NORTH VINE STREET,WEST UNION,IA,52175,"http://maps.google.com/maps?q=119 NORTH VINE STREET,+WEST UNION,+IA+52175&hl=en"
NORTHEAST IOWA DRUG TASK FORCE,THRIFTY WHITE PHARMACY,702 MONTGOMERY ST.,DECORAH,IA,52101,"http://maps.google.com/maps?q=702 MONTGOMERY ST.,+DECORAH,+IA+52101&hl=en"
NORTHEAST IOWA DRUG TASK FORCE,UNION DRUG STORE,315 HIGHWAY 150,WEST UNION,IA,52175,"http://maps.google.com/maps?q=315 HIGHWAY 150,+WEST UNION,+IA+52175&hl=en"
NORTHEAST IOWA DRUG TASK FORCE,WAL-MART SUPER CENTER,1798 OLD STAGE ROAD,DECORAH,IA,52101,"http://maps.google.com/maps?q=1798 OLD STAGE ROAD,+DECORAH,+IA+52101&hl=en"
NORTHEAST IOWA DRUG TASK FORCE,WAUKON POLICE DEPT.,565 11 1ST STREET,WAUKON,IA,52172,"http://maps.google.com/maps?q=565 11 1ST STREET,+WAUKON,+IA+52172&hl=en"
NORTHEAST IOWA DRUG TASK FORCE,WINNESHIEK CO/DECORAH POLICE LAW ENFORCEMENT CNTR,400 CLAIRBORNE DRIVE,DECORAH,IA,52101,"http://maps.google.com/maps?q=400 CLAIRBORNE DRIVE,+DECORAH,+IA+52101&hl=en"
NORTHEAST MISSOURI NARCOTICS TASK FORCE,COUNTY MARKET,1805 ELM ST,CANTON,MO,63435,"http://maps.google.com/maps?q=1805 ELM ST,+CANTON,+MO+63435&hl=en"
OCONOMOWOC POLICE DEPARTMENT,PROHEALTH OCONOMOWOC MEMORIAL HOSPITAL EVENT 10:00AM-2:00PM,791 SUMMIT AVE,OCONOMOWOC,WI,53066,"http://maps.google.com/maps?q=791 SUMMIT AVE,+OCONOMOWOC,+WI+53066&hl=en"
OMAHA POLICE DEPT.-NW PRECINCT,FAMILY FARE SUPERMARKET,3026 S 24TH STREET,OMAHA,NE,68108,"http://maps.google.com/maps?q=3026 S 24TH STREET,+OMAHA,+NE+68108&hl=en"
OMAHA POLICE DEPT.-NW PRECINCT,HYVEE,747 N 132ND ST,OMAHA,NE,68154,"http://maps.google.com/maps?q=747 N 132ND ST,+OMAHA,+NE+68154&hl=en"
OMAHA POLICE DEPT.-NW PRECINCT,HYVEE,8809 W CENTER ROAD,OMAHA,NE,68124,"http://maps.google.com/maps?q=8809 W CENTER ROAD,+OMAHA,+NE+68124&hl=en"
OMAHA POLICE DEPT.-NW PRECINCT,WALGREENS,3005 LAKE ST,OMAHA,NE,68111,"http://maps.google.com/maps?q=3005 LAKE ST,+OMAHA,+NE+68111&hl=en"
ORDORDVILLE POLICE DEPARTMENT,ORFORDVILLE POLICE DEPARTMENT EVENT 10:00AM-2:00PM,303 E BELOIT ST,ORFORDVILLE,WI,53576,"http://maps.google.com/maps?q=303 E BELOIT ST,+ORFORDVILLE,+WI+53576&hl=en"
OSCEOLA POLICE DEPARTMENT,HYVEE,510 W MCLANE STREET,OSCEOLA,IA,50213,"http://maps.google.com/maps?q=510 W MCLANE STREET,+OSCEOLA,+IA+50213&hl=en"
OSKALOOSA IA POLICE DEPARTMENT,MAHASKA DRUG PHARMACY,207 NORTH E STREET,OSKALOOSA,IA,52577,"http://maps.google.com/maps?q=207 NORTH E STREET,+OSKALOOSA,+IA+52577&hl=en"
OSSEO POLICE DEPARTMENT,OSSEO POLICE DEPARTMENT EVENT 10:00AM-2:00PM,13712 8TH STREET,OSSEO,WI,54758,"http://maps.google.com/maps?q=13712 8TH STREET,+OSSEO,+WI+54758&hl=en"
OTTAWA POLICE DEPARTMENT,OTTAWA POLICE DEPARTMENT LOBBY,301W. LAFYETTE ST.,OTTAWA,IL,61350,"http://maps.google.com/maps?q=301,+OTTAWA,+IL+61350&hl=en"
PALMYRA POLICE DEPARTMENT,PALMYRA POLICE DEPARTMENT EVENT 10:00AM-2:00PM,126 N FIRST STREET,PALMYRA,WI,53156,"http://maps.google.com/maps?q=126 N FIRST STREET,+PALMYRA,+WI+53156&hl=en"
PEKIN POLICE DEPARTMENT,PEKIN POLICE DEPARTMENT LOBBY,111 SOUTH CAPITOL STREET,PEKIN,IL,61554,"http://maps.google.com/maps?q=111 SOUTH CAPITOL STREET,+PEKIN,+IL+61554&hl=en"
PEORIA POLICE DEPARTMENT,KROGER PHARMACY,9219 N. LINDBERGH DRIVE,PEORIA,IL,61615,"http://maps.google.com/maps?q=9219 N. LINDBERGH DRIVE,+PEORIA,+IL+61615&hl=en"
PEORIA POLICE DEPARTMENT,OSF CENTER FOR HEALTH,8800 STATE ROUTE 91,PEORIA,IL,61615,"http://maps.google.com/maps?q=8800 STATE ROUTE 91,+PEORIA,+IL+61615&hl=en"
PEORIA POLICE DEPARTMENT,PEORIA POLICE DEPARTMENT,600 SW ADAMS,PEORIA,IL,61602,"http://maps.google.com/maps?q=600 SW ADAMS,+PEORIA,+IL+61602&hl=en"
PEPIN COUNTY SHERIFF'S OFFICE,DURAND FIRE HALL EVENT 10:00AM-1:00PM,205 E MONTGOMERY STREET,DURAND,WI,54736,"http://maps.google.com/maps?q=205 E MONTGOMERY STREET,+DURAND,+WI+54736&hl=en"
PERRY POLICE DEPARTMENT,HY-VEE STORE,1215 HWY. 141,PERRY,IA,50220,"http://maps.google.com/maps?q=1215 HWY. 141,+PERRY,+IA+50220&hl=en"
PITTSVILLE POLICE DEPARTMENT,PITTSVILLE POLICE DEPARTMENT EVENT 10:00AM-2:00PM,5318 1ST AVE,PITTSVILLE,WI,54466,"http://maps.google.com/maps?q=5318 1ST AVE,+PITTSVILLE,+WI+54466&hl=en"
PLATTE CITY POLICE DEPARTMENT,COSENTINO'S PRICE CHOPPER,2600 ENSIGN HILL DR.,PLATTE CITY,MO,64079,"http://maps.google.com/maps?q=2600 ENSIGN HILL DR.,+PLATTE CITY,+MO+64079&hl=en"
POLK COUNTY SHERIFF'S OFFICE,CVS,104 E 1ST STREET,ANKENY,IA,50023,"http://maps.google.com/maps?q=104 E 1ST STREET,+ANKENY,+IA+50023&hl=en"
POLK COUNTY SHERIFF'S OFFICE,CVS,215 EUCLID AVE,DES MOINES,IA,50310,"http://maps.google.com/maps?q=215 EUCLID AVE,+DES MOINES,+IA+50310&hl=en"
PORT EDWARDS POLICE DEPARTMENT,PORT EDWARDS POLICE DEPARTMENT EVENT 11:00AM-1:00PM,201 MARKET AVE,PORT EDWARDS,WI,54469,"http://maps.google.com/maps?q=201 MARKET AVE,+PORT EDWARDS,+WI+54469&hl=en"
PORTAGE COUNTY SHERIFF'S OFFICE,ALMOND-BANCROFT COMMUNITY CENTER EVENT 12:30PM-2:00PM,122 MAIN ST,ALMOND,WI,54909,"http://maps.google.com/maps?q=122 MAIN ST,+ALMOND,+WI+54909&hl=en"
PORTAGE COUNTY SHERIFF'S OFFICE,LINCOLN CENTER EVENT 8:00AM-12:00PM,1519 WATER ST,STEVENS POINT,WI,54481,"http://maps.google.com/maps?q=1519 WATER ST,+STEVENS POINT,+WI+54481&hl=en"
POTTAWATTAMIE COUNTY SHERIFF'S OFFICE,OAKLAND COMMUNITY CENTER,614 DR. VAN ZEE ROAD,OAKLAND,IA,51560,"http://maps.google.com/maps?q=614 DR. VAN ZEE ROAD,+OAKLAND,+IA+51560&hl=en"
PRAIRIE ISLAND TRIBAL POLICE,PRIARIE ISLAND PUBLIC SAFETY BUILDING,1960 ISLAND BOULEVARD,WELCH,MN,55089,"http://maps.google.com/maps?q=1960 ISLAND BOULEVARD,+WELCH,+MN+55089&hl=en"
PRINCETON POLICE DEPARTMENT,PRINCETON POLICE DEPARTMENT PEG MACIEJEWSKI,605 ELM PLACE,PRINCETON,IL,61356,"http://maps.google.com/maps?q=605 ELM PLACE,+PRINCETON,+IL+61356&hl=en"
PUTNAM COUNTY SHERIFF'S OFFICE,PUTNAM SHERIFF'S OFFICE,"1601 MAIN STREET, COURTHOUSE RM:0101 (BASEMENT)",UNIONVILLE,MO,63565,"http://maps.google.com/maps?q=1601 MAIN STREET, COURTHOUSE RM:0101 (BASEMENT),+UNIONVILLE,+MO+63565&hl=en"
RALSTON POLICE DEPARTMENT,WALGREENS 84TH & HARRISON,8380 HARRISON STREET,RALSTON,NE,68127,"http://maps.google.com/maps?q=8380 HARRISON STREET,+RALSTON,+NE+68127&hl=en"
RED WING PD,RED WING POLICE DEPARTMENT,430 WEST 6TH STREET,RED WING,MN,55066,"http://maps.google.com/maps?q=430 WEST 6TH STREET,+RED WING,+MN+55066&hl=en"
RICHIFIELD PD,RICHFIELD POLICE DEPARTMENT,6700 PORTLAND AVENUE SOUTH,RICHFIELD,MN,55423,"http://maps.google.com/maps?q=6700 PORTLAND AVENUE SOUTH,+RICHFIELD,+MN+55423&hl=en"
RICHLAND CENTER POLICE DEPT,RICHLAND CENTER POLICE DEPT EVENT 10:00AM-2:00PM,470 S MAIN ST,RICHLAND CENTER,WI,53581,"http://maps.google.com/maps?q=470 S MAIN ST,+RICHLAND CENTER,+WI+53581&hl=en"
RICHMOND POLICE DEPARTMENT,RICHMOND POLICE DEPARTMENT,207 SUMMIT ST.,RICHMOND,MO,64085,"http://maps.google.com/maps?q=207 SUMMIT ST.,+RICHMOND,+MO+64085&hl=en"
RILEY COUNTY POLICE DEPARTMENT,DILLONS,1101 WESTLOOP PLACE,MANHATTAN,KS,66502,"http://maps.google.com/maps?q=1101 WESTLOOP PLACE,+MANHATTAN,+KS+66502&hl=en"
RILEY COUNTY POLICE DEPARTMENT,RILEY COUNTY POLICE DEPARTMENT,1001 S. SETH CHILD ROAD,MANHATTAN,KS,66502,"http://maps.google.com/maps?q=1001 S. SETH CHILD ROAD,+MANHATTAN,+KS+66502&hl=en"
RINGGOLD COUNTY SHERIFF'S OFFICE,RINGGOLD CO SHERIFF'S OFFICE NO BOXES-SEND SHIPPING LABELS,801 W. SOUTH ST.,MOUNT AYR,IA,50854,"http://maps.google.com/maps?q=801 W. SOUTH ST.,+MOUNT AYR,+IA+50854&hl=en"
RIVER FALLS POLICE DEPARTMENT,RIVER FALLS POLICE DEPARTMENT EVENT 9:00AM-5:00PM,125 E. ELM STREET,RIVER FALLS,WI,54022,"http://maps.google.com/maps?q=125 E. ELM STREET,+RIVER FALLS,+WI+54022&hl=en"
RIVERSIDE POLICE DEPARTMENT,RIVERSIDE POLICE DEPT.,2990 NW VIVION ROAD,RIVERSIDE,MO,64150,"http://maps.google.com/maps?q=2990 NW VIVION ROAD,+RIVERSIDE,+MO+64150&hl=en"
ROCHELLE POLICE DEPT,ROCHELLE POLICE DEPT.,416 N 6TH ST,ROCHELLE,IL,61068,"http://maps.google.com/maps?q=416 N 6TH ST,+ROCHELLE,+IL+61068&hl=en"
ROCK ISLAND COUNTY SHERIFF'S OFFICE,ROCK ISLAND COUNTY JUSTICE CENTER,1317 3RD AVENUE,ROCK ISLAND,IL,61201,"http://maps.google.com/maps?q=1317 3RD AVENUE,+ROCK ISLAND,+IL+61201&hl=en"
SANDWICH POLICE DEPARTMENT/NW MEDICINE/VALLEY WEST,NORTHWEST MEDICINE VALLEY WEST HOSPITAL,1302 N. MAIN STREET,SANDWICH,IL,60548,"http://maps.google.com/maps?q=1302 N. MAIN STREET,+SANDWICH,+IL+60548&hl=en"
SARPY COUNTY SHERIFF'S OFFICE,HY-VEE GROCERY STORE (SHADOW LAKE) NORTH PARKING LOT,11650 S. 73RD STREET,PAPILLION,NE,68046,"http://maps.google.com/maps?q=11650 S. 73RD STREET,+PAPILLION,+NE+68046&hl=en"
SAVANNAH POLICE DEPARTMENT,BROTHERS MARKET,402 EAST PRICE,SAVANNAH,MO,64485,"http://maps.google.com/maps?q=402 EAST PRICE,+SAVANNAH,+MO+64485&hl=en"
SHOREWOOD HILLS POLICE DEPARTMENT,SHOREWOOD HILLS POLICE DEPARTMENT EVENT 8:00AM-1:00PM,810 SHOREWOOD BLVD,MADISON,WI,53705,"http://maps.google.com/maps?q=810 SHOREWOOD BLVD,+MADISON,+WI+53705&hl=en"
SIGOURNEY POLICE DEPARTMENT,SIGOURNEY POLICE DEPARTMENT,100 N MIAN STREET,SIGOURNEY,IA,52591,"http://maps.google.com/maps?q=100 N MIAN STREET,+SIGOURNEY,+IA+52591&hl=en"
SOUTHEAST IOWA NARCOTICS TASK FORCE,SLUMBERLAND PARKING LOT POC : ADAM PLEIN PLEINA@DMCOUNTY.COM,3150 E AGENCY ST,BURLINGTON,IA,52601,"http://maps.google.com/maps?q=3150 E AGENCY ST,+BURLINGTON,+IA+52601&hl=en"
ST. CHARLES POLICE DEPARTMENT,NORTHWESTERN MEDICINE CONVENIENT CARE ST. CHARLES,2900 FOXFIELD DR,SAINT CHARLES,IL,60174,"http://maps.google.com/maps?q=2900 FOXFIELD DR,+SAINT CHARLES,+IL+60174&hl=en"
ST. JOSEPH POLICE DEPARTMENT,EAST HILLS MALL EAST PARKING LOT NEAR DILLARDS DEPARTMENT STORE,3702 FREDERICK AVENUE,SAINT JOSEPH,MO,64506,"http://maps.google.com/maps?q=3702 FREDERICK AVENUE,+SAINT JOSEPH,+MO+64506&hl=en"
STEVENS POINT POLICE DEPARTMENT,LINCOLN CENTER SENIOR (ADRC) EVENT 8:00AM-12:00PM,1519 WATER STREET,STEVENS POINT,WI,54481,"http://maps.google.com/maps?q=1519 WATER STREET,+STEVENS POINT,+WI+54481&hl=en"
STRATFORD POLICE DEPARTMENT,STRATFORD POLICE DEPARTMENT EVENT 10:00AM-2:00PM,265 N 3RD AVE,STRATFORD,WI,54484,"http://maps.google.com/maps?q=265 N 3RD AVE,+STRATFORD,+WI+54484&hl=en"
TOWN OF BELOIT,TOWN OF BELOIT EVENT 10:00AM-2:00PM,1133 E INMAN PKWY,BELOIT,WI,53511,"http://maps.google.com/maps?q=1133 E INMAN PKWY,+BELOIT,+WI+53511&hl=en"
TOWN OF EAST TROY POLICE DEPARTMENT,TOWN OF EAST TROY POLICE DEPARTMENT EVENT 10:00AM-12:00PM,N9330 STEWART SCHOOL ROAD,EAST TROY,WI,53120,"http://maps.google.com/maps?q=N9330 STEWART SCHOOL ROAD,+EAST TROY,+WI+53120&hl=en"
TOWN OF ROME POLICE DEPARTMENT,TOWN OF ROME POLICE DEPARTMENT EVENT 10:00 AM -2:00 PM,1156 ALPINE DRIVE,NEKOOSA,WI,54457,"http://maps.google.com/maps?q=1156 ALPINE DRIVE,+NEKOOSA,+WI+54457&hl=en"
URBANDALE POLICE DEPARTMENT,URBANDALE POLICE DEPARTMENT 8:00AM-2:00PM,3740 86TH ST,URBANDALE,IA,50322,"http://maps.google.com/maps?q=3740 86TH ST,+URBANDALE,+IA+50322&hl=en"
VAN BUREN COUNTY SHERIFF'S OFFICE,LAW CENTER LOBBY,907 BROAD STREET,KEOSAUQUA,IA,52565,"http://maps.google.com/maps?q=907 BROAD STREET,+KEOSAUQUA,+IA+52565&hl=en"
VERONA POLICE DEPARTMENT,VERONA POLICE DEPARTMENT EVENT 10:00AM-2:00PM,111 LINCOLN STREET,VERONA,WI,53593,"http://maps.google.com/maps?q=111 LINCOLN STREET,+VERONA,+WI+53593&hl=en"
VILLAGE OF COTTAGE GROVE POLICE DEPARTMENT,FOREWARD PHARMACY EVENT 9:00AM-12:00PM,429 W COTTAGE GROVE ROAD,COTTAGE GROVE,WI,53527,"http://maps.google.com/maps?q=429 W COTTAGE GROVE ROAD,+COTTAGE GROVE,+WI+53527&hl=en"
VILLAGE OF EAGLE POLICE DEPARTMENT,EAGLE MUNICIPAL BUILDING EVENT 12:00PM-2:00PM,820 E MAIN STREET,EAGLE,WI,53119,"http://maps.google.com/maps?q=820 E MAIN STREET,+EAGLE,+WI+53119&hl=en"
VILLAGE OF EAST TROY POLICE DEPARTMENT,VILLAGE OF EAST TROY POLICE DEPARTMENT EVENT 10:00AM-2:00PM,2015 ENERGY DRIVE,EAST TROY,WI,53120,"http://maps.google.com/maps?q=2015 ENERGY DRIVE,+EAST TROY,+WI+53120&hl=en"
VILLAGE OF MERRILLAN POLICE DEPARMENT,VILLAGE OF MERRILLAN POLICE DEPARTMENT EVENT 8:00AM-12:00PM,101 S MAIN STREET,MERRILLAN,WI,54754,"http://maps.google.com/maps?q=101 S MAIN STREET,+MERRILLAN,+WI+54754&hl=en"
VIROQUA POLICE DEPARTMENT,VIROQUA POLICE DEPARTMENT EVENT 10:00AM-2:00PM,702 EAST BROADWAY,VIROQUA,WI,54665,"http://maps.google.com/maps?q=702 EAST BROADWAY,+VIROQUA,+WI+54665&hl=en"
WAMEGO POLICE DEPT.,GENE'S HEARTLAND FOODS,1003 US 24 HWY,WAMEGO,KS,66547,"http://maps.google.com/maps?q=1003 US 24 HWY,+WAMEGO,+KS+66547&hl=en"
WARREN COUNTY SHERIFF'S OFFICE,WARREN COUNTY SHERIFF'S OFFICE,115 N HOWARD ST.,INDIANOLA,IA,50125,"http://maps.google.com/maps?q=115 N HOWARD ST.,+INDIANOLA,+IA+50125&hl=en"
WASHINGTON COUNTY SHERIFF'S OFFICE,WASHINGTON COUNTY SHERIFF'S OFFICE,301 B. STREET,WASHINGTON,KS,66968,"http://maps.google.com/maps?q=301 B. STREET,+WASHINGTON,+KS+66968&hl=en"
WATERLOO POLICE DEPARTMENT,GREENWOOD PHARMACY,2104 KIMBALL AVE,WATERLOO,IA,50702,"http://maps.google.com/maps?q=2104 KIMBALL AVE,+WATERLOO,+IA+50702&hl=en"
WATERLOO POLICE DEPARTMENT,WATERLOO POLICE DEPT EVENT 10:00AM-12:00PM,136 N MONROE ST,WATERLOO,WI,53594,"http://maps.google.com/maps?q=136 N MONROE ST,+WATERLOO,+WI+53594&hl=en"
WAUKEE POLICE DEPARTMENT,WAUKEE POLICE DEPARTMENT,1300 SE LA GRANT PKWY,WAUKEE,IA,50263,"http://maps.google.com/maps?q=1300 SE LA GRANT PKWY,+WAUKEE,+IA+50263&hl=en"
WAUSHARA COUNTY SHERIFF'S OFFICE,WILD ROSE FIRE DEPARTMENT EVENT 10:00AM-12:00PM,145 GRANT AVE,WILD ROSE,WI,54984,"http://maps.google.com/maps?q=145 GRANT AVE,+WILD ROSE,+WI+54984&hl=en"
WAVERLY POLICE DEPARTMENT,WAVERLY PUBLIC LIBRARY,1500 WEST BREMER AVE,WAVERLY,IA,50677,"http://maps.google.com/maps?q=1500 WEST BREMER AVE,+WAVERLY,+IA+50677&hl=en"
WEBSTER COUNTY SHERIFF'S OFFICE,DANIEL PHARMACY 10AM-12PM,1114 CENTRAL AVE,FORT DODGE,IA,50501,"http://maps.google.com/maps?q=1114 CENTRAL AVE,+FORT DODGE,+IA+50501&hl=en"
WEBSTER COUNTY SHERIFF'S OFFICE,HY VEE PHARMACY,115 29TH ST,FORT DODGE,IA,50501,"http://maps.google.com/maps?q=115 29TH ST,+FORT DODGE,+IA+50501&hl=en"
WEST DES MOINES POLICE DEPARTMENT,WEST DES MOINES POLICE DEPARTMENT,250 MILLS CIVIC PKWY,WEST DES MOINES,IA,50265,"http://maps.google.com/maps?q=250 MILLS CIVIC PKWY,+WEST DES MOINES,+IA+50265&hl=en"
WEST LIBERTY IOWA POLICE DEPARTMENT,CITY HALL LOBBY (10AM - 1PM),409 N. CALHOUN ST,WEST LIBERTY,IA,52776,"http://maps.google.com/maps?q=409 N. CALHOUN ST,+WEST LIBERTY,+IA+52776&hl=en"
WESTBY POLICE DEPARTMENT,WESTBY POLICE DEPARTMENT EVENT 1000AM-2:00PM,200 MELBY STREET,WESTBY,WI,54667,"http://maps.google.com/maps?q=200 MELBY STREET,+WESTBY,+WI+54667&hl=en"
WILLIAMSBURG POLICE DEPARTMENT,WILLIAMSBURG POLICE DEPARTMENT,210 STATE STREET,WILLIAMSBURG,IA,52361,"http://maps.google.com/maps?q=210 STATE STREET,+WILLIAMSBURG,+IA+52361&hl=en"
WINDSOR HEIGHTS POLICE DEPARTMENT,WINDSOR HEIGHTS POLICE DEPARTMENT,1133 66TH STREET,WINDSOR HEIGHTS,IA,50324,"http://maps.google.com/maps?q=1133 66TH STREET,+WINDSOR HEIGHTS,+IA+50324&hl=en"
WINNEBAGO COUNTY SHERIFF'S OFFICE,WINNEBAGO COUNTY SHERIFF'S OFFICE,935 HWY. 69 NORTH,FOREST CITY,IA,50436,"http://maps.google.com/maps?q=935 HWY. 69 NORTH,+FOREST CITY,+IA+50436&hl=en"
WINONA COUNTY ASAP,WINONA COUNTY ASAP WALGREENS PARKING LOT,750 MANKATO AVENUE,WINONA,MN,55987,"http://maps.google.com/maps?q=750 MANKATO AVENUE,+WINONA,+MN+55987&hl=en"
WOOD COUNTY SHERIFF'S OFFICE,COPPS EVENT 10:00AM-2:00PM,900 E RIVERVIEW EXPRESSWAY,WISCONSIN RAPIDS,WI,54494,"http://maps.google.com/maps?q=900 E RIVERVIEW EXPRESSWAY,+WISCONSIN RAPIDS,+WI+54494&hl=en"
WOODFORD COUNTY SHERIFF'S OFFICE,"WOODFORD COUNTY SHERIFF'S OFFICE EUREKA, IL",111 E. COURT STREET,METAMORA,IL,61548,"http://maps.google.com/maps?q=111 E. COURT STREET,+METAMORA,+IL+61548&hl=en"
WOODSTOCK POLICE DEPARTMENT,WOODSTOCK POLICE DEPARTMENT COLLECTION SITE IS THE PUBLIC PARKING LOT,656 LAKE AVE.,WOODSTOCK,IL,60098,"http://maps.google.com/maps?q=656 LAKE AVE.,+WOODSTOCK,+IL+60098&hl=en"
WRIGHT COUNTY SHERIFF'S OFFICE,IOWA SPECIALTY HOSPITAL EVENT ON 10/26/18 FROM 10AM-12PM,1316 S MAIN STREET,CLARION,IA,50525,"http://maps.google.com/maps?q=1316 S MAIN STREET,+CLARION,+IA+50525&hl=en"
