Participant,CollectionSite,Address,City,State,Zip,MapURL
ALAMEDA COUNTY DISTRICT ATTORNEY'S OFFICE,ALAMEDA COUNTY FAMILY JUSTICE CENTER,470 27TH STREET,OAKLAND,CA,94612,"http://maps.google.com/maps?q=470  27TH STREET,+OAKLAND,+CA+94612&hl=en"
ALAMEDA COUNTY DISTRICT ATTORNEY'S OFFICE,ALAMEDA HALL OF JUSTICE,2233 SHORELINE DRIVE,ALAMEDA,CA,94501,"http://maps.google.com/maps?q=2233 SHORELINE DRIVE,+ALAMEDA,+CA+94501&hl=en"
ALAMEDA COUNTY DISTRICT ATTORNEY'S OFFICE,EAST COUNTY HALL OF JUSTICE,5151 GLEASON DRIVE,DUBLIN,CA,94568,"http://maps.google.com/maps?q=5151 GLEASON DRIVE,+DUBLIN,+CA+94568&hl=en"
ALAMEDA COUNTY DISTRICT ATTORNEY'S OFFICE,FREMONT HALL OF JUSTICE,39439 PASEO PADRE PARKWAY,FREMONT,CA,94538,"http://maps.google.com/maps?q=39439 PASEO PADRE PARKWAY,+FREMONT,+CA+94538&hl=en"
ALAMEDA COUNTY SHERIFF'S OFFICE,ALAMEDA COUNTY SHERIFF'S OFFICE EDEN TOWNSHIP SUBSTATION,15001 FOOTHILL BLVD,SAN LEANDRO,CA,94578,"http://maps.google.com/maps?q=15001 FOOTHILL BLVD,+SAN LEANDRO,+CA+94578&hl=en"
AMADOR COUNTY SHERIFF'S OFFICE,AMADOR COUNTY SHERIFF'S OFFICE,700 COURT STREET,JACKSON,CA,95642,"http://maps.google.com/maps?q=700 COURT STREET,+JACKSON,+CA+95642&hl=en"
ANAHEIM P.D. (KAISER),KAISER PERMANENTE ANAHEIM MEDICAL CENTER KRAEMER MEDICAL OFFICE BLDG. 1,3460 E. LA PALMA AVE.,ANAHEIM,CA,92806,"http://maps.google.com/maps?q=3460 E. LA PALMA AVE.,+ANAHEIM,+CA+92806&hl=en"
ANTIOCH POLICE DEPARTMENT,ANTIOCH POLICE DEPARTMENT FRONT LOBBY,300 L ST,ANTIOCH,CA,94509,"http://maps.google.com/maps?q=300 L ST,+ANTIOCH,+CA+94509&hl=en"
AUBURN POLICE DEPARTMENT,AUBURN PUBLIC WORKS,1225 LINCOLN WAY,AUBURN,CA,95603,"http://maps.google.com/maps?q=1225 LINCOLN WAY,+AUBURN,+CA+95603&hl=en"
AZUSA POLICE DEPARTMENT,AZUSA POLICE DEPT. (LOBBY) CPL. JASON KIMES,725 N. ALAMEDA AVE.6268123299X3922,AZUSA,CA,91702,"http://maps.google.com/maps?q=725 N. ALAMEDA AVE.,+AZUSA,+CA+91702&hl=en"
BAKERSFIELD POLICE DEPARTMENT,BAKERSFIELD POLICE DEPARTMENT,1601 TRUXTUN AVE,BAKERSFIELD,CA,93301,"http://maps.google.com/maps?q=1601 TRUXTUN AVE,+BAKERSFIELD,+CA+93301&hl=en"
BAKERSFIELD POLICE DEPARTMENT,BAKERSFIELD POLICE WEST COLLECTION SITE PARKING LOT ADJACENT TO PHYSICCAL ADDRESS LOCATION,3501 STOCKDALE HWY,BAKERSFIELD,CA,93309,"http://maps.google.com/maps?q=3501 STOCKDALE HWY,+BAKERSFIELD,+CA+93309&hl=en"
BALDWIN PD (KAISER),KAISER PERMANENTE BALDWIN PK MED. CTR. PARKING LOT,1011 BALDWIN PARK BLVD.,BALDWIN PARK,CA,91706,"http://maps.google.com/maps?q=1011 BALDWIN PARK BLVD.,+BALDWIN PARK,+CA+91706&hl=en"
BENICIA POLICE DEPARTMENT,BENICIA POLICE DEPARTMENT,200 EAST L STREET,BENICIA,CA,94510,"http://maps.google.com/maps?q=200 EAST L STREET,+BENICIA,+CA+94510&hl=en"
BREA POLICE DEPARTMENT,BREA POLICE DEPARTMENT FRONT DRIVEWAY,1 CIVIC CENTER CIRCLE,BREA,CA,92821,"http://maps.google.com/maps?q=1 CIVIC CENTER CIRCLE,+BREA,+CA+92821&hl=en"
BRENTWOOD POLICE DEPARTMENT,BRENTWOOD POLICE DEPARTMENT CSO MICHELE KEADY,9100 BRENTWOOD BLVD,BRENTWOOD,CA,94513,"http://maps.google.com/maps?q=9100 BRENTWOOD BLVD,+BRENTWOOD,+CA+94513&hl=en"
BUENA PARK P.D.,BUENA PARK PD LOBBY,6640 BEACH BL.,BUENA PARK,CA,90621,"http://maps.google.com/maps?q=6640 BEACH BL.,+BUENA PARK,+CA+90621&hl=en"
BUENA PARK P.D.,BUENA PARK SENIOR CENTER LOBBY,8150 KNOTT AVE,BUENA PARK,CA,90620,"http://maps.google.com/maps?q=8150 KNOTT AVE,+BUENA PARK,+CA+90620&hl=en"
BURBANK POLICE DEPARTMENT,BURBANK POLICE STATION PARKING LOT,200 N THIRD ST.,BURBANK,CA,91502,"http://maps.google.com/maps?q=200 N THIRD ST.,+BURBANK,+CA+91502&hl=en"
CA DEPT. OF PUBLIC HEALTH - FOOD & DRUG,CARMICHAEL LIBRARY,5605 MARCONI AVENUE,CARMICHAEL,CA,95608,"http://maps.google.com/maps?q=5605 MARCONI AVENUE,+CARMICHAEL,+CA+95608&hl=en"
CA DEPT. OF PUBLIC HEALTH - FOOD & DRUG,CASTRO VALLEY LIBRARY,3600 NORBRIDGE AVENUE,CASTRO VALLEY,CA,94546,"http://maps.google.com/maps?q=3600 NORBRIDGE AVENUE,+CASTRO VALLEY,+CA+94546&hl=en"
CA DEPT. OF PUBLIC HEALTH - FOOD & DRUG,ROBBIE WATERS POCKET-GREENHAVEN BRANCH LIBRARY,7335 GLORIA DRIVE,SACRAMENTO,CA,95831,"http://maps.google.com/maps?q=7335 GLORIA DRIVE,+SACRAMENTO,+CA+95831&hl=en"
CALAVERAS COUNTY SHERIFF'S OFFICE,ANGELS CAMP POLICE DEPARTMENT,200 MONTE VERDA STREET,ANGELS CAMP,CA,95222,"http://maps.google.com/maps?q=200 MONTE VERDA STREET,+ANGELS CAMP,+CA+95222&hl=en"
CALAVERAS COUNTY SHERIFF'S OFFICE,CALAVERAS COUNTY SHERIFF'S OFFICE TOYON MIDDLE SCHOOL,3412 DOUBLE SPRINGS ROAD,VALLEY SPRINGS,CA,95252,"http://maps.google.com/maps?q=3412 DOUBLE SPRINGS ROAD,+VALLEY SPRINGS,+CA+95252&hl=en"
CALIFORNIA HIGHWAY PATROL - SANTA MARIA STATION,CA. HIGHWAY PATROL OFFICER EFREM MOORE,1710 N. CARLOTTI DR.,SANTA MARIA,CA,93454,"http://maps.google.com/maps?q=1710 N. CARLOTTI DR.,+SANTA MARIA,+CA+93454&hl=en"
CALIFORNIA HIGHWAY PATROL- MONTEREY OFFICE,CALIFORNIA HIGHWAY PATROL MONTEREY OFFICE,960 E BLANCO RD,SALINAS,CA,93901,"http://maps.google.com/maps?q=960 E BLANCO RD,+SALINAS,+CA+93901&hl=en"
CAMARILLO POLICE DEPARTMENT,CAMARILLO POLICE DEPT. LOBBY,3701 E. LAS POSAS RD.,CAMARILLO,CA,93010,"http://maps.google.com/maps?q=3701 E. LAS POSAS RD.,+CAMARILLO,+CA+93010&hl=en"
CARMEL POLICE DEPARTMENT,CARMEL POLICE DEPARTMENT,SE JUNIPERO AND FOURTH AVENUE,CARMEL,CA,93921,"http://maps.google.com/maps?q=SE JUNIPERO AND FOURTH AVENUE,+CARMEL,+CA+93921&hl=en"
CENTRAL MARIN POLICE AUTHORITY,CENTRAL MARIN POLICE AUTHORITY,250 DOHERTY DRIVE,LARKSPUR,CA,94939,"http://maps.google.com/maps?q=250 DOHERTY DRIVE,+LARKSPUR,+CA+94939&hl=en"
CENTRAL MARIN POLICE AUTHORITY,CENTRAL MARIN POLICE AUTHORITY SAN ANSELMO STATION,525 SAN ANSELMO AVENUE,SAN ANSELMO,CA,94960,"http://maps.google.com/maps?q=525 SAN ANSELMO AVENUE,+SAN ANSELMO,+CA+94960&hl=en"
CHINO POLICE DEPARTMENT,CHINO POLICE DEPARTMENT FRONT LOBBY,5450 GUARDIAN WAY,CHINO,CA,91710,"http://maps.google.com/maps?q=5450 GUARDIAN WAY,+CHINO,+CA+91710&hl=en"
CITRUS HEIGHTS POLICE DEPARTMENT,CITRUS HEIGHTS POLICE DEPARTMENT,6315 FOUNTAIN SQUARE DRIVE,CITRUS HEIGHTS,CA,95621,"http://maps.google.com/maps?q=6315 FOUNTAIN SQUARE DRIVE,+CITRUS HEIGHTS,+CA+95621&hl=en"
"CITY OF BELLFLOWER, L.A. CTY SHERIFF (KAISER)",KAISER MEDICAL OFFICES PARKING LOT OFF OF CLARK AVE.,9400 E. ROSECRANS,BELLFLOWER,CA,90706,"http://maps.google.com/maps?q=9400 E. ROSECRANS,+BELLFLOWER,+CA+90706&hl=en"
CITY OF OAKLEY POLICE DEPARTMENT,CITY OF OAKLEY POLICE DEPARTMENT,3231 MAIN STREET,OAKLEY,CA,94561,"http://maps.google.com/maps?q=3231 MAIN STREET,+OAKLEY,+CA+94561&hl=en"
CLAREMONT POLICE DEPARTMENT,CLAREMONT POLICE DEPARTMENT FRONT LOBBY,570 W. BONITA AVE,CLAREMONT,CA,91711,"http://maps.google.com/maps?q=570 W. BONITA AVE,+CLAREMONT,+CA+91711&hl=en"
CLOVIS POLICE DEPARTMENT,CLOVIS POLICE DEPT,1233 5TH ST,CLOVIS,CA,93612,"http://maps.google.com/maps?q=1233 5TH ST,+CLOVIS,+CA+93612&hl=en"
COALINGA POLICE DEPARTMENT,COALINGA POLICE DEPARTMENT,270 N SIXTH ST,COALINGA,CA,93210,"http://maps.google.com/maps?q=270 N SIXTH ST,+COALINGA,+CA+93210&hl=en"
COLTON POLICE DEPARTMENT,COLTON POLICE DEPARTMENT CIVIC CENTER PARKING LOT,650 NORTH LA CADEENA DR.,COLTON,CA,92324,"http://maps.google.com/maps?q=650 NORTH LA CADEENA DR.,+COLTON,+CA+92324&hl=en"
CONTRA COSTA COUNTY SHERIFF'S OFFICE,BLACKHAWK CONTRA COSTA COUNTY OFFICE OF SHERIFF,"1092 EAGLE NEST PL.,",DANVILLE,CA,94526,"http://maps.google.com/maps?q=1092 EAGLE NEST PL.,,+DANVILLE,+CA+94526&hl=en"
CONTRA COSTA COUNTY SHERIFF'S OFFICE,CONTRA COSTA COUNTY SHERIFF MUIR STATION / FOB,1980 MUIR RD.,MARTINEZ,CA,94553,"http://maps.google.com/maps?q=1980 MUIR RD.,+MARTINEZ,+CA+94553&hl=en"
CONTRA COSTA COUNTY SHERIFF'S OFFICE,DANVILLE POLICE DEPARTMENT,510 LA GONDA WAY,DANVILLE,CA,94526,"http://maps.google.com/maps?q=510 LA GONDA WAY,+DANVILLE,+CA+94526&hl=en"
CONTRA COSTA COUNTY SHERIFF'S OFFICE,LAFAYETTE POLICE DEPARTMENT,3471 MOUNT DIABLO BLVD,LAFAYETTE,CA,94549,"http://maps.google.com/maps?q=3471 MOUNT DIABLO BLVD,+LAFAYETTE,+CA+94549&hl=en"
CONTRA COSTA COUNTY SHERIFF'S OFFICE,ORINDA POLICE DEPARTMENT,22 ORINDA WAY,ORINDA,CA,94563,"http://maps.google.com/maps?q=22 ORINDA WAY,+ORINDA,+CA+94563&hl=en"
CORONA POLICE DEPT.,CORONA PD PARKING LOT,730 PUBLIC SAFETY WAY,CORONA,CA,92880,"http://maps.google.com/maps?q=730 PUBLIC SAFETY WAY,+CORONA,+CA+92880&hl=en"
COSTA MESA PD,COSTA MESA P.D. DET. ALEGADO 7147545361,99 FAIR DR.,COSTA MESA,CA,92628,"http://maps.google.com/maps?q=99 FAIR DR.,+COSTA MESA,+CA+92628&hl=en"
COVINA POLICE DEPT.,COVINA POLICE DEPT. LOBBY,444 NORTH CITRUS AVE.,COVINA,CA,91723,"http://maps.google.com/maps?q=444 NORTH CITRUS AVE.,+COVINA,+CA+91723&hl=en"
CULVER CITY POLICE DEPARTMENT,CULVER CITY POLICE DEPARTMENT NORTHSIDE CORNER,4040 DUQUESNE,CULVER CITY,CA,90232,"http://maps.google.com/maps?q=4040 DUQUESNE,+CULVER CITY,+CA+90232&hl=en"
CYPRESS POLICE DEPT.,CYPRESS POLICE DEPT. FRONT PARKING LOT,5275 ORANGE AVE.,CYPRESS,CA,90630,"http://maps.google.com/maps?q=5275 ORANGE AVE.,+CYPRESS,+CA+90630&hl=en"
DEA - SACRAMENTO DISTRICT OFFICE,DEA - SACRAMENTO DISTRICT OFFICE,4328 WATT AVENUE,SACRAMENTO,CA,95821,"http://maps.google.com/maps?q=4328 WATT AVENUE,+SACRAMENTO,+CA+95821&hl=en"
DEA FRESNO DISTRICT OFFICE,DEA FRESNO ROBERT E. COYLE FEDERAL BUILDING,2500 TULARE STREET,FRESNO,CA,93721,"http://maps.google.com/maps?q=2500 TULARE STREET,+FRESNO,+CA+93721&hl=en"
DINUBA POLICE DEPARTMENT,DINUBA POLICE DEPARTMENT,680 S. ALTA AVENUE,DINUBA,CA,93618,"http://maps.google.com/maps?q=680 S. ALTA AVENUE,+DINUBA,+CA+93618&hl=en"
DIXON POLICE DEPARTMENT,DIXON POLICE DEPARTMENT POLICE DEPARTMENT LOBBY,201 WEST A STREET,DIXON,CA,95620,"http://maps.google.com/maps?q=201 WEST A STREET,+DIXON,+CA+95620&hl=en"
DOS PALOS POLICE DEPARTMENT,DOS PALOS POLICE DEPARTMENT,1546 GOLDEN GATE AVE,DOS PALOS,CA,93620,"http://maps.google.com/maps?q=1546 GOLDEN GATE AVE,+DOS PALOS,+CA+93620&hl=en"
DOWNEY POLICE DEPARTMENT,DOWNEY POLICE DEPARTMENT IN THE WEST PARKING LOT,10911 BROOKSHIRE AVENUE,DOWNEY,CA,90241,"http://maps.google.com/maps?q=10911 BROOKSHIRE AVENUE,+DOWNEY,+CA+90241&hl=en"
DRUG ENFORCEMENT ADMINISTRATION,CLINICA MONSIGNOR ROMERO POC ZELENNE CARDENAS 213-622-1621 X-224,2032 MARENGO STREET,LOS ANGELES,CA,90033,"http://maps.google.com/maps?q=2032 MARENGO STREET,+LOS ANGELES,+CA+90033&hl=en"
DRUG ENFORCEMENT ADMINISTRATION,COUNTY OF L.A. HELEN KELLER PARK CHARLES PORTER 2136221621,12521 VERMONT AVE.,LOS ANGELES,CA,90044,"http://maps.google.com/maps?q=12521 VERMONT AVE.,+LOS ANGELES,+CA+90044&hl=en"
DRUG ENFORCEMENT ADMINISTRATION,FEDERAL ROYBAL BUILDING - LOBBY,255 E TEMPLE ST,LOS ANGELES,CA,90012,"http://maps.google.com/maps?q=255 E TEMPLE ST,+LOS ANGELES,+CA+90012&hl=en"
DRUG ENFORCEMENT ADMINISTRATION,HOLLYWOOD POLICE DEPT. SGT. DAVIS 6619044303,6501 FOUNTAIN AVE.,LOS ANGELES,CA,90028,"http://maps.google.com/maps?q=6501 FOUNTAIN AVE.,+LOS ANGELES,+CA+90028&hl=en"
DRUG ENFORCEMENT ADMINISTRATION,WATTS HEALTHCARE CORP. TENESHA TAYLOR 3235685400X5422,10300 COMPTON AVE.,LOS ANGELES,CA,90002,"http://maps.google.com/maps?q=10300 COMPTON AVE.,+LOS ANGELES,+CA+90002&hl=en"
DUBLIN POLICE DEPARTMENT,DUBLIN POLICE DEPARTMENT PARKING LOT,100 CIVIC PLAZA,DUBLIN,CA,94568,"http://maps.google.com/maps?q=100 CIVIC PLAZA,+DUBLIN,+CA+94568&hl=en"
EL DORADO COUNTY SHERIFF'S OFFICE,EL DORADO COUNTY FIRE STATION 17,6430 PONY EXPRESS TRAIL,POLLOCK PINES,CA,95726,"http://maps.google.com/maps?q=6430 PONY EXPRESS TRAIL,+POLLOCK PINES,+CA+95726&hl=en"
EL DORADO COUNTY SHERIFF'S OFFICE,EL DORADO COUNTY SHERIFF'S OFFICE,300 FAIR LANE,PLACERVILLE,CA,95667,"http://maps.google.com/maps?q=300 FAIR LANE,+PLACERVILLE,+CA+95667&hl=en"
EL DORADO COUNTY SHERIFF'S OFFICE,EL DORADO COUNTY SHERIFF'S OFFICE SUBSTATION,"4355 TOWN CENTER BLVD., SUITE 113",EL DORADO HILLS,CA,95762,"http://maps.google.com/maps?q=4355 TOWN CENTER BLVD., SUITE 113,+EL DORADO HILLS,+CA+95762&hl=en"
EL DORADO COUNTY SHERIFF'S OFFICE,EL DORADO COUNTY SHERIFF'S OFFICE SUBSTATION,"6101 FRONT ST., SUITE 4",GEORGETOWN,CA,95634,"http://maps.google.com/maps?q=6101 FRONT ST., SUITE 4,+GEORGETOWN,+CA+95634&hl=en"
EL SEGUNDO POLICE DEPT.,EL SEGUNDO CITY YARD PARKING LOT,150 ILLINOIS ST.,EL SEGUNDO,CA,90245,"http://maps.google.com/maps?q=150 ILLINOIS ST.,+EL SEGUNDO,+CA+90245&hl=en"
ELK GROVE POLICE DEPARTMENT,ELK GROVE POLICE DEPARTMENT,8400 LAGUNA PALMS WAY,ELK GROVE,CA,95758,"http://maps.google.com/maps?q=8400 LAGUNA PALMS WAY,+ELK GROVE,+CA+95758&hl=en"
EXETER POLICE DEPARTMENT,EXETER POLICE DEPARTMENT,100 NORTH C ST,EXETER,CA,93221,"http://maps.google.com/maps?q=100 NORTH  C ST,+EXETER,+CA+93221&hl=en"
FARMERSVILLE POLICE DEPARTMENT,FARMERSVILLE POLICE DEPARTMENT,909 W. VISALIA ROAD,FARMERSVILLE,CA,93223,"http://maps.google.com/maps?q=909 W. VISALIA ROAD,+FARMERSVILLE,+CA+93223&hl=en"
FILLMORE POLICE DEPARTMENT,FILLMORE POLICE DEPARTMENT LOBBY,524 SESPE AVE.,FILLMORE,CA,93015,"http://maps.google.com/maps?q=524 SESPE AVE.,+FILLMORE,+CA+93015&hl=en"
FIREBAUGH POLICE DEPARTMENT,FIREBAUGH POLICE DEPARTMENT,1575 11TH STREET,FIREBAUGH,CA,93622,"http://maps.google.com/maps?q=1575 11TH STREET,+FIREBAUGH,+CA+93622&hl=en"
FOLSOM POLICE DEPARTMENT,FOLSOM POLICE DEPARTMENT,46 NATOMA STREET,FOLSOM,CA,95630,"http://maps.google.com/maps?q=46 NATOMA STREET,+FOLSOM,+CA+95630&hl=en"
FULLERTON POLICE DEPARTMENT,FULLERTON POLICE DEPARTMENT DRIVE-THRU ON HIGHLAND AVE.,237 W COMMONWEALTH AVE,FULLERTON,CA,92832,"http://maps.google.com/maps?q=237 W COMMONWEALTH AVE,+FULLERTON,+CA+92832&hl=en"
GALT POLICE DEPARTMENT,GALT POLICE DEPARTMENT,455 INDUSTRIAL DRIVE,GALT,CA,95632,"http://maps.google.com/maps?q=455 INDUSTRIAL DRIVE,+GALT,+CA+95632&hl=en"
GARDEN GROVE POLICE DEPARTMENT,GARDEN GROVE POLICE DEPARTMENT LOBBY,11301 ACACIA PKWY,GARDEN GROVE,CA,92842,"http://maps.google.com/maps?q=11301 ACACIA PKWY,+GARDEN GROVE,+CA+92842&hl=en"
GARDENA POLICE DEPARTMENT,GARDENA P.D.,1718 W 162 STREET,GARDENA,CA,90247,"http://maps.google.com/maps?q=1718 W 162 STREET,+GARDENA,+CA+90247&hl=en"
GLENDORA POLICE DEPARTMENT,GLENDORA P.D. LOBBY,150 S. GLENDORA AVE,GLENDORA,CA,91741,"http://maps.google.com/maps?q=150 S. GLENDORA AVE,+GLENDORA,+CA+91741&hl=en"
GONZALES POLICE DEPARTMENT,GONZALES POLICE DEPARTMENT,109 FOURTH STREET,GONZALES,CA,93926,"http://maps.google.com/maps?q=109 FOURTH STREET,+GONZALES,+CA+93926&hl=en"
HAYWARD POLICE DEPARTMENT,HAYWARD POLICE DEPARTMENT,300 W. WINTON AVENUE,HAYWARD,CA,94544,"http://maps.google.com/maps?q=300 W. WINTON AVENUE,+HAYWARD,+CA+94544&hl=en"
HERCULES POLICE DEPARTMENT,HERCULES POLICE DEPARTMENT,111 CIVIC DR,HERCULES,CA,94547,"http://maps.google.com/maps?q=111 CIVIC DR,+HERCULES,+CA+94547&hl=en"
HERMOSA BEACH POLICE DEPARTMENT,HERMOSA BEACH POLICE DEPARTMENT FRONT LOBBY,540 PIER AVE,HERMOSA BEACH,CA,90254,"http://maps.google.com/maps?q=540 PIER AVE,+HERMOSA BEACH,+CA+90254&hl=en"
HOLLISTER POLICE DEPARTMENT,TARGET PARKING LOT,1790 AIRLINE HWY,HOLLISTER,CA,95023,"http://maps.google.com/maps?q=1790 AIRLINE HWY,+HOLLISTER,+CA+95023&hl=en"
HUNTINGTON BEACH POLICE DEPT.,HUNTINGTON BEACH P.D. FRONT LOBBY,2000 MAIN STREET,HUNTINGTON BEACH,CA,92648,"http://maps.google.com/maps?q=2000 MAIN STREET,+HUNTINGTON BEACH,+CA+92648&hl=en"
IRVINE P.D.,HOAG HEALTH CTR. PARKING LOT,16405 SAND CANYON,IRVINE,CA,92618,"http://maps.google.com/maps?q=16405 SAND CANYON,+IRVINE,+CA+92618&hl=en"
IRVINE P.D.,IRVINE POLICE DEPT. FRONT PARKING LOT,1 CIVIC CENTER PLAZA,IRVINE,CA,92606,"http://maps.google.com/maps?q=1 CIVIC CENTER PLAZA,+IRVINE,+CA+92606&hl=en"
IRVINE P.D.,KAISER PERMANENTE FRONT PARKING LOT,6650 ALTON PARKWAY,IRVINE,CA,92618,"http://maps.google.com/maps?q=6650 ALTON PARKWAY,+IRVINE,+CA+92618&hl=en"
IRVINE VALLEY COLLEGE POLICE,IRVINE VALLEY COLLEGE POLICE PARKING LOT 5,5500 IRVINE CENTER DR.,IRVINE,CA,92618,"http://maps.google.com/maps?q=5500 IRVINE CENTER DR.,+IRVINE,+CA+92618&hl=en"
KENSINGTON POLICE DEPARTMENT,KENSINGTON POLICE DEPARTMENT,217 ARLINGTON AVE,KENSINGTON,CA,94707,"http://maps.google.com/maps?q=217 ARLINGTON AVE,+KENSINGTON,+CA+94707&hl=en"
KERN COUNTY SHERIFF'S OFFICE,KCSO HEADQUARTERS,1350 NORRIS ROAD,BAKERSFIELD,CA,93308,"http://maps.google.com/maps?q=1350 NORRIS ROAD,+BAKERSFIELD,+CA+93308&hl=en"
KERN COUNTY SHERIFF'S OFFICE,KERN COUNTY SHERIFF'S OFFICE DELANO SUBSTATION,455 LEXINGTON STREET,DELANO,CA,93215,"http://maps.google.com/maps?q=455 LEXINGTON STREET,+DELANO,+CA+93215&hl=en"
KERN COUNTY SHERIFF'S OFFICE,KERN COUNTY SHERIFF'S OFFICE KERNVALLEY SUBSTATION,"7046 LAKE ISABELLA BLVD.,",LAKE ISABELLA,CA,93240,"http://maps.google.com/maps?q=7046 LAKE ISABELLA BLVD.,,+LAKE ISABELLA,+CA+93240&hl=en"
KERN COUNTY SHERIFF'S OFFICE,KERN COUNTY SHERIFF'S OFFICE MOJAVE SUBSTATION,1771 MAIN STREET,MOJAVE,CA,93501,"http://maps.google.com/maps?q=1771 MAIN STREET,+MOJAVE,+CA+93501&hl=en"
KERN COUNTY SHERIFF'S OFFICE,KERN COUNTY SHERIFF'S OFFICE RIDGECREST SUBSTATION,128 E. COSO AVENUE,RIDGECREST,CA,93555,"http://maps.google.com/maps?q=128 E. COSO AVENUE,+RIDGECREST,+CA+93555&hl=en"
KERN COUNTY SHERIFF'S OFFICE,KERN COUNTY SHERIFF'S OFFICE TAFT SUBSTATION,315 N. LINCOLN STREET,TAFT,CA,93268,"http://maps.google.com/maps?q=315 N. LINCOLN STREET,+TAFT,+CA+93268&hl=en"
KERN COUNTY SHERIFF'S OFFICE,KERN COUNTY SHERIFF'S OFFICE TEHACHAPI SUBSTATION,22209 OLD TOWN ROAD,TEHACHAPI,CA,93561,"http://maps.google.com/maps?q=22209 OLD TOWN ROAD,+TEHACHAPI,+CA+93561&hl=en"
KERN COUNTY SHERIFF'S OFFICE,KERN COUNTY SHERIFF'S OFFICE WASCO SUBSTATION,"748 ""F"" STREET",WASCO,CA,93280,http://maps.google.com/maps?q=748 
LA HABRA POLICE DEPARTMENT,LA HABRA POLICE DEPARTMENT FRONT LOBBY,150 NORTH EUCLID STREET,LA HABRA,CA,90631,"http://maps.google.com/maps?q=150 NORTH EUCLID STREET,+LA HABRA,+CA+90631&hl=en"
LA VERNE POLICE DEPARTMENT,LA VERNE POLICE DEPARTMENT LOBBY,2061 THIRD ST.,LA VERNE,CA,91750,"http://maps.google.com/maps?q=2061 THIRD  ST.,+LA VERNE,+CA+91750&hl=en"
LATHROP POLICE SERVICES,LATHROP SENIOR CENTER,15707 FIFTH STREET,LATHROP,CA,95330,"http://maps.google.com/maps?q=15707 FIFTH STREET,+LATHROP,+CA+95330&hl=en"
LINDSAY POLICE DEPARTMENT,LINDSAY POLICE DEPARTMENT,185 N. GALE HILL AVE,LINDSAY,CA,93247,"http://maps.google.com/maps?q=185 N. GALE HILL AVE,+LINDSAY,+CA+93247&hl=en"
LIVERMORE POLICE DEPARTMENT,LIVERMORE POLICE DEPARTMENT,1110 S. LIVERMORE AVE.,LIVERMORE,CA,94550,"http://maps.google.com/maps?q=1110 S. LIVERMORE AVE.,+LIVERMORE,+CA+94550&hl=en"
LIVINGSTON POLICE DEPT,LIVINGSTON POLICE DEPARTMENT,1446 C STREET,LIVINGSTON,CA,95334,"http://maps.google.com/maps?q=1446 C STREET,+LIVINGSTON,+CA+95334&hl=en"
LODI POLICE DEPARTMENT,LODI POLICE DEPARTMENT,215 W. ELM STREET,LODI,CA,95240,"http://maps.google.com/maps?q=215 W. ELM STREET,+LODI,+CA+95240&hl=en"
LONG BEACH POLICE DEPARTMENT,LONG BEACH MEMORIAL HOSP. PARKING LOT,2801 ATLANTIC,LONG BEACH,CA,90806,"http://maps.google.com/maps?q=2801 ATLANTIC,+LONG BEACH,+CA+90806&hl=en"
LOS ALAMITOS POLICE DEPT.,MCAULIFFE MIDDLE SCHOOL ATTN:CHRIS VLASIC 5627994700XT80412,4112 CERRITOS AVE.,LOS ALAMITOS,CA,90720,"http://maps.google.com/maps?q=4112 CERRITOS AVE.,+LOS ALAMITOS,+CA+90720&hl=en"
LOS ANGELES COUNTY SHERIFF'S DEPT.,"LASD, LOMITA STATION SGT. DOUG SHIVE 3102001534",26123 S. NARBONNE AVE.,LOMITA,CA,90717,"http://maps.google.com/maps?q=26123 S. NARBONNE AVE.,+LOMITA,+CA+90717&hl=en"
LOS ANGELES COUNTY SHERIFF'S DEPT.,"LASD, SANTA CLARITA VALLEY STATION SGT. TIM VANDER LEEK 6617995198",23740 W. MAGIC MOUNTAIN PKWY,VALENCIA,CA,91355,"http://maps.google.com/maps?q=23740 W. MAGIC MOUNTAIN PKWY,+VALENCIA,+CA+91355&hl=en"
LOS ANGELES COUNTY SHERIFF'S DEPT.,"LASD, TEMPLE STATION DEP.CANTU 6262923376",8838 E. LAS TUNAS DR.,TEMPLE CITY,CA,91780,"http://maps.google.com/maps?q=8838 E. LAS TUNAS DR.,+TEMPLE CITY,+CA+91780&hl=en"
LOS ANGELES COUNTY SHERIFF'S DEPT.,"LASD, WALNUT STATION SGT. JASON CUNNINGHAM 9098592802",KAISER HOSP.1336 BRIDGE GATE DR.,DIAMOND BAR,CA,91765,"http://maps.google.com/maps?q=KAISER HOSP.,+DIAMOND BAR,+CA+91765&hl=en"
LOS ANGELES PD (KAISER),FIRST BAPTIST CHURCH ALICE LEE 9093422788,760 S. WESTMORELAND AVE.,LOS ANGELES,CA,90005,"http://maps.google.com/maps?q=760 S. WESTMORELAND AVE.,+LOS ANGELES,+CA+90005&hl=en"
LOS ANGELES PD (KAISER),KAISER PANORAMA CITY MED CTR JULIE YOO & FLAVIUS BAIESC,"13652 CANTARA ST., NORTH 3 BLDG",PANORAMA CITY,CA,91402,"http://maps.google.com/maps?q=13652 CANTARA ST., NORTH 3 BLDG,+PANORAMA CITY,+CA+91402&hl=en"
LOS ANGELES PD (KAISER),KAISER PERMANENTE LOS ANGELES MEDICAL CENTER ALEX CAO 3107410290,4760 WEST SUNSET BLVD.,HOLLYWOOD,CA,90027,"http://maps.google.com/maps?q=4760 WEST SUNSET BLVD.,+HOLLYWOOD,+CA+90027&hl=en"
LOS ANGELES PD (KAISER),KAISER PERMANENTE SOUTH BAY MED. CTR. PARHAM NEBEGH 3105172248,"25825 S. VERMONT AVE., PARKVIEW BLDG.",HARBOR CITY,CA,90710,"http://maps.google.com/maps?q=25825 S. VERMONT AVE., PARKVIEW BLDG.,+HARBOR CITY,+CA+90710&hl=en"
LOS ANGELES PD (KAISER),KAISER PERMANENTE WOODLAND HILLS MEDICAL CENTER ROBERT DEAMER 8052364941,5601 DE SOTO AVENUE,WOODLAND HILLS,CA,91367,"http://maps.google.com/maps?q=5601 DE SOTO AVENUE,+WOODLAND HILLS,+CA+91367&hl=en"
LOS ANGELES PD (KAISER),KAISER WEST L.A MEDICAL CTR. ARIC WILSON ARIC.J.WILSON@KP.ORG,6041 CADILLAC AV. (24 HR. PHARM. CIRCLE),LOS ANGELES,CA,90034,"http://maps.google.com/maps?q=6041 CADILLAC AV. (24 HR. PHARM. CIRCLE),+LOS ANGELES,+CA+90034&hl=en"
LOS BANOS POLICE DEPARTMENT,LOS BANOS POLICE DEPARTMENT,945 5TH STREET,LOS BANOS,CA,93635,"http://maps.google.com/maps?q=945  5TH STREET,+LOS BANOS,+CA+93635&hl=en"
MANHATTAN BEACH POLICE DEPARTMENT,MANHATTAN BEACH POLICE DEPARTMENT CONFERENCE ROOM,420 15TH ST,MANHATTAN BEACH,CA,90266,"http://maps.google.com/maps?q=420 15TH ST,+MANHATTAN BEACH,+CA+90266&hl=en"
MARIN COUNTY SHERIFF'S OFFICE,MARIN COUNTY PUBLIC SAFETY BUILDING,850 DRAKE AVE,SAUSALITO,CA,94965,"http://maps.google.com/maps?q=850 DRAKE AVE,+SAUSALITO,+CA+94965&hl=en"
MARIN COUNTY SHERIFF'S OFFICE,MARINWOOD FIRE DEPARTMENT,777 MILLER CREEK RD,SAN RAFAEL,CA,94903,"http://maps.google.com/maps?q=777 MILLER CREEK RD,+SAN RAFAEL,+CA+94903&hl=en"
MARINA POLICE DEPARTMENT,PUBLIC SAFETY BUILDING,211 HILLCREST AVENUE,MARINA,CA,93933,"http://maps.google.com/maps?q=211 HILLCREST AVENUE,+MARINA,+CA+93933&hl=en"
MARIPOSA COUNTY SHERIFF'S OFFICE,MARIPOSA COUNTY LAKE DON PEDRO TRANSFER STATION,9729 MERCED FALLS ROAD,LA GRANGE,CA,95329,"http://maps.google.com/maps?q=9729 MERCED FALLS ROAD,+LA GRANGE,+CA+95329&hl=en"
MARIPOSA COUNTY SHERIFF'S OFFICE,MARIPOSA SHERIFF'S OFFICE DISPATCH LOBBY,"4963 10TH STREET,",MARIPOSA,CA,95338,"http://maps.google.com/maps?q=4963 10TH STREET,,+MARIPOSA,+CA+95338&hl=en"
MARIPOSA COUNTY SHERIFF'S OFFICE,MARIPOSA SHERIFF'S OFFICE SUB STATION #1,10549 FISKE ROAD,COULTERVILLE,CA,95311,"http://maps.google.com/maps?q=10549 FISKE ROAD,+COULTERVILLE,+CA+95311&hl=en"
MENDOTA POLICE DEPARTMENT,MENDOTA POLICE DEPARTMENT,"1000 AIRPORT BLVD., BUILDING A",MENDOTA,CA,93640,"http://maps.google.com/maps?q=1000 AIRPORT BLVD., BUILDING A,+MENDOTA,+CA+93640&hl=en"
MENDOTA POLICE DEPARTMENT,MENDOTA POLICE DEPARTMENT MONDAY - FRIDAY 8:00AM - 5:00 PM,1000 AIRPORT BLVD. BLDG. A,MENDOTA,CA,93640,"http://maps.google.com/maps?q=1000 AIRPORT BLVD. BLDG. A,+MENDOTA,+CA+93640&hl=en"
MILPITAS PD,MILPITAS POLICE DEPARTMENT,1275 N. MILPITAS BLVD,MILPITAS,CA,95035,"http://maps.google.com/maps?q=1275 N. MILPITAS BLVD,+MILPITAS,+CA+95035&hl=en"
MONTCLAIR POLICE DEPARTMENT,MONTCLAIR POLICE DEPARTMENT FRONT LOBBY,4870 ARROW HIGHWAY,MONTCLAIR,CA,91763,"http://maps.google.com/maps?q=4870 ARROW HIGHWAY,+MONTCLAIR,+CA+91763&hl=en"
MONTEBELLO P.D.,YMCA PARKING LOT,2000 WEST BEVERLY BLVD.,MONTEBELLO,CA,90640,"http://maps.google.com/maps?q=2000 WEST BEVERLY BLVD.,+MONTEBELLO,+CA+90640&hl=en"
MONTEREY COUNTY SHERIFF'S OFFICE,BANK OF AMERICA PARKING LOT IN FRONT OF THE BANK,RIO ROAD AT HWY 1,CARMEL,CA,93923,"http://maps.google.com/maps?q=RIO ROAD AT HWY 1,+CARMEL,+CA+93923&hl=en"
MONTEREY COUNTY SHERIFF'S OFFICE,PINE CANYON FIRE STATION PARKING LOT IN FRONT OF THE FIRE STATION,51251 PINE CANYON ROAD,KING CITY,CA,93930,"http://maps.google.com/maps?q=51251 PINE CANYON ROAD,+KING CITY,+CA+93930&hl=en"
MONTEREY COUNTY SHERIFF'S OFFICE,PRUNETREE SHOPPING CENTER PARKING LOT IN FRONT OF CVS/PHARMACY,17579 VIERRA CANYON ROAD,SALINAS,CA,93907,"http://maps.google.com/maps?q=17579 VIERRA CANYON ROAD,+SALINAS,+CA+93907&hl=en"
MONTEREY POLICE DEPARTMENT,MONTEREY POLICE DEPARTMENT,351 MADISON STREET,MONTEREY,CA,93940,"http://maps.google.com/maps?q=351 MADISON STREET,+MONTEREY,+CA+93940&hl=en"
MORGAN HILL POLICE DEPARTMENT,MORGAN HILL POLICE DEPARTMENT,16200 VINEYARD BLVD,MORGAN HILL,CA,95037,"http://maps.google.com/maps?q=16200 VINEYARD BLVD,+MORGAN HILL,+CA+95037&hl=en"
MURRIETA POLICE DEPARTMENT,MURRIETA POLICE DEPARTMENT LOBBY,2 TOWN SQUARE,MURRIETA,CA,92562,"http://maps.google.com/maps?q=2 TOWN SQUARE,+MURRIETA,+CA+92562&hl=en"
NAPA COUNTY SHERIFF OFFICE,AMERICAN CANYON POLICE DEPARTMENT,911 DONALDSON WAY,AMERICAN CANYON,CA,94503,"http://maps.google.com/maps?q=911 DONALDSON WAY,+AMERICAN CANYON,+CA+94503&hl=en"
NAPA COUNTY SHERIFF OFFICE,NAPA POLICE DEPARTMENT,3285 CLAREMONT WAY,NAPA,CA,94559,"http://maps.google.com/maps?q=3285 CLAREMONT WAY,+NAPA,+CA+94559&hl=en"
NAVAL HOSPITAL CAMP PENDLETON,"MCB CAMP PENDLETON ACTIVE DUTY, RETIRED, BENEFICIARIES AND STAFF",PACIFIC VIEWS MCX200 VANDEGRIFT BLVD.,CAMP PENDLETON,CA,92055,"http://maps.google.com/maps?q=PACIFIC VIEWS MCX,+CAMP PENDLETON,+CA+92055&hl=en"
NEWPORT BEACH POLICE DEPARTMENT,HOAG HOSPITAL/LOWER CAMPUS PARKING LOT,1 HOAG ROAD,NEWPORT BEACH,CA,92663,"http://maps.google.com/maps?q=1 HOAG ROAD,+NEWPORT BEACH,+CA+92663&hl=en"
NEWPORT BEACH POLICE DEPARTMENT,OASIS SENIOR CENTER OVERFLOW LOT AT 5TH AVE. & MARGUERITE AVE.,801 NARCISSUS AVE,CORONA DEL MAR,CA,92625,"http://maps.google.com/maps?q=801 NARCISSUS AVE,+CORONA DEL MAR,+CA+92625&hl=en"
NORTHEEAST LOS ANGELES P.D.,NORTHEAST LOS ANGELES P.D. COMMUNITY ROOM,3353 N. SAN FERNANDO RD.,LOS ANGELES,CA,90065,"http://maps.google.com/maps?q=3353 N. SAN FERNANDO RD.,+LOS ANGELES,+CA+90065&hl=en"
ONTARIO POLICE DEPARTMENT,KAISER MEDICAL CENTER BUILDING B,2295 S. VINEYARD AVE,ONTARIO,CA,91761,"http://maps.google.com/maps?q=2295 S. VINEYARD AVE,+ONTARIO,+CA+91761&hl=en"
